index,time,score,reple,1st_week,2st_week,3st_week
765,2015.10.29,1,ㅋㅋㅋ설정이 뭐이러냐 주원 돈도없는데 도박이나하고잇고 그냥 첨보자마자 누가 범인인줄알거다 졸작중에 삼류다 반전도없고 감동도없고 귀신은 왜나오는겨 ㅋㅋ중간중간 깜짝놀랫던 기억밖에 없다  ,1,0,0
766,2015.10.29,8,스토리는 흥미진진했지만 전개는 일반 스릴러물과는 다르게 천천히 흘러가네요ㅎㅎ 그래도 잔잔하게 흘러가는게 긴장감도 끝까지 가고 좋았어요~  ,1,0,0
767,2015.10.29,9,주원 유해진 이유영을 조합은 환상적이였다  ,1,0,0
768,2015.10.29,10,심장쫄깃! 그놈이다대박!  ,1,0,0
769,2015.10.29,10,윤준형감독의 말처럼 실화에 바탕을 둔 한국형 미스터리 스릴러!  ,1,0,0
770,2015.10.29,9,아직도 생생하게 기억나는 장면들이 몇몇 있음..  ,1,0,0
771,2015.10.29,1,아쉽네 아재거기가면 죽어ㅠ  ,1,0,0
772,2015.10.29,6,멀보고 나왔는지 완전 노잼  ,1,0,0
773,2015.10.29,10,처음에그렇게무서울줄몰랐는데 너무 무서워요ㅠ  ,1,0,0
774,2015.10.29,10,긴장감이 좋았어요. 모든 배우들의 연기가 일품이었습니다. 계속 되는 긴장감에 주먹 꽉 쥑 ㅗ봤네요  ,1,0,0
775,2015.10.29,10,유해진이 이렇게 무서워 보일줄이야ㅠ.ㅠ.. 베테랑에서랑은 완전 다른 모습 !!  ,1,0,0
776,2015.10.29,10,스토리는 평범하고 단순한데 분위기가 으스스하고 스릴감있고 무섭기까지 합니다.  ,1,0,0
777,2015.10.29,10,걍 꿀잼이네 유해진 주원 배우들 다 연기가 좋다  ,1,0,0
778,2015.10.29,10,스토리도 스토리지만 배우들의 연기가 한 몫 한거 같다ㅋㅋ 최고최고  ,1,0,0
779,2015.10.29,8,진짜 재밌었다 주원이 이렇게 연기 잘하는지 몰랐네  ,1,0,0
780,2015.10.29,10,최근 본 영화들 중 가장 인상깊고 재밌었던 영화  ,1,0,0
781,2015.10.29,10,"평점 잘 안남기는데요, 꼭 남기고 싶네요. 진짜 재밌어요!!!! 제 인생 영화입니다!!!! 여러분 꼭 보세요!!!! (나만 당할 수 없지...)  ",1,0,0
782,2015.10.29,10,내가 예상했던 스토리와는 다르게 흘러가서 그런지 흥미진진하게 잘 본 거 같음  ,1,0,0
783,2015.10.29,9,관람객재밋네여 아이아앙아애이잉아아ㅏ  ,1,0,0
784,2015.10.29,8,추격자 이후로 이렇게 쫄깃한 스릴러는 그놈이다가 처음인듯  ,1,0,0
785,2015.10.29,2,어제 개봉날 봤다. 정말 시간아깝고 짜증나고 열받았다. 알바들 정말 쩌네.  ,1,0,0
786,2015.10.29,10,생각보다 훨씬 재밌고 볼거리도 많고 무서웠음ㅋㅋ 몰입도가 장난 아님  ,1,0,0
787,2015.10.29,10,"관람객무서웠지만, 주원과 유해진의 연기력최고였습니다!! 결말이 살짝 뜬금없었음.  ",1,0,0
788,2015.10.29,10,그냥굿 너어어무 잼나요  ,1,0,0
789,2015.10.29,10,정말 돈 안 아까운 영화  ,1,0,0
790,2015.10.29,9,배우들의 연기하며 감독의 연출하며 한국형 스릴러를 제대로 맛 볼 수 있었던 작품  ,1,0,0
791,2015.10.29,10,범인 누군지 알고 봤는데도 재밌었엉ㅋㄷㅋㄷ 유해진 역시 짱짱맨  ,1,0,0
792,2015.10.29,1,너무 재밋네요 ㅎㅎ 다들 보면 좋겟네요 헤  ,1,0,0
793,2015.10.29,10,심장 졸이면서 봤어요.. 기존의 스릴러와는 확실히 색다르긴 했어요  ,1,0,0
794,2015.10.29,10,심장 쫄깃해지는 영화로 두 주인공의 연기력이 돋보였고 아직도 생생하게 생각이 난다  ,1,0,0
795,2015.10.29,10,장르를 공포스릴러로 바꾸세요ㅠㅠ 그냥 스릴러인줄 알았는데 오늘 밤 잘 못 잘거 같아요 흐엉  ,1,0,0
796,2015.10.29,10,왠지 공포영화를 보는 듯한 기분이 들었지만 그래도 스릴 넘치고 집중해서 볼 수 있었다  ,1,0,0
797,2015.10.29,10,적당히 무섭고 계속 긴장감을 놓을 수 없게 만드는 영화에요~ 배우들 모두 연기를 너무 잘 하셔서 몰입하고 공감할수 있었어요 대박나시길!!  ,1,0,0
798,2015.10.29,1,1점도 아까운 짬뽕 영화  장르가 뭔지 봐도 모를잡탕에 배우가 아까운 영화. 영화끝나자마자  곳곳에서 나오는 한숨들. 알바들이 낚시 잘했네요/  ,1,0,0
799,2015.10.29,10,같이본 친구는 좀 무섭다고 했지만 난 딱 적당하다고 생각. 역시 사람이 젤 무서운법..  ,1,0,0
800,2015.10.29,9,오랜만에 심장 쫄깃해지는 영화~ 그놈이다 영화 진짜 최고였옹  ,1,0,0
801,2015.10.29,10,돈과 시간이 아깝지 않은 영화로 주위 사람들한테 재밌다고 추천중이에요ㅎㅎ  ,1,0,0
802,2015.10.29,10,끝까지 스릴 넘치는 긴장감으로 시간 가는줄 모르고 긴장하면서 봤어요  ,1,0,0
803,2015.10.29,10,소름돋는 유해진의 연기와 흥미진진하고 빠르게 진행되는 스토리의 합작  ,1,0,0
804,2015.10.29,10,신선한 내용에 짜릿한 공포까지 처음부터 끝까지 재밌게 봤습니다^^  ,1,0,0
805,2015.10.29,10,최근에 나온 모 스릴러 영화랑은 비교도 안되게 재밌군  ,1,0,0
806,2015.10.29,8,관람객킬링타임용제격입니다  ,1,0,0
807,2015.10.29,9,시간가는줄 모르고 봤네 .. 대박..  ,1,0,0
808,2015.10.29,8,관람객유해진연기짱그놈이다볼만함  ,1,0,0
809,2015.10.29,10,굿굿 유해진 하면 믿고봄!! 천만 배우!!  ,1,0,0
810,2015.10.29,10,긴장감 넘치고 몰입도가 높네요 진짜 무서웠고 재밌었어요  ,1,0,0
811,2015.10.29,8,가슴 조리면서 조마조마하게 봤음.. 공포영호가 따로 없네  ,1,0,0
812,2015.10.29,6,배우들 연기만 좋음....  ,1,0,0
813,2015.10.29,1,이거 재밌다는 사람 무섭다는 사람 스릴있다는사람 모두다 영화 처음보는사람...? 이토록 이유 없고 이토록 개연성없는 영화는 오랜만이다 그러니까 결론은 보지 마라  ,1,0,0
814,2015.10.29,10,시릴있고 쫄깃쫄깃해지고 스토리탄탄해요 배우들 연기력에도 엄지척! 그놈이다 화이팅!!!  ,1,0,0
815,2015.10.29,10,얼마나 긴장됬는지 보는내내 옴 몸에 힘 빡..!  ,1,0,0
816,2015.10.29,9,장르를 공포 스릴러로 바꿔주시지ㅋㅋ  ,1,0,0
817,2015.10.29,10,긴장감 장난아님..;; 주원 연기력이 날이갈수록 미치는듯 ㅋㅋ  ,1,0,0
818,2015.10.29,10,진짜 소름 돋는 연기에 춥던 날씨가 더 춥게 느껴지더라..하  ,1,0,0
819,2015.10.29,10,15세와 19세 사이의 아슬아슬한 경계..  ,1,0,0
820,2015.10.29,10,그놈인걸 알면서 그놈인지 의심만 하게 되는ㅋㅋ 암튼 너무 재밌다  ,1,0,0
821,2015.10.29,9,스릴러 넘치고  한번더 보고싶게 유혹하는 영화입니다.  ,1,0,0
822,2015.10.29,10,스릴만점!! 다시 한번 제대로 보고 싶은건 나뿐인강  ,1,0,0
823,2015.10.29,10,"믿고보는 배우 주원씨, 여러 얼굴담은 유해진씨 ,베니스영화제  여우주연상에 빛나는  신인 이유영씨까지 어우러진 그놈이다 는 그동안 보지 못한 한국식 독특한 스릴러이다. 스릴러 못보고 안 좋아하는 내가 한 번 이상 보게 된 영화. 다들 경험해보시길!!  ",1,0,0
824,2015.10.29,10,기대이상의 영화를 봐서 좋아요 막 임팩트 있는 반전 같은건 없지만 그래도 스릴러 영화다웠어요  ,1,0,0
825,2015.10.29,8,마치 공포영화를 보는 듯한 느낌이랄까 스릴도 있고 집중도 할 수 있었던 영화에요  ,1,0,0
826,2015.10.29,10,"유해진,주원은믿고보는배우!  ",1,0,0
827,2015.10.29,10,깜짝깜짝 놀라는 장면들이 어찌나 많던지ㅠ  ,1,0,0
828,2015.10.29,10,스릴러 영화답게 스릴은 당연히 있었고 집중하기에 좋은 요소들이 많아서 지루하지 않게 볼 수 있었던거 같아요  ,1,0,0
829,2015.10.29,10,생각보다 더 무섭고 스릴감 넘쳤음 재밌고 진짜 기대이상의 영화였음  ,1,0,0
830,2015.10.29,1,별로..주원은 정말 좋아하진만..ㅠ  ,1,0,0
831,2015.10.29,9,믿고 보는 주원과 유해진~~ 그놈이다 파이팅^^!  ,1,0,0
832,2015.10.29,10,스릴 넘치며 두시간이 어떻게 흘러간지도 모르고 푹 빠져서 봤다  ,1,0,0
833,2015.10.29,9,몰입 할 수 밖에 없는 배우들의 연기에 시간 가는줄 모르고 봤어요~  ,1,0,0
834,2015.10.29,10,좀 아쉬웠지만 그래도 무섭고 전개도 빠르고 주원의 연기에 보는 제가 마음이 아팠어여..ㅠ  ,1,0,0
835,2015.10.29,9,배우들연기너무좋았습니다~첨부터끝까지..심장이쫄깃하네요~  ,1,0,0
836,2015.10.29,10,무서움과 잔인함이 공존하는 유해진의 연기는 정말 최고  ,1,0,0
837,2015.10.29,10,추격작같은 스릴러 영화에 호러가 섞였다고 하면 될 듯ㅋㅋ 꿀잼임  ,1,0,0
838,2015.10.29,10,정말 대박인 영화다 주원과 유해진의 연기력은 말이 필요 없다  ,1,0,0
839,2015.10.29,6,기대를 넘 마니해서 그런가 별 재미없었음!  ,1,0,0
840,2015.10.29,8,박진감 넘치고 보는내내 흥미진진ㅎㅎ  ,1,0,0
841,2015.10.29,10,탄탄한 스토리와 탄탄한 연기력으로 똘똘 뭉친 영화  ,1,0,0
842,2015.10.29,10,무섭기도 하고 쫄깃하기도 하고 주인공들뿐 아니라 조연들의 연기까지도 너무 좋았네요  ,1,0,0
843,2015.10.29,10,관객들을 들었다 놨다ㅋㅋ 장난 아니구만 이 영화  ,1,0,0
844,2015.10.29,10,주원과 유해진의 연기는 말이 필요없더라.. 간만에 긴장하며 본 영화로 강력추천!  ,1,0,0
845,2015.10.29,10,기대 안했는데 나름 스릴있고 괜찮던데 무엇보다 배우들 연기력에 푹 빠졌옹ㅎ  ,1,0,0
846,2015.10.29,9,호러와 스릴러의 적절한 만남으로 과하지 않게 볼 수 있었던 영화  ,1,0,0
847,2015.10.29,10,무섭기도 했지만 마음도 아파요.. 실화를 바탕으로 한 영화라고 들었는데 잠시도 눈을 뗄 수 없었습니다ㅜㅜ..  ,1,0,0
848,2015.10.29,10,올해 최고의 영화. 이도저도 아닌 굉장한 시나리오였다. 소름끼치는 연기로 도대체 영화가 끝나고도 왜 범인이 주인공 동생을 죽였는지 도저히 이해안되는 최고의 반전영화. 돈 만원을 가장 쓸모없게 쓰고 싶다면 강력히 추천하는 영화다. 많은 호구들이 보길바람  ,1,0,0
849,2015.10.29,10,우리나라 스릴러 영화하면 추격자가 떠오르는데 딱 추격자같은 영화였어요!  ,1,0,0
850,2015.10.29,1,배우들의 연기만 좋았던 영화  ,1,0,0
851,2015.10.29,10,방금 보고 나왔는데 온 몸에 소름이 돋는다. 정말 강추! 올가을 최고의 문제작! 와 이건 진짜 나만 돈주고 이딴 영활볼수가 없네요. 모두에게 강력추천합니다^^!  ,1,0,0
852,2015.10.29,10,잔잔하게 흘러가는데도 계속되는 긴장감에 내 몸은 경직!  ,1,0,0
853,2015.10.29,10,관람객계속 긴장하게 해서 끝나고도 배가아프다재밌네요  ,1,0,0
854,2015.10.29,1,그냥 디렉팅이 쓰레기  ...  ,1,0,0
855,2015.10.29,10,추천합니다. 죽이고싶을만큼 싫어하는 사람과 이 영화를 보세요. 러닝타임동안 그 사람이 괴로워하는걸 볼수있습니다. 헤어지고싶은 연인과 보세요. 영화가 끝나기도전에 당신의 뺨을 한대 때리고 밖으로 뛰쳐나갈겁니다. 올해 최고의 문제작이네요^^ 꼭 보세요.  ,1,0,0
856,2015.10.29,10,그놈이 진짜 그놈이였엉 볼만하고 돈과 시간은 아깝지 않음  ,1,0,0
857,2015.10.29,10,스릴러라는 장르에 딱 맞았던 영화에요 감독님의 연출이 돋보이는 영화였어요  ,1,0,0
858,2015.10.29,10,오늘 영화관 가서 봤는데 공포 스릴러 연기가긴장감이 들더라 특히 여배우가 다이쁜게 내꺼하고싶더라ㅋ 이영화 강추!!  ,1,0,0
859,2015.10.29,8,재밌는 영화도 보고 영화 끝나고 무대인사까지~  ,1,0,0
860,2015.10.29,10,정말 순간순간 쫄게하는ㅋㅋ 처음에 놀랄때 팝콘 쏟음..ㅋ  ,1,0,0
861,2015.10.29,4,"딱히 하는 일 없는 귀신은 왜 나와서 분위기만 잡는지 모르겠고, 살인범이 장우 여동생을 죽인 이유는 공감이 안 되고, 장우와 시은은 나이 차이도 얼마 안 나 보이는데 왜 아저씨가 부르는지도 이상하고... 영화는 내내 폼만 잡다 갑자기 끝나버린다.  ",1,0,0
862,2015.10.29,10,기존의 한국 스릴러 영화들과는 차원이 다르네요  ,1,0,0
863,2015.10.29,8,관람객ㅎ ㅏ... 반은 가리고 본듯. 생각보다 무서웠음.  ,1,0,0
864,2015.10.29,2,이영화 보고 좀 실망했음..이건 아닌듯...근데 유치장신은 쵝오!!~~~  ,1,0,0
865,2015.10.29,10,기대이상의 재미와 스릴을 주는 그놈이다  ,1,0,0
866,2015.10.29,5,뭔가 이상한 영화.. 재밌게 본거 같지도 않고 재미없게 본거 같지도 않은... 근데 경찰이 너무 이상하게 나왔다.스마트폰보면 요즘시대인데 왜 영화속이랑 시대가 안맞는 느낌일까? 섬에 살아본 적 있는 사람으로서 억지라고 본다  ,1,0,0
867,2015.10.29,7,관람객보는내내 긴장감있고 재미있었습니다!!!  ,1,0,0
868,2015.10.29,10,오늘보고왔는대 진짜시간가는지모르고봤음 주원 유해진 그리고 그귀신보이는여자 진짜연기대박 짱짱잼남  ,1,0,0
869,2015.10.29,10,친구가 무섭다고 그래서 얼마나 무섭길래 하고 봤는데 이건 그냥 스릴러가 아님..ㅎㅎ  ,1,0,0
870,2015.10.29,10,이번에 개봉한 우리나라 영화는 수작이 많으네요. 정말 잘 보았습니다. 손에 땀을 쥐며 재미나게 봤습니다.  ,1,0,0
871,2015.10.29,10,무서워 하면서도 끝까지 관람ㅋㅋ 보는내내 눈을 뗄 수 없었고 마지막 장면은 아직도 생각남  ,1,0,0
872,2015.10.29,10,장우의 오열하는 장면 정말 인상깊었어요 ㅠㅠ ♥♥♥♥주원님 유해진님 두분다 연기대박~~ 꼭 흥행했으면좋겠어요^^  ,1,0,0
873,2015.10.29,9,관람객영화 끝날때까지 긴장감의 연속스릴러와 공포를 좋아하는 분이라면 추전~ㅋ  ,1,0,0
874,2015.10.29,1,"영화 배경이 무슨 60,70뇬대냐?깡촌 마을이래도 동일범으로 의심가는 연속 2건 살인 사건에 조사도 하는둥 마는둥 이렇게 없는 일 처럼 흘러가는 것도 웃기고 cctv증건 뭐 장난감이여?글구 약사가 막노동에 체격도 훨 좋은 주원보다 힘이쎄?ㅋ 완전쓰레기  ",1,0,0
875,2015.10.29,5,배우들 연기는 좋았으나 연출이 안 받쳐주는 영화??  ,1,0,0
876,2015.10.29,10,정말 기대 안했는데 대박이다 이 영화  ,1,0,0
877,2015.10.29,9,스릴러영화로써 굉장히 괜찮은 영화다 스릴러물 좋아하면 재밌게 볼 듯  ,1,0,0
878,2015.10.29,10,역시 믿고 보는 주원!!  ,1,0,0
879,2015.10.29,9,와 진짜 스토리 탄탄해여  ,1,0,0
880,2015.10.29,10,이제 주원 나오는 작품들은 무조건 볼 듯ㅋㅋ 주원이랑 유해진의 연기력은 진짜 볼만했어  ,1,0,0
881,2015.10.29,10,뻔하지 않고 예상하지 못한 이야기라 더 흥미진진하게 본 것 같아요  ,1,0,0
882,2015.10.29,10,막 반전이다!! 하는건 없었는데도 재밌었음 무엇보다 연기력이ㄷㄷ  ,1,0,0
883,2015.10.29,10,이런 영화들은 극장에서 봐야 더 재밌게 볼 수 있는거 같아  ,1,0,0
884,2015.10.29,10,보는내내 긴장의 끈을 놓을 수 없었고 잡게 만드는 그런 영화였다  ,1,0,0
885,2015.10.29,10,스릴 장난 아니다 진짜 간만에 진짜 스릴러영화 한편!!  ,1,0,0
886,2015.10.29,10,러닝타임 109분이라는 시간 동안 공포에 떨게 만들어준 영화  ,1,0,0
887,2015.10.29,8,이건 유해진이 대박이네요 연기 너무 잘하세여ㅎㅎ 삼시세끼 보로 가야딩  ,1,0,0
888,2015.10.29,10,아무런 정보없이 본 영환데 무섭네영ㅠ 계속 긴장긴장하면서 봤어여ㅋ  ,1,0,0
889,2015.10.29,10,역시 주원씨 유해진씨 두배우 정말 대단했어요~~이유영씨도 넘 잘했어요^^정말 넘 무서웠어요^^근데 또 보고싶어요~~감독님^^최고♥주원씨 사랑해요~♥♥  ,1,0,0
890,2015.10.29,9,생각보다 훨씬 무섭고 암울해지고 그렇지만 스릴러 영화로썬 충분히 제 몫 한거 같아요  ,1,0,0
891,2015.10.29,10,온 몸에 힘을 주고 보게 되는 영화.. 무서운거 좋아하면 꼭 보시길  ,1,0,0
892,2015.10.29,10,몰입도 최고ㅋㅋ 배우들 연기력과 스토리 그리고 연출까지 다 좋았음  ,1,0,0
893,2015.10.29,10,아무 생각없이 봤는데 등골 오싹 거릴 정도로 스릴과 공포감은 살아 있네요  ,1,0,0
894,2015.10.29,8,별 다섯개가 전혀 아깝지 않은 말이 필요없는 영화  ,1,0,0
895,2015.10.29,10,주원 요즘 호감가는 배우 중 한명ㅎㅎ 앞으로가 더 기대되는 배우  ,1,0,0
896,2015.10.29,9,유해진의 소름돋는 연기 너무 인상깊습니다  ,1,0,0
897,2015.10.29,10,보는내내 숨죽일수 밖에 없네요  ,1,0,0
898,2015.10.29,10,귀신 나오고 그럴줄은 생각도 못했는데ㅋㅋ 무서운데 보게되는 흡입력이 있다  ,1,0,0
899,2015.10.29,3,"과유불급, 수많은 장르가 따로논다. 전형적인 용두사미 영화, 배우가 아깝다.  ",1,0,0
900,2015.10.29,2,연기는 진짜 인정인데 그냥 생각하는거 그대로 흘러가는영화.친구가 돈 내준다면 보러갈만해요.  ,1,0,0
901,2015.10.29,10,와 순간순간 깜작 놀라는 장면들이 어찌나 많던지 방금 보고 나왔는데 오늘 잠 다 잤네여..  ,1,0,0
902,2015.10.29,10,얼마나 몰입해서 봤는지 보는내내 서늘했던~ㅎㅎ  ,1,0,0
903,2015.10.29,10,이유영씨 간신에서도 인상깊게 봤는데 그놈이다에서도 색다른 연기 잘보고 왔습니다^^  ,1,0,0
904,2015.10.29,8,손에 땀이 흥건ㅠㅠ 탄탄한 스토리 정말 재밌었다!  ,1,0,0
905,2015.10.29,10,두시간이 짧게 느껴졌어요 19세 나왔더라면 더 재밌었을거 같아요  ,1,0,0
906,2015.10.29,10,긴장하면서 봤더니 어깨 경직ㅋㅋ 다 보고 나니까 어깨 뻐근  ,1,0,0
907,2015.10.29,1,이게 진심 재밌더냐??? 진짜 이런 쓰레기같은 영화 지들도 찍으면서 이건 아니지 싶은데... 이런생각 안드나?? 스토리는 개 잡탕 짬뽕 무슨 내용인지도 모르겠고 진짜 이건 아니자나.. 해진이형  ,1,0,0
908,2015.10.29,10,간만에 긴장면서 본 영화! 무섭기만 한것도 아니여서 다음 장면들이 궁금해지는 그런 영화였다!  ,1,0,0
909,2015.10.29,10,보는내내 조마조마함이 가득했던.. 범인이 누군지 알고 봐도 재밌어  ,1,0,0
910,2015.10.29,9,너무 소름 돋는다ㅠㅠ 만약 내가 주인공이였으면 더 했을듯..  ,1,0,0
911,2015.10.29,10,왠만한 공포영화 보다도 무서웠던 영화로 스릴 넘치고 흥미진진했다  ,1,0,0
912,2015.10.29,9,오ㅋㅋㅋ재밋다 별기대없이봤는데 스릴장난아님ㄱㅋㅋ뒷목아파.완전짱잼이요~  ,1,0,0
913,2015.10.29,9,주원 믿고 봤는데 믿고 보길 잘했군  ,1,0,0
914,2015.10.29,9,관람객생각만큼은 아니지만 유혜진과 주원이 잘어울리네요.재미있게 봤엉?.  ,1,0,0
915,2015.10.29,10,난 진짜 재밌게봤다. 진짜  ,1,0,0
916,2015.10.29,10,나오는 배우들 하나같이 연기력이 수준급ㅋ  ,1,0,0
917,2015.10.29,10,분위기는 어둡고 잔인하긴 하지만 스릴러 영화 즐기기엔 딱입니다  ,1,0,0
918,2015.10.29,10,굿재밌음굿재밌음굿굿  ,1,0,0
919,2015.10.29,10,그놈이다가 주는 긴장감 공포감에 깜짝 깜짝 놀랐어요 잼나게 잘 보고 왔어요~~  ,1,0,0
920,2015.10.29,8,관람객깜짝깜짝 놀래켜요 임산부나 노약자는 피하는게~~^^  ,1,0,0
921,2015.10.29,8,엔딩이 좀 아쉽긴 하지만 긴장의 연속ㅋㅋ  ,1,0,0
922,2015.10.29,7,오컬트좋아하는사람 딱임  날씨가뜩이나 춥던데 이거보고더 추워짐  ,1,0,0
923,2015.10.29,10,같은 시기에 나온 모 스릴러 영화보다 훨씬 재밌네요 유해진님 연기 대박이에요  ,1,0,0
924,2015.10.29,10,새롭고 신선하진 않았지만 이정도의 영화라면 충분히 볼만하다  ,1,0,0
925,2015.10.29,10,벌렁벌렁 무셥ㅠ 다들 연기력 탄탄하구 보셈요~  ,1,0,0
926,2015.10.29,9,아니 범인을 알고 봐도 재밌잖아..  ,1,0,0
927,2015.10.29,10,스릴 넘치고 주연 배우들 연기력도 엄청 났어  ,1,0,0
928,2015.10.29,9,스릴러 영화 좋아하면 무조건 보세요 정말 재밌습니당  ,1,0,0
929,2015.10.29,10,재밌게 잘 보고 왔어요 유해진 연기 짱!  ,1,0,0
930,2015.10.29,10,패션왕의 주원이 아니야ㅋㅋ아 이번에 영화 초이스 잘한듯  ,1,0,0
931,2015.10.29,10,보면 볼수록 긴장이 되는 영화랄까? 스토리 좋고 스릴 있고 좋음  ,1,0,0
932,2015.10.29,10,너무 긴장감하면서 봐서 몸이 뻐근해요ㅠㅠ 놀라는 장면은 왜 이렇게 많은지..  ,1,0,0
933,2015.10.29,10,관람객가진것은 가족뿐인 재개발촌의 한 남자가 여동생을 살해당하고 믿을건 오로지 직감과 자신처럼 소외된 영매 소녀뿐... 신선하고 독특한 연출. 흔한 스릴러 장르의 요란함이 없는 전개가 매우 매력적. 배우들의 연기력의 향연들은 그 모든걸 완벽하게 했름.  ,1,0,0
934,2015.10.29,10,깜짝깜짝 놀랐는데 나름 잼나게 봤어용 꿀잼ㅎㅎ!  ,1,0,0
935,2015.10.29,8,뭔가 좀 이프로 아쉽긴한데 재미는 확실히 있음  ,1,0,0
936,2015.10.29,5,오늘 보고 왔는데 기대 하지마세요그냥 편한 마음으로 보시길 바랍니다 평점에 비해 형편없습니다주원.유해진 연기력 때문에 그나마 볼수있는거지...이런건 딱 dvd 나오면 시디 빌려서 보거나 영화사이트 들어가서다운받아 컴으로 보는게 케이득입니다  ,1,0,0
937,2015.10.29,10,강추!! 무섭고 스릴 넘친다 특히 이유영 연기 대박  ,1,0,0
938,2015.10.29,7,관람객그냥그렇네요 조금 아쉬워요  ,1,0,0
939,2015.10.29,1,형 진심으로 말한다....진짜 노잼이다 보지마라... 휴 억지로 쥐어짜내는 슬픈내용 이런거 진짜 우리나라 영화 문제다 ㅡㅡ  ,1,0,0
940,2015.10.29,10,배우들 연기도 좋고 스토리도 좋고 실화를 모티브로 했다는데 그래서 그런지 더 인상깊게 볼 수 있었다  ,1,0,0
941,2015.10.29,1,노잼..  개연성도없고 동기도없고 그냥..  실화드립치지마라  ,1,0,0
942,2015.10.29,8,관람객볼만하네요 여자친구가좀무서워하긴했지만ㅎㅎ  ,1,0,0
943,2015.10.29,6,관람객시나리오가 많이 부족하네요.연기력으로만 보기에는 무리네요.  ,1,0,0
944,2015.10.29,8,보면서 얼마나 많이 놀랐는지ㅠㅠ  영화 분위기 자체가 처음부터 끝까지 무섭  ,1,0,0
945,2015.10.29,8,관람객역시 해진씨..!!!저는 유해진씨 보구 본 영화입니다.끝이 조금허무해서 8쩜^^  ,1,0,0
946,2015.10.29,10,실화라는 점과 끝날때 까지 계속되는 긴장감에 숨 쉴 틈 없이 봤습니당  ,1,0,0
947,2015.10.29,9,참바다씨 용팔이씨 두배우는 역시 연기갑임!!! 소름소름믿고보는 두 배우 유해진 주원 흥해라!!!  ,1,0,0
948,2015.10.29,10,쫄깃.. 보는내내 주먹 꽉 쥐고 봄..  ,1,0,0
949,2015.10.29,1,실화를 바탕으로 했다고 하지만 ~~글쎄요~~  ,1,0,0
950,2015.10.29,10,그냥 대박이라는 말 밖에 안나옴ㅋㅋ 이정도면 한국 스릴러 영화 중 열 손가락 안으로 들어가듯  ,1,0,0
951,2015.10.29,10,와 오전에 봐서 다행.. 저녁에 봤음.. 진짜 후덜덜;  ,1,0,0
952,2015.10.29,10,어후 긴장감이 정말ㅎㅎ공포영화보다 더 무서웠다  ,1,0,0
953,2015.10.29,9,주원과 유해진의 연기력에 박수를..  ,1,0,0
954,2015.10.29,10,어둡고 무거운 영화였지만 두분의 강렬한 연기력에 시간 가는줄 모르고 봤네여  ,1,0,0
955,2015.10.29,1,내 돈과 내 시간이 너무나도 아깝다 어떻게 109분이 3시간처럼 느껴질수 있는거지? 이 영화를 보는내내 이걸 보자고 했던 내가 OOO이였다고 후회하고 이걸 10000원이나 내고 보게된 친구한테 진짜 미안했다. 친구야 미안해 난 앞으로 영화 안고를께  ,1,0,0
956,2015.10.29,8,귀신 나온순간 공포로 장르가 바뀌어버림 ㅋㅋㅋㅋ  ,1,0,0
957,2015.10.29,10,처음부터 끝까지 마음 졸이면서 봤어요 스릴러던데 공포영화를 보는 듯 했네요ㅎ  ,1,0,0
958,2015.10.29,10,심장 쫄깃한 스토리!! 실화여서 더 재밌게 볼 수 있었다  ,1,0,0
959,2015.10.29,6,"대중성과 거리가 좀 먼,비주류영화입니다.아트하우스or 아트나인 같은 예술전용영화관에서나 상영해야 할 정르..영화도입부에 대놓고  cgv아트하우스 뜸ㅎㅎ무겁고 진지한 영화니 참고하시구요.참고로 자는분들 여럿 있더군요^^  ",1,0,0
960,2015.10.29,5,간만에 영화보면서 자려고하는데 불쑥불쑥 불편했다.  ,1,0,0
961,2015.10.29,10,친구가 스포했는데 알고 봐도 스릴 넘치던데.. 진심 최고  ,1,0,0
962,2015.10.29,8,간만에  긴장감느끼게하는 영화였네요ㅎ  주인공들의연기도  볼만하구요  오랜만에  바운OO운스~  ,1,0,0
963,2015.10.29,9,역시 그놈이 그놈이였네 유해진 짱  ,1,0,0
964,2015.10.29,10,개봉날 보고 왔는데 주원.유해진 두분다 연기 최고였고 심장이 쫄깃함 다보고 나니 짠하고 슬픈 여운이 남는 영화..  ,1,0,0
965,2015.10.29,10,흥미진진한 스토리 전개에 그에 맞는 깜짝 놀라는 음향효과까지 더해지니 무서울 수 밖에ㅠ  ,1,0,0
966,2015.10.29,7,무서웠다.ㅜ 여름에 나오지 날씨도 추운데 연기 잘하네.  ,1,0,0
