index,time,score,reple,1st_week,2st_week,3st_week
1562,2015.10.31,10,쫄깃함이 살아있는 추격극..  ,1,0,0
1563,2015.10.31,10,"범인이 누구인지 밝혀가는 과정이 아닌, 그 범을 추격하는 과정에 포커스를 맞췄기 때문에 처음부터 범인이 지목되지만 긴장감을 늦출 수 없었다. 주원은 남자가 봐도 참 멋짐  ",1,0,0
1564,2015.10.31,10,스토리 탄탄 배우 연기 짱짱 오랜만에 제대로된 스릴러였다.  ,1,0,0
1565,2015.10.31,9,깜짝 놀람;; 무섭..  ,1,0,0
1566,2015.10.31,10,긴장감속에서 느껴지는 소름..  ,1,0,0
1567,2015.10.31,1,내 생애 가장 재미없던 영화.평점 알바들이 존재한다는 걸 믿게 해준 영화  ,1,0,0
1568,2015.10.31,1,진짜 이게 뭔스토리? 보는 내내 기분 나쁘기만 함  ,1,0,0
1569,2015.10.31,1,본인은 관대한 사람이라 웬만한 영화에 5점이상 주려고 한다. 하지만 이영화는 오랜만에 1점을 준다.. 이럴수가 있나???  ,1,0,0
1570,2015.10.31,8,관람객소소합니다.긴장은  되더이다.  ,1,0,0
1571,2015.10.31,7,대작이 될뻔한 영화.. 후반부가 너무아쉽  ,1,0,0
1572,2015.10.31,2,이렇게 이상한 영화는 오랜만이다..  초반부터 느낌이 쌔하긴했는데 가면갈수록 이상함. 나름 긴장감은 있는데 대사며 줄거리 컨셉 연출이 어색하고 장르는종범됨. 영화끝나고나올때 기분찝찝하더라..  주원 유해진이 열심히연기하는데 안타까워보일정도.  ,1,0,0
1573,2015.10.31,4,귀~신~영~화~~~  ,1,0,0
1574,2015.10.31,9,관람객주원과 유해진의 사실과같은 액션씬이 너무 좋았고 모든 배우 특히 이유영의  귀신들린 역할이 볼만하였다~장우의 오열하는 씬은 과히 맘이 아플정도였다.  ,1,0,0
1575,2015.10.31,3,관람객지루하네요재미 없네요  ,1,0,0
1576,2015.10.31,10,이정도면 충분히 다른 사람들에게도 만족스럽지 않았나 싶다  ,1,0,0
1577,2015.10.31,10,디테일 하나하나가 살아있는 미스터리 추격극  ,1,0,0
1578,2015.10.31,10,걍 시덥잖은 스릴러 일줄 알았는데 이런 내 생각을 어떻게 읽은건지 들었다 놨다..아주.. 심장 쫄깃해졌었음  ,1,0,0
1579,2015.10.31,10,주원연기좋고 유해진씨 눈빛 소름!!  ,1,0,0
1580,2015.10.31,10,먼.. 재밌다고만 하면 다 알바래..ㅋㅋ  ,1,0,0
1581,2015.10.31,5,관람객졸잼 꿀잼 재미따능 앞뒤스토리는 좀 이상한듯  ,1,0,0
1582,2015.10.31,10,예고편 그 이상으로 재밌었던 영화.  ,1,0,0
1583,2015.10.31,7,관람객배우의 연기는 일품! 그런데 귀신의등장과 사건의 전개가 좀 어색함!  ,1,0,0
1584,2015.10.31,7,스릴러에 공포를 더해야 하는거 아닌가요.. 공포는 못보지만 스릴러좋아했던 저에겐 보는내내 힘들었어요... 귀신이라니..귀신이라니..하 ㅠㅠ  ,1,0,0
1585,2015.10.31,10,관람객완전 소름돕고 잔인하고 무서웠다  ,1,0,0
1586,2015.10.31,9,주원 때문에 본 영화인데 유해진한테 빠져서 나온 영화..ㅎㅎ  ,1,0,0
1587,2015.10.31,1,연계성부족 아오 긴장감부족 흔하디흔한스토리 아오  ,1,0,0
1588,2015.10.31,10,너무너무 짱짱 진짜 재밌어요~~~!!  ,1,0,0
1589,2015.10.31,3,배우들의 실감나는 연기덕분에 그나마 3점 줄만한 영화였습니다.  ,1,0,0
1590,2015.10.31,10,초반부터 심장을 쪼이고 소름돋는 장면들이 계속 나와서 섬뜩했어요;;ㅎㅎ 마지막까지 긴장을 놓을 수 없더라구요..  ,1,0,0
1591,2015.10.31,10,설중매 연기 쩔ㅋㅋ 이쁘게 생겼던데 ㅋㅋ  ,1,0,0
1592,2015.10.31,1,1점도 아깝다.. 뻔한 스토리 구조와 뻔한결말.  ,1,0,0
1593,2015.10.31,7,"관람객오래만에  몰입도 있는 영화를 봤어요 주원  유해진  연기 좋아었요단..마지막  결론이  쫌,별로임  ",1,0,0
1594,2015.10.31,1,"방금 보고왔는데, 역시 댓글알바들.. 왜 그러고 사나요?이건 일반대학 교양과목 조별과제로 찍은 수준입니다. 개연성 없는 전개, 각 장면이 독립적으로 뚝뚝 끊기는 흐름, 아무때나 튀어나오는 귀신. 이건 너무 심하네요. 감독님아,?반성 좀 하셔야할듯  ",1,0,0
1595,2015.10.31,10,내가 딱 ! 좋아하는 스타일 ㅎㅎ  ,1,0,0
1596,2015.10.31,10,대충 줄거리를 알고 갔는데도 마지막까지 흥미진진했어요  ,1,0,0
1597,2015.10.31,10,영화 재밌게 봤습니다! 주원 다음 작품도 기대해요  ,1,0,0
1598,2015.10.31,10,이유영? 이라는 여자 연기 진짜 소름끼칠정도로 잘하네요!  ,1,0,0
1599,2015.10.31,10,연기력만으로도 엄지척 할만한 영화 아닌가..  ,1,0,0
1600,2015.10.31,5,광명롯시] 스토리를 연결하는 개연성이 억지스러운 느낌이 든다. 결론 만들고 끼워 맞추기. 다만 연출이 탁월해 분위기가 있다. 그래서 나름 볼만했지만 그냥저냥 요즘 쏟아지는 저렴한 양산형 한국영화중 하나라고 생각한다.  ,1,0,0
1601,2015.10.31,9,충분히 기대하고 볼만한 영화  ,1,0,0
1602,2015.10.31,7,관람객배우 연기력? 10점 입니다.다만 아쉬운점은  내용과 내용이 이어짐이 매끄럽지 못한 부분들이 있어요. 돈 아깝다고 생각들진 않네요.  ,1,0,0
1603,2015.10.31,7,관람객밤에 연출이 너무 무서워요  ,1,0,0
1604,2015.10.31,10,오싹오싹 무서우면서도 배우들의 명연기에 감탄!재밌다재밌다ㅎㅎ굿굿  ,1,0,0
1605,2015.10.31,6,재밌대서 봤는데 스릴러인지 호러인지 액션인지...뭐가뭔지 모르게봤어요..  ,1,0,0
1606,2015.10.31,10,와 삼시세끼에서는 찾아볼 수 없는 유해진의 OOO기력  ,1,0,0
1607,2015.10.31,9,너무 흥미진진하던데여 ㅋㅋ 재미없다는 사람들 이해 못하곘음  ,1,0,0
1608,2015.10.31,10,당분간 초코볼을 못먹겠어요 ;;  ,1,0,0
1609,2015.10.31,7,혼자봤는데.. 괜히봤네. 무섭고 소름끼침.솔직히  내용은 별 것 없이 흘러가는데..; 그리 유쾌한 영화는 아니었음. 유해진씨는 밝은 배역 좀 맡으세요.  ,1,0,0
1610,2015.10.31,6,흠...배우들연기력은 짱인데..스토리가 좀 탄탄하지못한듯요..  진짜 무서운데 재밌다는 생각은 안듦..  ,1,0,0
1611,2015.10.31,10,계속 긴장해서 봐서 그런지 몸이 좀 뻐근하기도ㅠㅠ  ,1,0,0
1612,2015.10.31,10,영화 끝날때까지 긴장의 연속! 공포영화 좋아하면 강력추천!  ,1,0,0
1613,2015.10.31,10,매순간마다 긴장감은 최고조~ 재밌게 봤어요ㅎㅎ  ,1,0,0
1614,2015.10.31,9,금일 보고왔습니다.  생각했는거보다 잼나고  주원 유해진의연기가 넘 리얼하네요  소름 돋아서 섬짓했어요.  ,1,0,0
1615,2015.10.31,8,개인적으로 스릴러 영화를 좋아해서 그런지 재밌었당  ,1,0,0
1616,2015.10.31,4,관람객진부한 스토리에 난데없이 영매가 끼어들어서 스릴러도 공포도 아닌듯한 어중간한 느낌  ,1,0,0
1617,2015.10.31,10,무섭고 서늘하고.. 슬프기도 했던 여운이 깊은 영화  ,1,0,0
1618,2015.10.31,5,관람객막 재밋지는않앗음유해진 무서움  ,1,0,0
1619,2015.10.31,1,이게 재밌어요..? 진짜?  ,1,0,0
1620,2015.10.31,1,연출력은 영화를 만드는데 있어서 가장중요한 요소  ,1,0,0
1621,2015.10.31,10,지릴뻔 무서웠어요ㅜㅜ  ,1,0,0
1622,2015.10.31,10,관람객몰입도 최고에요! 근데 너무 깜짝깜짝 놀래서 심장이...ㅠㅠ  ,1,0,0
1623,2015.10.31,10,다 보고나서 실화라는 말 듣고 정말 소름 돋았다.. 세상엔 정말 이상한 사람들이 많은거 같다  ,1,0,0
1624,2015.10.31,7,관람객마지막의 긴장감이 아쉬운 영화  ,1,0,0
1625,2015.10.31,6,"분명 좋은배우들이 좋은연기력으로 극을 이끌어가며관객과 호흡하는데...극의 개연성, 스토리, 몰입도를 방해하는 요소들이 중간중간 너무 많이 튀어나옴시간촉박? 제작비 문제?이유야 어찌되었든 연출력 부족이라 생각함.배우들 연기가 훌륭해서 보는 영화.  ",1,0,0
1626,2015.10.31,10,명품연기로 몰입감최고. 간만에 재미있는 스릴러 봤네요. 추천합니다.  ,1,0,0
1627,2015.10.31,8,관람객코믹한 연기가 어울리는 유해진인데 정반대 역할도 나름대로 어울린다고 느꼈다. 영화 전체적인 분위기는 강렬하지는 않지만 적당하게 긴장감을 느낄수 있었던것 가따  ,1,0,0
1628,2015.10.31,1,"영화가 완전망작이다 보니, 알바를 거하게 풀었나봅니다. 인간적으로 이 영화는 대학교 교양과목 조별과제만도 못합니다. 개연성은 없고, 흐름은 뚝뚝 끊기고. 터무니없는 장면들의 연속(주인공 펀치에 건물이 무너짐, 귀신이 아무때나 튀어나옴) 기타등등. 심함  ",1,0,0
1629,2015.10.31,1,평점에 제대로 낚엿다... 와 평점 무섭네  ,1,0,0
1630,2015.10.31,10,관람객짱재밌음 지루할 틈도 없고 긴장백배 심장쫄깃해짐  ,1,0,0
1631,2015.10.31,7,관람객연기력 내용구성은 좋네여 ~ㅋㅋ볼만합니당  ,1,0,0
1632,2015.10.31,5,초반전개는 좋은데.뭐랄까?약간 뒤로 갈수록 사건에대한 연관된 설명없이그냥 영화분량 채우고 끝낼려는 느낌이었어요.뭔가 중간중간 부실했던 느낌.그리고 약국문은 깨도깨도 다시 복원되는 약국의 문.연관성은 많이없고 부실했지만배우들연기는좋았어요.  ,1,0,0
1633,2015.10.31,10,관람객 개인적으로 시간가는줄 모르고 잘봤어요  ,1,0,0
1634,2015.10.31,10,"관람객혼자보러갔었는데 옆사람 팔잡고 볼뻔했어요!연기력, 스토리.몰입감.긴장감. 모두 최고입니다!!!완전 잘봤어요 !!!!  ",1,0,0
1635,2015.10.31,10,관람객연기력이 짱주원 유혜진 짱  ,1,0,0
1636,2015.10.31,1,진심 안보는걸 추천합니다 돈 버리지 마시길 바랍니다 평점 1점도 아깝습니다 도대체 무슨 영화인지 모르겠습니다  ,1,0,0
1637,2015.10.31,5,주원도 유해진도 없었다 오직 설중매만 있더라  ,1,0,0
1638,2015.10.31,1,돈날리고싶으면보셈.. 진짜 노잼입니다  ,1,0,0
1639,2015.10.31,10,내일 보러가는데 빨리보고싶어서 설레요!!  ,1,0,0
1640,2015.10.31,10,방금 영화보고 나왔어요~오랜만에 깔끔하게 재미있게 본 스릴러였습니다.연기도 잘하고 영화도 군더더기 없다는 느낌이었어요!무대인사 처음 봐서 더 좋았어요^^  ,1,0,0
1641,2015.10.31,8,관람객재미있었는데 반전이 없네요.. 주원 연기 잘하네요 영화가 조금 살짝 허전한 느낌 빼면 재밌어요  ,1,0,0
1642,2015.10.31,7,관람객보통!!!전혀 반전이 없는 영화!  ,1,0,0
1643,2015.10.31,9,배우들 대박~기대했던것보다 넘 잘봤어요 ^^  ,1,0,0
1644,2015.10.31,10,관람객범인 쫓는데 음침한 기운까지 플러스 된 영화. 유쾌한 내용은 아니지만 오싹하고 끝날 때까지 놓을 수 없는 마음이었음.  ,1,0,0
1645,2015.10.31,10,관람객와 보는내내 심장 쫄보 였음 ㅠㅠ 꿀잼꿀잼  ,1,0,0
1646,2015.10.31,1,관람객...재미없어요 시작부터 범인이 누군지도알고 핵 노잼입니다..ㅠ 돈아까움  ,1,0,0
1647,2015.10.31,1,진짜 개노잼임 스릴러보면서 친구랑 비웃다왔음평점알바한테 속았다는 느낌 이번에 처음받아봄  ,1,0,0
1648,2015.10.31,10,무서운 영화 잘 못보는데 영화 중간중간에 너무 깜짝 놀랐어요. 공포물로 갔어도 됐을 듯. 배우들의 연기과 연출에 10점 드립니다. 저는 스토리도 무난무난해서 좋았네요.  ,1,0,0
1649,2015.10.31,10,관람객너무재밌어여 주원연기짱 짱  ,1,0,0
1650,2015.10.31,1,영화관 전등세는게 더 재밌을 정도  ,1,0,0
1651,2015.10.31,9,관람객유해진배우의 새로운 모습을 보게된 영화약국 유리값  꾀 들겄네^^  ,1,0,0
1652,2015.10.31,8,관람객뻔한스토리입니다 그래도 볼만하네요  ,1,0,0
1653,2015.10.31,1,평점 처음 남겨요..  믿고 보지마세요..  ,1,0,0
1654,2015.10.31,8,관람객주원 볼라고 갔다가 유해진 아저씨 연기에 푹 빠졌어요 유해진 아저씨 연기는 해가 바뀔수록 특색있고 흥미로움ㅋㅋ글구 그 여자분 땜에 너무 무서웠어요ㅜㅜ  ,1,0,0
1655,2015.10.31,1,중간에 나오고 싶었는데 나오면 갈곳이 없어서 끝까지 앉아있었다 ..  ,1,0,0
1656,2015.10.31,10,관람객보기보다는  괸찬내여ㅎ  ,1,0,0
1657,2015.10.31,8,관람객스릴잔잔 끝까지 반전의 반전을 거듭하고 마무리가좋앗던 영화엿습니다. 너무 잔인하지도 않아서 볼만햇어요~^^  ,1,0,0
1658,2015.10.31,9,"스릴러물에  샤머니즘 이  가미된  독특한 소재라   궁금해서 안볼수가 없더라구요,  주원씨와 유해진씨 연기 완전 짱이예요~으스스하고 음침한 배경들과   음향효과  그런것들  표현을 정말 잘하셨던데  기대했던 반전이 없어  조금 아쉬웠어요.  ",1,0,0
1659,2015.10.31,9,눈요깃거리가 있는 스펙타클한 영화는 분명 아니다.독립영화 같이 어둡고 스산하다.그런데 묘하게 긴장감을 유지한다..처음엔 스토리가 개연성이 좀 없다고 생각했는데 다시 보니 감독의 의도가 이해된다..스산한 가을...두 인생의 아픔과 구원이 감슴에 아린다.  ,1,0,0
1660,2015.10.31,1,아 정말 최악쓰레기다 이걸 영화라고 1시간 반 잤다 핵노잼이다 이게 무슨 영화야 돈아까워 차라리 하늘을 걷는 남자 마션 브파이브릿지 007보지 아까워 감성팔이는 그만하자 응  ,1,0,0
1661,2015.10.31,1,스토리 엉성하고 개연성 부족하고 죽어라고 깜짝깜짝 놀래기만함. 스릴러도 아니고 그냥 저렴한 호러일뿐.  ,1,0,0
1662,2015.10.31,10,영화 몰입있게 완전잘봤다 연기대박 ㅠ  ,1,0,0
1663,2015.10.31,10,주원 유해진 연기대박 스릴짱  ,1,0,0
1664,2015.10.31,6,관람객무서움....ㄷㄷ그냥스릴러..귀신...  ,1,0,0
1665,2015.10.31,2,관람객유해진씨 연기력은 인정할수밖에 없네요.. 근데...영화는...ㅎㅎ  ,1,0,0
1666,2015.10.31,10,핵꿀잼 이런장르는 첨이야 신선  ,1,0,0
1667,2015.10.31,1,쓰레기..살면서 본영화중 최악이었습니다  ,1,0,0
1668,2015.10.31,8,관람객손에 땀을땀을... ㅋㅋㅋ  ,1,0,0
1669,2015.10.31,3,3점 ... 그이상은 안돼  ,1,0,0
1670,2015.10.31,6,배우들의 연기력은 좋은데 스토리가 너무너무뻔한 노잼  ,1,0,0
1671,2015.10.31,10,연기력에 한 번 빠져들었고 내용도 집중해서 볼 수 있었습니다. 이해가 안가는 부분이 사람들마다 취향이 다르지만 평점이 낮은데다 쓰레기라고 하시는데 개인적으로 마션 더폰 베테랑보다 훨씬 재밌게 봤구요 특히 애국심으로 보는 암살... 이게 진짜 쓰레기죠  ,1,0,0
1672,2015.10.31,10,재미있음 꼭추천하고싶은 영화  ,1,0,0
1673,2015.10.31,9,관람객한국형 스릴러의 새로운 유형을 열다. 심령적요소와 결합한 호러와 범죄의 균형있는 조화.  ,1,0,0
1674,2015.10.31,10,관람객처음으로 예매해서 보러 갔는데 너무 편하게  잘 보았 씁니다.다음에또 만이 이용해야겠어요..  ,1,0,0
1675,2015.10.31,9,영화는 영화로 봐야지..여기가 슈퍼스타K인가 싶다..제 점수는요? 타이틀도 평점이아니라..소감.후기로 바꾸는게 맞는게 아닌가 하는 생각  ,1,0,0
1676,2015.10.31,1,어휴 5점짜리 영환데 평점이 왜이리 높냐 진짜 중간중간 잠시 놀래는것빼면 이미 중반 전에 잤다  ,1,0,0
1677,2015.10.31,10,무섭고 재밌고 스릴넘침  ,1,0,0
1678,2015.10.31,10,여자가 마지막에 손에둘러준 스카프때매 주원 살지롱  ,1,0,0
1679,2015.10.31,10, 스릴있었고 재밌었음 여배우 연기괜찮  ,1,0,0
1680,2015.11.01,9,관람객좋은영화봤어요글구 좋은사람이랑 봐서 더 좋았어요ㅎㅎ  ,1,0,0
1681,2015.11.01,8,그냥웰메이드영화~~  ,1,0,0
1682,2015.11.01,8,아좋다특히나주원과유해진연기는돋보였다 점점발전하는모습이보이는 문배우...앞으로가더기대된다 깜짝놀라는부분이많고 무서운효과음ㅜ귀막고눈막고힘들었지만 주원의새로운모습도 볼수있었고오랜만에꿀잼영화본듯! 약간아쉬운감? 이있긴하지만후회하지않는영화이번영화흥행하길  ,1,0,0
1683,2015.11.01,9,재밌다 보세요진짜  귀신물이랑 살인물이결합된놀람  ,1,0,0
1684,2015.11.01,10,유해진이 이번에는 주원-이유영과 파트너로  ,1,0,0
1685,2015.11.01,10,주원&유해진&이유영♡♡♡♡진짜연기대박^^끝까지눈을 뗄수없었어요~사실무서운영화잘못보는데~주원배우때문에첫스릴러영화도전성공.대박기원.주원화이팅.  ,1,0,0
1686,2015.11.01,5,일단 제일 이해안가는게 귀신을보는 시은이의 능력이용으로 범인을 잡는게아님.. 왜 시은이를 등장인물에 넣은지도 모르겠고 은지를 죽인 이유도 상당히 설득력없고 범인밝혀지는것도 주인공의노력이 아니라 의심계속하니까 그냥 자기라고 다말해줌;; 범인찾는재미도없음  ,1,0,0
1687,2015.11.01,3,생각보다별로였어요..  배우들은 좋았지만 스토리가 많이아쉽네요....  ,1,0,0
1688,2015.11.01,7,어정쩡한 동기와 과거와 계기와 증거가 모여 만들어진 '중후반정도까지는' 괜찮은 스릴러와 미친 연기  ,1,0,0
1689,2015.11.01,1,유해진빼고 전부 발연기 미치겟다 돈아까워죽겟네  ,1,0,0
1690,2015.11.01,8,관람객주원연기력인정?하게만드는영화그냥저냥볼만합니다~  ,1,0,0
1691,2015.11.01,10,관람객흥미진진하게 잘봣네요  ,1,0,0
1692,2015.11.01,4,스토리가..   공백10자  ,1,0,0
1693,2015.11.01,8,관람객내용은 뻔하지만 볼만해요  ,1,0,0
1694,2015.11.01,7,그냥 물흐르듯이 ㅎㅎ 반전이 없다는게 반전  ,1,0,0
1695,2015.11.01,9,재미있던데 평점이 왜 이리 낮지? 잘봤습니다  ,1,0,0
1696,2015.11.01,1,평점 처음달아봅니다 진심 3류영화  ,1,0,0
1697,2015.11.01,1,왜이렇게 밑에 평점이 좋은지 이해불가...좀 전에 보고나왔는데 초반엔 긴장 스릴감 장난아닌데갑자기 귀신이 나오질않나.. 그것까진 그렇다치는데스토리의 개연성도 없고 막판에 끝날 땐 급으로 너무 억지로 맞추듯 맺어지는 결말에 할말이 없음...  ,1,0,0
1698,2015.11.01,4,"관람객반전도,감동도 없는듯해요. .보는내내 기분이 안좋았음. .  ",1,0,0
1699,2015.11.01,8,주원 연기 잘하네...영화는 첨이라 반신반의했는데 사투리연습 많이 한거같고 배역에 녹아들었음 유해진은 말할것도 없고 다만 범인 밝혀지고부터 좀 개연성이 떨어져서 2점 감점  ,1,0,0
1700,2015.11.01,10,영화관에서 본 영화중에 제일 많이 놀램ㄷㄷ  ,1,0,0
1701,2015.11.01,7,혼신의 연기와 '중후반정도까지는' 괜찮은 스릴러  ,1,0,0
1702,2015.11.01,2,주원 좋아해서 봤는데인물 너무 안우울리고답답하고 재미없고 진짜 최악이에요  ,1,0,0
1703,2015.11.01,9,제가 넘 깜짝깜짝놀래서 옆에 남자분이 더 놀랐대요ㅋㅋㅋㅋ  ,1,0,0
1704,2015.11.01,1,"손님에 이은 최악의 영화중 하나네요....이영화 일주일동안 광고바짝해서 상영관 많이한다음 검은사제들같은 영화 나오면 상영관 없어질듯.,..진짜 후회되네요  ",1,0,0
1705,2015.11.01,9,드라마에만 익숙햇던 주원. 스크린에서도 빛이나네요 긴박감넘치는 영화였어요  ,1,0,0
1706,2015.11.01,7,관람객그냥저냥볼만햇어욤 ㅎ  ,1,0,0
1707,2015.11.01,9,"관람객무서운 장면은 거의 가리고 봤고, 유해진이 악역은 실감났다. 주원도 연기쵝오 어려서 가정이란 정말  제일 중요한 것 같다.  아이들을 사랑으로 키워 정서적으로 올바르게 자랄 수 있도록 해줘야 하는게 우리들의 몫이라 절실히 또 느꼈다.  ",1,0,0
1708,2015.11.01,7,관람객긴장감은 있지만 내용은 애매한듯...  ,1,0,0
1709,2015.11.01,8,빠른전개로 딴생각할틈없이 잘봄. 그러나 뭔가 아쉬운느낌? 그래도 볼만함  ,1,0,0
1710,2015.11.01,2,소리로 놀래키는 신개념 스릴러. 보고나서 남는게 하나도 없어 아쉬운 영화.  그와중에  연기잘하는 배우들.  ,1,0,0
1711,2015.11.01,10,관람객...많이놀랬어요... 남친한테안기기는 좋았는데....밤에잠 못잘것같네요  ,1,0,0
1712,2015.11.01,10,관람객스릴있고 내용도 좋았어요 재미없다는 사람이 이해가 안갈정도로 재미있게 봤고요 스릴넘치고공포+스릴+내용탄탄 보는내내 지루함없이보고 유해진연기 잘하는거 알았지만 보고 소름돋았고진짜 영화잘될거 확신합니다 꼭보세요  ,1,0,0
1713,2015.11.01,1,절대안보는것을 추천합니다  ,1,0,0
1714,2015.11.01,10,"대박 지금 심야영화보고 설농탕먹으러 왔는데 댓글을 남기지 않을 수가 없다. 주원의 새로운 연기모습에 빠졌고, 유해진의 진지한 연기에 소름이 돋았다. 영화보느라 팝콘을 손에 놓긴 또 간만인듯...무서워서 음료도 잘못마셨다ㅜㅜ  ",1,0,0
1715,2015.11.01,9,시나리오가 탄탄해서 공포스러움도 모두 근거를 가지는게 맘에 든다.그러할 수 밖에 없었던 이유... 불쌍하다.  ,1,0,0
1716,2015.11.01,1,유해진 주원이 아까운 4점짜리 영화; 스토리가 탄탄하지도 않음~ 유해진의 살떨리는 연기에 우와 하면서 보긴해도 8점은 아닌듯  ,1,0,0
1717,2015.11.01,1,무뢰한 그다음으로 10노잼이다.  ,1,0,0
1718,2015.11.01,8,관람객보는 시간동안 흡족했습니다...  ,1,0,0
1719,2015.11.01,9,주원  너무많이뛰고 너무많이 맞아서 불쌍했다 역시성실한배우♡유해진씨도 전혀다른모습에 좀  무서웠ㅇㅓ요영화에서의 그 분노에 저도 화가났어요그범인빨리잡혔으면좋겠다  ,1,0,0
1720,2015.11.01,5,혼자보다가 죽는줄알았어요..맘약하신분은 절대혼자보지마세요. .ㅜ.ㅜ  ,1,0,0
1721,2015.11.01,8,관람객오랜만에 느껴보는 오싹함!  ,1,0,0
1722,2015.11.01,2,납득되지않고 공감되지않는 살인동기에다가 쌀쌀한 가을날씨에 공포+스릴러를 한방에보게된다면 가을이 2시간만에 겨울로 넘어가게됨을 알수 있음. 걍 잔인하고 공포스러운 분위기가 끝  ,1,0,0
1723,2015.11.01,1,별 한개도 아깝다. 올해본 영화중 최악. 개연성도 없고 억지설정에 경찰은 무슨 현실감 아얘없는 부랑자집단으로 나오고. 감독이 담배꽁초버리다가 경찰아찌한테 혼난적 있는듯.  ,1,0,0
1724,2015.11.01,1,올해 본 영화 중 단연코 최악이었습니다. 유해진이라는 배우를 이렇게 밖에 못쓰시다니요. 이런데에 글 한번도 남긴 적 없는데 분노가 차올라서 글남깁니다.  ,1,0,0
1725,2015.11.01,1,노잼.핵노잼. 대한민국 영화사에서 선정한 우주세계최고의 핵노잼  ,1,0,0
1726,2015.11.01,5,그냥 뻔한범인에 뻔한마무리는 너무 식상한 구조와 결밀이였다. 중빈부터 너무 지루함  ,1,0,0
1727,2015.11.01,10,그놈이다최공주윈굿짱  ,1,0,0
1728,2015.11.01,1,나같은 실수를 범하지 말라고 1점준다. 개연성도 없고 무조건 다죽이네. 이 두 배우를 이렇게 밖에 활용 못하나? 경찰은 하는거도 없고 살인 명분도 없고. 난 유해진씨가 시나리오 보고 영화 고르는줄 알앗는데 아닌가보다. 급히 돈 쓸일이 있으셨나. 비추.  ,1,0,0
1729,2015.11.01,1,나같은 실수를 범하지 말라고 1점준다. 개연성도 없고 무조건 다죽이네. 이 두 배우를 이렇게 밖에 활용 못하나? 경찰은 하는거도 없고 살인 명분도 없고. 난 유해진씨가 시나리오 보고 영화 고르는줄 알앗는데 아닌가보다. 급히 돈 쓸일이 있으셨나. 비추.  ,1,0,0
1730,2015.11.01,6,늘어진다.. 두시간이어야했나 너무길기도했고 많이지루하고늘어지네요.. 귀신보는이야기였다니ㅋㅋㅋㅋ  ,1,0,0
1731,2015.11.01,8,"크게 지루한 부분 없이 즐기기에 괜찮은 스릴러라 생각된다. 주원 연기 잘하고, 여동생 이쁨  ",1,0,0
1732,2015.11.01,10,이걸보면서느낀점 어쨋든주원은연기를잘한다  ,1,0,0
1733,2015.11.01,8,관람객무서워요..공포영화인줄ㅠㅠ  ,1,0,0
1734,2015.11.01,7,관람객영화의 전개가 자극 위주로 진행되는 느낌. 딱히 스토리가 짜임새있지는 않다. 그래도 배우들의 연기가 뛰어남. 생각없이 킬링타임용으로 보기에 괜찮을 듯 싶다.  ,1,0,0
1735,2015.11.01,10,스릴감 넘치고 긴장하면서봤어요 주원박해진 이유영 연기다잘하고 몰입도짱입니당!  ,1,0,0
1736,2015.11.01,9,관람객그냥그냥 볼만한 영화이다  ,1,0,0
1737,2015.11.01,1,2명에 12000원 내고 봤는데도 돈아깝따 ..영화구성이 영...다른분들도 많이보세요..저혼자 보면 억울하니깐..  ,1,0,0
1738,2015.11.01,7,연기는 좋았으나...스토리가 좀 뻔해서 아쉬웠습니다ㅜ  ,1,0,0
1739,2015.11.01,10,스토리는 그냥 그렇지만 배우들의 연기가 엄청 뛰어남  ,1,0,0
1740,2015.11.01,8,관람객재밌군요 나름 즐거웠습니다  ,1,0,0
1741,2015.11.01,6,무섭고 귀신나와요..흑흑...  ,1,0,0
1742,2015.11.01,1,스토리 개연성없구 결말도 기대하고 봤지만 제대로 마무리없이...  ,1,0,0
1743,2015.11.01,10,주원이 연기를일케잘했던가...유해진은말할것도없고  ,1,0,0
