index,time,score,reple,1st_week,2st_week,3st_week
2328,2015.11.03,10,보면서 깜짝 깜짝 얼마나 많이 놀랐는지 몰라요  ,1,0,0
2329,2015.11.03,1,진심 로그인까지해서 평점 잘 안쓰는데 리얼 노잼  ,1,0,0
2330,2015.11.03,10,주원 역시 연기 잘하고 유해진과의 합도 너무 좋았음~  ,1,0,0
2331,2015.11.03,6,"스릴러라기보다는..  공포영화랄까, 귀신나오는지 모르고봐서 깜놀 ㅜ 6점대가 맞을듯 .  ",1,0,0
2332,2015.11.03,1,너무 진부한 스토리 / 70년대 경찰을 보는듯 / 유해진이 아무 의미없이 범인 행세 잘함 / 긴박한 순간에 차에 핸드폰 두고 다니는 센스 /  ,1,0,0
2333,2015.11.03,1,관람객정말로 실망했습니다~~기대이하입니다^^  ,1,0,0
2334,2015.11.03,3,1.주원의 어색한 사투리.(안어색하더라도  꼭  사투리가 필요한 지역을 설정할 필요가 있었을까. 보는 내내 답답)2.꼬맹이귀신  왜 싸돌아다녀? 마지막에  아주 조금 설명이 있긴하지만 납득불가. 왜 시은이를 쫓아다님?3.전개가 쓸데없이 길다.  ,1,0,0
2335,2015.11.03,10,관람객개무서워ㅠㅠㅠㅠ힝 벌벌떨었움  ,1,0,0
2336,2015.11.03,1,참내...뭐라 말로  표현 할 방법이 없네..그리고 경찰을 너무..참내...그리고 무슨 귀신...참내...휴..  ,1,0,0
2337,2015.11.03,5,주원이 유해진한테 동생얘기를 하는데 부모님 돌아가셔서 우는데 여동생 왈  내가 있잖아 하면서 손잡아 줬네 하는 그 장면에서 울었습니다.돈 아까워서  ,1,0,0
2338,2015.11.03,3,평점 알바쓰나요? 주원 팬?연기자들이 아까운 스토리입니다. 단순공포 스릴러에 반전 전혀없는 식상한 내용~  ,1,0,0
2339,2015.11.03,7,관람객더폰이랑 약간비슷한?  ,1,0,0
2340,2015.11.03,1,태어나서 평점 처음남겨보는데 공짜표로본건데도 공짜표 아까워죽을뻔. 이렇게 재미없는영화처음이다 내용도 다 짬뽕에다가 스토리는 뭘말하는건지모르겠고 사투리는 사투리대로 어색하고 결말 너무 뻔하다 진짜 실망..너무재미없다ㅠ아 공짜표라도 너무아까워 왜이딴걸봤지  ,1,0,0
2341,2015.11.03,7,관람객중간중간놀랄상황은있었지만 범인찾는데 반전이크지않아 조금아쉽네요  ,1,0,0
2342,2015.11.03,7,맷집 최강 주원+만렙 무당  ,1,0,0
2343,2015.11.03,1,노잼 핵노잼  진짜 초반스토리에 비해 후반이 너무 어물쩡끝나버림 어이없고 남는것도 없고 시간 돈 둘다 아까웠음  ,1,0,0
2344,2015.11.03,7,"보기 전까지는 굉장히 현실적인 스릴러, 그러니까 주원이 현실적으로 증거를 찾아가며 범인을 잡아갈 거라 예상했으나 예상과 반대로 귀신이 나오면서 환타지 스릴러가 된 느낌..? 내가 기대했던 것과 달라서 조금 실망스러웠다  ",1,0,0
2345,2015.11.03,10,관람객짱잼 ㅠ진짜..연기도 엄청 잘하고 뭔가 뻔한스토리인데스릴 ㅎㅎ짱맨  ,1,0,0
2346,2015.11.03,10,관람객진짜 재미있습니다.강력추천합니다.꼭 한 번 보세요.안 보시면 후회합니다.  ,1,0,0
2347,2015.11.03,9,관람객연기들은 쩌는데 결말이좀 아쉽  ,1,0,0
2348,2015.11.03,1,관람객진짜개노잼....연기력은좋은데 그게 묻힌다..  ,1,0,0
2349,2015.11.03,5,관람객기대가커서그런가 별재미없었음  ,1,0,0
2350,2015.11.03,10,볼만했음.. 주원이 영화에서도 빛을 발하는듯~^^  ,1,0,0
2351,2015.11.03,6,"배우들 연기 짱영화 구성이 먼가 전체적인 짜임새나 아귀가 맞아야 하는데,, 놀라게 하는 장면들은 좋았지만~ 다른사람 리뷰처럼 먼가 개연성이 부족한 느낌ㅜ특히 몇인물들은 왜 전체적인 내용에 아무런 필요가 없어보임. 한마디로 내용이 허섭OOO  ",1,0,0
2352,2015.11.03,8,관람객지루할 시간없이 긴장의 연속  ,1,0,0
2353,2015.11.03,8,역시 유해진과 주원의 연기력 최곱니다  ,1,0,0
2354,2015.11.03,9,엄청긴장하고무서웟엇다  ,1,0,0
2355,2015.11.03,8,유해진 연기가 수준급~ !주원도 나름 굳굳...  ,1,0,0
2356,2015.11.03,1,아 내시간..내돈...ㅎㅏ  ,1,0,0
2357,2015.11.03,10,조오오5오5~~~~5오온잼  ,1,0,0
2358,2015.11.03,10,개에에구구꾸꾸꾸우우우우울잼  ,1,0,0
2359,2015.11.03,8,관람객보는내내 심장 쫄깃했답니다믿고보는연기^.^  ,1,0,0
2360,2015.11.03,7,하늘을 걷는 남자 볼려다가 시간대가 안되서 그냥 봤는데 후반부가 아쉽네요~  ,1,0,0
2361,2015.11.03,8,관람객재밌게봤습니다~하지만조금먼가부족한부분도많았구요그래도스릴러답게연기도잘하네요~잘봤습니다  ,1,0,0
2362,2015.11.03,1,"너무 억지스러움, 뭔 경찰이 CCTV도 하나 확인안함? 아무리 주인공 역할 부각시키려지만 개애바. 게다가 경찰이 유해진 차로 데려다줄때 다른 경찰이 갑자기 전화해서 그 집 비밀은 왜 말함? 존나 뜬금 연기는 좋은데 내용 너무 말도안됨  ",1,0,0
2363,2015.11.03,6,정말 기대이하였다 실망  ,1,0,0
2364,2015.11.03,7,관람객처음부터 끝까지 스릴이 느껴지는영화였습니다.  지루할틈은 없어요ㅋㅋ 귀신이 나온다는것이 아무것도 모르고 본 게 의외였지만.. ㅋㅋ 주원씨랑 유해진씨는 역시 연기가 좋았네요 그냥 무난한 영화였습니다~  ,1,0,0
2365,2015.11.03,1,재미없당 나는 정말 돈주고 보기 아깝당.ㅋ  ,1,0,0
2366,2015.11.03,5,범죄와 귀신보는 능력을 가진 사람이 합춰지는 조금 색다른 건 좋았는데 스토리가 말아먹었고 그말아먹은 스토리를 배우들의 연기로 살렸다 깜짝놀라는 장면이 많아서  볼때 힘들긴 했는데  볼만은 했다 배우들 덕에.  ,1,0,0
2367,2015.11.03,8,가족이 살인을 당하고 복수를 하는 진부한 틀인줄 알았지만 그 이상이었다.  ,1,0,0
2368,2015.11.04,10,관람객너무재미있게 봤다 공포 추리 스릴러  ,0,1,0
2369,2015.11.04,10,"스토리도 탄탄하며 , 보는 중간중간 스릴감이 ㄷㄷ 완죤 짱 잼있어요  ",0,1,0
2370,2015.11.04,1,관람객진짜 이런 재미없는 영화는 세상처음주원과 유해진이 나왔는데도 불구하고 하..  ,0,1,0
2371,2015.11.04,10,솔직히 8점주고싶지만 너무저평가된듯해서 10줍니다  ,0,1,0
2372,2015.11.04,7,관람객무난합니다 분위기는 잘잡음  ,0,1,0
2373,2015.11.04,2,관람객기대 많이 했는데....아쉽네요  ,0,1,0
2374,2015.11.04,5,실명제 등록으로 바꾸던가 알바가 판을치네 평점믿고 봤다가 돈아까워서 피눈물흘렸다 주원이 흘린피보다 많다 양심적으로 5점  ,0,1,0
2375,2015.11.04,10,관람객공포와 스릴을 한꺼번에 느낄수있어서 좋았어요~ 연기자들의 연기력도 탄탄해서 더 몰입할수있었어요ㅎㅎ  ,0,1,0
2376,2015.11.04,8,회사언니가 재밌다고해서 조조로 보러갔는데 진짜 영화보다 소리지른건 처음이었음.  그냥 무서웠어요. 주원 생각보다 연기를 잘해서 놀랬음.ㅋ 그리고 역시 유해진은 악역이 잘어울림.볼만했음..  ,0,1,0
2377,2015.11.04,4,아 솔직히 스토리 탄탄하다고 올린사람은 영화를 주인공만 봅니까? 잘생기면 스토리가 탄탄한건가요? 알바가 아니라면 공부좀 하고 영화 봅시다. 소리지르고 음향효과로 심장 쫄깃해 진다고 스토리가 탄탄한건 아니잖아요. 이번주는 쉬시고 담주에 다른영화 보세요  ,0,1,0
2378,2015.11.04,10,관람객완전강추네요연기가대박이어라  ,0,1,0
2379,2015.11.04,6,관람객주원과 유해진의 연기는 좋았으나 전반적인 줄거리의 구성이 좀 엉성해서 아쉬웠음. 중간중간 깜짝놀라게 하는 요소가 조금씩 있긴하지만 그렇게 무서운것도 아니고..  ,0,1,0
2380,2015.11.04,8,관람객스릴감있는 스토리로 시간가는줄 모르고갔는데 끝맺음이 아쉽네요  ,0,1,0
2381,2015.11.04,7,유해진연기 정말 기억에 남아여!!!솔직히 근데 베스트평점처럼 초반 몰입도는 좋았다가 무섭긴했어도ㅎㅎ 뒷심이 부족한거같아여 점점 몰입도가 떨어지는느낌? 연관성도 억지로 제가 짜맞춰서 봐야하는느낌이었구여... 쫌 아쉬웠습니다!  ,0,1,0
2382,2015.11.04,5,뻔하게 이어질 스토리를 질질 끌어서 만든느낌 ㅋㅋ 유해진의 연기는 굿  ,0,1,0
2383,2015.11.04,7,관람객경찰서에서 주원과 유해진의 투샷은 정말 숨죽이고 봤다.유해진의 목꺽기는 이 영화의 하이라이트!  ,0,1,0
2384,2015.11.04,6,그냥 그저그런 스릴러.별로 재미 없었다  ,0,1,0
2385,2015.11.04,1,"개연성 없는 꼬마귀신, 작두타는 무당 나오는 영화.  ",0,1,0
2386,2015.11.04,7,관람객재미있었다 깜짝 놀라는 요소도 많고ㅠㅠ 근데 나오고보니 남는건 없느듯  ,0,1,0
2387,2015.11.04,1,진짜 이런것도 영화라고  촬영한 유해진이 이해가 안간다. 초반 진행도 이상하고 갑자기 뜬금포에 말도 안되는 스토리 전개도 이상하고 그냥 이상한 영화.  ,0,1,0
2388,2015.11.04,7,적당히  즐기기에는  충분한 영화입니다.  ,0,1,0
2389,2015.11.04,1,평점 왤케 높아...ㅡㅡ 주원 유해진 연기빼고는 볼게 없음  ,0,1,0
2390,2015.11.04,1,여자애는 대체 왜나오는거야ㅡㅡ 시나리오 엉망진창 공짜로 보여줘도 안볼영화를 돈주고 받다니 ㅡㅡ 알바늠들때메 낚였어 ㅡㅡ  ,0,1,0
2391,2015.11.04,10,주원과 유해진의 팽팽한 연기력.. 굿굿굿  ,0,1,0
2392,2015.11.04,1,관람객핵노잼 영화보다 중간에 나올줄이야  ,0,1,0
2393,2015.11.04,8,관람객주원의 사투리연기가 어색했고 마지막 마무리가 급마무리.... 나쁘진않았어요  ,0,1,0
2394,2015.11.04,3,뒷끝이 깔끔해서 그나마 3점 줬네요ㅋㅋ이영화보면서..역쉬 한국영화구나 생각들었음..변화가 없네요..살인자는 엄청 힘이 쌔고 강하다..죽었을꺼 같은 주인공은 꼭 먼가에 의해서 살아있고...집에서 드라마보는게 낮겠어요ㅋㅋ  ,0,1,0
2395,2015.11.04,6,관람객그놈이다 기대안한만큼 그저그런 영화^^주원때문에 복?봤어요  ,0,1,0
2396,2015.11.04,9,소름돋게 무서운 영화랄까ㅠㅠ 손에 땀을 쥐는 긴장감..  ,0,1,0
2397,2015.11.04,8,무서웠지만 흥미진진 그 자체! 그놈이 범인이다!  ,0,1,0
2398,2015.11.04,10,범인이 누군지 처음부터 알게되지만 그래도 순간 순간 많이 놀랬고 주원과 유해진의 치열했던 머리싸움도 한 몫 했네요  ,0,1,0
2399,2015.11.04,10,두시간내내 심장 벌렁벌렁 조조로 혼자 봤는데 정말 무섭더라  ,0,1,0
2400,2015.11.04,10,갑툭튀… 진짜 너무 놀래서 팝콘 쏟을뻔 하  ,0,1,0
2401,2015.11.04,10,스릴러를 좋아하는 나로썬 긴장감을 늦출 수 없었던 영화였다  ,0,1,0
2402,2015.11.04,8,실화를 바탕으로 만든 영화라 더 소름!  ,0,1,0
2403,2015.11.04,10,친구가 하도 재밌다길래 봤는데 진짜 재밌었어ㅋㅋ 완전 개꿀잼  ,0,1,0
2404,2015.11.04,10,연기도 좋고 완전 긴장하면서 봤어요 추격자랑 살인의추억을 섞어 논거 같은 느낌?  ,0,1,0
2405,2015.11.04,10,스릴있게 잘 봤지만 안타깝기도.. 내가 만약 주인공이였더라면 더 했을듯  ,0,1,0
2406,2015.11.04,10,영화 보고 집에 가는 길이 어찌나 무섭던지ㅎㅎ  ,0,1,0
2407,2015.11.04,10,영화가주는 긴박감은 정말 최고!! 마지막이 좀 아쉽기도 했지만 전체적으로 볼만한 스릴러 영화라고 생각한당  ,0,1,0
2408,2015.11.04,9,관람객꽉 찬듯한 시나리오와 주원씨와 유해진씨의 연기가 실감났어요  ,0,1,0
2409,2015.11.04,10,범인이 누군지 알고봐도 스릴있고 긴장감 넘치더라  ,0,1,0
2410,2015.11.04,10,유해진의 광기 스릴러적인 눈빛에 소름이 쫙..  ,0,1,0
2411,2015.11.04,9,배우들의 연기는 참 좋았어요 나름 긴장감도 있고 무섭기도 했고 오랜만에 심장 쫄깃함을 느낄 수 있었어요  ,0,1,0
2412,2015.11.04,8,혹시나 반전을 기대한다면 실망할수도~ 그래도 영화 보는내내 너무 재밌었다~  ,0,1,0
2413,2015.11.04,1,여러분 알바생은 존재합니다..  ,0,1,0
2414,2015.11.04,10,심야로 보고 잠 제대로 못 잤어ㅠㅠ흐어  ,0,1,0
2415,2015.11.04,10,혼자 보기엔 무서웠지만 재미는 확실히 있었습니다  ,0,1,0
2416,2015.11.04,10,정말 스릴 넘치는 영화였지만 중간중간 슬픈 부분들도 있었고 재밌었어요  ,0,1,0
2417,2015.11.04,8,다른건 몰라도 유해진의 후덜덜한 연기가 압권!!  ,0,1,0
2418,2015.11.04,10,손에 땀을 쥐게 하는 영화로 배우들의 연기가 정말 좋았어요 간만에 재밌는 영화 한편 봤습니다ㅎㅎ  ,0,1,0
2419,2015.11.04,10,기대 안하고 봤는데 시간 가는줄 모르고 봤어요 공포 그 자체ㄷㄷ  ,0,1,0
2420,2015.11.04,10,보는내내 마음 졸이며 숨죽이며 봤어요..  ,0,1,0
2421,2015.11.04,10,연기들을 잘해줘서 두배로 무섭게 느껴진거 같아요 영화 끝날때까지 긴장을 놓을 수가 없었어요  ,0,1,0
2422,2015.11.04,9,재밌었습니다 주원과 유해진 그야말로 말로는 설명할 수 없는 연기에 가슴 졸이면서 봤네요  ,0,1,0
2423,2015.11.04,8,쫄깃쫄기한게 스릴 만점이였음 조마조마해하며 봤음  ,0,1,0
2424,2015.11.04,8,관람객주원과 유해진의 연기가 돗보였던 영화 !  ,0,1,0
2425,2015.11.04,1,관람객아..이건 뭐.. 리뷰에 낚여서 기대했는데..하...참...뭐니 이게?  ,0,1,0
2426,2015.11.04,10,좋아하는 장르는 아니였는데 시간 가는줄 모르고 몰입  ,0,1,0
2427,2015.11.04,10,주원과 유해진의 연기만으로도 충분히 매력있는 영화  ,0,1,0
2428,2015.11.04,10,범인이 누군지 알고 봐도 긴장감을 놓을 수 없었다!!  ,0,1,0
2429,2015.11.04,10,영화 보고나서 실화라는 사실을 알게 됬는데 너무 마음이 아프더라구여..  ,0,1,0
2430,2015.11.04,8,강추강추! 시간 가는줄 몰르고 봤넹ㅋ  ,0,1,0
2431,2015.11.04,10,손에 땀이 날 정도로 소름돋고 긴장감있고.. 믿고 보는 배우들 덕분에 잘보고 왔습니다  ,0,1,0
2432,2015.11.04,6,이런영화만들어야지~ 하고만들어서 적당히 상업성을 입힌 다분히 상업적 그이상그이하도아닌영화   빈깡통같은영화 소리만요란했을뿐 알맹이는 없었다 영화속 의도된 장면들은 오히려 저급함을 초래하였다 다소 억지스러운 추격씬은 어색하고 또어색했다 다만 배우들의연기  ,0,1,0
2433,2015.11.04,10,대박임ㅋㅋ 무슨 공포영화를 보는듯한 느낌  ,0,1,0
2434,2015.11.04,10,보느내내 스릴감 긴장감 그리고 특히 유해진씨의 연기 너무 인상깊어요  ,0,1,0
2435,2015.11.04,10,귀신과 사람 둘 다 무서웠던 영화 그놈이다.  ,0,1,0
2436,2015.11.04,10,보는 동안 무서워서 덜덜.. 포스터가 모든걸 알려줬군  ,0,1,0
2437,2015.11.04,10,예상치 못한 호러물이 가미가 되어 있지만 몰입도는 최고..  ,0,1,0
2438,2015.11.04,10,보면서 중간중간 심장 정지 오는줄ㅎ  ,0,1,0
2439,2015.11.04,10,범인이 누군지 알면서도 굉장히 스릴있고 걍 무서웠음ㅠ  ,0,1,0
2440,2015.11.04,10,살인마가 누군지 보는 관점도 괜찮았고 러닝타임 내내 긴장감을 놓을 수가 없었어요  ,0,1,0
2441,2015.11.04,9,와 개 쫄림.. 생각보다 공포스런 영화였어  ,0,1,0
2442,2015.11.04,10,배우들 연기가 넘 좋아서 퀄리티를 더 살릴 수 있었던거 같아요  ,0,1,0
2443,2015.11.04,10,오싹하고 서늘.. 간만에 스릴러다운 스릴러 한편  ,0,1,0
2444,2015.11.04,10,관람객스릴잇어요 재밋개보고왓네용  ,0,1,0
2445,2015.11.04,1,"정말 이 영화를 어떻게 평해야 할까?스토리도 별로, 배우들의 연기도 그냥 그렇고200석 극장에 10여명이서 보았는데 4명이 중간에 나가버리는씁쓸한 영화였다.  ",0,1,0
2446,2015.11.04,10,우와...진짜 대박... 보는내내 심장이 떨어지는줄알앗어요배우들 연기 짱♥실화를 잘 표현한 영화같네요 그놈이다 흥해라~~  ,0,1,0
2447,2015.11.04,2,유해진씨 믿고 본영화...실망하고왔습니다..유치하고 진부하기 짝이없는 영화...  ,0,1,0
2448,2015.11.04,2,귀신나왔다가 무당나왔다가 갑자기 연쇄살인범나왔다가 가정폭력 나왔다가 개연성도 없고 결말도 흐지부지하고 전형적인 한국식끝맺기 개허접  ,0,1,0
2449,2015.11.04,9,관람객두배우의 연기는 어마어마하다  ,0,1,0
2450,2015.11.04,1,내가 한국영화를 안보는 이유.  ,0,1,0
2451,2015.11.04,5,"엄청 기대했는데, 딱히 교훈도 없고 놀래기만 하고 온 영화...  ",0,1,0
2452,2015.11.04,1,동생아 미안하다~ 앞으로 너가 보자는 거 볼게~  ,0,1,0
2453,2015.11.04,8,관람객그냥그저그랬어여 흠.. 딱히 반전도없고ㅋㅋㅋ  ,0,1,0
2454,2015.11.04,1,진짜 한국영화  수준떨어져서 이건 영화도 아니다.  ,0,1,0
2455,2015.11.04,7,조금더 빠른 전개와 치밀했다면 어땠을까 하네요  ,0,1,0
2456,2015.11.04,6,스릴감이 정말 많고...보면서 흠칫흠칫놀라요... 근데  재미있어요 근데 뭔가 마지막이 허무하다고...할까...  ,0,1,0
2457,2015.11.04,7,관람객급으로 본거라 내용도 모르고가서 봤는데 재밋게봤습니다~! 초반부엔 설마 공포인가..했는데 그정도는아니였구요 역시 유해진님나오는 영화는 굿굿  ,0,1,0
2458,2015.11.04,5,관람객임팩트가 없이 다음 이야기를 알 수 있는 전개가 흥미 유발에 약했다.  뭔가 부족한 부분들이 그리고 반전 없이 일찍부터 범인을 알아버려 반전을 기대 했는데 허무한 결말이다.  ,0,1,0
2459,2015.11.04,8,관람객볼만한영화입니다 평타는침  ,0,1,0
2460,2015.11.04,8,관람객유해진 주원의 연기가 좋았음  ,0,1,0
2461,2015.11.04,7,관람객그냥 생각하지말고 볼만함  ,0,1,0
2462,2015.11.04,5,관람객주원만 좀 볼 만 함..스토리가 내 스탈 아님  ,0,1,0
2463,2015.11.04,1,이 영화 처음부터 범인 알려주고 시작하는 느낌이에요 정말 별로인 영화  ,0,1,0
2464,2015.11.04,10,와진짜 개소름 주원연기대박!!!  ,0,1,0
2465,2015.11.04,10,그냥 그럼 돈아깝진않음 유해진이 더 싸이코처럼 해줬음 몰입이 더됬을텐데  ,0,1,0
2466,2015.11.04,10,정말 스릴있고 쫀쫀하니 존나 잼나게 보고 나온 영화다 주원이랑 유해진 뿐만 아니라 그 여자 배우도 연기 참 잘한다 깜짝 깜짝 놀라고 나온 영화  ,0,1,0
2467,2015.11.04,4,연기자들의 연기는 일품 이었다...언제 부터 스릴러가 공포영화가 되었는지는 모르지만..스토리만 좋았어도..하는아쉬움이 깊게 남는 그런 영화 이다  ,0,1,0
2468,2015.11.04,10,관람객굳굳 정말 재밋게 봣어요 긴장감 팽팽  ,0,1,0
2469,2015.11.04,2,"진짜 간만에 재미없는영화 봤어요,!!!보다가 걍 나오고싶을정도로 ...  ",0,1,0
2470,2015.11.04,1,쓰레기영화 차라리 귀신영화로했을면 좋았을듯  ,0,1,0
2471,2015.11.04,9,관람객스릴감때문에 그냥 볼만은 했다  ,0,1,0
2472,2015.11.04,2,조연들이 너무별로다. 눈만부라릴줄알지  대사도 어색하고 연기도 식상함.  비슷한시기에본 특종하고 너무차이남(특종은 조연들 연기가 너무 좋더라고요)  ,0,1,0
2473,2015.11.04,1,지금 영화관에서 보는 중인데 핵노잼진짜 빡치네요주원 요새 용팔이 때부터 시나리오 거지같은거 고르는 듯  ,0,1,0
2474,2015.11.04,7,괜찮았음.. 뭔가 반전도 없고 계속 떡밥을 절로 물어줘서 아쉬웠음..좀 흔한 스토리..  ,0,1,0
2475,2015.11.04,10,"난 재미게봤는데,,,,  ",0,1,0
2476,2015.11.04,1,진짜 내 인생 최악의 영화ㅋㅋㅋㅋ 공짜로 볼 기회가 생겨서 다행이지 도저히 돈 주고는 못보겠다.. 그나마도 딴 영화 볼 걸 이 생각 드는데 아효... 주원이 잘 생겨서 1점 거저먹는 영화.  ,0,1,0
2477,2015.11.04,1,관람객울트라 핵노잼 돈이아끼움..  ,0,1,0
2478,2015.11.04,10,직업에 귀천이 없다는 말을 많이 하지만 아직 그런 편견을 가지고 살아가는 우리 사회를 고발한 영화라고 나름 생각합니다  ,0,1,0
2479,2015.11.04,10,졸잼졸잼졸잼졸잼졸잼  ,0,1,0
2480,2015.11.04,10,진짜 소름돋앗다  배우들이 연기잘해서 몰입도도 좋앗던것같다  ,0,1,0
2481,2015.11.04,9,관람객무슨애긴지 첨에 몰랏는데 끝나고 실화 라고 들으니 소름 ..  ,0,1,0
2482,2015.11.04,1,"와..진짜 노잼.. 유해진씨가 이렇게 힘이 쎌줄 몰랐네요..ㅎㅎ 배우들의 연기는 좋았으나, 진짜 너무 어이가 없고 힘이 빠져요. 진심; 평점이 왜이렇게 높은지도 모르겠네요. 그리고 이거 참고로 귀신영화임 ;;  ",0,1,0
2483,2015.11.05,7,관람객긴장감넘쳐서 너무재밌엇어요 유해진 연기짱  ,0,1,0
2484,2015.11.05,10,다들 연기가  최고였던거 같습니다. 특히 유치장씬  두분연기가 엄청 인상적이었는데  끝까지  긴장감 놓을 수 없었던 영화..  ,0,1,0
2485,2015.11.05,1,시작부터 딱 범인이 유해진이겠다 싶으면서 시작관람객은 누구나 다 아는 범인을 마을주민들만 끝까지 모름 억지로 모름. 심지어 경찰도 범죄에 연관되어있나 싶을정도로 정말 억지로 모름그리고 아무리 생각해봐도 유해진이 왜 여자들을 죽이는지 모르겠음  ,0,1,0
2486,2015.11.05,8,관람객끝이 허무함 ㅋㅋ놀래킴  ,0,1,0
2487,2015.11.05,7,연기력만 좋았던 영화였다.너무 뻔한 범인으로 지루한 감이 있었다. 또한 부족한 설명으로 왜... 어째서... 라는 생각이 들었던 영화(특히 수지가 왜 시은이를 쫓아다녔나.. 등등)였다.작가가 한번만 더 신경 썼더라면... 아쉬움이 남는 영화였다.  ,0,1,0
2488,2015.11.05,1,연기력에 있어선 10점을 주고싶으나... 내용이 너무 핵 쓰레기라 ....집중도 안되고 이해도 안되고 재미도 없고 이건뭐..  ,0,1,0
2489,2015.11.05,2,아니 댓글들 보니까 정말 믿을 수 없어서 처음으로 후기 댓글 달아본다. 같이 보고 나오는 사람들 전부 재미없다고 엘레베이터에서 그러는데 댓글들 머지/ 주원이가 신 들린 것도 아니고 그냥 느낌가는대로 범인 다 찾아감  ,0,1,0
2490,2015.11.05,7,연기와 카메라 각도와 구성은 정말 좋았다! 그러나 부족한건 보다 짜임새있는 스토리와 중간중간 내용이 건너뛰는 어설픈것만 수정하면될듯! 살인사건을 다룬 영화가 너무많다보니 이런류의 영화는 질리고 새로운 분야의 영화가 나왔으면한다! 너무 식상하다  ,0,1,0
2491,2015.11.05,9,관람객주원의 연기때문에 볼만했음 근데 결말이 아쉽 너무 뻔함 ㅠㅠ 글고 공포영화닠ㅋ 무섭다  ,0,1,0
2492,2015.11.05,10,"관람객주원과 유해진의 연기만으로도 충분히 매력있는 영화인듯 함,.,긴장감도 있고..스릴도 있고..여운도 남고..몰입해서 본 나름 재밌게 본 영화였어요~  ",0,1,0
2493,2015.11.05,2,진짜 내가 올해 본 영화중에 젤 쓰레기 영화였다..공짜로 봐서망정이지 돈주고 봤으면 짜증났을듯  ,0,1,0
2494,2015.11.05,7,진짜 보다 경기일으킬뻔ㅠㅠ너무 무서워요...ㅠㅠㅠㅜ살인도 무서운데 귀신까지 나와서 심장 마비걸릴뻔했어요ㅠㅠ스릴러가 아니라 공포호러에요...보실분들 참고하시길  ,0,1,0
2495,2015.11.05,5,관람객뭔가 허전하고 별로다 비추  ,0,1,0
2496,2015.11.05,4,"무서운거 못보는 분들이 보기엔 공포영화급일듯 극전개는  너무 지루하고 루즈 , 주원 사투리 잘해서 경상도 사람인줄알았는데 서울출생..  ",0,1,0
2497,2015.11.05,7,영화 전체적으로는 나쁘지 않았다. 하지만 마지막에 약간 과하다 싶은 장면이 있어서 아쉬웟다.  ,0,1,0
2498,2015.11.05,6,스릴러 좋아해서 나오자마자 보러갔는데 뜬금없는 부분도 있고 영화가 정리가 잘안된 느낌?? 연기력은 좋아서 별점 그나마 줍니다. 영화내용은 솔직히 지루하네요.  ,0,1,0
2499,2015.11.05,7,관람객ㅠ.ㅠ아쉬운점이 있는 영화인것같아요  ,0,1,0
2500,2015.11.05,1,아 처음 영화평 쓰는데 11월 4일에 봤는데 아 내시간이 아깝다고 생각하는 영화 여기 알바들 많나봐요 이런걸 10별 주는거보니 왜 이런영화를 만들었을까 .. 스토리도 너무 단순하고  뻔하다  ,0,1,0
2501,2015.11.05,7,관람객볼만해요..볼만해요..  ,0,1,0
2502,2015.11.05,10,손에 땀을 쥐고 보게 되는 영화로 역시 기대를 져버리지 않았네요  ,0,1,0
2503,2015.11.05,8,누가 재미없댔엌ㅋㅋ 스릴있고 완전 재밌구만  ,0,1,0
2504,2015.11.05,8,연기력이 돋보인 영화 아쉬운건 반전이 없다.참신한 케릭터도 없었던게 아쉽다  ,0,1,0
2505,2015.11.05,10,어떤영화인지 잘 모르고 봤는데 재밌더라구여 근데 임팩트 있는 반전은 없었어여ㅋ  ,0,1,0
2506,2015.11.05,10,순간순간 깜놀하게 되는 스토리 넘 괜찮았음ㅎㅎ  ,0,1,0
2507,2015.11.05,10,스릴러인듯 공포인듯 장르를 뛰어넘어 다니는~!  ,0,1,0
2508,2015.11.05,10,배우들의 연기를 보는거만으로도 충분히 가치가 있네요  ,0,1,0
