index,time,score,reple,1st_week,2st_week,3st_week
3017,2015.08.25,10,볼땐 존나 쳐웃었을 새끼들이... 난 세번봤다  ,1,0,0
3018,2015.08.25,1,영화의 내용이나 전개의 이어짐이 유감이다...  ,1,0,0
3019,2015.08.25,8,"낮은 평점의 이유 중에 하나가, 잘생긴 남자만 밀접한 씬을 찍는다는 의견이 있었는데요. 그건 영화라는 매체의 상업적특성상 불가피했다고 봅니다. 이수가 잘생긴 우진에게만 잘 대해준건 아니죠? 그녀가 결혼을 선택한 건 그 모든 우진을 사랑하겠다는 겁니다.  ",1,0,0
3020,2015.08.25,10,멜로라는 영화의 새로운 개정된 교과서 그냥 보고 숨죽이면서 쳐다만봣다 진짜 제대로된 영화인거같다  ,1,0,0
3021,2015.08.25,1,내 취향에 안맞음 .ㅡㅡ  ,1,0,0
3022,2015.08.25,7,"자고나면 몸이 바뀐다는 설정에도 불구하고 결국 주인공들은 서로의 의사소통 부재, 상대방에 대한 미안함 등 관람객도 공감할 수 있는 일반적인 것들로 싸운다. 극중 우진이 우린 얼굴을 서로 맞대고 다른 사랑을 하고있었다 라는 대사에 코끝이 찡~  ",1,0,0
3023,2015.08.25,10,영화를 보는 내내 '행복하다' 는 감정을 느꼈어요. 영화가 너무 예뻤고 이 예쁜 영화가 안끝나길 바라면서 봤던 것 같아요. 오래도록 남을 영화같습니다 : )  ,1,0,0
3024,2015.08.25,10,개인적으론 건축학개론보단 훨씬  작품성 있다고 판단된다. 만화적 소재에 훌륭한 전개..^^ 흥하십시오.  ,1,0,0
3025,2015.08.25,5,"결국 외면보다는 내면이 중요하다는 이야길 하고 싶은 것 같은데.. 글쎄 크게 와닿지 않는다. 그냥 나오는 배우진이 화려해서 그거 보는 맛 화려한 껍데기, 속은 텅텅 비어 있는 느낌  ",1,0,0
3026,2015.08.25,7,관람객주제는신선했지만기대한거에비해좀안타깝다  ,1,0,0
3027,2015.08.25,10,감동적이고 스스로를 돌아볼 시간도 갖게해준 영화  ,1,0,0
3028,2015.08.25,2,뷰티인사이드 인사이드아웃 같은 인사인드에 둘다 전개가 뻔한데도 이건 재미가 없다.왜지?  ,1,0,0
3029,2015.08.25,10,개인적으로 인생영화였음. 재미도 있지만 예쁘다는 수식어가 정말 잘어울리는 좋은영화♡  ,1,0,0
3030,2015.08.25,7,관람객약간에 웃음과 로맨스가있어서인지 볼만한영화이다  ,1,0,0
3031,2015.08.25,1,진짜너무지루함영화보다가잔적진짜오랜만^^보자고한친구랑틀어질뻔했네요!친구가사과하는영화^^  ,1,0,0
3032,2015.08.25,9,"난 잔잔하게 진짜 잼있게 봤는데.. 평정이 왜 일치??? 분명 썸타고있거나 사랑하고 싶다면,,, 꼭 보시길,... 한효주  대박.. ㅠㅠ 난 대박 추천....  ",1,0,0
3033,2015.08.25,8,역시 인생은 완얼이다.  ,1,0,0
3034,2015.08.25,6,김희원이 초밥을먹으러가자고했으면 따라갔을까?김상호가 파티장에 왔으면 애인이라고 소개했을까?영화에선 내면이 중요하다고 말하지만. 외면을 보는게 느껴졌어요...중반이후 지루함은 안타깝습니다  ,1,0,0
3035,2015.08.25,10,"나도연애하고싶다,커플끼리보면좋겠네이생각하면서영화관나옴 한효주나와서안본다는사람들있던데 연기때문이라면봐도괜찮을듯 벌써2번이나봤는데2번다괜찮게봄  ",1,0,0
3036,2015.08.25,10,엥? 왜이렇게 악평이 많지? 잘생긴 사람일때에 스킨십도 있고 고백했던건 남자주인공이 잘생길때 자신감 생겨서 고백하고 그런거 아닌감? 어쨌든 저랑 제 친구들은 진짜 재미있게 봤어요!! 10점!!  ,1,0,0
3037,2015.08.25,8,한효주의 느낌을 잘 살려낸 영화 그리고 아이폰느낌나는 영화?잔잔하게 볼만했고 기대를 안해서인지 순간 몰입도 좋았음감정몰입에 따라 등장하는 배우들 연기봐서 좋았음갠소하고싶은 영화임  ,1,0,0
3038,2015.08.25,1,여자주인공만 아니면 보고 싶은 영화인데 여자주인공을 맡은 배우가 너무 마음에 안 들어서 보고싶지 않다.  ,1,0,0
3039,2015.08.25,8,신선하고 재밌네! 평점 조작은 하지말자 인간적으로  ,1,0,0
3040,2015.08.25,10,진짜 재밌었다. 처음부터 끝까지 영상미는 최고였다  ,1,0,0
3041,2015.08.25,1,한효주 나와서 안볼란다  ,1,0,0
3042,2015.08.25,1,살인마 가족 안보고 만다  ,1,0,0
3043,2015.08.25,8,아직보지못해지만악평이되겟많네요 한번보고 평다시올릴게요내심기대많이한영화인데 소재도 특별해서 ㅜㅜ  ,1,0,0
3044,2015.08.25,10,진짜재밌습니다그냥재미없다고별점1점주는별점테러말고실제로보세요...진짜솔직히누구싫다고보지도않은영화재미없다고하는건너무한것같습니다실제로재밌어요  ,1,0,0
3045,2015.08.25,4,한효주 개이쁘다...  ,1,0,0
3046,2015.08.25,7,관람객소재는 좋았으나 내용의 풍성함이 좀 아쉬웠던 작품. 잘생긴 남자배우 보는 맛에 눈호강함ㅋㅋ  ,1,0,0
3047,2015.08.25,8,한 번 보기 재밋고 무엇보다 영상속 색감에서 아름다움이 많이 묻어나요  ,1,0,0
3048,2015.08.25,10,난 재밌게 봤는데 너무 테러가 많아서 10점 드려요!  ,1,0,0
3049,2015.08.25,10,나는 이 영화 의미있었어요재밌게봣고 한효주 너무 이뻐요  ,1,0,0
3050,2015.08.25,9,외형적 모습이 정해져 있지 않은 우진이라는 인물을 연기한 배우들 그런 우진을 사랑하는 이수의 모습을 연기한 한효주의 연기력이돋보였다. 소재도 신선했고 보고 난 뒤 마음 속에 남는 것이 있는 영화. 주장한다기 보다는 물음을 던지고 있다는 느낌을 받았다.  ,1,0,0
3051,2015.08.25,7,"영화가 주고자 하는 느낌이나 영상미를 생각하면 충분히 수작이라 생각 합니다.  그리고 한효주,이동휘 씨의 연기는 정말 훌륭 했구요.  다만 영화가 보여주고자 했던 내면의 아름다움이란 고민을 정작 중요한 우진이 아닌 이수가 고심 한게 넌센스라 생각..  ",1,0,0
3052,2015.08.25,10,재밌게봤는데 반응이 의외네요 다들 남자배우들때문에 너무 기대하고 보신건가ㅋㅋ 영상도 내용도 따뜻해서 좋았고 영화 다시 한번 더 보러가고싶을정도로 한효주가 너무 이뻤어요  ,1,0,0
3053,2015.08.25,8,영상미가 예뻤던 영화. 이런 상상력이 있다는 자체로도 참 멋진 영화이다.  ,1,0,0
3054,2015.08.25,10,결국 잘생긴 사람이 나올때만 비중있는 순간이라고 별점 테러하는 사람들 ... 영화는 제대로 본건지..  스토리상에서 김우진이 잘생긴 얼굴이든 못생긴 얼굴이든 한효주는 똑같이 좋아하고 사진찍고 추억을 남깁니다.. 비꼬려고 작정한 사람들ㅉㅉ  ,1,0,0
3055,2015.08.25,10,저는 정말재밋게봣어요! 사람에 따라 지겹다고느낄수 잇지만 저는 마음에 들엇어요! 개인적 차이인거같아요~ 하지만 전 그냥되게좋앗다는!!!  ,1,0,0
3056,2015.08.25,1,시간과 돈을 아껴드리기 위해 난생 처음 평점을 남깁니다.제목은 내면의 아름다움인데 결론은 외모지상주의. 일본인으로 변하고 서양인으로 변하는 둥 쓸데없는 과한 설정이 불편.재미도 없는 섹드립으로 또 불편.최악의 영화는 아니지만 기대에 상당히 미달  ,1,0,0
3057,2015.08.25,8,다들 이게 왜 뷰티인사이드냐구 그러시네요.. 저는 잘생기지 않은 배우들과의 씬에서도 보여준게 많다고 생각하는데.. Cf를 많이 찍으신 감독님이라 그런지 영상이 너무 이쁘더라구요. 영화 볼 만 했어요~  ,1,0,0
3058,2015.08.25,9,관람객배우들 한명한명 연기도 대단했고 한효준 진짜..갓효주.. 배우가 바뀌는데도 한사람을 보는듯한 연기 정말 짱이었어요  ,1,0,0
3059,2015.08.25,8,영화를 이해못하는 사람들이 많은듯..내면이 아름다워야된다 라기 보다는 겉모습은 바뀌지만 속은 같은사람이기 때문에 사랑한다는거지 내면의 아름다움을 강조한 영화는 아닌것같은데?그렇게따지면 조달환 김희원같은 사람들도 나오는데 외모만 강조한다니...  ,1,0,0
3060,2015.08.25,10,재미있는데 마지막이 아쉬움  ,1,0,0
3061,2015.08.25,9,처음으로 평점 남겨봅니다 집사람하고  봤는데 영상과 OST 는 참 좋았습니다 한효주 예쁘게 나옵니다. 대부분 사람이 그러하듯 첫사랑과 이뤄지지 않는데 이건 매일매일이 첫사랑이니 두근거림이 있더군요 물론 중간에 지루함도 있지만 잔잔하고 좋았습니다. ^^  ,1,0,0
3062,2015.08.25,1,영화보고 나온다음에 싹 잊어버려도 전혀 아쉽지 않은 영화  ,1,0,0
3063,2015.08.25,8,"평점을 보고 망설이다 보게되었는데요, 생각보다 재밌게 봤습니다. 글쎄요.... 이 영화를 보면서 어떤부분을 기대하면서 보길래 평점이 1점밖에 안되는지는 잘 모르겠지만요  긴 뮤비를 보는 느낌이었고 영상미가 좋던데요  ",1,0,0
3064,2015.08.25,3,한효주와 단역들?ㅎㅎ  ,1,0,0
3065,2015.08.25,1,지루하고 무리한설정.. 감동이어딨지...뻔한 결말  ,1,0,0
3066,2015.08.25,10,이번 여름에 본 영화중 단연 최고였음.... ^^  ,1,0,0
3067,2015.08.25,9,관람객너무보고싶었는데 보면서  판타지라 현실감은 없지만 그작은감정들하나하나 이입ㅎㅏ면서  보게되더라구요정말저런상황이 온다면어떨까...너무재밋게봤어요~~~  ,1,0,0
3068,2015.08.25,10,감동이었어요.. 의미있는메세지..고마워요  ,1,0,0
3069,2015.08.25,1,영화 보는 내내 좀 지루했다.  ,1,0,0
3070,2015.08.25,10,호불호가 갈리는데에는 한효주도 한 몫 하는 것 같은데 개인의 취향 이지만 난 베테랑보다 재밌었다. 물론 암살이 훨씬 더 재밌음. 어떤 모습으로 바뀌어도 내면의 그 사람을 사랑한다는 것 자체로 제목이 뷰티인사이드가 되기에 충분했다고 보는데.  ,1,0,0
3071,2015.08.25,2,관람객재미가 있긴있는데... 쪼끔 지루했어요  ,1,0,0
3072,2015.08.25,7,소재는 신선하구 좋았어요 ^^그치만 전개 과정이 조금은 뻔했던 것 같습니다~그래두 새로운 설정에 묘한 느낌에 빠진 느낌에좋았던 것 같네요 :) 효주신 아름답스무니다!  ,1,0,0
3073,2015.08.25,10,많은것을 생각하게되며 옆에있는 여자친구의 소중함을 느꼈습니다 제가 봐왔던 영화들중에 best of best인거같습니다. 조금 전개가 느린부분이있었는데 그부분도 또다른 의미로 해석되 영화가 참 깊다는 느낌을 받아 지루함 없이 영화를 관람했습니다. 최고!  ,1,0,0
3074,2015.08.25,5,"이진욱 나올때 심장 멎는줄 알았다,, 영상미가 가장 좋았던듯,,ㅎㅎ  ",1,0,0
3075,2015.08.25,8,뻔한 결말이지만 연출과 스토리는 뻔하지 않은 영화  ,1,0,0
3076,2015.08.25,1,역대급노잼 영화ㅎㅎ 한효주얼굴빼고 볼게없ㅅㄷㅁ  ,1,0,0
3077,2015.08.25,10,관람객가벼운 마음으로 그 뜻을 파헤치기보다 힐링을 위해 보면 재미와 감동이 있는 로맨스를 좋아하는 나로서는 재밋었던 영화  ,1,0,0
3078,2015.08.25,1,개인적으로 영화보면서 이렇게 지루한 적 처음입니다..스토리가 너무 뻔하고 달달함이 느껴지는 부분이 박서준 나올때 빼고는 없어서 실망했습니다.전체적으로 평점은 지.루.함입니다.  ,1,0,0
3079,2015.08.25,9,관람객처음부터 끝까지 잔잔한 영화인것같다 재밌었다  ,1,0,0
3080,2015.08.25,10,제목도 잘모르고봐서 그런지.  공감하며 재밌게 영화 봤네요..  ,1,0,0
3081,2015.08.25,10,진짜 재미있어요!! ㅎㅎ  ,1,0,0
3082,2015.08.25,10,이 영화는 내가 사람을 볼때 얼굴만이 다가 아니다라는 것을 깨닫게 해준 좋은 영화였다. 그리고 우진과이수의 사랑을 하면서 힘들어하는 모습을 볼때 내가 만약 우진과 이수같은 상황에 처하면 나는 어떻게 할 것인가를 생각해주는 뜻깊고 좋은영화였던거 같다.  ,1,0,0
3083,2015.08.25,10,할말없다 여운쩐다 강추!  ,1,0,0
3084,2015.08.25,1,외모지상주의 끝판왕 영화 제목을 뷰티아웃사이드로 바꿔야할듯  ,1,0,0
3085,2015.08.25,7,뻔하지만 그래도 볼만하다~!특히 극장에서 이진욱 나올때 환호가 절로 나옴~ㅋ  ,1,0,0
3086,2015.08.25,6,관람객잔잔한 영화였어요~드라마 같은느낌ㅋ  ,1,0,0
3087,2015.08.25,1,아.... 진짜 보다가 중간에 나갈까 나갈까? 다섯 번 정도생각함. 소재는 있는데 내용 부실  ,1,0,0
3088,2015.08.25,1,이것도 아깝다~~아앙  ,1,0,0
3089,2015.08.25,9,"그냥 재밌었다 많은생각들과 잔잔한 음악,배경 잘어울려 보기편안한 영화였다 생각이많아지게하는 그런 영화  ",1,0,0
3090,2015.08.25,9,난  좋았다.뭔가 뭉클했다. 잔잔한영화.착한영화  ,1,0,0
3091,2015.08.25,10,"영화의 취지를 전달하기에는 씬 구성을 잘 못했지만독특한 소재와 영상미, 각 배우들의 노련한 연기력으로 주는 즐거움 덕에 충분히 시간이 아깝지 않은 영화.밖에서 가진 감정을 영화로 끌고와 평가하다니..안타깝다  ",1,0,0
3092,2015.08.25,8,잘 봤습니다. 데이트하는 장면도 뭔가 아날로그적이여서 좋았고 한효주는 여자가 봐도 정말 이쁘네요ㅠㅠ 제목에 걸맞는 영화는 아니였지만 영상미와 영화 분위기가 너무 좋아 겨울에 다시 봐도 좋을거 같습니다.  ,1,0,0
3093,2015.08.25,10,관람객영화 너무 재미나여ㅠㅠ  ,1,0,0
3094,2015.08.25,10,"중요장면때 미남배우만 나와서 별점낮게 주신분들,그건 저도 공감이긴 한데 우리 솔직해집시다.데이트씬에서 미남미녀배우가 나올수록 더 설레고좋은건 다들 마찮가지아닌가요.그러면서 뭘더 바라시는지.조금아쉽긴하지만 뭐라할수도  없는 문제지요.영화도 상업이니  ",1,0,0
3095,2015.08.25,7,재밋엇음 먼가보고난후 여운이남음 한효주가너무이뻣고 전체적인 배경이나 음악이좋앗음 하지만 제목과달리  너무 미남배우들위주... 아무생각없이 보기좋은 설레는 영화  ,1,0,0
3096,2015.08.25,8,도대체 왜이렇게 저평가 되고 있는 건지 모르겠는데 꼭 보라고만 말하고 싶어요.  ,1,0,0
3097,2015.08.25,7,관람객우선 아이템은 너무 신선했다.  매일 몸이바뀐다는. 그래서 많은 남자연기자들을 한 영화에서 볼수있는 즐거움을 줬다.  그리고 너무 멋진 수제 의자들을 거의 작품 감상하듯  볼거리를 제공했다.  여기까지. 끝ㆍ  ,1,0,0
3098,2015.08.25,9,관람객재밌어용♡배우들 너무 잘생겼어여ㅠ♥  ,1,0,0
3099,2015.08.25,10,관람객완전대박이다! 깊은 여운...  ,1,0,0
3100,2015.08.25,9,관람객리뷰 보고 걱정 좀 햤는데 감정선도 좋고 전 재밌었어요 ㅎㅎ  ,1,0,0
3101,2015.08.25,10,뷰티아웃사이드라고 말하시는분들은 제목을 제대로해석하시지 못하신것같습니다 그리고 그게영화내용에 영향을미치는것도아니고 영화는 전체적으로 재밌어요  ,1,0,0
3102,2015.08.25,10,충격적이다 난 좋게보고 왔는데 평점 1점이 많네 5점 7점도 아니고 1점만  ,1,0,0
3103,2015.08.25,10,방금 보고왔다. 좋았음  ,1,0,0
3104,2015.08.25,1,지금 다 보고 엔딩 크레딧 보고 있습니다 2시간이 이렇게 괴로웠던적이 없습니다  ,1,0,0
3105,2015.08.25,9,평점개판이라서 좀걱정했는데  의외로좋았음 배우들 얼굴 찾는 재미도 쏠쏠 그치만 스토리상 답답한 느낌이 없잖아 있었음 그러나 이진욱이 멋있어서참겠다  ,1,0,0
3106,2015.08.25,8,관람객영상이 너무 이쁘다요.. 한효주 짱이뻐ㅜㅜ  ,1,0,0
3107,2015.08.25,9,대박이에여 김주혁이 헤어지자그럴때부터 계속 울었습니다..  ,1,0,0
3108,2015.08.25,2,소재만 신선하다. 이 영화는 그게 다 인것 같다. 뷰티인사이드라는 메시지를 전하기엔 외모라는 한계를 벗어날 수 없었고 결말 역시 급하게 짜낸 듯 갑작스럽고 비현실적이다. 실망스러움에 입을 다물 수가 없었다. 암살을 봤어야했다.  ,1,0,0
3109,2015.08.25,1,평점낮추기위해 로그인햇음  ,1,0,0
3110,2015.08.25,10,뷰티아웃사이드인건맞지만....그래도 나름 잔잔하게 힐링받으면서 봤음  ,1,0,0
3111,2015.08.25,10,정말 따뜻하고 좋은 영화  ,1,0,0
3112,2015.08.25,10,연애하고싶어졌어요고마워요  ,1,0,0
3113,2015.08.25,8,아래 다 무시하시고올가을 사랑하고싶어지는 영화..진심을담아 추천합니다  ,1,0,0
3114,2015.08.25,10,개인적으로 잔잔하고 이런분위기를 너무좋아해서너무 잘봤음..ㅠㅠ다들평점낮게주는게 아쉬울정도로..배우들 보러가는것도 없지않아있긴함  ,1,0,0
3115,2015.08.25,8,관람객약간지루했지만 이진욱에서 탄성  ,1,0,0
3116,2015.08.25,9,난 분명 여자인데 한효주가 너무 좋아져서 나옴ㅋㅋ 진짜 사랑을 하는거 같아서 영화 보는 내내 좋음 뭐 생각보다 영화 시간이 길어서 놀랐는데 나름 괜찮았음  ,1,0,0
3117,2015.08.25,1,진짜노잼..그냥 보고싶으면 배우들얼굴보러간다생각하고 보러가셈  ,1,0,0
3118,2015.08.25,10,관람객나무너무너무 가슴따뜻하고 웃음나는 영화였어요  ,1,0,0
3119,2015.08.25,8,소재는 신선 약간은 지루 하지만 저처럼 사연 많은 분들에겐 강추 남자인 저도 영화 끝나갈때 살짝 눈물 나왔네요ㅠㅠ  ,1,0,0
3120,2015.08.25,10,좋아요 좋아요ㄱㄱㄱㄱ  ,1,0,0
3121,2015.08.25,10,그냠 개꿀잼...말이 필요  없는영화입니다....ㅋㅋ  ,1,0,0
3122,2015.08.25,7,관람객글쎄요... 한효주가 정말 예뻤습니다. 후반부로갈수록 몰입도가떨어졌구여. 그래도 나름 재밌게 봤습니다. 감사합니다  ,1,0,0
3123,2015.08.25,10,잘만들었다 지루하지도 않고 잼난다 연기잘하네  ,1,0,0
3124,2015.08.25,9,기대안하고 봤지만 은은한 감동이있고 여운이 남음  ,1,0,0
3125,2015.08.25,10,개인적으로  재미있었어서 평점 남깁니다. 영화에 대한 아무 정보 없이 봤는데 소재가 신선하고 잔잔한 분위기가 좋았습니다. 특유의 아련함도요.:)  ,1,0,0
3126,2015.08.25,8,기대없이 보아서 그런지 잔잔하면서도 유쾌하고 슬프기도 하고 설레기도 하고 공감하면서 재미있게 봤다  ,1,0,0
3127,2015.08.25,10,너무 재밌게 봤는데 평이 이렇게 낮다니요.. 정말 최고입니다.  ,1,0,0
3128,2015.08.25,4,주입시키는 아름다움.  ,1,0,0
3129,2015.08.25,1,그것이 알고싶다 952회 한효주  ,1,0,0
3130,2015.08.25,9,솔직한평점 영화자체는 잔잔한로맨스인데호불호가갈리는게 현실적이지않은 부분때문인거같아요저는 감정이입하면서보니까 재밌던데요슬프고ㅠ꼭 연애감정아니여도 대사잘들어보면공감대는부분도있어서 소소하게 잘봤습니당  ,1,0,0
3131,2015.08.25,10,좋아요 최고에요★세번봤아요  ,1,0,0
3132,2015.08.25,9,관람객사실은 다중적인 인간들이 늘상 겪는 모습을 아름답게 표현한 수작!  ,1,0,0
3133,2015.08.25,9,"""8월의 크리스마스"",""미술관 옆 동물원""영화가 떠오르는 맑고 상큼한 영화 ..영화관을 나서며 맞는 바람은 선선했지만 가슴을 따뜻하게 한 ..  ",1,0,0
3134,2015.08.25,8,비현실적인설정이지만 나름잔잔하게볼수있는영화 한효주이쁘네  ,1,0,0
3135,2015.08.25,10,관람객첨엔  잼있다가 중간부터 슬퍼지는 그런영화  ,1,0,0
3136,2015.08.25,10,괜찮은 영화라 평하고 싶다.  ,1,0,0
3137,2015.08.26,9,"스텝 스크롤 올라갈 때 뒷 이야기가 나온다. 그런데 관람객 대다수가 그 전에 나가더라. 그 중 하나면서 여기에 별점 테러하는 사람은 반성하시길. 가지 많은  나무, 잘 다듬었다. 감정선도 끝까지 잘 끌고간 훌륭한 구성이었다고 생각.  ",1,0,0
3138,2015.08.26,9,난 괜찮던데...지루할듯하면서도 괜찮게 봤네요  ,1,0,0
3139,2015.08.26,10,관람객너무너무 재밋어요 다시한번 사랑에 대해 생각하게 됫고사람의 겉모습만 보고 판단하지말자 라는 생각되게 해준 고마운영화인거 갓습니다 뷰티인사이드에 나오는 연기자분들 감정이입하기 힘드셧을것같은데 고생하셧고 멋진영화 만들어줘서 고맙습니다  ,1,0,0
3140,2015.08.26,9,관람객재밌게 봤습니다 연애하고 싶네요  ,1,0,0
3141,2015.08.26,1,지루지루지루지루 정말지루해  ,1,0,0
3142,2015.08.26,9,관람객초반부터 재밌고 신선한 소재였다.  ,1,0,0
3143,2015.08.26,7,관람객한국 사회는 결국 완얼이다  ,1,0,0
3144,2015.08.26,10,관람객기대 이상.!기대했던 것 과는 달리 신선한 영화 였어요.  ,1,0,0
3145,2015.08.26,10,난 얼마나 이성친구를 이해하고 있을지 생각하게 해주네요. 서로가 이해하고 배려하는 모습. 내가 홍이수라면? 어떤 느낌일까요? 마지막 장면에서 홍이수에게 김우진이 다가오는 장면이 정말 인상깊어요. 홍이수가 느끼는 우진은 어떤 느낌일지 여운이 남아요  ,1,0,0
3146,2015.08.26,8,원작과 다른 엔딩. 자칫 왜 내면의 아름다움을 이야기하며 비주얼배우들만 비중있냐 할수있지만. 그게 영화. 우리도 겉만보지말고 내부의 이야기를 봐야한다.  ,1,0,0
3147,2015.08.26,8,여러분 관람객 아닌 리뷰는 씹고갑시다  ,1,0,0
3148,2015.08.26,10,관람객굿굿강추 연인들보면 더가까워지는영화입니다ㅎㅎ  ,1,0,0
3149,2015.08.26,8,왜 이영화를 보고 낮은점수를 주는지 모르겠네요.개인적으로 재미있게 잘 봤습니다. 스토리도 좋았고요~  ,1,0,0
3150,2015.08.26,10,왜 평점들이 쓰레기죠?베테랑급의 재미에 뛰어난영상미에 이게영화구나 싶었습니다무슨 영화에서 얻을것을따집니까? 그럴라면 집에서 자기계발서나 읽으십쇼  ,1,0,0
3151,2015.08.26,9,"영화의 생동감은 없엇지만 여주의 내면에 포인트를 맞춰서 영화를 관람하면 재밋게 볼수잇을거같다, 여주가느끼는 두려움 이런것등을 생각하면서 보면 재밋을거같다  ",1,0,0
3152,2015.08.26,10,이 영화는 정말 호불호가 심하게 갈리는 영화 같습니다. 영상미 예쁘고 잔잔한 영화 별로 안 좋아하는 사람들은 재미없다는 반응이지만 전 올해 본 영화중에 제일 좋았습니다.  ,1,0,0
3153,2015.08.26,1,아무렇지도 않게 태연하게  ,1,0,0
3154,2015.08.26,7,우리나라에서 나오기 힘든 판타지로맨스영화 두 남녀의 마음을 느끼면서 영화를보니 참 슬프다. 지루하진 않았다. 그냥 두 사람의 사랑이 안타깝고 슬프다... 그리고 분위기에 맞는 연출. 그래도 역시 아쉬운 면은 제목의 모순.  ,1,0,0
3155,2015.08.26,10,관람객영화를 보기전에 뷰티인사이드에 대해 연인이라면 더 깊이 사랑하고싶은 마음이 들것이다 이런 비슷한 문구를 봤었습니다 많은것을 생각하게 했지만 가장 좋았던 것은 바뀌는 모습을 사랑하는것이 아니라 그사람 그대로를 사랑하는것이라는 그런 깊은 울림이 좋았습니다  ,1,0,0
3156,2015.08.26,8,난 우진이가 보였다. 얼굴은 잘 모르겠지만영화가 끝난뒤 우진이라는 존재는 선명했다  ,1,0,0
3157,2015.08.26,2,뭐가재밋단건지..재미로본건아니지만개성있는배우보단얼굴잘생긴배우만계속나오고얼굴이자꾸바뀌니집중도안되고내용이해가잘안된다중간에자서한번더보고싶지만돈아까워서못보겟다  ,1,0,0
3158,2015.08.26,9,확실히 호불호가 갈릴 수 있을 것 같은 작품이긴 한데 저는 진짜 너무 재밌게 봤네요ㅎㅎ 감정이입도 잘돼고 굉장히 따뜻한 내용이였어요~  ,1,0,0
3159,2015.08.26,8,자고일어나면 한효주얼굴이되고싶다  ,1,0,0
3160,2015.08.26,8,관람객울다가 웃다가울다가 웃다가연인들이 보면 좋을만한영화혼자봐서그런건지 부모님과떨어져지내며봐서그런건지 부모님까지생각나는건저혼자였을까요?좋았습니다 기분좋게보고왔어요^^  ,1,0,0
3161,2015.08.26,10,악플 다는놈들 이해가 안가네 ㅋㅋ 보고 얘기하는건지..기대 안하고 봤는데 기대이상! 강추! 한효주 너무 좋으다ㅠㅠ  ,1,0,0
3162,2015.08.26,10,대박 한효주 연기 좋고 나머지 남자배우들도 멋짐  ,1,0,0
3163,2015.08.26,8,관람객마음을 따뜻하게 해준 영화이다.  ,1,0,0
3164,2015.08.26,9,보는내내눈호강♥ 이현우가너무짧게나와서아쉬웠지만..  ,1,0,0
3165,2015.08.26,10,누구를 사랑하가 보면 매일매일이 한결 같을순 없고 어제와 내일이 다를 경우가 훨씬 많은데 김우진씨는 그게 겉으로 표현이 됐을뿐이고 한효주는 겉으로 표현이 안됐을 뿐  ,1,0,0
3166,2015.08.26,6,관람객좋아하는 사람이랑 같이 가서 봐서 그런지 더설레였어요 뒤로갈수록 재미가 떨어진건사실이지만  돈내고 볼만한영화였어요  ,1,0,0
3167,2015.08.26,6,관람객너무 여자들의 눈호강에 치우친 영화  ,1,0,0
