index,time,score,reple,1st_week,2st_week,3st_week
1539,2015.08.22,10,여러배우들을 볼수있어서 좋았고 웃다가 울다가 하는 내용이 너무너무 좋았던것같아요♥영화 잘봤습니다!!-롯데신림-  ,1,0,0
1540,2015.08.22,10,영화너무재밌었어요^^ 롯데신림  ,1,0,0
1541,2015.08.22,10,너무 재밌어요!!!!♥.♥ 효주누나 여신강림!!!! 진짜이뻐요!!!! 응원합니다 뷰티인사이드 화이팅!! 롯데신림  ,1,0,0
1542,2015.08.22,10,정말  지루할틈 없이 즐겁고 여러 생각도 할수 있게해준 뿌듯한 영화였어요 뷰티인사이드 짱!! 롯데신림  ,1,0,0
1543,2015.08.22,10,3번 봤어요 짱이에요 ㅠㅠ  ,1,0,0
1544,2015.08.22,10,"초반에는 신선한 소재, 내용으로 재밌었고 가끔 재밌는 웃음 코드로 웃을 수 있었으며 절정이 최고조로 달했을 때 나도 모르게 빠져들었고 끝나고 나서는 큰 여운이 남는 영화였다. 나중에 다시보기로 보고 싶은 영화이다.  ",1,0,0
1545,2015.08.22,7,관람객볼만하다 한효주 이쁘다  ,1,0,0
1546,2015.08.22,8,"분위기와 대사 하나하나, 소품 하나하나가 예뻐서 눈을 뗄 수 없던 영화. 로맨스의 정의를 내려준 영화. 진정 그 사람의 진짜 모습까지도 이해해주는 사랑의 결정체랄까. 감정선이 아름다워 몰입도가 높았다. 로맨스를 꿈꾼다면 추천!  ",1,0,0
1547,2015.08.22,7,볼만 함 여자가보기에 좋다 잘생긴사람 마니나와서 제목과 많은괴리감이 있는영화지만 난 즐겁게봄 울기도하고  ,1,0,0
1548,2015.08.22,4,내면의 아름다움이라지만 영화를 보고나니 사람 외모가 얼마나 중요한지를 더 깨닫게 되었음. 고로 이영화 공감안됨.  ,1,0,0
1549,2015.08.22,10,아 진심 좋네요 한효주 너무이뻐요 ㅜㅜㅜ무대인사 완전 굳굳굳 이진욱 존잘 섹시 인정  ,1,0,0
1550,2015.08.22,10,재밌어요ㅋㅋㅋ 새로운 시도 굿  ,1,0,0
1551,2015.08.22,10,관람객잔잔한 감동 진한 여운이..  ,1,0,0
1552,2015.08.22,10,재밌었는데  왜이렇게들꼬였나재밌어요 강추^^  ,1,0,0
1553,2015.08.22,6,지금 평점이 너무 웃긴게 관련 없는 글들 공감수 누르고 하는 건 티나서 안 좋은 평들만 찾아서 안티들이 공감수 누르고 있음 참..  ,1,0,0
1554,2015.08.22,1,한효주 뻔뻔하다 진짜 양심이 없으신가  ,1,0,0
1555,2015.08.22,10,진정한 사랑이 뭔지를 보여준 영화.매일 바뀌어가는 남주와  그런 남주를 조금씩 받아들여가는 여주의 로맨스.더할나위 없는 영화였다  ,1,0,0
1556,2015.08.22,10,감동이 공들여 만든 이 영화의 영상미 만으로도 충분하다  ,1,0,0
1557,2015.08.22,10,"개인적으로는 최근에 봤던 한국 영화중에 최고였습니다. 사랑은 모든걸 주지만... 사랑이 모든걸 망치기도하죠. 보통의 멜로는 뭔가 공감해서 운다고 해야하나, 근데 이 영화는 이야기는 공감이 안가는데 눈물이 납니다. 사랑할수있을까요?  ",1,0,0
1558,2015.08.22,8,관람객지루한감있지만 괜찮아용 ㅎㅎㅎ  ,1,0,0
1559,2015.08.22,8,생각보다진짜재밌었는데 내용도그렇지만 보면서 웃긴부분이많아서좋앗어요 진짜 별기대안하고 봤거든요 재미없으시다고하는분들많으신데 저는 개인적으로 진짜 재밌었어요  ,1,0,0
1560,2015.08.22,3,잘생긴분들만좀많이나오고나머지분들은2분?정도나오는것같은데그럴거면뭐할려고캐스팅한지모르겟다보는내내지루해서딴짓하고건진건배우들얼굴보는거  ,1,0,0
1561,2015.08.22,2,재미없어요 네 말그대로 재미없어요보다가 지루해서 죽을뻔했어요맨처음에는 웃겨서 좋았는데 뒤로갈수록 지루하고 뻔한스토리..  한마디로 지루합니다 이현우나와서 별한개요  ,1,0,0
1562,2015.08.22,10,관람객나무나무재밌어요 우하하  ,1,0,0
1563,2015.08.22,10,그냥 재밌음 공감안가도 재밌음  ,1,0,0
1564,2015.08.22,10,감수성 폭발...하아... 너무 달달하고 로맨틱하고 잔잔한 감동에 웃음에완전 재밌게 봤어요두시간 동안 시간 가는줄 모르고 봤다는^^  ,1,0,0
1565,2015.08.22,1,뷰티인사이드.자신감은 멋진외모를가질때만 나오나봄 슬픔 ㅜ.ㅜ 의미는있지만 많이지루한영화 따분한영화  ,1,0,0
1566,2015.08.22,2,제목과 내용의 괴리가 심하고 대사가 너무 진부했다 킬링타임으로는 괜찮은 영화  ,1,0,0
1567,2015.08.22,9,관람객아름답고 좋습니다 추천합니다  ,1,0,0
1568,2015.08.22,10,관람객달달한 멜로 엔딩의 후폭풍은...같이 보던 동생들중한명은 울었네요  ,1,0,0
1569,2015.08.22,10,전혀 기대 안 하고 봤는데.. 재미와 영상미가 좋은 의외의 수작. 깔끔합니다.  ,1,0,0
1570,2015.08.22,10,"나는 이런 영화가 좋으다!  개인적으로 좋아하는 우에노주리를 볼 수 있어 좋기도 했고 , 힛 ~  ",1,0,0
1571,2015.08.22,10,잔잔하고 여운이 남는 영화  ,1,0,0
1572,2015.08.22,9,멜로영화좋아하시는분들은 이 영화가 정말 재미있으실건데 아닌분들은 지루할 수 있을것 같네요. 난정말 멜로가좋다! 하시는분들 적극추천합니다! 전 멜로를 좋아해서 정말 재미있게 봤던것 같아요~  ,1,0,0
1573,2015.08.22,10,로맴스물 좋아하는나로서는 좋았다 막 엄청좋다 이런건아닌데 괜찮았다 볼만한정도  ,1,0,0
1574,2015.08.22,3,"지루하고 허무함, 쓸쓸함과 공허함이 마음에 남음  ",1,0,0
1575,2015.08.22,1,시작부터 끝까지 지루하다; 초반부터 지루하길래 도입부라 그렇겠지 싶었는데 중간부터는 언제 끝날지 시계만 보고 있었다.. 평점 등록 같은거 해본 적 없는데 정말 답답해서 쓴다.. 돈이 아까운 것 보다 시간 아까운 영화였다. 최악  ,1,0,0
1576,2015.08.22,9,"볼만한영화, 재밌고 감동적이다뻔할수있는스토리이지만 나름대로 돈아깝단생각안듬..평점너무낮네 지들이스토리짜보던가 감독도아닌것들이 욕은조질나게하네  ",1,0,0
1577,2015.08.22,7,납득안되는 병...떨어지는 리얼리티에도 오랜만에 몽글몽글 예쁜 영화라 반갑다  ,1,0,0
1578,2015.08.22,10,간만에 가슴 먹먹하고 마음이 따뜻해 지는 영화였습니다. 한효주씨 영화는 감시자들 이후 오랜만에 봣는데 목소리 하며 섬세한 표정연기등 새로운 매력을 볼 수 있었습니다.  ,1,0,0
1579,2015.08.22,10,관람객신선하고재밋엇습니다ㅎㅎ  ,1,0,0
1580,2015.08.22,10,관람객한효주 너무 연기 잘하네요 ㅠ슬프고 감동적이였습니다~  ,1,0,0
1581,2015.08.22,10,"여자친구랑 보고 왔는데, 잘 보고 왔어요. 뻔한 내용에 불만인 사람도 있는데.. 충분히 사랑하는 사람에대한 좋은 감정 느끼고 왔어요. 사랑하는건 똑같잖아요. 어쩌면 당연히 뻔할수밖에 없지 않을까요..  ",1,0,0
1582,2015.08.22,10,나 아픈거만 보고 상대방 아픈거 못본 모습들이 나에 지금모습과 같아 잠시 눈물 훔쳤습니다  ,1,0,0
1583,2015.08.22,1,감사평 적을것도 없네...노잼  ,1,0,0
1584,2015.08.22,6,"관람객영화라지만 억지스럽고.,감동도재미도 못느꼇습니다ㅜ개인의차이가 있으니 한번보시고 판단하세요^^ 저는 핵노잼이라는..ㅜ  ",1,0,0
1585,2015.08.22,6,전지현여자영화 안보려고 이거본거였는데 이건 한효주여자 영화였음..드라마들도그렇고 너무 여주인공 비주얼만 믿고가는듯.내용을 보고싶다고 ㅜ  ,1,0,0
1586,2015.08.22,7,나쁘지않았던.. 첨부터끝까지 정적이지만 이런장르를 좋아해서ㅎㅎ  ,1,0,0
1587,2015.08.22,10,음..전 재미있었는데  ,1,0,0
1588,2015.08.22,5,관람객뻔한결말에클라이맥스도없고..그냥너무잔잔한느낌ㅠㅠ그냥한효주를위한영화같다  ,1,0,0
1589,2015.08.22,8,메말라있던 감수서성을 회복하는데 좋은 영화라고 생각합니다. 좋은 배우와 좋은 소재로 좋은 영화였습니다.  ,1,0,0
1590,2015.08.22,8,스토리가 잔잔하게 물흐르듯이 흐르네요~ 킬링타임용으로 좋아요!  ,1,0,0
1591,2015.08.22,10,소재도 괜찬고 잔잔하구만 나름 괜찬었어  ,1,0,0
1592,2015.08.22,2,뭐 알바생도아니고 실관람객임 방금 보고옴 근데 진짜게뭔 제목은 뷰티인사이드면서 너무 잘생긴모습일때만 좋은장면도많고 외적인것을 추구하는게 보임 내용도 영 별로고 이게뭔가싶음....좀..ㅎㅎ  ,1,0,0
1593,2015.08.22,1,캐스팅과 주제는 좋았지만 너무 지루하고 진부한 스토리에 뻔한 엔딩 돈보다 시간이 너무 아까웠던 영화  ,1,0,0
1594,2015.08.22,10,"내가 볼땐 오히려 암살, 베테랑보다 더 나은 영화인것 같은데 평점이 왜이리 박할까 의아한 영화, 영화 외적인 문제는 영화 외적으로 평가하고 영화는 영화로 평가하는게 맞다고 생각.  ",1,0,0
1595,2015.08.22,10,소재도 독특하고 창의적이었고 배우들 감정이 이어져서 좋았습니다.  ,1,0,0
1596,2015.08.22,10,기대보다 훨씬 재밌었고 깊이 생각해볼 수 있는 요소도 많았음ㅋㅋㅋㅋ  ,1,0,0
1597,2015.08.22,9,관람객배우들 라인업 자체가 충분히 볼 가치가 있어요 ㅋ  ,1,0,0
1598,2015.08.22,9,다양한.배우들을 볼수.있어서.좋았고한효주를.좋아하진.않지만영화 자체는 사랑에.대해 다시 생각해볼.수 있어서.가슴이.먹먹했네요ㅠ  ,1,0,0
1599,2015.08.22,9,개인적으로진짜재밌었음  ,1,0,0
1600,2015.08.22,10,관람객많은생각이 드네용~ 한효주 짱이뽕ㅎㅇ  ,1,0,0
1601,2015.08.22,2,"그냥 2시간동안 한효주씨 CF보고 나온 느낌정도? 이야기도 탄탄하지 못하구, 도대체 왜 사랑하는지 이유를 모르겠음..여주 그냥 착함. 성격 착함..성격까지 따뜻함 너무 완벽한 그녀가 외니 도대체 사랑에 빠진건지 설명도 부족하구 이해안되는...  ",1,0,0
1602,2015.08.22,1,진짜 역대 최고로 재미없었다 존1나 어집럽고 오글거리기만하고 빨리 뛰쳐나오고 싶더라 하 공짜로보여준다해도 아까운영화다  ,1,0,0
1603,2015.08.22,10,관람객와 진심... 제 인생 영화 중 하나 ㅎㅎ..  ,1,0,0
1604,2015.08.22,9,"눈과 속이 호강한 영화입니다.  외면이 아름다운 배우들이 내면의 아름다음을 표현하는 연기가 좋았고, 캐릭터의 매력을 녹여내는 작품성이 배우들의 연기와 어울어져 기억에 오래남을 것 같은 영화입니다.  ",1,0,0
1605,2015.08.22,1,관람객개노잼진짜한효주땜에봣네 비추  ,1,0,0
1606,2015.08.22,9,별로라는 것들이 알바임...괜춘함 좀 지루한것빼고  ,1,0,0
1607,2015.08.22,7,부담없이 편안하게 보세요~  ,1,0,0
1608,2015.08.22,9,한효주하고 여러ㅓ배우들이 연기하는 모습이 자연스럽고 내용자체도 사람의 내면이 중요하다는걸 잘 나타낸것 같음...  ,1,0,0
1609,2015.08.22,1,전체적으로 너무 재미없음. 그리고 한효주 연기 더럽게 못함. 돈 버림. 그냥 안보는게  돈 버는것임.  ,1,0,0
1610,2015.08.22,10,관람객나름의 감동을 주는 영화  ,1,0,0
1611,2015.08.22,10,기대 안하고 봤는데 너무 재밌어서 감동받은 영화. 운 사람은 나뿐인가?  ,1,0,0
1612,2015.08.22,10,관람객달달한영화 찾으시는분들 추천  ,1,0,0
1613,2015.08.22,9,"관람객영상미가 이쁘고, 몰입도가 강한 영화 인것 같습니다.^^  ",1,0,0
1614,2015.08.22,10,관람객평소보던 영화보다 참신하고 한효주가 너무 예뻣다. 영화가 전체적으로 간질간질하면서도 무거운 부분에선 무겁다 자칫 지루할 수도 있지만 영화 몰입도가 높아서 집중할 수 있었다.  ,1,0,0
1615,2015.08.22,8,관람객소소하게 잘봤네요~~  ,1,0,0
1616,2015.08.22,10,뷰티 인사이드 너무 재미있었습니다.  ,1,0,0
1617,2015.08.22,10,묘함. 한번봐도괜찮을듯  ,1,0,0
1618,2015.08.22,10,관람객난 잼있었는데 평이 별루네요  ,1,0,0
1619,2015.08.22,10,재밌던데 한효주졸쁨 ㅎㅎㅎ  ,1,0,0
1620,2015.08.22,10,관람객인생멜로영화♡정말사랑스러운영화다  ,1,0,0
1621,2015.08.22,10,한효주에 의한한효주 스토리 도 그리고 영상감도 좋았다 마지막 체코 씬 이 아쉽다 마지막 엔딩을 끌어올릴려고 무리한거 같아보이지만 사실 초잔과 중반 아무 색도 칠하지 않았던 순수한 장면들이 더 인상 깊음  ,1,0,0
1622,2015.08.22,2,ㄹㅇ 눈호강용영화 뻔한스토리  ,1,0,0
1623,2015.08.22,9,관람객재밌었어요 꾸르잼 쿄쿄  ,1,0,0
1624,2015.08.22,10,관람객연인과 함께보면 좋은 영화입니다한효주 넘이뻐요  ,1,0,0
1625,2015.08.22,10,평범한 삶에 대하여 생각해보게 되는 영화  ,1,0,0
1626,2015.08.22,10,와 진짜 이영화 개쩜 ㅜㅠ  ,1,0,0
1627,2015.08.22,10,"한효주너무이뿌고영화색감,분위기가너무좋아요^^첨평점남기는데이영화잘됐으면좋겠네용~  ",1,0,0
1628,2015.08.22,10,재밌게 잘봤습니다. 여운이 남아서 좋아요  ,1,0,0
1629,2015.08.22,7,로맨스 영화로 감동적인 메세지도 가지고있다 ㅎ  ,1,0,0
1630,2015.08.22,7,"박서준으로 시작해서 이진욱, 유연석으로 끝. 소재 좋다  ",1,0,0
1631,2015.08.22,5,좀 슬프긴했는데 베댓말대로 중요한 장면에는 다 잘생긴남자 갖다써서 제목이랑 괴리감이 느껴졌음. 그리고 5번째 베댓이 쓴 글중에 한효주가 부처다?? 이거에는 공감 못하겠음. 결론은 소재는 좋은데 그게 다라서 5점  ,1,0,0
1632,2015.08.22,1,감독님 배우를 잘 선택하시길...  ,1,0,0
1633,2015.08.22,1,와진짜..배우들좋아서기대하고봤는데..너무노잼이라 실망이크네요..  ,1,0,0
1634,2015.08.22,6,그렇게재밋지도 재미없지도않던영화. 무슨내용인지 예고편도안보고 그냥봣는데 한효주가참이쁘더라..내용은그저그런데 잘나가는배우들섭외한거치고는 1~2분나오고 바뀌고..아무튼그저그럼..걍볼만한?  ,1,0,0
1635,2015.08.22,10,관람객정말 오랜만에 괜찮은 로맨스영화 보고왔습니다! 굿굿굿  ,1,0,0
1636,2015.08.22,10,"한효주 나왔다고 까지말고,중요한 장면에 미남배우 나왔다고 까지 맙시다.솔직히 영화니까 이쁜장면 보여주고 싶어서 중요장면에 미남배우 쓴거고 동생분 은  한효주님 자신이 아니니까 그걸로 뭐라하지맙시다.여운이 남는 영화였음. 처음으로 평점 남겨봐요.  ",1,0,0
1637,2015.08.22,8,영화의 주고자 하는 메세지가 느껴짐!  ,1,0,0
1638,2015.08.22,10,뻔한데 뻔하게 빠져드는 영화... 인거 같아요 ㅋㅋㅋ 사랑하고 계시다면.. 감수성 충만하다면 충분히 재밌을거예요 ㅋㅋ  ,1,0,0
1639,2015.08.22,9,최근국내멜로영화중 세손가락안에 들어감. 상당히 느낀게많았던영화. 배우들 영상미또한아름다움평점테러  신경쓰지말고 봐보시길)) ))특히 연인들이 보는거 추천이에요  ,1,0,0
1640,2015.08.22,9,재미는 있음 근대 왜 댓글이 다 좀 아니라서  놀람ㅡㅡ  ,1,0,0
1641,2015.08.22,7,차라리 외모가 뛰어나지않은 우진역 배우와의 키스신이나 애틋한 씬이 있었다면 내면의 중요성이 더 부각됐을텐데 참 아쉽다  ,1,0,0
1642,2015.08.22,10,관람객너무 좋았어요. 또 보고 싶은  ,1,0,0
1643,2015.08.22,10,1점줄영화는절대아닙니다영상미도이쁘고소재가신선하고 배우들 비주얼도 대박이고 배경음악도좋고요특히 김주혁이랑 눈오는날이별씬이 대박 이때움  후반부좀 지루한느낌이있지만감수성이 풍부해지는느낌 한효주진차이쁨 남배우들도잘생기고 이런잔잔하고아련한영화좋아하는분들추천  ,1,0,0
1644,2015.08.22,10,오랜만에 편해지는 영화를 본거같네요  ,1,0,0
1645,2015.08.22,7,관람객잔잔하고 소소한영화이다 간간히 웃음소스와 신선한소재 현실속판타지가 좋았다다만 루즈한 스토리전개가 가장아쉽고 큰반전없는게 장점이자 단점인것같다.  ,1,0,0
1646,2015.08.22,10,무슨말을해야될지도모르겠다..  ,1,0,0
1647,2015.08.22,10,관람객감동이에요감동이에요  ,1,0,0
1648,2015.08.22,10,편하고 재밌는 영화! 즐거웠습니다  ,1,0,0
1649,2015.08.22,9,모야 재밌기만하다가을이 오는 이 시점.. 잔잔한 이 영화 빠져든다튀지않고 무난하다.. 그래서 좋다신선란소재..괜찮다..마지막 유연석이 좀 약했지만한효주가 아님 안됬던거같다..자연스러운 미 화장기 없는 얼굴 ..괜찮았다 아주많이~  ,1,0,0
1650,2015.08.22,10,관람객사랑이란..힘들어도 아껴주고 서로 생각해주는게 사랑인듯색다른소재로 너무 재밋어요  ,1,0,0
1651,2015.08.22,8,한프레임 한프레임 정성다해 찍은 느낌 특히한소재로 이야기를 잘꾸민거같다 영화보는 동안 편안하고 힐링되는 느낌 다소 중요하지않은 장면을 길게끌어 지루한것도 있었지만 보는내내 기분좋았다  ,1,0,0
1652,2015.08.22,10,시간가는줄모르고봄 재밌다  ,1,0,0
1653,2015.08.22,10,관람객멜로영화의 새로운 도전 남자배우들 보는재미 솔솔 ㅎ  ,1,0,0
1654,2015.08.22,10,영화자체는 좋았는데 영상도 예쁘고 감초였던 상백이가 웃겨서 많이웃고 여러생각도 들게하고 다만 마무리가 조금 아쉬웠을뿐? 그런데 내면이 아닌 외모지상주의라고한 사람들은 영화 보지도 않고 까는거니 뭐.. 전체스토리가 아닌 일부 배우모습만보고 그러니 쯧  ,1,0,0
1655,2015.08.22,10,"저는 개인적으로 슬프고 엄청 재밌엇슴! 사랑하는 사람을 생각하니 눈물도 났고..장면 하나하나 예뻣고 진짜 지루한 부분이 1도 없었어용 뭐가 지루하단건지..베테랑,뷰티인사이드 연속으로봤는데 뷰티가 더 와닿았음그리고 잘생긴배우만 보이는 영화는절대아닌데;  ",1,0,0
1656,2015.08.22,1,고인의 유족들이 뻔히 눈뜨고 있는데 정말 염치가 없다 드라마에는 다시는 나오지 않기를 바랄뿐이다 영화는 어차피 쎄OO 망한것처럼 관객들이 안보러 가겠지만 드라마 나오면 방송국에 출연금지 신청할거다  ,1,0,0
1657,2015.08.22,10,여자친구가 만족한 영화 :)  ,1,0,0
1658,2015.08.22,10,최근에 본영화중 가장 감명깊고 느끼는게많았던 영화네요. 한효주매력을 충분히 느낄수있고 출연했던 다양한 배우들의 한사람을표현하려하는 다양한연기가 시선을 사로잡습니다.  아련하네요..  ,1,0,0
1659,2015.08.22,10,관람객잔잔하면서 틈틈히 웃기게 해주는 영화  ,1,0,0
1660,2015.08.22,10,정말 역대급 멜로영화입니다 꼭봐야해요  ,1,0,0
1661,2015.08.22,1,?.?.?.?.?.?.?  ,1,0,0
1662,2015.08.22,5,신선한 소재와 좋은 배우들을 전혀 활용하지 못한 영화... 집중 할 수 없었던 부분도 아쉽네요...  ,1,0,0
1663,2015.08.22,10,여러분 한효주를 배우로만 보고 판단하세요 평점테러하지 마시고 싫으시면 안보시면 되잖아요 괜히  훼방놓지말고 싫으시면 보지마세요 저는 이영화보고 굉장히 인상깊었습니다 매일 얼굴이 바뀌는 설정에 새롭고 재밋기만 할거라고 생각했는데 내면의 슬픔이 있었네요  ,1,0,0
1664,2015.08.22,9,최근 가장 아름다운 로맨스 영화느낌. 잔잔하지만 감성이 폭발하는 영화임. 한효주 너무 이쁘더라 보지도 않고 평점 테러하지 맙시다..  ,1,0,0
1665,2015.08.22,10,"이게 왜 2점이나4점인지 이해가 안돼네요. 매번 바뀌는 배우들의 연기력면에서나 내용적인 측면, 영상미까지 개인적으로 굉장히 맘에 들었습니다. 10점이 짜다고 생각할 정도로 제겐 인생영화였습니다  ",1,0,0
1666,2015.08.23,10,관람객오랜만에 감성적인 영화 후회없이 봤네요 눈호강은 덤!  ,1,0,0
1667,2015.08.23,10,관람객잔잔하고 감동도있는♡  ,1,0,0
1668,2015.08.23,8,볼 만 하다 한효주 이쁘다♡  ,1,0,0
1669,2015.08.23,9,근래 본 한국 멜로 드라마 중엔 최고구만. 소재도 참신하고 스토리 전개도 말끔하다.한효주는 장차 대형 배우로 성장할 수도 맀을 것 같은 가능성이 보였음. 평점을 보니 한효주에 열폭하는 오크들이 참 많다는 느낌을 지울수 없네.  ,1,0,0
1670,2015.08.23,9,관람객코믹으로갈수있는영화인더  나늠 로맨스잘표헨햇음  ,1,0,0
1671,2015.08.23,10,한효주너무 이쁨 ㅎㅎ 진짜 재밌게봤다  ,1,0,0
1672,2015.08.23,1,와 한효주안까이네 이젠?  ,1,0,0
1673,2015.08.23,10,너무 좋았던 영화입니다. 뻔하다고도 할 수 있지만 재밌기도 하고 눈물도 나고~ 아직도 잔상이 남네요  ,1,0,0
1674,2015.08.23,8,"관람객저는 잘 봤습니다- 조금 아쉬운 면도 있었지만 생각보다 많은 것을 느끼게 해주는 영화였습니다. 영상미 있는 장면 하나하나에서 섬세함이 느껴졌고, 영화의 전체적인 분위기가 따뜻해 좋았습니다.  ",1,0,0
1675,2015.08.23,10,가을같이 선선하며 따뜻한 영화.  ,1,0,0
1676,2015.08.23,8,조금 지루한면이있지만 재밌었음 소재 신선 그냥 저 장면에 빠져보면 재밌다  ,1,0,0
1677,2015.08.23,10,상대적으로 많은 배우들을 대해야되서 연기 집중하기 힘들었을텐데도 자연스러웠음 볼땐 그저그런데 영화가 끝나고나서 여운이 많이남는영화  ,1,0,0
1678,2015.08.23,10,평점은 중요하지 않아서정적이고 너무 너무너무너무 좋았는데오에스티도 이수가 받아들이는 과정도 이입하기 충분했음  ,1,0,0
1679,2015.08.23,10,재밌고의미있는영화였음  ,1,0,0
1680,2015.08.23,8,난 꽤 재밌게 봤지만 한효주랑 좋은 거 한 남자는 다 잘생긴 배우였단 거 인정 외모지상주의 경향?없다고 하진 못 함 그래도 1점 행진할 정도로 개차반은 아닌데 1점 준 사람들한테 한효주 그 사건...?이 영향 미친 듯 현우 3초는 나왔니 우정출연급 ㅜ  ,1,0,0
1681,2015.08.23,10,난솔직히 재밌게봤는데 평이너무 다들 너무하신듯  ,1,0,0
1682,2015.08.23,10,감정소모가 심했던 영화. 영화를 보면서 이렇게 감정에서 헤어나기 어려웠던 적은 처음이었다. 이수와 우진의 심리묘사가 정말 좋았다. 사랑하면서도 내가 사랑하는 사람은 매일 처음보는 사람이다  이 모순을 가지고 살아가는 이수의 감정이 공감되었던 영화였다  ,1,0,0
1683,2015.08.23,10,여운이많이남는영화네요  ,1,0,0
1684,2015.08.23,10,"영상미도 좋고, 여러 배우들 보는맛도 있고 좋아요.  ",1,0,0
1685,2015.08.23,10,여태껏 보지못한 신선한 멜로영화였습니다. 감독님의 연출이 빛을 바라는 영화였습니다. 재밌게 봤어요~~  ,1,0,0
1686,2015.08.23,1,"....10점을 준 평점 내용만 봐도 어떤 영화인지 알 수 있는 영화, 이게 인생영화고 그렇게 재밌는 영화야?  ",1,0,0
1687,2015.08.23,10,난좋았는데;; 왜들그러시지  ,1,0,0
1688,2015.08.23,10,관람객진짜 쭤로리 남주인공들 대박 ㅠㅠ  ,1,0,0
1689,2015.08.23,8,관람객?괜찮았어요 볼만한영화?  ,1,0,0
1690,2015.08.23,10,"감성 영화 좋아하시는 분에게는 딱입니다. 감성영화를 싫어하신다면 다소 지루할 수도 있어요.일단 전 엄청 재미있게 봤어요. 전혀 지루하지도 않았구요. 감독의 연출력도 좋았어요. 무엇보다도 한효주가 너무 예뻐요, 아 예뻐서 10점 준거는 아니에요  ",1,0,0
1691,2015.08.23,9,호불호가 엄청 갈리는 영화일 듯 합니다. 저한테는 절말정말 예쁜 영화였습니다. 슬픈영화가 아닌데도 펑펑 울었고 영상미도 좋고 무엇보다 여운이 남는 영화였습니다.  ,1,0,0
1692,2015.08.23,9,관람객사랑하고싶게 만드는영화입니다^^  ,1,0,0
1693,2015.08.23,10,이 영화는 19세미만 관람불가?이다..애들이 보기엔 쫌..정말 평점 1점짜리 지루해보일수 있는 영화이지 않을까싶다..난 액션영화를 좋아한다 하지만 이영화는 생각을 많이 들게 하는 영화라는것은 확실하다..  ,1,0,0
1694,2015.08.23,9,관람객완전 푹 빠져 봤는데 생각보다 호불호가 있는 영화인 듯... 친구랑 난 생각 이상으로 넘 좋았는데...  ,1,0,0
1695,2015.08.23,9,힐링되는 잔잔하고 편안한 영화..! 좋았습니다~  ,1,0,0
1696,2015.08.23,10,잔잔하고 감동적이고 배우들 연기가 좋앗다 한효주도 좋앗고 남자역배우들이 진짜 한사람같앗다  ,1,0,0
1697,2015.08.23,10,아 여기 진짜 베베 꼬인애들 겁나많네 . 영화를 진짜 보고쓴건지 아니면 그냥 뭔가를 둘러대서 비평하는건지 하아.. 10점 .한효주가 어떻고저떻고간데 보세요 . 좋은 영화에요.  ,1,0,0
1698,2015.08.23,10,평점이 왜이럴까요..보는내내 먹먹하며영화가 너무 섬세하고 한 장면장면이 아름다웠습니다.추운가을에 나왔으면 더 좋았을듯.정말 소장하고싶은 영화. 강추.!  ,1,0,0
1699,2015.08.23,10,"영상. 음악. 주고자하는 메시지까지 모두 굿- 어제 오늘 연달아 2번 봤지만 또 보고싶어지는,  ",1,0,0
