index,time,score,reple,1st_week,2st_week,3st_week
4760,2015.08.30,8,한효주의 평범한 아름다움은 따라올 자가 없는 것 같다. 아쉬운 점은 그냥 헤어졌을 때 영화를 끝냈어야했다. 적어도 현실적이었다면 더 큰 공감이 있었을 것을..  ,0,1,0
4761,2015.08.30,10,관람객정신과의사랑 상담할 때 이수의 입장이 너무 느껴지고 안타까웠다 기억에 많이 남는다  ,0,1,0
4762,2015.08.30,10,관람객한효주가 예쁘게 나오네요 사람이 변할때 마다 여자들의 환호소리 땜시 넘재밌었어요 ㅋㅋ  ,0,1,0
4763,2015.08.30,10,너무재밌다 한효주 진짜뭐야개이뻐  ,0,1,0
4764,2015.08.30,1,인물에 몰입이 안되네요 별로에요..  ,0,1,0
4765,2015.08.30,1,뷰티인사이드가 아닌 외모지상주의 영화임~그냥 배우얼굴 눈요기한다 셈치고 보면 될듯....감동은 없음  ,0,1,0
4766,2015.08.30,5,"예쁜 각도로, 조명으로, 대사로, 표정으로. 무조건 예쁘면 되는거야?  ",0,1,0
4767,2015.08.30,1,세상은 넓고 고추는 많다 오는 고추 안막고 가는 고추 안잡는다  걸레부심을  자랑하는 고장난 자물쇠의 일기장  ,0,1,0
4768,2015.08.30,1,영화가진자개판이에요영화도재미없는대같이본여자도못생겨서ㅂㄷㅂㄷ  ,0,1,0
4769,2015.08.30,1,지루했어요돈아까움ㅜㅜ미쓰와이프가더더더재미있음  ,0,1,0
4770,2015.08.30,1,한효주때문에 영화 드럽게 재미없네 별 하나도 아깝다  ,0,1,0
4771,2015.08.30,9,관람객기대하고봣는데도 재밋어요  ,0,1,0
4772,2015.08.30,8,뒷부분이 조금 지루한것 빼곤  전체적으로 괜찮았어요  ,0,1,0
4773,2015.08.30,9,볼때보다 보고나서 여운이 남는 영화 계속 생각하게된다  ,0,1,0
4774,2015.08.30,6,남자 셋이서 봤음 볼만해요 여자랑봤으면 9점줬을듯 ㅎ  ,0,1,0
4775,2015.08.30,1,설정에 빈틈이 너무많다내면을 사랑하는 게 주제지만 모순투성이.외국어는 유창하지만 외국어를 못알아듣는 것도뭣 같은 컨셉ㅋㅋㅋ꼭 못생긴배우나올때만 웃긴장면이 연출된다철저한 외모지상주의영화  ,0,1,0
4776,2015.08.30,9,관람객아이러브 한효주누구와도 케미 쩐다  ,0,1,0
4777,2015.08.30,10,보이지 않는 내면의 아름다움을 표현하는 영화에요 잔잔하게 이쁜 영화였어요  ,0,1,0
4778,2015.08.30,8,딱 8점 정도 영화 신선한 소재였고 뻔한스토리지만 재밌었음  ,0,1,0
4779,2015.08.30,1,아무리 로맨스 영화라 해도 스토리가 없음. 초반에는 재밌는 것 같았는데 후반부엔 이게 뭔 내용이야 생각밖에 안들었음. 영화비랑 시간 완전 아까움. 한마디로 재미 없다...  ,0,1,0
4780,2015.08.30,1,별로...재미가없네...  ,0,1,0
4781,2015.08.30,10,관람객좋았다 여운이 긴영화 ...헤어진지 얼마 안돼서 더 몰입해서 보게된듯  ,0,1,0
4782,2015.08.30,1,제목과 내용의 괴리...  ,0,1,0
4783,2015.08.30,7,관람객나는 그녀의 무엇을 사랑했던걸까?  ,0,1,0
4784,2015.08.30,10,그냥너랑봐서정말좋았다  ,0,1,0
4785,2015.08.30,8,관람객내 스탈 영화라 8점...ㅎㅎ  ,0,1,0
4786,2015.08.30,10,가볍게 본 로맨스.  참재미있게 봤습니다.  한효주 넘  사랑스러웠어요. 연인끼리 부부끼리 보면 좋을듯^^  ,0,1,0
4787,2015.08.30,10,처음으로 선보인 장르여서 몇가지 아쉬운점도 있지만 이정도 면 여자들이 재밌게보고 좋아할수 있는 영화 전 굉장히 재미있게봤습니다  ,0,1,0
4788,2015.08.30,10,관람객울게 만드는 먹먹한 영화  ,0,1,0
4789,2015.08.30,10,최고의 영화! 한효주씨가이렇게 연기잘하는줄은 몰랏네요  ,0,1,0
4790,2015.08.30,6,너무지루하다는 평이많은대 이정도면 평균 이상인거같다.커플이보기엔 사랑이 더 짙고 깊어질수있는거같고 솔로가봤다면 사랑을하고싶은 그런느낌? 현실적으로 불가능한 내용이지만 가볍게보기엔 영화전체적분위기도 아름답고 사랑하고싶어지는 영화  ,0,1,0
4791,2015.08.30,1,영화보지마세요 시간이랑돈아까움 진짜 뭐 이딴경우가 도중에나옴  ,0,1,0
4792,2015.08.30,10,초반 도입부 그렇다 가정하고 보니 영상미도 좋고 감성돋는 영회네요 오랜만에  ,0,1,0
4793,2015.08.30,10,저는 오히려 지루할 틈 없이 봤어요. 사랑에 대해서도 다시 생각하게 되었구 세상의 모든 소수자에게 보내는 위로같기도 하구..쨋든 너무 감명깊게 봤습니다  ,0,1,0
4794,2015.08.30,5,내 남편에게 더 잘해야겠단 생각 오징어로 보이기보단 더 멋있어보임  ,0,1,0
4795,2015.08.30,1,지루하다..시간이아깝다..보다뛰쳐나올뻔했다... 인내심많은사람만 보시오.. 왜안끝나는거야 를 5번도넘게 생각함....썸남하고 같이와서 나갈수도없고..  ,0,1,0
4796,2015.08.30,2,결국 외모에 따라 반응의 적극성이 차이가..또한 여주의 외모에 너무 치중  ,0,1,0
4797,2015.08.30,10,관람객재밋엇음 연애하고싶다..  ,0,1,0
4798,2015.08.30,10,올해 본 영화 중 가장 몰입하고 본 영화자신의 외모가 자신을 판단하는데 미치는 것과 여주인공관점에서 자신이 좋아하는것보다 타인의 시선에 대해 느끼는 포인트 그리고 개인적으로 느낀 점.또한 햇빛이 너무나 잘 이용해 찍은 영상미는 최고다!  ,0,1,0
4799,2015.08.30,10,너무 예뻐요~감성을 자극하네요  ,0,1,0
4800,2015.08.30,7,소재가 신선하고 좋아하는 배우들이 나와서 보러 갔는데 영상의 색감이나 분위기 자체는 좋았어요. 근데 주제에 비해 잘생긴 배우한테만 분량이 몰아진 느낌과 마지막 부분에서는 내용을 너무 질질 끈다는 생각이 들었네요. 그냥 편하게 보시기에 추천하는 영화  ,0,1,0
4801,2015.08.30,9,"관람객솔직히 공감은 안되지만, 재미있게본영화왜 주변에서 연애하고싶어지는 영화라는지 알겠음. 사랑하고 사랑받는 여자가 어떤모습인지 알게되는 영화  ",0,1,0
4802,2015.08.30,10,참 좋은 영화 ㅎㅎ 따듯한 영화~~  ,0,1,0
4803,2015.08.30,4,"관람객재미는 중간중간 있었지만,,,좋은건 다 잘생긴 사람과ㅎㅎㅎ 마지막 엔딩도 잘생긴 남자ㅎㅎ  ",0,1,0
4804,2015.08.30,6,"뷰티인사이드라더니 어디가 인사이드임?? 만남의 시작부터 첫잠자리, 프로포즈, 재회까지  매 중요한 순간마다 훈남이던데요.  CF감독이 만들어서인지 스토리는 없고 겉멋만 잔뜩 들어간 영화.  중딩조카는 재밌다고 하네요. ㅎㅎ  ",0,1,0
4805,2015.08.30,10,"관람객반가운 멜로 영화인데다  눈을 뗄 수 없는 영상, 보고나니 마음도 따뜻해진 좋은 영화.  ",0,1,0
4806,2015.08.30,10,난 존나재밌던데ㅌㅋㅋ굿굿.  ,0,1,0
4807,2015.08.30,10,진짜 재밌었는데 영화보지도않고 그냥 자기 악감정표출하는사람들 때문에 평점 낮게나오는것같다.  ,0,1,0
4808,2015.08.30,10,한국멜로 영화도 좋네요 여운이 많이 남아요  ,0,1,0
4809,2015.08.30,6,관람객잔잔하게 재미있엇어요  ,0,1,0
4810,2015.08.30,8,관람객아무생각없이보면 그럭저은의 영화겠지만 조금만 더 깊이 들여다보면 생각해볼게 많은  ,0,1,0
4811,2015.08.30,10,호불호는 강하겠지만 영화 전체적으로 깔끔하고 디자인적 요소가 강하네요 재밌게 봤습니다  ,0,1,0
4812,2015.08.30,8,관람객마지막은 진부하게 끝나지만 2시간이 길지 않게 느껴지는 영화 외모만이 전부가 아니라는 메시지가 있지만 연애할때는 배우들이 다 잘생겼다...  ,0,1,0
4813,2015.08.30,10,관람객영상미와 음악이 잘 어우러졌던 영화.보기에 아름다웠어요 :)  ,0,1,0
4814,2015.08.30,10,관람객정말 재미 있는 내용 이였어요안보신분들에게 꼭 추천해드리거 싶네여  ,0,1,0
4815,2015.08.30,10,재밌게 봤구요 오늘봤는데 재밌네요.. 근데무슨일인지..  ,0,1,0
4816,2015.08.30,10,오랜만에 괜찮았던영화  ,0,1,0
4817,2015.08.30,5,그냥... 눈호강한 느낌?  ,0,1,0
4818,2015.08.30,7,내면의 갈등을 이렇게 배제하고 CF만 찍다니..  ,0,1,0
4819,2015.08.30,10,관람객기억에 남는 대사가 많은거같아요....좋은영화네요  ,0,1,0
4820,2015.08.30,10,관람객진짜 이쁜영화! 애인들이랑 꼭 보세요  ,0,1,0
4821,2015.08.30,7,그냥 처음부터 끝까지 한효주만 본 영화.. 한효주는 진짜 예쁘다.. 다만 영화는 그저 그랬음 ㅠㅠ 한효주짱  ,0,1,0
4822,2015.08.30,1,한개도 아깝다 아이폰광고보는줄알앗다 내내 한마디요약노잼!!!!  ,0,1,0
4823,2015.08.30,10,나무가구를 보면서 느끼는 편안함 색다른 소재 깨알같은웃음거리 편안하게 보기좋은영화  ,0,1,0
4824,2015.08.30,5,잔잔한 감동을 느낄 수 있었다  ,0,1,0
4825,2015.08.30,8,남자인데 재미있게봤네요  ,0,1,0
4826,2015.08.30,9,"관람객웃다가 울다가 미소짓다.. 여러 감정들로 가득찼던 영화!스릴러, 액션, 호러만 좋아하는 남친도 볼만했다고 해서 다행! 좋았어요 정말♡  ",0,1,0
4827,2015.08.30,10,다들 왜 이렇게 평점을 낮게 주신건지...저만 재미있었던 건가요? 이상하네...  ,0,1,0
4828,2015.08.30,4,아니 그냥 눈뜨고 2시간 가만히 명상한 기분이였어요연예세포가 죽어있어서그런지 모르겠는데저는 다큐 보는줄 알았어요 ㅎㅎ결론은 한효주가이뻤고 이진욱 이동욱 잘생겼네요.이진욱 이동욱 오빠때문에 별 2개 드려요^^..솔로보지마세요.감정이입 1도안되요  ,0,1,0
4829,2015.08.30,8,관람객모순된 외모지상주의 영화. 내면의 중요성 어쩌고 하더니 애정씬은 잘생긴 배우랑만 나오고...  ,0,1,0
4830,2015.08.30,10,난 재밌었는데..?내가 이상한건가 근데 남주가 너무 시도때도 없이 바껴서 나도 한효주처럼 혼란스럽고 머리아프긴했음ㅋㅋ그래도 소재가 하도 신선해서 나름 재밌게본듯. 시간 낭비까진 아니고 그럭저럭 볼만해요~ 근데 진짜 천우희 연기 짱ㅠㅠㅠㅠ  ,0,1,0
4831,2015.08.30,10,오랜만에 좋은영화를 본것 같다 깨알 웃음포인트들과 영화이 참아름다웠다 오랜만에 영화보다가울었네  ,0,1,0
4832,2015.08.30,9,관람객굿 배우보는 재미도 내용도 좋았음  ,0,1,0
4833,2015.08.30,10,나만 되게 이상한가보다너무좋았다사랑을 해본사람이고 이별을 해본사람이면 느낄수있는그런 가슴아픈 애절한느낌...배우들이 이쁘고 멋있어서 더 빠져들수있었고감히 내 인생에 최고의 영화였다 말하고싶다..  ,0,1,0
4834,2015.08.30,8,재미는 있어요~~근데 키스신은 유연석 박서준 베드신은 이진욱...싸우는 씬마저 서강준ㅠㅠㅠㅠ뷰티아웃사이드  ,0,1,0
4835,2015.08.30,8,관람객그냥 아무생각없이 즐기기 좋음  ,0,1,0
4836,2015.08.30,7,관람객배우들이 넘 멋지네용*^^*  ,0,1,0
4837,2015.08.30,10,관람객베리굿베리베리베리굿  ,0,1,0
4838,2015.08.30,9,네가 어떤 모습이든 난 너를 사랑해. 우리가 하는 사랑에 대해 생각하게 하는 영화.  ,0,1,0
4839,2015.08.30,10,눈호강도 하고 많은 생각을 하게 만든영화같다!!! 최고ㅎㅎ  ,0,1,0
4840,2015.08.30,10,관람객이진욱이너무멋잇어요....후.. 아름답고 슬픈영화네요 !!♥  ,0,1,0
4841,2015.08.30,10,관람객몽환적이면서 완전 재밌었어요  ,0,1,0
4842,2015.08.30,1,지루하고...외모지상주의를 부추기는 영화라...내용면에서도 별로네요...좋은 소재를 잘못 연출한듯  ,0,1,0
4843,2015.08.30,8,관람객연인사이에 보면 참 좋은영화가될것같다  ,0,1,0
4844,2015.08.30,10,연인끼리 보기 좋은 영화 인것 같아요 저도 개봉전부터 기대했었는데 잔잔한 로멘스 영화 좋아하시면 딱 좋습니다. 중간에 코믹도 좀 있어여 극장에서 다같이 웃는 타이밍이 한 5~6번은 있었던거 같네요  ,0,1,0
4845,2015.08.30,8,음 난 로맨스 별로 안좋아하는 사람이지만 나름 재밌게 보고 왔는데 ..  ,0,1,0
4846,2015.08.30,10,마음이 아프기도 먹먹하기도 달달하기도 행복하기도했던 영화였어요♡♡  ,0,1,0
4847,2015.08.30,7,관람객잔잔한영화인거같다결국사람내면이중요하다는거같다  ,0,1,0
4848,2015.08.30,1, 지루한감 좀 있음  ㅇㅅㅇ  ,0,1,0
4849,2015.08.30,1,진짜 재미없음.너무 남자주인공이 바뀌어서 처음엔 정신없다가 나중엔 지루해짐.한효주도 카메라 의식하는듯한 연기.  순수한척 이쁜척.반하게 하려는것같은데 전혀... 얼굴 계속 클로즈업되서 부담스러웠다  ,0,1,0
4850,2015.08.30,10,관람객예고보고 재밌어보여서 봤는데 잔잔하니 괜찮게 봤어요  ,0,1,0
4851,2015.08.30,10,"원래 평점같은거안쓰는데 이영화는 분위기 자체가 따뜻하고아름답다 얼굴이 나날이 바뀌는 애인과 사랑하면서 힘드는것,서로간의갈등을 오랜시간이걸렸지만 끝내 소중함을알고 자신들만의 사랑을 이루는것 정말 내면의 아름다움을 잘느낄수있는영화였다 꼭들보시길  ",0,1,0
4852,2015.08.30,10,보고판단하길.연인이있다면 느끼지못하는것이 비정상이다.  ,0,1,0
4853,2015.08.30,1,영화가 한 입으로 두 말 하는 느낌.  사랑의 내면을 확인할 수 있는 이야기를 하고 싶다라는 감독의 의도가 좀 더  깊은 뜻을 담고 있을줄 알았는데.. 남주 캐릭터 특성상 겪는 어려움을 호소하다 미남의 상태에서 사랑을 확인하는 것으로 끝남.  ,0,1,0
4854,2015.08.30,10,가슴을 울리는 영화... 영화자체 분위기도 너무 좋고 슬프고 웃기고 감동적이고. 영화가 끝나고도 여운이 많이 남는 영화. 최고!  ,0,1,0
4855,2015.08.30,10,난 재밌었는데... 영화 잘 봤습니다  ,0,1,0
4856,2015.08.30,7,관람객연기자분들의연기도좋앗고 재밋엇습니다  ,0,1,0
4857,2015.08.30,10,오랜만에 몽글몽글 설레는영화  ,0,1,0
4858,2015.08.30,10,나름신선했고 재미도있었다.다양한 얼굴의 우진을 바라보는 이수의 연기도 만족스러웠고.... 코믹한 내용도 있어서 좋았고달달해지고싶은 영화였다.^^  ,0,1,0
4859,2015.08.30,8,살짝 아쉬운면이 있긴했지만 괜찮아요~  ,0,1,0
4860,2015.08.30,1,인물이 계속 바껴서 그 사랑이 아름다운건줄모르겠어요  ,0,1,0
4861,2015.08.31,10,지금막 보고 나왔어요. 느낌 좋은 영화네요. 한효주가 더 좋아지네요. 좋은 사랑 많이 해요  ,0,1,0
4862,2015.08.31,10,한효주가 정말 너무 이쁘게 나온다  ,0,1,0
4863,2015.08.31,5,"관람객니름 재밌었찌만 기대만큼은 못미침. 사랑을 정말로 해본사람은 재밌게볼만한 영화, 하지만 평점의 말대로 뷰티인사이드의 뜻 처럼 내면의 아름다움을 내새우기엔 외면적인게 너무 큼  ",0,1,0
4864,2015.08.31,10,믿고보는 한효주 굿이네요  ,0,1,0
4865,2015.08.31,1,외모 지상주의 그 이상도 이하도 아님  ,0,1,0
4866,2015.08.31,10,너무너무 잼있어요~~  ,0,1,0
4867,2015.08.31,8,관람객한효주보다이쁘다고안해주는남자친구는정말솔직하네여 왠지모르게눈물나는영화..  ,0,1,0
4868,2015.08.31,8,관람객소소한감동은 있지만... 끝이 좀 허무한느낌 ㅜㅜ  ,0,1,0
4869,2015.08.31,9,관람객기대안하고봤는데  진한 여운이 있는 영화에요  ,0,1,0
4870,2015.08.31,8,관람객사랑의 감정에 대해서 다시 생각해보는 스스로를 발견하게된다.  ,0,1,0
4871,2015.08.31,10,관람객기대안하고봤는데 소소하게 좋았어요 화면이 너무예쁘고 가구전공하는데 가구 많이볼수있어서 더 재밌었던것같아요ㅎㅎ  ,0,1,0
4872,2015.08.31,1,재밋다고한사람나와 ㅡㅡ아 개노잼  ,0,1,0
4873,2015.08.31,1,1점도 아깝다 10자10자  ,0,1,0
4874,2015.08.31,10,왜 나는 좋았는데 평점이 왜이래 다들  ,0,1,0
4875,2015.08.31,7,관람객부정적으로 보면 뷰티인사이드라는 제목과 안 맞게 미남배우에 초점이 맞춰져 있단 사실이 우습다. 하지만  그래도  신선한 소재와 영상미 정도만 볼 때 괜찮았다.  ,0,1,0
4876,2015.08.31,10,"관람객처음부터 엔딩까지 음악하나 배우들의 모습하나 색감도, 사소한것 하나도 특유의 잔잔한 분위기를 잘지키는것같아요  참 견고한것같아요. 내용도 신성하고 역할도 재밌고 참 예쁘고 느리고 좋네요 !  ",0,1,0
4877,2015.08.31,10,정말재미잇었어요. 강추!  ,0,1,0
4878,2015.08.31,8,기발한 소재를 아름다운 멜로로 승화시킨 영화에요. 또 보고 싶네요^^  ,0,1,0
4879,2015.08.31,7,관람객한효주이쁨 박서준머싯 재밌습니다  ,0,1,0
4880,2015.08.31,10,내 생에 최고의 영화..  ,0,1,0
4881,2015.08.31,6,관람객한효주의 미모가 빛을 뿜는 영화하지만 개인적으로 내용은...  ,0,1,0
4882,2015.08.31,10,되게 재밌네요 ㅎㅎ 추천하고 싶은 영화입니다  ,0,1,0
4883,2015.08.31,10,기대 안 하고 봤는데 정말 너무 좋았던 영화.. 두고두고 보고 싶은 영화  ,0,1,0
4884,2015.08.31,10,연출이 정말 좋다.생각했던 엔딩은 아니지만구성도 중간 중간 재밌고 무엇보다 한효주의 연기가 돋보인듯. 사람들과 함께 웃으며 볼수있었던 영화. 따뜻하다.  ,0,1,0
4885,2015.08.31,10,신선하고 재밌어요. 연애할때와 이별의 아픔들이 잘 전달되서 보는 내내 제가 연애하는 기분이었네요!  ,0,1,0
4886,2015.08.31,6,"눈시울을 붉히는 장면이 나왔을때, 잘생긴 배우들을 내세운다는걸 알곤 더이상 눈물이 나오지 않았고, 아름다움은 내면에 있다는 대사를 듣고 실소가 나왔으며, 같은 씬에서 못생긴 배우가 나왔을때 관객들이 이정도로 몰입할수 있을까를 생각하니 쓴웃음이 나왔다.  ",0,1,0
4887,2015.08.31,10,아무한테도 추천하기 싫은 나만의 영화  ,0,1,0
4888,2015.08.31,10,관람객정말 따뜻한영화..  최곱니다  ,0,1,0
4889,2015.08.31,10,영화 분위기도 색감도 배우들도 다 너무좋다  ,0,1,0
4890,2015.08.31,10,정말 잘 만들었다. 영화는 영화. 그렇지만 말하고자하는 메시지가 명확하고 잘 풀어내는 영화 !  ,0,1,0
4891,2015.08.31,7,스토리에 공감은 되지 않는다. 배우들 연기는 좋았다. 다만 여주가 좀 외모지상주의 같다는 생각이 드는건 어쩔수 없다.  ,0,1,0
4892,2015.08.31,10,아름답다 이쁘다 슬프다  ,0,1,0
4893,2015.08.31,10,저는 너무 재미있게 잘 봤습니다. 한효주씨도 너무예쁘고 .(별점테러하시는분들 이해불가 마땅한이유라면 납득이 가지만).다른배우분들의 연기도 훌륭해요 물론 내면의아름다움을 사랑하는 주제를 약간 비켜나가긴 하지만그래도 감수성터지게 잘봤습니다  ,0,1,0
4894,2015.08.31,8,한국에도 이런 영화가! 독특하고 아름다운 상상력이 두시간을 끌어간다. 배우들의 연기력과 영상미가 지루함을 덜한다. 다소 힘빠지는 결말이 아쉽다. 결코 밑도 끝도 없이 욕먹을 영화는 아님.  ,0,1,0
4895,2015.08.31,1,한효주는 맨날똑같은스타일의옷.머리.말투.. 영화느낌두~~  ,0,1,0
4896,2015.08.31,10,재밌었음 이하10자임  ,0,1,0
4897,2015.08.31,10,난 재미있엇다 ㅋㅋ 한효주도 예쁘고  ,0,1,0
4898,2015.08.31,10,개인적으로 영화관에서2번이상보고싶은영화 어제본것이지만 다시보고싶을정도로.. 오늘본판타스틱4보다는 뷰티인사이드 2번보는것이 더좋을것같단 생각이드네요      그나저나 한효주너무좋은데어떡해요  ,0,1,0
4899,2015.08.31,8,이영화가 늦가을이나 초겨울즈음에 개봉했다면 영화배경과 맞아서 더 좋았을텐데 그거하나 아쉽네요!  ,0,1,0
4900,2015.08.31,9,영화취향에따라 호불호가 많이 갈릴 스타일이지만 영화에서 말하고자하는것에대해 잘표현한것같아서 소재가 좀 비현실적이여도 재밌게봤어요 4년된남자친구랑 보러가서 더 몰입도 잘됐고 공감되는부분도많았고 하지만 중요장면에서 잘생긴배우만 나왔다는 지적에는 공감합니다  ,0,1,0
4901,2015.08.31,10,그냥 한효주가 나와서 좋았다  ,0,1,0
4902,2015.08.31,3,우에노 주리를 불러다가 뭐한짓거리야.!  ,0,1,0
4903,2015.08.31,10,관람객진째재밋음 이진욱나올때여자들환호하는 ㅠㅠㅠ  ,0,1,0
4904,2015.08.31,10,오랫만에 영화보고 감정따라서 울었던것같아요..힝ㅠㅜ  ,0,1,0
4905,2015.08.31,9,"관람객영상미가 아름답다. 한효주 이쁨 ㅋ,  ",0,1,0
4906,2015.08.31,8,새로운 시도치고 나름 괜찮은 전개. 무엇보다 영상미가 돋보여서 좋았음  ,0,1,0
4907,2015.08.31,1,왜 별1개인지 보면안다  ,0,1,0
4908,2015.08.31,7,관람객게스트 보러 갔다가... 울고나오는영화  ,0,1,0
4909,2015.08.31,1,영상미 하나는 장난아니게 아름다운데 좋은 소재로 이정도밖에 못만드나.. 진짜 지루해서 참느라 미치는줄 알았네.. 계속 시계만 몇번을 봤는지.. 오랜만에 본 쓰레기영화.. 이거볼바엔 차라리 미니언즈를 100번 보겠다  ,0,1,0
4910,2015.08.31,10,웃기기도했고 한효주랑 결혼하고싶다  ,0,1,0
4911,2015.08.31,7,관람객잘생긴 주연들은 너무 빨리지나가고 지루한면이 있음  ,0,1,0
4912,2015.08.31,10,정작 외적인 것만 중시한다고? 오히려 난 우리 의식을 제대로 반영한 설정이었다고 생각함 재밌었습니다  ,0,1,0
4913,2015.08.31,10,재미없다그래서기대안했는게꿀잼입니당  ,0,1,0
4914,2015.08.31,10,재미있었다. 두근두근  ,0,1,0
4915,2015.08.31,2,OOO 영화 관람객까지 장애로 만드는 영화 ..등장인물 계속 바뀌어 몰입 제로다..외모지상주의라는 이상한 느낌만 주는듯 남녀 사랑과 이별 공감 한부분 빼고 돈주고 보기는아깝다.. Dvd 나오면 보시길..  ,0,1,0
4916,2015.08.31,6,그럭저럭 쏘쏘 ... 가볍게 보고 즐기기 좋은 영화  ,0,1,0
4917,2015.08.31,7,"영상이나 모든 것이 정말 감각적! 판타지 멜로, 하지만 보편적 연애 감성을 말하고 싶어하는 영화?  원작도 찾아봐야지. ^^ 엔딩 영상은 좀 오글. 굳이... ㅎㅎ  ",0,1,0
4918,2015.08.31,1,별 하나도 아깝다가 정답이다....  ,0,1,0
4919,2015.08.31,8,관람객기대안하고봤는데 소재도 신선하고 연인끼리보기에도좋고 썸타는사이에도 보면 참 좋은영화네요~!  ,0,1,0
4920,2015.08.31,8,관람객생각했던거 보다는 노잼  ,0,1,0
4921,2015.08.31,7,전 좋았어요 후반부에 지루함이 없진 않았는데  ,0,1,0
4922,2015.08.31,9,관람객한배우마다맡은내면연기가좋았다 이우진이라는역할을모두다같은느낌으로다가오진않았지만 영화가보여주려는내용은보여서좋았다  ,0,1,0
4923,2015.08.31,9,계속 오래두고 보고 싶은 영화 중에 하나로 남을 것 같다  ,0,1,0
4924,2015.08.31,1,과평가. 밸런스 맞추기용.  ,0,1,0
4925,2015.08.31,1,볼가치가 없다 감정이입안됨  ,0,1,0
4926,2015.08.31,7,소재는 참신! 재미는 있는데 영화끝난 후 여주처럼 혼란스럽다 ㅋ  ,0,1,0
4927,2015.08.31,8,관람객재밌어요ㅠㅎ 이진욱은 진짜.. 대박  ,0,1,0
4928,2015.08.31,10,한효주 계속생각나네..난 개인적으로 김주혁나올때가 웰케 슬펐던거같냐  ,0,1,0
4929,2015.08.31,8,"스토리 괜찮고 따뜻한 영화, 한효주의 매력은 여전  ",0,1,0
4930,2015.08.31,10,그럼 중요한 순간에 못생긴 남자 등장시키면 공감대 형성이 됨? 이상한사람들이네요즘 나온 영화 중 제일 재밌었음뷰티>베테랑=암살>인사이드아웃>미션  ,0,1,0
4931,2015.08.31,10,전매우재밋고 잘봤는데 한효주도이뻣고 연기도좋았어요  ,0,1,0
4932,2015.08.31,10,관람객남자 혼자 봤습니다.... 연애 욕구가 폭발하더군요 좋았습니다 ㅋㅋ  ,0,1,0
4933,2015.08.31,9,개인적인 생각으론. 이 영화의 주인공인 우진은 여주인공인 이수를 좋아하는 사람입니다. 그런 사람에게 자신의 멋있고 잘생긴 모습만 보여주고 싶어하는것은 당연한것이 아닐까요? 저는 영화를 보는동안 잘생긴 배우들만 나온다는 생각이 들지 않았던 영화 입니다.  ,0,1,0
4934,2015.08.31,1,여주보는 순간 괜히 봤다하는..집중이 않되네요  ,0,1,0
4935,2015.08.31,1,잘생긴 배우들한테만 키스씬이나 중요한 대사들 집중적으로 넣어주고 아저씨나 할머니 등등 그 외 배우들은 그냥 들러리로 잠깐 나왔다 사라지는 영화...뷰티 인사이드라면서 철저히 뷰티 아웃사이드를 추구하는 모습을 보여주는 모순적인 영화  ,0,1,0
4936,2015.08.31,10,간만에 여운 남았던 영화...  ,0,1,0
4937,2015.08.31,4,두사부일체2때가 리즈시절이군  ,0,1,0
4938,2015.08.31,1,보다가 잠든 몇 안되는 영화. ㅎㅎ 독특한 소재 빼곤 볼거 없는 영화. 게다가 소재도 그다지 잘 살리지 못함. 이건 뭐 개연성도 없고 판타지도 아니고 애매모호 하네. 높은 평점은 알바인듯 ㅋ  ,0,1,0
4939,2015.08.31,4,창피하다  근데 다들 연기는 잘하더라  ,0,1,0
4940,2015.08.31,5,관람객마지막이아름다운영화  ,0,1,0
