index,time,score,reple,1st_week,2st_week,3st_week
2088,2016.04.17,10,여자친구와 방금 보고나와서 후기 적습니다정말 재밌게 봤어요!!! 꼭보세요!!!  ,1,0,0
2089,2016.04.17,5,저 아래말대로 관객들이 어이없어서 다같이 웃은영화..스토리 연출 넘 어색하고 납득안가는 상황들 여럿나옴배우외모 보는맛은 있으니 5점 줌..  ,1,0,0
2090,2016.04.17,1,미친핵노잼 걍 핵노쟘이자누 ㅠㅠ  ,1,0,0
2091,2016.04.17,8,관람객나름재밋었어요 임수정 이쁘다  ,1,0,0
2092,2016.04.17,9,관람객 스토리도 좋고 배우들연기도 좋네요. 스릴러지만 멜로느낌도나구요.  ,1,0,0
2093,2016.04.17,10,관람객비교적 재밌고 잘 만든 영화  ,1,0,0
2094,2016.04.17,10,볼만했네요 시그널비슷한데 좀 아쉬워요 딱 8.0수준  ,1,0,0
2095,2016.04.17,7,관람객졸잼!!!감동!!이진욱 역시나 넘나 멋있는것..!  ,1,0,0
2096,2016.04.17,8,관람객이진욱은역시키스씬이죠  ,1,0,0
2097,2016.04.17,9,주인공들 연기는 좀 어색하지만 볼만하네 ㅋㄱ 시그널따라한거같지만  ,1,0,0
2098,2016.04.17,1,진심 돈 아깝다 보지마라  ,1,0,0
2099,2016.04.17,3,좀비영화 스릴굿10자  ,1,0,0
2100,2016.04.17,5,관람객좀비다 좀비가 나타났다  ,1,0,0
2101,2016.04.17,10,진짜 재밌음 내가 타임물을 좋아해서 일지도 모르겠지만 조정석의 희생으로 그 강승범과 부인이 행복해져서 좋았음 이진욱 역시 연기 잘하고 임수정 너무 좋음  ,1,0,0
2102,2016.04.17,1,관람객재미없어요 전개가 조잡해요  ,1,0,0
2103,2016.04.17,9,관람객내용도 좋고 연기력도 짱!!  ,1,0,0
2104,2016.04.17,9,재밌게 봤네요.배우들 다 좋네요~  ,1,0,0
2105,2016.04.17,10,처음보는영화다  감동적인영화인거같다  ,1,0,0
2106,2016.04.17,1,생물쌤을 위한 영화왕소심으로 인한 삐침그리고 살인그리고 좀비화세상에 고층에서 떨어졌는데 바로 뛰어올라옴  ,1,0,0
2107,2016.04.17,9,관람객재미써요~~~ㅎㅎㅋㅋ  ,1,0,0
2108,2016.04.17,9,"몰입도 긴장감 좋아요, 약간오글거려서 1점뺌  ",1,0,0
2109,2016.04.17,5,관람객이 세 배우를 이렇게 사용하다니ㅠㅠ 넘 아쉬움ㅠㅠ  ,1,0,0
2110,2016.04.17,10,관람객드라마 시그널본거같은기분..너무좋았어요배우들연기도 좋고 눈호강..  ,1,0,0
2111,2016.04.17,7,관람객뭔가 시그널같았지만 재밌  ,1,0,0
2112,2016.04.17,8,관람객어렵고 낯선 이야기를 잘 풀어나가고 잘 찍은 영화라서 보는 내내 몰입했던 것 같아요. 범인이 좀 약해서 그렇지만 배우들의 연기력으로 이를 메워나간 것 같아요.좋았어요. 대박나기를~~~  ,1,0,0
2113,2016.04.17,7,"타임워프, 타임슬립 이런 영화 좋아하는데 스토리가 살짝 아쉬운 부분도 있지만 나름 잼있게 봤습니다. 시그널보다 먼저 찍었는데 늦게 개봉되서 자꾸 비교되는게 좀 아쉽네요.  ",1,0,0
2114,2016.04.17,4,관람객뭔가 여러 내용을 짬뽕한 영화  ,1,0,0
2115,2016.04.17,4,관람객뭔가 여러 내용을 짬뽕한 영화  ,1,0,0
2116,2016.04.17,10,관람객기대했던것보다 훨씬 재밌게봤습니다~~  ,1,0,0
2117,2016.04.17,1,시간약탈자. 엉성한 설정 탓에 중간중간 개연성이 떨어진다. 마지막 장면을 위해 억지로 끼워 맞춘 듯한 기분. 이런 구시대적 연출이 아직도 존재한다는 게 놀랍다.  ,1,0,0
2118,2016.04.17,10,관람객조정석이 너무 멋있게 나와서 잼있게 봤어요^^  ,1,0,0
2119,2016.04.17,10,범인선생이랑 조정석이랑 실랑이 벌이다가 도망갈때 체육복 입고 있었고 통에다가 칼 버리러 갈때도 체육복이었는대 그모인 사람중에 체육복 입은 교사를 못찾을수가 없음  ,1,0,0
2120,2016.04.17,1,먼 이딴영화가..  시그널따라하다  개망햇네 아  짱나 드릅게 잼없네   댓글알바에  속지말자  ,1,0,0
2121,2016.04.17,4,과거를 바꾸고 나니 나는 직업을 잃었다  ,1,0,0
2122,2016.04.17,10,관람객넘나 재밌는 것!!! ㅋㅋ  ,1,0,0
2123,2016.04.17,10,정말 최고의 영화입니다 이렇게 재밌고 스토리가 정말 완벽하고 연기도 짱이예요 후회하지 않을꺼예요!!! 진짜 재밌어요ㅠ  ,1,0,0
2124,2016.04.17,9,먼저 제작했어도 이미 시청한 시그널을 떠올리게 하는건 어쩔 수 없다. 글치만 큰 기대없이 보다가 몰입하면서 봤다는. 무엇보다도 눈호강ㅎㅎ  ,1,0,0
2125,2016.04.17,5,관람객너무 판타지 처럼 전개되지 않았나싶습니다그래도 잘봤네여^^  ,1,0,0
2126,2016.04.17,1,무슨 생각으로 시나리오 짠건지 모르겠음. 장르가 불분명한건 둘째치고 아예 개연성이 없음  ,1,0,0
2127,2016.04.17,1,영화의 몰입을 방해하는 곳곳의 요소들....  아.... 영화보다 욕했슴 ㅠㅠ  ,1,0,0
2128,2016.04.17,2,장르 이탈함ㅋㅋㅋ 판타지+스릴러+멜로+좀비물이 다 섞여있음 . 배우들이아깝다. 스토리전개가 개연성이 없고 좀 끊기는 느낌이다. 오글거리는장면도 좀 있고 .... 연출이별루다  ,1,0,0
2129,2016.04.17,9,이진욱 너무 멋져요!!!ㅠㅠ  ,1,0,0
2130,2016.04.17,10,재밌습니다 엔딩이 특히 맘에드네요 여자친구랑 봤는데 둘다 만족했네요  ,1,0,0
2131,2016.04.17,1,"스토리 흐름, 개연성, 연기력 어느하나 만족스럽지 않네요. 기대 별로 안하고 갔는데도 충격받았네요. 참을수 없어 처음으로 영화평 남깁니다. 이런 영화 연기하느라 연기자분들 참 힘들었겠습니다.  ",1,0,0
2132,2016.04.17,1,이런 영화를 돈주고 본 제가 바보같아서 저같이 시간을 낭비하는 피해자가 생기면 안되겠기에 글 남겨요. 제 인생에 이토록이나 최악인 영화가 있었나 싶을정도구요ㅋ 영화를 보는 내내 이건 코미디인가 싶었고 정말 스토리 연기 개연성 cg 모두 개판입니다.  ,1,0,0
2133,2016.04.17,8,관람객정말 재미있었어요 간만에 본 영화라 재미있었고 내용도 재미있네요 후반에 전개가 갑자기 빨라지는게 좀 아쉬워요 아 그리고 좋은사람이랑 봐서 더좋은 영화였던것같아요  ,1,0,0
2134,2016.04.17,5,관람객중간부터 갑자기 전개가 억지로 마무리 지으려고 껴맞추는 느낌이 들었지만조정석 연기는 좋았음!  ,1,0,0
2135,2016.04.17,7,관람객음 ...  기대는 안했지만..기대이상으로 스릴재미 있었어요연출 시나리오도 잘썼다 느끼며 끝까지 숨죽이며 봤는데분명해피엔딩인데 어딘가 찜찜한 이 기분은 어쩔수가 없드라구요..  전체적인평점은 8점가까이..  ,1,0,0
2136,2016.04.17,10,관람객근래 본 영화중 가장 괜찮고 집중되는 영화얐습니다!  ,1,0,0
2137,2016.04.17,8,관람객해피엔딩인듯한 새드엔딩  ,1,0,0
2138,2016.04.17,10,평론가랍씨고 깝치며 평점 야박하게 주는 한국*들 보면 가소롭다.  그 넘들이 말하는 9점대 이상의 영화는 만들지도 못하는 주제에..이 정도면 한국영화수준에서 8점대 이상을 줘도 손색없다  ,1,0,0
2139,2016.04.17,10,내 인생은 시간이탈자를 보기 전과 본 후로 나누어 진다.내 인생의 나침반은 아직 흔들리는 중이다.  ,1,0,0
2140,2016.04.17,1,진짜 개꿀잼이다 나만보기아깝다 두번봅시다여러분  ,1,0,0
2141,2016.04.17,10,오늘 보고 왔는데 진심 스릴있고 배우분들이 연기를 너무 잘 해주셔서 몰입해서 볼 수 있었어요!  ,1,0,0
2142,2016.04.17,8,관람객너무 재밌는데 조금 시간을 끄는 부분도 있었지만 그래도 시간가는줄모르고 봤습니다!!  ,1,0,0
2143,2016.04.17,5,관람객그저그랬엇는데요재밌긴해여  ,1,0,0
2144,2016.04.17,7,관람객별로 별로 별로 별로 별로  ,1,0,0
2145,2016.04.17,9,관람객너무 너무 재미있게봤습니다  ,1,0,0
2146,2016.04.17,1,이건 머 장난하는 것도아니고. 조선마술사랑 비슷한 수준입니다. 한마디로 OOO기.  ,1,0,0
2147,2016.04.17,10,원래 타입슬립소재를 좋아해서 그런지 정말재밌게 봤고 또 보고싶네요. 호불호는 갈리는듯하지만 저는 좋음  ,1,0,0
2148,2016.04.17,7,관람객잘봤어요 연기들다잘하고 재밌어요  ,1,0,0
2149,2016.04.17,7,관람객아무생각없이 봣는데 은근 잼  ,1,0,0
2150,2016.04.17,8,"시그널,나인과 많이 닮아있는 영화. 무언가 예상되는 반전이지만 그래도 나름 재미있게 봤습니다  ",1,0,0
2151,2016.04.17,9,마지막 옥상씬 조정석 얼굴 하얀 메이크업 문희준인줄..  ,1,0,0
2152,2016.04.17,10,관람객시간가는줄모르고봣어요~~추천추천 ㅋㅋㅋ  ,1,0,0
2153,2016.04.17,6,나름 스릴있고 긴장감있게 전개가 되지만 스토리상 허점이 많아 몰입도가 떨어진다. 그런 부분을 어느정도 감안하고 보면 킬링타임용으로 나쁘지 않은 듯.  ,1,0,0
2154,2016.04.17,2,내용 연개성이 엉망 기대했는데 실망이네요...  ,1,0,0
2155,2016.04.17,6,범인  hp만렙찍었네숨바꼭질이래 첨보는 범인의 미친체력  ,1,0,0
2156,2016.04.17,10,결말이 맘에 듭니다요요  ,1,0,0
2157,2016.04.17,10,이진욱 멋있당 하핳 나인생각나요  ,1,0,0
2158,2016.04.17,10,재미있어요 조정석 열연! 시그널느낌이 나긴했지만 그래도 넘나재미있는것  ,1,0,0
2159,2016.04.17,8,관람객재미있음. 나도 교사하고 싶다  ,1,0,0
2160,2016.04.17,9,관람객재밌어요 엔딩이맘에듭니다.  ,1,0,0
2161,2016.04.17,7,관람객생각보다 스릴있고 잼났던 영화  ,1,0,0
2162,2016.04.17,10,관람객기대보다 좋았음. 생각보다 괜찮음  ,1,0,0
2163,2016.04.17,6,스토리 유기성이 터무니 없다  ,1,0,0
2164,2016.04.17,10,관람객스토리정말탄탄하고재밌음  ,1,0,0
2165,2016.04.17,10,저는 진짜 재미있게 봤어요!!  시간이 금방갔어요!  ,1,0,0
2166,2016.04.17,1,알바가 왜케 많지...소재는 나쁘지 않은데 연출을 어떻게한건지 그 좋은 배우들의 연기가 다 못봐주겠던데  ,1,0,0
2167,2016.04.17,8,저지금 보고나오는길입니다 기대안하고봤는데 재밌게봤어요 시그널과 비교하지마시고 보시면 될듯ㅡ  ,1,0,0
2168,2016.04.17,10,이렇게 재미있는액션영화는 첨인듯..보는내내 배우들에 스릴있는연기력에 긴장을놓치지 않고 봤음 스토리도굿!  ,1,0,0
2169,2016.04.17,10,관람객약간 오글거리기도하지만 잼나염~  ,1,0,0
2170,2016.04.17,6,관람객그저그랫다 식상한듯 시그널보는느낌  ,1,0,0
2171,2016.04.17,10,저는 처음부터 끝까지 완전 재밌었어요 긴장되고 두 손 깍지 끼며 집중해서 봤어요 배우님들 모두 연기를 잘 하셔서 더 긴장감있었고 재밌었어요 영화가 끝난지도 모르게 시간이 빨리 흘러간거 같아요 저는 시간로프를 좋아해서요 더 재밌던거 같아요  ,1,0,0
2172,2016.04.17,10,진심 기대안하고봤는데 진짜 재밌었음ㅋㅋㅋ 스릴도 있고 지루하지않고 내내 재밌게 봤습니다 이진욱 화이팅!!  ,1,0,0
2173,2016.04.17,10,시간 가는줄 모르고 봤음 한장르만 파는 매니아들분만 아니면 매우 재밌을듯  ,1,0,0
2174,2016.04.17,4,좀비 영화인가....? 말하고자 하는게 뭔지 모르겠다.  ,1,0,0
2175,2016.04.17,9,스릴 넘치고 집중시키는 연출이기는 하지만 스토리 개연성이 다소 떨어지고 허술함  ,1,0,0
2176,2016.04.17,7,. 초중반 지루항  자리이탈자 속출  . .  후반부 이것저것많은것을 넣으려한거같긴함. . 반전 액션 감동 등등 . . 그러나 조금허접  ,1,0,0
2177,2016.04.17,10,간만에 영화 심장 쫄깃하게 잘 봤네요 조정석 연기 존잘하고 이진욱 존잘생...  ,1,0,0
2178,2016.04.17,10,어쩌다 두번 보게 됐는데 첨엔 스토리 촘촘하고 좋은데 마지막 급마무리 느낌이었으나 두번째 보고나니 마지막이 감동이었음ㅠ 첨에 안나던 눈물까지....처음 볼때 막봤나봄ㅠ 두번 같이 본 혈육도 똑같이 느끼고 감동함ㅠ  ,1,0,0
2179,2016.04.17,8,관람객시그널이랑 비슷했지만 재밌었습니다.  ,1,0,0
2180,2016.04.17,8,"생각보다 나름 재밌었어요~ 하지만 스토리가 억지스러운 부분이 좀 있었어요....추락과 염산, 그리고 스포츠카 ㅋㅋㅋㅋ 근데 다른부분은 예상과는 달리 신선했고 스릴만점이여서 8점줍니당  ",1,0,0
2181,2016.04.17,1,별점 알바 그만 설쳐라.. 영화 보는 중에 극장이탈자가 꽤 나왔다는것만 기억하시면 될듯합니다. 저 배우들을 데리고 발연기 시킨 감독이 죽일놈이야...  ,1,0,0
2182,2016.04.17,8,관람객재밋음 근데무서웡ㅠㅠㅠ  ,1,0,0
2183,2016.04.17,9,대사의 오글거림은 있었지만 기대보다 재미 있었움  ,1,0,0
2184,2016.04.17,8,기대 않고 봤는데 재밌게 봤네요심장도 쫄깃~^^  ,1,0,0
2185,2016.04.17,1,ㅋㅋ 보고 웃었다 OO  작작 해라 알바들아  ,1,0,0
2186,2016.04.17,1,관람객입니다..시그널이랑 비교하지마세요시그널은 무슨ㅡㅡ정말 최악..중간에 조금 스릴있였던것 빼고멜로도아니고 허접한 시간여행보고나서 든 생각은 기분만 안좋아졌음  ,1,0,0
2187,2016.04.17,1,"수준낮은 우리나라 영화수준.. 맨날 칼로 쑤시고, 골목 뛰댕기고 끝. 수준낮은 게이비오 개빠따 돼지야구도 마찬가지.. 공통점은 수준낮고, 개노잼이고, 관중수 조작에 댓글부대로 조작 한다는점.  ",1,0,0
2188,2016.04.17,8,관람객재밋네요 ㅋㅋ내용도 신박하고 ㅋㅋ재밋엇습니다 짱짱  ,1,0,0
2189,2016.04.17,3,범인 좀비임.  절대 안죽음.  결국 벼락 떨어뜨려 주김.  내 멘탈도 쥬금 ㅠㅠㅠㅠ  ,1,0,0
2190,2016.04.17,1,로그인하게 만든 영홬ㅋ  ,1,0,0
2191,2016.04.17,8,관람객재미있긴한데...비슷한내용이..있네요..흥미롭지는 않은듯?  ,1,0,0
2192,2016.04.17,10,시그널본 사람은 재미없다는 이야기를 들은것과 달리 너무 재밌게봤어요~~ 언니랑 추리하면서 보는데 소름... ㅋㅋ 나증에 또 봐야겠어요  ,1,0,0
2193,2016.04.17,7,볼만은 하지만 보라고 추천은 못하겠는 영화  ,1,0,0
2194,2016.04.17,10,연기들이 다 좋았어요!  ,1,0,0
2195,2016.04.17,10,재미없단 글이 있어서 좀 걱정했는데 재밌었어요!  ,1,0,0
2196,2016.04.17,9,관람객생각했던 것보다 재미가 있었음  ,1,0,0
2197,2016.04.17,6,스토리가 약해ㅜㅜㅜㅜ  ,1,0,0
2198,2016.04.17,1,뒤죽박죽내용 이진욱발연기  ,1,0,0
2199,2016.04.17,9,시간 가는 줄 모르고 재밌게 봤습니다.  ,1,0,0
2200,2016.04.17,7,"방금 보고 나왔는데, 생각 보단 재밌음. 돈 아깝진 않음  ",1,0,0
2201,2016.04.17,10,관람객굿 재밌어요 ㅎㅎㅎ!!  ,1,0,0
2202,2016.04.17,1,억지 보는 내내 한숨만 나옴  ,1,0,0
2203,2016.04.17,9,사랑하는 연인과 함께 본다면 서로의 사랑을 더 끈끈하게 만들어줄 영화같네요. 시간을 초월한 두 남녀의 사랑이야기 뻔한 이야기임에도 끝에서는 저도 고운 눈물을 머금었었네요. 사랑의 감정이 메마르신 분들에게 시간이탈자 추천합니다  ,1,0,0
2204,2016.04.17,9,관람객조정석이랑 이진욱이랑 연기잘함  ,1,0,0
2205,2016.04.17,10,생각보다 탄탄한 스토리와 초긴장되서어 마지막 끝날때까지 초집중하며 봤음. 나름 여운이 남는 괜찮게 볼만한 영화였다  ,1,0,0
2206,2016.04.17,10,완전재밋게봣어용ㄱㅋㅋ최고최고  완전몰입해서곰ㅋㅋ  ,1,0,0
2207,2016.04.17,1,"스토리, 연기, cg가 너무 부조화스럽게 잘 어울러저있다. 30년 전에 만들었다고 해도 충분히 믿을만한 개연성과 스토리. 내가 시간을 이탈한것 같구나!  ",1,0,0
2208,2016.04.17,8,관람객시그널 느낌. 재미있게봤습니다연기 다들 너무 잘함  ,1,0,0
2209,2016.04.17,8,재밋드라 아쉽다면 살인마가 너무 질겨 안죽대  ,1,0,0
2210,2016.04.17,5,그냥 팝콘무비. 자막 올라갈때 곽재용 감독님이 연출했다고 해서 좀 놀랐어요. 장르가 안 맞았나봐요  ,1,0,0
2211,2016.04.17,10,진짜 리뷰 처음써봄 ㅠㅠ 엄청 재밌음 진짜 완전 굳굳 ^^  ,1,0,0
2212,2016.04.17,8,지루하지도 않았고 연기도 좋았고 너무 많은걸 기대하지 않는다면 재밌게 볼 수있을듯.  ,1,0,0
2213,2016.04.17,7,관람객뭔가 여러 장르가 섞여있는 느낌  ,1,0,0
2214,2016.04.17,7,관람객재미있게 봤습니다조정석씨의 엄지척!  ,1,0,0
2215,2016.04.17,8,조정석의 연기를 보다 보면 어느새 부턴가 영화에 몰입하게 된다. 범인이 범죄를 저지른 이유에 대해 큰 생각을 갖지 않고 본다면 스토리가 탄탄하다. 깜짝 놀라는 장면이 하나 있다. 연인과 손잡고 보기 좋은 영화  ,1,0,0
2216,2016.04.17,10,영화를보는 내내 시나리오가 너무좋았고 적절한긴장감이 있었고 영화를본 후 여운이 오래남는 영화였다  ,1,0,0
2217,2016.04.17,10,재밌어요조정석연기짱  ,1,0,0
2218,2016.04.17,8,관람객이진욱은 10점이네요  ,1,0,0
2219,2016.04.17,7,관람객기대없이봤는데 긴장감넘치고 색다른 주제여서 재밌게봤어요!!!!  ,1,0,0
2220,2016.04.17,10,생각보다 평점이 낮아서 걱정했는데완전 재밌습니다 16년도 본 영화중에 제일 몰입도  ,1,0,0
2221,2016.04.17,7,관람객재밌는데 상상스릴이네요  ,1,0,0
2222,2016.04.17,9,관람객정말 재미있게봤습니다  ,1,0,0
2223,2016.04.17,9,너무 뻔하지 않고 스릴있고 너무 유치하지않고 스토리구성있고 재밌어요  ,1,0,0
2224,2016.04.17,9,관람객감샤합니다재밋엇어요  ,1,0,0
2225,2016.04.17,10,누구나오는지도모르고봤는데 이진욱이랑 임수정 조정석나오고 재밌게보고왔음 꿀잼인데 마지막결말훈훈해서더좋음  ,1,0,0
2226,2016.04.17,9,관람객재미있게 잘봤어요~~  ,1,0,0
2227,2016.04.17,10,관람객약간 이해안가는 부분도 잇긴햇는데 괜찮앗어요! 슬프기도하고ㅜㅜ  ,1,0,0
2228,2016.04.17,8,관람객볼만하네여!!! 스마~트폰! 빵터졌어요 뭔가 시그널같다는 느낌이 있었지만 재밌게 잘 봤어용 ㅎㅎ  ,1,0,0
2229,2016.04.17,10,관람객중간 슬펐는데 마지막은 해피엔딩~  ,1,0,0
2230,2016.04.17,7,볼만하긴한데 이진욱 연기가 안좋음  ,1,0,0
2231,2016.04.17,8,전체적으로괜찮은데이진욱표정이매사에진지해서연기가엉성해보였고일부러괜개들답답하라고그렇게만든거일수도있는데사람을죽인범인을일단먼저따라가잡든가죽이든가해야되는거아님?경찰이..후..나름볼만했음범인찾기힘들었어  ,1,0,0
2232,2016.04.17,3,혹시나 역시나 시 그 널 극 장 판  ,1,0,0
2233,2016.04.17,8,등에 총자국 나만 기다렸니....?  ,1,0,0
2234,2016.04.17,8,이진욱의 어설픈 연기로 영화가 빛을 발하다 말다 할때마다 조정석과 임수정이 살린 영화. 액션과 판타지멜로가 잘 섞인 영화다  ,1,0,0
2235,2016.04.17,8,재밌었어요. 현실과 과거를 오가는 짜릿한 내용이 손에 땀을 쥐게 했어요. 썸남 남자친구랑 보기에 좋은 영화에요  ,1,0,0
2236,2016.04.17,8,관람객8.5점 드리겠소. 볼만했소  ,1,0,0
2237,2016.04.17,10,시그널이랑 비슷한부분이 많긴 하지만.재미잇었어요!!  ,1,0,0
2238,2016.04.17,3,시그널생각남시그널 전에 나왓음 참신한 스토리  ,1,0,0
2239,2016.04.17,10,배우들도 너무 맘에들고 내용도 긴장되면서 너무재미있게봤어요~~  ,1,0,0
2240,2016.04.17,9,스토리에 긴장감도 있고 저는 재밌게 봤어요^^  ,1,0,0
2241,2016.04.17,10,와.. 진짜 재밌더라.. 역시 영화는 평점 믿고 보면 안되..  ,1,0,0
2242,2016.04.17,10,솔직히 재미는 있지 않았나? 보는 내내 눈을 뗄 수가 없던데;;  ,1,0,0
2243,2016.04.17,10,나랑 내친구랑 둘다 넘 재미있게 본 영화~!! 평이 안좋은건 사람들이너무 기대해서 그런듯  ,1,0,0
2244,2016.04.17,8,관람객재밌고왔다갔다거리는데도헷갈리지않고좋았습니다  ,1,0,0
2245,2016.04.17,10,몰입도가 좋아 끝날때까지 집중ㅋㅋㅋ 화장실도 참고 봤어  ,1,0,0
2246,2016.04.17,9,"관람객장면들이 아름다웠어요옹! 뻔한 시간여행 소재였지만, 영화를 다 보고 난 다음에는 감성의 감동이 남네요!  ",1,0,0
2247,2016.04.17,8,관람객피곤한상태로가서 잘잤음  ,1,0,0
2248,2016.04.17,10,이건무조건봐야한다..2016년영화들다재밌다ㄷ  ,1,0,0
2249,2016.04.17,10,와~ 지금까지 이런저런 대작들도 많이 봤지만 스토리가 끝까지 지루하지않고 긴장감 넘치고 엔딩까지 너무 잘 짜여진 영화는 처음이였음!!! 마지막까지 허전하지 않고 꽉찬 스토리와 영상미까지~ 굿굿  ,1,0,0
2250,2016.04.17,7,"몰입도는 있는편, 개연성이 좀 많이 떨어짐..단순 스릴러인줄 알았는데 뜻밖의 공포영화...하지만 내 심장을 쥐어짰으니까 7점  ",1,0,0
2251,2016.04.18,6,예고편도보지않고  시그널같은느낌이아닐까. 내심기대하고본영화.예상과달리  한마디로말하자면  ..칼부리영화 . 보는내내 슬픈것보다 잔인해서오는 스트레스로인해 찝찝할따름..호불호가 갈리겠다  ,1,0,0
2252,2016.04.18,10,이거 너무 재밌는데 홍보같은게 잘안되는느낌? 에스엔에스에서는 그냥 그렇다고 그러는데 개인적으로 너무 재밌었음 따스한감성도있고 쿵쾅거리는 스릴도있고 암튼 개인적으로 너무재미있었고 끝날때까지 집중해서봄 남들이 재미없다고 해서 안보지마시고 꼭 보시길!!강추  ,1,0,0
2253,2016.04.18,10,관람객이진욱존잘임....  ,1,0,0
2254,2016.04.18,10,관람객가나다라마바사아잦ㄱㅈㄱㄴ  ,1,0,0
2255,2016.04.18,10,기대없이 갔는데 재밌게 보았어요. 무엇보다 이진욱 님 짱..  ,1,0,0
2256,2016.04.18,10,관람객영화잘만들었넹ㅋㅋ이진욱 조정석 멋있다  ,1,0,0
2257,2016.04.18,9,관람객범인의 비중이 너무 없는듯.. 그래도 맘족스러운 영화  ,1,0,0
2258,2016.04.18,4,관람객숨가쁜 이야기를 감독의 올드한 연출한 망쳐놓는다.  ,1,0,0
2259,2016.04.18,7,생물선생은 좀비가 틀림없다  ,1,0,0
2260,2016.04.18,3,스크린쿼터랑 배급사독점좀 갈아엎든가 매번 똥을 싸놔도 좋다고 그거 먹겠다는 스캇매니아들만 늘어나니ㅉㅉ...그래놓고는 한국영화는 왜 헐리웃처럼 못만드냐면서 헛소리들을 해요  ,1,0,0
2261,2016.04.18,10,개봉전부터 예고편보고 꼭 보고싶었는데. . 역시 재밌네요. 영화보면서 드라마 시그널이 ㅎㅎ  ,1,0,0
2262,2016.04.18,4,시그널과 너무 비교됨 어설픈 꼬임에 헛웃음이... 어거지 좀비살인마에 갑자기 호러물;; 요즘은 싸이코패스 때문에 살인 동기부여도 대충 떤지면 다되네 그리고 정배도 늙으면 아내도 늙어야지 어상 형사는 이진욱인데 고생은 조정석이 다함 이진욱만 잘생김 끗  ,1,0,0
2263,2016.04.18,6,"딱 6점. 그 이상도 이하도 아님. 타임슬립, 스릴러 엄청 좋아해서 많은 기대를 안고 본 이상.. 허술한 구성과 뭔지모를 오그라드는 발연기, 억지 상황설정에 실망했지만.. 그래도 뭔가 이것저것 해보려 노력한건 보였음.. 그냥 볼만함.  ",1,0,0
2264,2016.04.18,10,솔직히 말해서 전 진짜 소름 계속 돋히면서 재밌게 봣어요 알바?? .. 그냥 진짜 명작이라고 생각하는데 여태 봣던것중에 최고에요 진짜 평점이나 후기 믿으면 안될듯 사람이 직접 보고 판단 해야될거같아요 진짜 추천 할게요 장르 이탈? 전혀 ㅋㅋ 추천이요ㅎ  ,1,0,0
2265,2016.04.18,2,아..좀전에 보고 왔는데..완전 실망.스토리를 어찌 저렇게.좋은 배우들 데리고 ㅠ  ,1,0,0
2266,2016.04.18,1,내가 영화보고 처음으로 평점 써본다평점 10점 준사람 명치를 때리고싶다 이런것도 영화라고 만들고 돈주고 본 사람들이 불쌍하지 ㅋㅋ 이거 볼 사람들은 절대 보지말도록... 진짜 노답인 영화  ,1,0,0
2267,2016.04.18,8,아무기대를 하지않고 봐서 그런지 모르겠지만 영화자체는 나름 재미있었다. 과거와 현재를 왔다갔다하면서 진행되는 스릴러적인 요소가 나름 긴장감있었고 카메라 앵글 등 감성적으로 잘 풀어낸것같다. 다만 개연성이 없어서 좀만 더 현실적으로 만들었으면..했다  ,1,0,0
2268,2016.04.18,7,임수정은 예쁘다 이진욱은 진짜.... ㅎㅎ 눈찌푸리는 표정 너무지겹다 ㅎㅎ 조정석은 선방 곽재용의 여배우 이쁘게 만드는 능력은 최고!!  ,1,0,0
2269,2016.04.18,10,아무 생각없이 봤는데 생각보다 숨막히는 전개 그리고 감동!  ,1,0,0
2270,2016.04.18,10,재미있었어요..  ㅎㅎ돈이 하나도 아깝지 않네요  ,1,0,0
2271,2016.04.18,5,곽재용 연출력의한계를보이는거같은데..  ,1,0,0
2272,2016.04.18,1,난 이런거 처음 써보는데만원 받아도 보기싫음.  ,1,0,0
2273,2016.04.18,9,"멜로가 버무러진 범죄, 스릴러예요~ 사건이 전개되고 해결되어가는 과정이 흥미진진하네요. 과거와 현재를 오가면서 스토리가 진행이 되는데 같이 사건을 해결하는 것처럼 집중해서 봤어요. 다만 과거 남주 구렛나룻은 좀... ㅋㅋㅋ  ",1,0,0
