index,time,score,reple,1st_week,2st_week,3st_week
1110,2016.04.14,10,뻔한 결말이였지만 과정은 매우 재밌다  ,1,0,0
1111,2016.04.14,7,여러 평점이 섞여있는 여기 평점과는 다르게 어떤 영화는 줄줄이 8~10점이네. 여기는 알바 안쓰네 ㅇㅈ!ㅋㅋㅋ  ,1,0,0
1112,2016.04.14,10,한국영화치고 참신함 사실 전 임수정 팬입니다....  ,1,0,0
1113,2016.04.14,1,핵폐기물. 알바들 작작해라  ,1,0,0
1114,2016.04.14,9,미스터리인줄 알았는데 로맨스였옹ㅋ  ,1,0,0
1115,2016.04.14,10,아놔 이영화 꼭보세여 너무 웃김 ㅡ.ㅡㅋㅋ 온갖 무리수의 향연.. 무리수의 극한에 도전하는 영화. 한국형 sf개그대작 열한시 이후로 이런 개콘같은 영화 간만. 너무 웃어서 옆사람에게 미친x 취급당함 ㅡㅡ;; 진지먹고 연기하는 배우들 넘 대단함 연기의신  ,1,0,0
1116,2016.04.14,10,2년전에 만든 영화라면 시그널 나오기 전이고 이런 발상으로 만들어졌다는 거 너무나도 독창적이라 생각합니다. 시그널 전에 개봉했다면 더 칭찬 받았을 영화라 생각합니다. 정말 재미있게 봤습니다. 강추합니다 ^*^  ,1,0,0
1117,2016.04.14,5,노잼 10자 10자 10자  ,1,0,0
1118,2016.04.14,1,졸작입니다.내가 시나리오를 쓰는게 더 낫겟다고 생각한 영화.  ,1,0,0
1119,2016.04.14,10,애낳고 오랜만에 본 영화인데 정말 잘골라서 본것같아요 눈까지 가리면서 봤어요!!!!완전 스릴 굿 스토리도 좋아요!!!!  ,1,0,0
1120,2016.04.14,10,조정석님 영화네요~ 몰입해서 너무 재밌게 잘봤습니다. 흥행하길..  ,1,0,0
1121,2016.04.14,10,와~3월부터 볼게 없어서 기대안하고 봤는데 엔딩 올라갈때까지 지루하지않지도 않고 긴장감 몰입감 정말좋았다 엔딩이 그렇게 퍼즐한조각 처럼 맞춰지다니. . 영화관에서 본거 정말 잘한거 같다 기대없이 갔는데 너무 좋았다  ,1,0,0
1122,2016.04.14,2,멘탈이탈자! 스릴러라기엔 멜로라인이 강하고 멜로라기엔 스릴러가 애매함. 격투씬이나 멜로씬 모두 연기가 어색했음. 영화 잘 안보는데 1년만에 극장갔다가 영화보고 멘탈이 이탈당했음. 이진욱이 마지막에 본업?으로 돌아갔을 때 제발 그건 아니길 바랬으나...  ,1,0,0
1123,2016.04.14,8,관람객지금 나온영화중 좋음재밌어요 연기 굳  ,1,0,0
1124,2016.04.14,8,관람객흔한 시간영화같으면서도 뭔가 색다른 느낌의 영화ㅎㅎ  ,1,0,0
1125,2016.04.14,10,최근본영화중에 젤재미있음！！  ,1,0,0
1126,2016.04.14,3,보다가 나올뻔 뭐하는짓임  ,1,0,0
1127,2016.04.14,9,시그널영화판 같음  배우들의 연기는 너무 좋았음 근데 스토리가 개연성이 다소 떨어지고 정신없음 임수정연기 너무좋다  ,1,0,0
1128,2016.04.14,10,재미있어요 중간중간 잔인한부분들도있었지만 긴장감있게 끝까지재밌게봄 ㅎㅎ배우들 연기도 좋아요 ㅎㄷㄷㄷ  ,1,0,0
1129,2016.04.14,9,시그널이 생각나지만  처음엔 오글오글 거렸지만 끝으로 갈수록 볼만하고 살짝무섭기도..기대하지않고 본다면  재밌게볼듯해요  ,1,0,0
1130,2016.04.14,10,평점이 극과극이네요. 개인의 취향같아요~ 같이 본 신랑은 별로라고 하고(액션취향ㅋ) 전 엄청 재밌게 봤어요~ 타임슬립 스토리를 워낙 좋아하는지라^^ 추천합니다!  ,1,0,0
1131,2016.04.14,6,스토리가 억지스러운 부분이 많아서 .. 다보고 나서 뭐지..? 했다.. 근데 조정석 연기는 지린다  ,1,0,0
1132,2016.04.14,10,충분히 볼만한 영화임 안보신 분들 믿고 보셔요~~  ,1,0,0
1133,2016.04.14,9,"겁내 재밌어요, 후반으로 갈수록 심장쫄깃해짐ㅋㅋㅋ 꿈을 통해 연결된다는것도 좋았구요! 그와중에 이진욱은 사랑입니다 ㅜㅜ 넘나잘생김 ;^)  ",1,0,0
1134,2016.04.14,9,시나리오도 연기도 탄탄한 영화였음  ,1,0,0
1135,2016.04.14,10,와 진짜 이런 영화는 영구보존해야합니다. 진짜 역대급 재미를 주네요... 시간 가는줄 몰랐어요~!!! 강추합니다 두번 보세요 3번 보세요 ㅎㅎ 명배우의 명연기!!  ,1,0,0
1136,2016.04.14,1,딱봐도 노잼영화 냄새가 풀풀난다 절대로 돈주고안본다  ,1,0,0
1137,2016.04.14,10,간만에 재밌는 영화 한편이였습니다 개인적으로 결말도 넘 좋았어요  ,1,0,0
1138,2016.04.14,10,시그널 같지만 꿈이라는 새로운 소재로 시그널 보다 더 신선하게 재밌게 볼 수 있었다  ,1,0,0
1139,2016.04.14,5,관람객후 몰입도는 괜찮았으니결말이별로네요  ,1,0,0
1140,2016.04.14,10,시나리오 연출 연기력 다 완벽하드라ㅎㅎ  ,1,0,0
1141,2016.04.14,10,스토리도 짜임새있고 연기자들의 일품 연기가 어우러져 지루함 없이 볼 수 있었습니다  ,1,0,0
1142,2016.04.14,10,재밌게 봤는데 무서워 죽는줄암ㅠ  ,1,0,0
1143,2016.04.14,10,"영화를 보는내내 긴장을 놓을수없고 계속 스릴감 넘치게봤어요!조정석 배우님,이진욱 배우님 연기도 너무 잘하시고 두분의 케미도 너무 좋아서 보는 내내 눈호강했어요♡♡스릴러와 감성이 적절히 잘 스며들어 있네요!이렇게 재밌는영화 오랜만이네요~  ",1,0,0
1144,2016.04.14,1,시간 강탈자....ㅁ  ,1,0,0
1145,2016.04.14,10,전생과 이생의 시간여행! 좋아요!  ,1,0,0
1146,2016.04.14,10,추천! 스릴러 영화 좋아한다면 무조건 재밌게 볼 수 있을거임!  ,1,0,0
1147,2016.04.14,10,이진욱 조정석이 다했네ㅜㅜㅜ 특히 조정석 완전 좋아  ,1,0,0
1148,2016.04.14,10,긴장감 있게 보다가 마지막엔 훈훈하게~~  ,1,0,0
1149,2016.04.14,10,"시간이탈자를 보고대한민국 스릴러 영화의 한단계 업그레이 된 작품이었다.배우들의 연기가 돋보였고, 반전의 연속으로 몰입감을 더해주었다.  ",1,0,0
1150,2016.04.14,1,알바 조온나 쓰네.. 알바땜에 빡쳐서 1점준다  ,1,0,0
1151,2016.04.14,6,후반부 스토리가 약함...  ,1,0,0
1152,2016.04.14,1,영화는 개봉 시작하고 좀 지나서 보시길.개봉할땐 알바 쓰나봐요.평점 올리느라.항상 당하네요.  ,1,0,0
1153,2016.04.14,10,이진욱 연기빼고 다좋았습니다.  ,1,0,0
1154,2016.04.14,10,관람객재밌음 약간 무섭기도.. 조정석 잘생김. 이진욱은 더 잘 생김. 정진영 연기 잘함  ,1,0,0
1155,2016.04.14,1,0점인데 0점이 없네...  ,1,0,0
1156,2016.04.14,10,최근에본 영화중 가장인상깊은 영화였습니다 연인들끼리 보러가면 좋을것같아요  ,1,0,0
1157,2016.04.14,10,관람객시간을 이탈했다..!  ,1,0,0
1158,2016.04.14,9,돌고돌아 다시 너에게로  ,1,0,0
1159,2016.04.14,6,설정 자체도 왔다갔다 해서 복잡한데 장르를 세개나 섞어버렸으니 난잡해져버린 영화.. 조금만 더 정갈하게 다듬지..  ,1,0,0
1160,2016.04.14,10,재밋어요 생물선생님 무서워요  ,1,0,0
1161,2016.04.14,10,아~~생물선생님 역활 연기하신분... 영화 거짓말에도 나오셨던분 맞죠..검색 해보니 이름이 전신환씨 더라구요 포스 작렬 ㅎㄷㄷ앞으로 팬이 될것 같습니다~~^^  ,1,0,0
1162,2016.04.14,10,관람객짱재미쪄요 ㅋㅋㅋㅋ조정석 이진욱 멋잇 ㅠㅠ마지막 소름 확돋앗어요 아 넘잼잼♡  ,1,0,0
1163,2016.04.14,10,재밌어요!! 정말 틈없이 영화가 이어져요! 조정석 배우님 연기가 정말 최곱니당!! 임수정 배우님은 역시 목소리 톤이 너무 좋구요. 이진욱 배우님도 역시 극을 이어가는 데에 역할을 톡톡히 해내세요. 잘 봤어요! 감사합니다~  ,1,0,0
1164,2016.04.14,1,배우들이 아깝습니다..  ,1,0,0
1165,2016.04.14,8,관람객전체적으로 볼만햇으나 넘 시그널 같앗어요 글구 결말이 쫌...  ,1,0,0
1166,2016.04.14,7,평소 관심있던 배우들의 영화개봉소식에 관심이 있었고 시사회로 보게 되었는데 스릴 있고 적절하게 시대를 넘나드는 추격전을 볼수있었어요  ,1,0,0
1167,2016.04.14,9,스릴 있고 재밌어요! 추천!  ,1,0,0
1168,2016.04.14,6,다 그렇다 치는데 범인이 너무 불사신임.. 시간을 달리는 좀비가 이영화에 더 맞는 제목인듯  ,1,0,0
1169,2016.04.14,5,영화내용이 다 억지같았습니다 납득이 가지 않는 내용투성이라 집중이 하나도 안됬습나다  ,1,0,0
1170,2016.04.14,6,관람객괜찮은 스토리 진행과 배우들의 연기력이 돋보였으나..옛날느낌의 사건전개.. 페이드인 아웃.. 대사.. 등이 너무나 아쉬웠습니다.  ,1,0,0
1171,2016.04.14,7,시그널을 후에 봤다면 평점을 높이 살 수 있겠지만 이미 내 수준이 같은장르에서 보는 눈이 높아져 버렸다.  ,1,0,0
1172,2016.04.14,1,영화보고 나오는 애들 남자는 여주 여자는 남주 잘생겼다 이쁘다 얘기뿐  ,1,0,0
1173,2016.04.14,10,시그널이 방영되기 개봉했다면 더 높은 평점을 받을 수 있었을 것 같다는 아쉬움을 받았다. 중간 중간 나오는 조정석의 눈 연기력을 잊을 수 없었고...조연의 연기력 또한 좋았다  ,1,0,0
1174,2016.04.14,1,이진욱 발연기 와 감탄스럽네  ,1,0,0
1175,2016.04.14,1,개연성 없는 범행동기에 불사신 범인 시그널 보고 가시는 분들 무조건 후회합니다  ,1,0,0
1176,2016.04.14,1,OOO기 영화 이거볼돈으로 치킨사드세요  ,1,0,0
1177,2016.04.15,8,관람객결말이 조금 아쉽긴하지만 지루할틈없이 잘봤습니다.^^ 살인자 칼비틀며 쉿 할때 소~오름  ,1,0,0
1178,2016.04.15,3,이진욱이 작품보는 눈이 없다는 걸 다시한번 증명하는 영화... 시그널과 겹치는 부분이야 촬영시기가 시그널 방영보다 앞이니 할말은 없다만 같은소재로 이렇게 그지같이 찍기는어려울듯 조정석 연기는 그와중 갑  ,1,0,0
1179,2016.04.15,1,방금 보고와서 충격받고  처음으로 글 남긴다한국영화는 다운받아보는게 맞다고 했던 친구 말을 안들은 내가 바보다시작하고 15분만에 나가고 싶었음팝콘이 아까워서 보고있었는데..이런건 정말 욕도 아까움한국 영화를 멀리하게두 좋은 계기가 될  ,1,0,0
1180,2016.04.15,3,어떤식으로 풀어나가려 했는진 알겠지만 내용도 개연성도 결말도 어설프다..  ,1,0,0
1181,2016.04.15,5,먼가 억지로 껴맞추려하는거 같은 느낌조정석배우님은 연기 넘 잘하셨고 이진욱배우님은 발성연습 좀 해야할듯 보면서 겁나 오글거림  ,1,0,0
1182,2016.04.15,10,"뭔가 어설프긴 했지만 뒤로 갈수록 흥미진진 재미있었다 음악,배경이 좋았다 아쉬운것은 연기  ",1,0,0
1183,2016.04.15,9,관람객이 영화 때문에 운명을 믿게됐어요  ,1,0,0
1184,2016.04.15,6,배우들의 매력이 없는건지 아니면 드러나지 않은건지...특히 임수정은 좀 힘들거같다...똑같은 영화라도 요새 잘나가는 티켓파워있는 배우가 출연했다면 좋은성적났을지도...적어도 검사외전같은거보다는 낫다 ㅋㅋ  ,1,0,0
1185,2016.04.15,10,시그널 제대로 보지도 않고 똑같다고 함부로 지껄이지마라 시간이탈자는 시간이탈자다 잼나다  ,1,0,0
1186,2016.04.15,1,한숨만 나오네요...  ,1,0,0
1187,2016.04.15,10,"기다리던 작품이라 달려가서 봤는데, 정말 제대로 감성 추적 스릴러네요. 요즘 볼 영화 없었는데, 가뭄의 단비였어요!!!  ",1,0,0
1188,2016.04.15,7,영화내용이 지금까지 봤던 영화와는 다른 매력이있고 배우들의 연기력이 너무 좋은 나머지 저도 모르게 몰입해서 봤네요 정말 고마워요 ㅠㅠ  ,1,0,0
1189,2016.04.15,9,1 점 주는 사람들  혹시 영화 를 잘 이해 못해서  그런건 아닌지?  잘 만든 영화로 보입니다.  참고로 전 알바 아님.  ,1,0,0
1190,2016.04.15,7,배우들 연기는 완벽. 각본은 아쉽..  ,1,0,0
1191,2016.04.15,6,그냥 저냥이라는 느낌이 절정 이후의 허무감으로 왔던 영화. 조정석씨와 범인이 큰 역할을 하여 흡입력은 인정할만했음. 하지만 남은 건 벼락과 키스?  ,1,0,0
1192,2016.04.15,8,관람객야밤에보고왓는데 재밋네요  ,1,0,0
1193,2016.04.15,1,내돈약탈자. 전개가 빨라도 너무 빨라서 임수정 이진욱은 끝날때까지 왜 서로 사랑하고 키스하는지 이해가 안간다. 범인은 아무 이유없이 그냥 싸이코. 총 한 5분 나오나. 스릴러에서 범인 비중이 엑스트라수준. 봉준호 말곤 스릴러 만들지 마라 제발.  ,1,0,0
1194,2016.04.15,10,긴장하고 땀흘리면서 한편으로는 설레면서 볼수있도록 적절히 조화를 이루는 스릴러와 감성스토리에 연기력까지 진짜 짱임다시 봐도 후회안할듯  ,1,0,0
1195,2016.04.15,1, 뜬금없는 전개 말도 안되는 개연성 관객들 마지막에 한명도 안일어납니다 먼가 다른 영상있는줄알고 그러다가 다 아쒸  하고 일어납니다 네이버에 평점 알바있다는걸 이 영화로 알았습니다 진짜 평점 알바가있네요 절대 보지마세요  ,1,0,0
1196,2016.04.15,5,박평식씨 평점 참고합니다...  ,1,0,0
1197,2016.04.15,10,기대하고 보긴했는데 더 재밋었어요! 돈주고 영화관가서 또 보고싶을 정도로 매력적인 시간이탈자♡ 추천 뿅뿅!!  ,1,0,0
1198,2016.04.15,10,관람객너무나 재미있었어요 역시 영화는 기대없이 봐야 꿀잼  ,1,0,0
1199,2016.04.15,1,"클리셰덩어리,  돈  버렸다.  내용도 허술하고  ",1,0,0
1200,2016.04.15,1,"내용도  엉망이고,  장르도 애매하고  스릴러면  스릴러로 가든가  감성을 왜붙여서  말아먹을까?  ",1,0,0
1201,2016.04.15,10,요즘 극장 가서 본 영화중에 최고였어요. 마음이 따뜻해지는 결말이 너무 좋았어요  ,1,0,0
1202,2016.04.15,3,공백없이 열글자 쓰래.  ,1,0,0
1203,2016.04.15,8,긴장감 좋네 별 기대안하고 봤는데 재밌네요  ,1,0,0
1204,2016.04.15,10,관람객짜임새 있는스토리에요 나인의 이진욱이 선하네요 재밌어요  ,1,0,0
1205,2016.04.15,10,시간대가 이거밖에 없어서 툴툴거리면서 봤는데한번 더 보러갈거예요ㅋㅋㅋㅋ스릴러물이지만 특유의 감성이 너무 좋음  ,1,0,0
1206,2016.04.15,9,결말이 시원한 영화는 간만이네요~ 처음에 이해안가는게 많을텐데 그냥 그러려니하면서 보시면 뒤에 다 이해하실거에요  ,1,0,0
1207,2016.04.15,8,"감독 혼자 어떻게든 재밋게 만들어 보려고 원맨쑈를 한 느낌이다. 때문에 극적 몰입도는 있었으나 , 과한 후시녹음의 남발로  미약한 배우들의 연기가 더 빛을 잃어 버렸다.  ",1,0,0
1208,2016.04.15,1,한국영화 특징. 배우들 연기는 좋은데 시나리오 자체가 b급도 안되는 쓰레기.  ,1,0,0
1209,2016.04.15,8,극장판 시그널~~전체적인 구성은 흥미롭지만 정진영님 역할이 애매하고 설득력이 떨어짐 무엇보다 이진욱의 발연기와 대사톤이 몰입을 어렵게 함 조정석이 살린 영화  ,1,0,0
1210,2016.04.15,8,관람객비슷한 내용을 봤던거 같지만 재미있었다  ,1,0,0
1211,2016.04.15,5,내용자체는 재밌으나 전혀 개연성없고 뜬금없는부분이해안가는부분 많음.언제 제작된영화인지모르나 개봉무산되었다가 시그널의 히트바람에 편승하는것 같다는 생각이 들정도임.  ,1,0,0
1212,2016.04.15,10,"세상에 태어나서 이런 영화를 본적이 없다 우선 이 영화는 공포스러우면서 코미디 하기도 하고 반전의 반전을 일으키고 좀비도 나오기도 하고  명대사도 엄청나게 나오고,진짜 내 인생에 영화다!너무 재밋다 진짜 10분빼고 나머지 시간을 다 웃엇다 인생 영화다  ",1,0,0
1213,2016.04.15,3,넘나재미없다 ㅠㅠ솔직히....소재가특별히신선하지도않앗고 내용전개도 관객을 사로잡진못한듯....  ,1,0,0
1214,2016.04.15,9,"내용은 시그널 플러스 나인,조정석 정진영 이진욱 다들 연기는 최고였고,임수정은 나이가 느껴졌고,맙소사 정배는 멋있게 잘컸다.끝!  ",1,0,0
1215,2016.04.15,10,보는 내내 심장 쫄깃쫄깃  ,1,0,0
1216,2016.04.15,9,혹시나 평점보고 영화 안볼 사람들 있을 것 같은데 개인적으로는 시그널만큼 괜찮았음  ,1,0,0
1217,2016.04.15,10,보는 내내 심장 쫄깃쫄깃!저는 너무 잼있게 봤네요!!!!  ,1,0,0
1218,2016.04.15,9,관람객억지감이 약간 있지만 생각보다 잘 짜여진 구성입니다.  ,1,0,0
1219,2016.04.15,1,"실소만 나옴. 대사 때문인지 배우들의 연기가 부자연스럽고 어색하며 오글거림. 언제까지 90년대 연출과 대본, 스토리로 성공을 바랄건지? 20분 정도 지나곤 참을성이 바닥에 다다랐는데 나가고 싶은걸 꾹 참았음. 근데 그 때 나가는게 맞았었다 싶음.  ",1,0,0
1220,2016.04.15,1,이런거 좀 만들지 마라...  ,1,0,0
1221,2016.04.15,9,시간이탈자 정말 재밌는데....어찌  표현할 방법이 없네....  ,1,0,0
1222,2016.04.15,5,이진욱으로도 캐리 안 돼요.ㅎㅎ조정석 연기는 잘하지만 음그냥 그렇습니다 ..!  ,1,0,0
1223,2016.04.15,10,"1점인 평점때문에 전혀 기대 없이 봤는데 완전 꿀잼 허니잼이던데?!! 여자친구랑 둘다 극찬했음 . 나름의 반전과 과거와 현재가 이어지는 연결고리들이 계속 있고 연기도 좋았고, 처음부터 끝까지 긴장감과 손에 땀을 쥐게했음, 마지막에 이해가 되면서 우와  ",1,0,0
1224,2016.04.15,8,이번 영화 굉장히 몰입하면서 관람했습니다.생각보다 흥미 넘칩니다. ^^  ,1,0,0
1225,2016.04.15,10,스릴러고 조정석이 나온다고 해서 기대하고 본 영화인데 기대한만큼 스릴넘치게 봄  ,1,0,0
1226,2016.04.15,5,연관성이 너무 억지스럽고  베테랑 배우들인데도 불구하고  연기가 어색하고 부자연스러웠다....뭔가 끼워맞춘기 급급한 영화보고나서 바로 객석이탈자로 변신함  ,1,0,0
1227,2016.04.15,1,관람객기대를 많이 해서그런지 실망감이 크네요.. 개연성없고 스토리를 이끌어 나가기위한 억지요소가 너무많습니다ㅜㅜ 배우들의 연기가 너무나도 몰입하는데 방해가 됩니다...  ,1,0,0
1228,2016.04.15,10,관람객조정석 연기가 완전 진정성 쩜 영화 재밌게 봤어요!  ,1,0,0
1229,2016.04.15,9,관람객진짜 너무 재밌게 본 영화였어요 후회없어요!  ,1,0,0
1230,2016.04.15,10,관람객재밌네요근데 스토리 구성이 더 폰이랑 비슷해서... 좀 연상이 되더군요ㅋ그래도 나름 흥미롭게 봤네요  ,1,0,0
1231,2016.04.15,10,"긴장감도있고, 이진욱 기대하고 봤는데 재밌게 잘봤어요 ㅎㅎ  ",1,0,0
1232,2016.04.15,6,어제 오후 춘천cgv에서 관람 했음. 미안하지만  원래 '해어화' 보려고 했지만 대기시간이 길어서... 그냥 평작.  ,1,0,0
1233,2016.04.15,5,관람객과거와 현재를 잇는 소재가 신선하고 좋았다  ,1,0,0
1234,2016.04.15,7,졸깃하고 잔잔하다 후반부 뚝 탈선된듯힌 아쉬움이 크레딧올라갈때까지 ....  ,1,0,0
1235,2016.04.15,10,관람객정말 잼있게 봤습니다~~^^시그널과 비교하지 않았으면 좋겠어요... 시간이탈자는 이대로 최고입니다~  ,1,0,0
1236,2016.04.15,10,진짜 처음에 몰입도 확되고 너무 재밌는데 임수정이 조금 깬다 ㅜㅜ  ,1,0,0
1237,2016.04.15,5,단언컨대 이 영화의 백미는 죽지 않는 용의자 인듯 불사조가 따로 없음. 개인적으로 솔직히 나인과 시그널 같은 타임슬립 매개체를 그냥 따라한 느낌이라서 극의 억지 전개가 느껴졌음. 조정석이진욱팬이면 그냥한번보셔도 좋을 듯하지만 시그널이나 나인은 아니다  ,1,0,0
1238,2016.04.15,10,스릴러 로맨스 둘 다 잡았넹ㅋㅋ  ,1,0,0
1239,2016.04.15,10,평점이 1도있고 10도어서 알바생쓴줄알고 기대없이봤는데 보는내내소름돋음 스릴러라하나 무섭진않음 장르이탈자다 무슨이탈자라하는데 꿀잼 사람마다취향이 다르지만 같이본친구도 재밌게봄 마지막부분이 아쉽긴한데 개꿀잼 추천드림(조정석 과거머리 촌스럽지만 잘생김ㅠ)  ,1,0,0
1240,2016.04.15,9,관람객보는 내내 심장이 쫄깃;; 마지막엔 완전 진짜 ㄷㄷ  ,1,0,0
1241,2016.04.15,10,간만에 영화 다운 영화본거 같아요. 스릴넘치고 나중에 모든 떡밥들이 풀릴 때 완전 시원했어요 두번 볼거예요  ,1,0,0
1242,2016.04.15,10,믿고보는 임수정.오랜만에 만나서 너무 좋았다  ,1,0,0
1243,2016.04.15,6,관람객정말 재미있었습니다. 신선한 소재를 깔끔하게 잘 풀어나갔네요ㅋㅋㅋㅋ 마지막 결말이 조금 아쉬웠...ㅠㅠ  ,1,0,0
1244,2016.04.15,6,관람객생각보다..스릴있진 않네요...;;;  ,1,0,0
1245,2016.04.15,8,관람객조정석님의 연기..몰입되고..큰 비중 차지했습니다..진욱님의 연기 보고파 관람한건더...정석님의 연기가 더 돛보인듯..느껴집니다..  ,1,0,0
1246,2016.04.15,10,조정석 연기 짱짱 이네요! 재밌게 봤어요  ,1,0,0
1247,2016.04.15,10,관람객꿀잼이였습니다ㅏㅏㅏ  ,1,0,0
1248,2016.04.15,10,소재와 배우분들이 좋아서 기대하던 영화였는데 역시나!! 시간가는줄 모르고 관람했습니다. 스릴러와 멜로가 적절히 섞여서 전혀 지루하지않고 막판에는 정말 깜짝 놀라는 장면도...!! 멜로장면에서의 영상미도 정말 아련하고 너무 예뻤습니다. 추천합니다!!  ,1,0,0
1249,2016.04.15,7,시간약탈자. 내시간을 돌려다오..  ,1,0,0
1250,2016.04.15,10,와진짜최고의영화ㅠㅜ진짜 지루한부분도 없고 다 집중해서 재밋게 봤다ㅠㅜㅠ배우들도 다 이쁘고 잘생기고 연기도잘하심ㅠㅠㅜ  ,1,0,0
1251,2016.04.15,10,관람객난 왜이렇게 이진욱 하고 조정석 연기가 비교되지...  ,1,0,0
1252,2016.04.15,10,전 재밌게 잘 봤어요 마지막엔 왜일케 들었다해서 괜히 눈물이  나오더라구요 시그널 안봐서 그런지 장르가 고르게 분포되어 좋았어요 ㅎㅎ  ,1,0,0
1253,2016.04.15,10,오랜만에 재밌는 한국영화조정석 연기에 몰입이 너무잘되됨.  조정석 굿  ,1,0,0
1254,2016.04.15,1,별 0개는 없나요??한시간 보다 이탈했습니다 이야 알바들 너무많아 아무리 영화볼거없다지만 이건아닙니다차라리 꽃구경가세요~  ,1,0,0
1255,2016.04.15,1,"곽재용 감독의 마지막 작품이 되어야 할 듯...이 배우들이 이렇게 연기를 못하는 배우들이 아닌데,,개연성은 없고, 갑작스런 러브라인은 불편하다.  ",1,0,0
1256,2016.04.15,1,극장 이탈자.ㅋㅋ..  ,1,0,0
1257,2016.04.15,10,진짜 지루하지 않은 2시간  ,1,0,0
1258,2016.04.15,8,관람객괜찮아요  먼가 예측되는결말이엿지만 잘만든듯  ,1,0,0
1259,2016.04.15,10,보는 내내 잔뜩 긴장하고봄 ㅠ 혼자봤는데 몰입 잘되고 재밌었다  ,1,0,0
1260,2016.04.15,10,스토리도 탄탄하고 간만에 긴장하면서 본 스릴러.  ,1,0,0
1261,2016.04.15,10,와 연기 스토리 전개 다 맘에드는 스릴러 영화였어요 ㅎㅎ  ,1,0,0
1262,2016.04.15,10,개소름... 범인 보고 소름돋았다 흥미진진  ,1,0,0
1263,2016.04.15,7,잘 가다가 나침반이 갈길을 잃었다.  ,1,0,0
1264,2016.04.15,10,마지막 결말도 좋고 여운도 많이 남네요 의외로 맘에드는 엔딩 굿  ,1,0,0
1265,2016.04.15,10,범인이 너무 잘살아나 ㅋㅋ 심장 쫄깃한 스릴러 영화! 이런건 스크린으로 보자  ,1,0,0
1266,2016.04.15,10,관람객조조로 봤는데 재밌었어요ㅋㅋ  ,1,0,0
1267,2016.04.15,10,배우들 연기도 하나같이 멋지고 스토리도 탄탄해서 좋앗습니다  ,1,0,0
1268,2016.04.15,9,시그널보다 일찍 나왔더라면..그래도 재밉게 보았네요.  ,1,0,0
1269,2016.04.15,10,관람객진짜진짜 영화잘만들었어요 완전재밌어요!!!!  ,1,0,0
1270,2016.04.15,10,강추 !시그널의 빈자리를 채워주는 느낌!  ,1,0,0
1271,2016.04.15,5,드라마 시그널이 더 완성도가 있는듯. 합니다. 연기는 좋은데 장면장면 개연성없이 폼만 잔뜩 잡은 영화라는 생각이 들어서요..이런 영화가 그런거지 라고..이해하고 보기에는 솔직히 너무 어설프다는...몰입이 안된다는...  ,1,0,0
1272,2016.04.15,10,거걱?ㄱ?ㄱ?ㅋ?ㄱ?ㄱ?ㄱ?ㄱ?ㄱ?ㄱ?ㄱ?  ,1,0,0
1273,2016.04.15,10,뻔한듯 하지만 전혀 뻔하지 않았어요~!  ,1,0,0
1274,2016.04.15,5,관람객너무 기대 하고 봤나봐요. 그럭저럭 볼만했다 정도?스릴도 없고 멜로도 약하고 흠..스토리가 좀 심심했어요  ,1,0,0
1275,2016.04.15,7,관람객왜 그런지 잘 모르게 만듦새가 허술하다  ,1,0,0
1276,2016.04.15,10,지금 사랑하는 사람이 있어야 이영화가 아름답고 감동을 주는 영화라는걸 알 수 있음...평점이 별로인분들은 솔로이거나 사랑을 모르는 바보.  ,1,0,0
1277,2016.04.15,10,조정석 연기 짱잘함! 보는 내내 소름 돋았다  ,1,0,0
1278,2016.04.15,10,감동적이고 푹빠져서 보고왔어여! 마지막 장면 울컥하네요 사랑하는 사람있는 분들은 꼭 보세요!!강추  ,1,0,0
1279,2016.04.15,10,이진욱 때문에 봤는데 조정석한테 반해서 나왔다  ,1,0,0
1280,2016.04.15,10,관람객시그널재밌게보셨다면 강추!!  ,1,0,0
