index,time,score,reple,1st_week,2st_week,3st_week
3085,2016.04.21,10,관람객뭔가 엄청 신기한느낌...  ,0,1,0
3086,2016.04.21,6,이 영화는 스토리와 인물의 개연성을 따지지 말고 걍 감독이 보여주는 데로 수긍하고 봐야 됨 7점을 줄까 했는데 정웅인이 어떻게 됐는지 궁금해서 1점 깎음  ,0,1,0
3087,2016.04.21,10,관람객시그널같은데 짱잼 긴장감 대박  ,0,1,0
3088,2016.04.21,2,이거 시그널 모방한거아니야??~~~  ,0,1,0
3089,2016.04.21,1,이 감독이 엽기적인 그녀랑  클래식 감독이라는게 이해가 가지않을 정도로 망작이다  극장이탈자로 제목 바꿔라  ,0,1,0
3090,2016.04.21,1,와 뭐이딴영화가 다있어 진짜 쓰레기끝판대장 개잡종영화임 내시간 내돈 뺏아간 양아치영화임 시그널발톱도못따라가고 클래식까지 망치는 클래식감독이 만들었다는데에 더소름  ,0,1,0
3091,2016.04.21,8,관람객소재는 신선했음. 연결되는 시선이 부족한듯합니다.  ,0,1,0
3092,2016.04.21,8,관람객나름 시간 보냈네 은근 빠져들때도 있고  ,0,1,0
3093,2016.04.21,1,이 영화를 보고 암이 걸렸습니다. 설정 구멍이 하도 많아서 내 뇌에도 구멍 뚫리는 줄 알았음  ,0,1,0
3094,2016.04.21,1,?정알 재미없다 젠장 돈내고 봤다니  ,0,1,0
3095,2016.04.21,2,처절한 알바들의 몸부림을 보라~배우들이 대사를 읽네읽어~참 나 감독이 여러 사랍 잡네~  ,0,1,0
3096,2016.04.21,1,진짜 너무한거 아니냐...난 영혼이 이탈하는줄 알았다. 개알바들아..  ,0,1,0
3097,2016.04.21,10,재미도 있고 스릴도 있고 그리고 출연자들이 다 좋아요  ,0,1,0
3098,2016.04.21,8,관람객영화 끝나고 나니 나만 이해 잘 안됐니? 뭔가 복잡했어...이해하기 어려웠어.. 그치만 볼만함!!  ,0,1,0
3099,2016.04.21,1,후회막급한 영화. 시간 아까비  ,0,1,0
3100,2016.04.21,8,"생각보다 참 재미있었다..누가 범인일지, 반장은 정체가 뭘지  등 나름 추리해보고 맞아떨어져가며 흥미진진~  ",0,1,0
3101,2016.04.21,10,스토리가 절망 탄탄하고 감동을 선사하는 영화입니다 영화관에서 시간가는 줄 모르고 봤네요 여러분들도 감동을 느껴보세요  ,0,1,0
3102,2016.04.21,9,관람객스토리진행도 빠르구 아주아주 잼있었다는  ,0,1,0
3103,2016.04.21,2,너무나 억지스러운..웃음도 감동도 무언가 새로운 기대감도... 그 어떤것도 없이 내용이 뻔히 예상되서 집중이 안됐다.  ,0,1,0
3104,2016.04.21,7,시간은 빨리 가더라구요. 기억남는건 이진욱이 잘생겼다?  ,0,1,0
3105,2016.04.21,10,말은 안 되지만 보는 내내 쫄깃ㅋ  ,0,1,0
3106,2016.04.21,9,시그널이랑비슷한장르라해서보러갔는데진짜내스타일추리하면서보는것도재밌는데그냥기대안하고봐서기대이상으로재밌었다  ,0,1,0
3107,2016.04.21,10,심장쪼리며본영화 재밌었다  ,0,1,0
3108,2016.04.21,10,관람객재밌어요  흥미진진 추천합니다  ,0,1,0
3109,2016.04.21,10,관람객이진욱조정석최고 진짜재밌어요  ,0,1,0
3110,2016.04.21,10,별로인 평이 많아서 기대안했는데 생각보단 재밌었다 범인이 계속 살아나는게 이상하지만...  ,0,1,0
3111,2016.04.21,10,오늘 보고 왔는데 세 배우다 연기 잘하시고 재미있어요^^  ,0,1,0
3112,2016.04.21,5,흡사 예전 체인지라는 '고전'영화의 피뢰침을 연상케하는 어마무시한 개연성의 엔딩. 모든 기운은 서경고등학교로?! 지고지순한 사랑으로는 용서받을 수 없는 비약적 전개와 허술한 사건의 재구성. 아 정말 총체적 난국.  ,0,1,0
3113,2016.04.21,4,다 알바들인가? 정말 지루했고 시간탐험대라고 제목을 짓는것이 어떨지? 주인공들 케미도 없고 이건뭐 ㅠㅠ 시나리오 엉망임 ㅜ  ,0,1,0
3114,2016.04.21,8,무난한 스토리이지만 재미있게봤음  ,0,1,0
3115,2016.04.21,10,난 재예매 해서 또 볼거임  ,0,1,0
3116,2016.04.21,7,관람객너무 사람을 죽임.. 그래서 짜증나지만 재미는 있음  ,0,1,0
3117,2016.04.22,5,관람객무난하게 돈아깝지않게볼만한영환듯하지만평론가평점이왜낮은지는알거같애요스토리가조금아쉬움  ,0,1,0
3118,2016.04.22,7,관람객시간여행이라는 소재가 다소 진부하게 보일 수 있습니다. 살인자의 범행동기가 뚜렷하게 묘사되지 못했습니다. 조정석 캐스팅은 좀 약해보입니다. 임수정의 캐릭터 변신이 돋보였습니다.  ,0,1,0
3119,2016.04.22,1,개연성도 그렇고 내용을 억지로 짜맞추려는 듯한 느낌에  ,0,1,0
3120,2016.04.22,10,핵잼이었는데 왜 100만도 못 찍고 있지...  이해가 안 가네  ,0,1,0
3121,2016.04.22,1,야 이건 아니지 극장이탈자 이딴 시나리오받고 연기를 하느이진욱한테 절망이다  ,0,1,0
3122,2016.04.22,10,내가 머리가 나빠서 이해를 못하는 건지는 모르겠지만 내용이 어렵다ㅠ.ㅠ 하지만 이진욱과 조정석의 연기는 좋았다.  ,0,1,0
3123,2016.04.22,10,상영시간이 길게느껴지지 않을정도로 좋았는데 확실히 시그널과 유사한느낌이... 조정석의 연기는 항상 좋았음. 긴장감도 있고  내용도 나쁘지않았음. 꼭보세요^^  ,0,1,0
3124,2016.04.22,10,조정석 이진욱 연기좋았어요.ㅎㅎ 재밌게 잘 봤어요. ^^  ,0,1,0
3125,2016.04.22,10,제일 감명깊게본 한국영화....  ,0,1,0
3126,2016.04.22,5,관람객딱히 추천해주고 싶은 영화는 아닙니다  ,0,1,0
3127,2016.04.22,10,타임슬립물 좋아하면 재미있음 결말도 맘에드는데  ,0,1,0
3128,2016.04.22,10,관람객순간 몰입도가 정말 좋았습니다. 재밌게 봤어요.  ,0,1,0
3129,2016.04.22,10,최근 본 영화중 최고!!! 시간가는줄 모르고 봤어요  ,0,1,0
3130,2016.04.22,10,관람객좋습니다 시도가 좋습니다  ,0,1,0
3131,2016.04.22,1,cj에 내가 또 속을까 하면서도 하아 진짜 또 속았다 이런 쓰레기같은 영화에 평점이 7이 넘는다고? 이걸 아직도 믿는 네티즌들이 있는 건 아니겠지  ,0,1,0
3132,2016.04.22,1,사랑했네 사랑했어두생을 넘어 사랑하는건 알겠는데감정은 어디감?코미디영화 연인이랑 같이보면 즐겁게 웃으면서 술먹을 수 있음  ,0,1,0
3133,2016.04.22,1,그냥 시그널보세요.. 훨씬 나음..  ,0,1,0
3134,2016.04.22,10,재밌었는데.. 이진욱 보러 갔다가 조정석한테 반하고 왔네요ㅠㅠ스토리고 뭐고 조정석으로 시작하고 조정석으로 끝나요 끝에 펑펑 울었어요ㅠ감성이 절묘하게 잘 섞였어요 1점자리 영화는 아니네요  ,0,1,0
3135,2016.04.22,7,관람객몰입도있구재밌어요ㅠㅠ다소엉성한느낌은있네요  ,0,1,0
3136,2016.04.22,6,운명같은 결말이 재미있게 보던 이 영화의 운명을 바꿨다.  ,0,1,0
3137,2016.04.22,8,관람객나비효과와는 다르지만 나름 감성적이게 볼수있는 영화  ,0,1,0
3138,2016.04.22,10,남친이랑 봤는데  전 재밌게봤어요 근데 박선생 괴물도아니고 무슨 계속 살아나고 ㅋㅋ좀비인가암튼 남자주인공들 때문에 멋잇고 내용이 슬프고 무서워요 ㅠㅠ  ,0,1,0
3139,2016.04.22,1,긴장 하나도 안되고 장르 구분도 안되는 영화. 주인공 판단력 노답  ,0,1,0
3140,2016.04.22,5,조금은 안타까왔던 영화네요 취향에 따른 후기가 천차만별이지만 그래도 참고할 만은 합니다 범죄스릴러물도 아닌것이 긴박감도 없고 얼렁뚱땅 넘어가는 엉성한 전개도 아쉽구요 ㅠ ㅠ  ,0,1,0
3141,2016.04.22,10,완전잼남  이진욱조정석멋짐  ,0,1,0
3142,2016.04.22,8,관람객끝은 절절한 로맨스긴 한데..왜르케 무서워ㅠㅠ..  ,0,1,0
3143,2016.04.22,10,조정석 너무 멋있어요ㅜㅠㅠㅠ  ,0,1,0
3144,2016.04.22,10,관람객마지막에 공포영화를 보는듯한 짜릿함도 있고 좋았어요  ,0,1,0
3145,2016.04.22,8,"아니 영화 재미없다고 하도 그래서 진자 핵 노잼으로 예상하고 영화를 봤는데, 생각보다 재밌었음 조정석 연기 개잘하고 임수정도 잘하고  말이야.  얼마나 개연성이 더있어야함?? 난 이정도면 영화 괜찮았다 생각함  ",0,1,0
3146,2016.04.22,8,연출이 조금만 더 좋았으면 더재밌었을거 같네요  ,0,1,0
3147,2016.04.22,7,댓글들 왜 이렇게 점수 야박하지 ... 볼만했는데시그널만큼의 개연성은 아니지만 그래도 가볍게 보기에는 딱 아니냐 조정석 연기최고  ,0,1,0
3148,2016.04.22,9,관람객재밋서여룰률류률룰룰  ,0,1,0
3149,2016.04.22,7,"이진욱 팬인데 너무 안타까운 영화예요. 개연성 없고, 인물도 펑면적이고, 줄거리를 배우를 통해 전달만해준다는 느낌. 감독, 배우  이름이 아까운 영화. 불사조 같은 범인도 영화니까라고 접고 들어가기엔 너무 안 죽어.  ",0,1,0
3150,2016.04.22,10,사실 별 기대안하고 봤는데 정말 재밌게 봤어요~ 조정석 배우 연기 몰입력이 특히 좋았어요ㅎㅎ 연기잘하는 배우로 기억에 남을꺼 같아요 굿!  ,0,1,0
3151,2016.04.22,5,"흥미로운 소재다. 그걸 따라가지 못하는 상황의 전개, 개연성을 막 보충 설명하듯 보여주는 장면들로 인해 스릴러 장르의 긴장감이 느껴지지 않아 아쉬울 따름!!! 배우의 활용도 아쉽다. 특히 온주완은 왜 출연했는지 의문!!! 아 범인과의 액션씬은 휴~~~  ",0,1,0
3152,2016.04.22,10,"역시 키스씬은 이진욱. 시그널과는 다른 매력이 있는 영화였어요. 스릴러와 로멘스를 적절히 섞어 놓은 느낌? 화면도 너무 예쁘고, 임수정도 진짜 예쁘고! 전 재밋게 잘 봤습니다 :)  ",0,1,0
3153,2016.04.22,10,후반부에 몰아치는 조정석씨의 연기가 하드캐리  ,0,1,0
3154,2016.04.22,8,스릴러  타임슬립류 좋아하는 사람들은 실망하지 않을 영화배우들도  너무 좋고 재미있게 잘 보았네요 ㅋ  ,0,1,0
3155,2016.04.22,10,왜이리 평점이야박하니.. ㅠㅠ  전진짜 소름돋을정도로 재밌게 봤는데....시간가는줄도모르겠고 너무 재밌었음..여운이 가시지도않고 제 인생영화일정도로 너무 재밌게봤습니다..  ,0,1,0
3156,2016.04.22,10,좀산만했지만 볼만했네요~ 범인이 누굴까? 과거인물이 현재에 누굴까 나름 추리하며 보니 재밌었어요.  ,0,1,0
3157,2016.04.22,1,배우 믿고 본 영환데 fun은 없고 뻔함만 있는  ,0,1,0
3158,2016.04.22,5,진지하게 보자면 유치하고 대책없는 영화지만 킬링타임용으로 보기엔 괜찮다. 조정석 보는맛이 은근히 쏠쏠함.  ,0,1,0
3159,2016.04.22,1,아 또 알바들한테 낚였네 ...  ,0,1,0
3160,2016.04.22,8,관람객재밌어요임수정연기대박  ,0,1,0
3161,2016.04.22,9,볼만한 한국영화입니다  ,0,1,0
3162,2016.04.22,1,막장 영화다 시간을 버리고싶다면 보셈  ,0,1,0
3163,2016.04.22,10,관람객조정석 이진욱 임수정 캐스팅이 신의 한수!  ,0,1,0
3164,2016.04.22,8,관람객조정석의 열연이 돋보인 작품  ,0,1,0
3165,2016.04.22,1,1점도 아깝다. 최근 몇년간 한국영화 많이 발전했다고 생각했는데 그 생각을 다시 고쳐야겠다 생각이 들었다.  ,0,1,0
3166,2016.04.22,9,재미 있어요....나름 반전도 있구  ,0,1,0
3167,2016.04.22,7,관람객역시 시그널 ㅣ비슷한 느낌이네요.  재미는 있어요!  ,0,1,0
3168,2016.04.22,3,관람객먼말이야 왔다리갔다리 이진욱잘생겼다 조정석잘생겼다  ,0,1,0
3169,2016.04.22,10,관람객과거를 바꿔 현재를 바꾸는 재밌는 영화  ,0,1,0
3170,2016.04.22,10,임수정 현대판 선생님으로 나와서 남친에게 애교부릴때 정말 아름답더라. 배우하나로 영화가 살았다.  ,0,1,0
3171,2016.04.22,10,감동적인 영화 였음 하나의 소재로 주제를 잘표현해내는데 있어서도 좋았고 스토리도 나름 재밌었음 조금조금 떡밥이 있어서 내용을 미리 알겠는것도 있고  ,0,1,0
3172,2016.04.22,10,시대를 구분이 잘되게 만든 배경 색감 시간을 넘나드는 영화인만큼 헷갈릴 수 있는데 그런 점도 전혀 없고 스토리도 막장으로 가지 않고 매끈하게 가네요. 요근래 본 영화 중 최고였습니다.  ,0,1,0
3173,2016.04.22,9,뻔한 스토리 그러나 뻔하지 않은 연출~  ,0,1,0
3174,2016.04.22,1,개연성도없고 계속머리속으로뭐지뭐지하는 영화  ,0,1,0
3175,2016.04.22,10,정말 스릴있는영화 나침반 명언들었을때 울컥..이거보고 내 꿈이결정된듯 정말추천합니다 돈이 아깝지않은 영화!!!  ,0,1,0
3176,2016.04.22,7,나쁘지는 않아 근데 악당이 좀비고 아니고 무슨...  ,0,1,0
3177,2016.04.22,6,"중간에 뜬금없는 전개, 갑자기 호러좀비물로 바뀌는 장르...좀 아쉬움이 남는 영화임. 평점 알바들있나봐...  ",0,1,0
3178,2016.04.22,9,재밌어요.. 끝나고 가슴이 먹먹함... 남자친구도 재밌어하던데ㅎㅎㅎ  ,0,1,0
3179,2016.04.22,1,이 영화! 꿈에서 봤어요! SNL 극장판인줄  ,0,1,0
3180,2016.04.22,8,관람객기대를 크게..안하고봐서 그런지 재미있게봤습니다. 약간은 시그널  느낌이있네요ㅋㅋ  ,0,1,0
3181,2016.04.22,9,관람객스릴넘치고 재밌음 기대 안하고 봤는데 무서워죽을뻔  ,0,1,0
3182,2016.04.22,8,"예고편 보고 기대하고 보러간 영화~그리고 나랑 같이 본 사람도 괜찮았다던 영화, 기대하고 본 것 치곤 만족스러운 영화  ",0,1,0
3183,2016.04.22,1,절대 보지마세요 완전 재미왔어 ㅠ 보다 나옴  ,0,1,0
3184,2016.04.22,8,관람객기대안해서 그런지 더 스릴있고 재미있네요 !ㅋㅋㅋ 연기력도 좋았습니다!  ,0,1,0
3185,2016.04.22,8,관람객재미있는데 엔딩이 아쉬워요  ,0,1,0
3186,2016.04.22,8,이해가 안되진 않았다. 마지막 장면은 복선처럼 와닿았기도 ㅇㅇ 예상은 했지만  ,0,1,0
3187,2016.04.22,10,대박 진짜 너무 재밌게 봤네요ㅎㅎ 정석오빠 넘멋져요♡♡정말 다시보고싶을 정도로 너무재밌네요!!♡♡  ,0,1,0
3188,2016.04.22,7,관람객큰 기대는 안했는데요~~그런데로 볼만한 영화입니다!  ,0,1,0
3189,2016.04.22,1,◆ 프리퀀시 흉내내는 OO년 스러운 영화가 왜 이리 많냐 ㅉㅉ 짜증나네.  ,0,1,0
3190,2016.04.22,1,제발 이런 영화 나오지 맙시다 한국영화 수준 떨어집니다  ,0,1,0
3191,2016.04.22,6,관람객케이블 나인이랑 너무 흡사함... 과거를 바꾸면 미래가 바뀌는점에서..  ,0,1,0
3192,2016.04.22,1,평점 귀찮아서 잘안쓰는 사람이였는데 내 돈을 이탈해가서 참을수가 없었다  ,0,1,0
3193,2016.04.22,6,내가 느낀 결론은 화생방 훈련을 잘하자. 그이상 그이하도 없었다.  ,0,1,0
3194,2016.04.22,1,영화평점 안남기는데 평점 알바풀었나 속아서 본게 화나서 남김. 배우들이 아까움. 돈낭비 시간낭비 하실분만 추천  ,0,1,0
3195,2016.04.22,1,감독이 돈이 많아서 취미로 찍나.. 싶을.. 왜케 억울하지.. 내시간 돈.. 감독님! 욕한번 시원하게 했습니다.. 오래사세요.. 학교 옥상씬은 옛날 영화 체인지 보는줄 알았어요.. 망작! 올해 본 영화중에 1Q 젤 돈아까운 영화..  ,0,1,0
3196,2016.04.22,10,이진욱이랑 조정석 쉐프님 ㅠㅠ 진짜 다시 봤다 너무 멋있어  ,0,1,0
3197,2016.04.22,8,관람객기대가 있어서인지 그만큼의 재미는 느낄수 없었네요.  ,0,1,0
3198,2016.04.22,9,처음에 시그널을 따라하는건가? 했지만 보다 보면 이 영화의 매력과 재미를 느낄 수 있다.  ,0,1,0
3199,2016.04.22,10,이.... 이거 드라마 나인과 비슷한데?  ,0,1,0
3200,2016.04.22,8,관람객이진욱 눈빛 쩔어 임수정은 늙지도않네  ,0,1,0
3201,2016.04.22,10,스릴 넘쳐서 손 붙잡고 봤네요. 조정석씨 짱  ,0,1,0
3202,2016.04.22,9,재밌게 봤어요!로맨스와 액션과 스릴...ㄷㄷ 잼!  ,0,1,0
3203,2016.04.22,6,뭐가 먼저 기획된건지 모르겟지만 시그널이랑 너무 비슷한데 더 정돈안되는 느낌? 제일 어이없는건 온주환은 왜 나온건지 모르겟다는.. 그냥 느낀점은 임수정도 많이 늙었구나 근데 이진욱은 웃을때가 이쁘다 이 정도임  ,0,1,0
3204,2016.04.22,5,관람객재밌게 잘봤네요 좋아요  ,0,1,0
3205,2016.04.22,10,한국영화에는 별로 크게 관심안갖고 기대안하고 보는 편인데 .. 이영화는 진짜 몰입도가 최고예요 진짜 너무재밋어요진짜너무너무!!! 올해 본영화중에 진짜 최고일듯해요.. 아직도 여운이 가시지않아요 .. 진짜 꼭보세요!!!  ,0,1,0
3206,2016.04.22,9,관람객정말 재미있었습니다. 뻔한듯하지만 그래도 즐겁게 볼수있는 영화. 시간을 넘어선 사랑 ㅎㅎ  ,0,1,0
3207,2016.04.22,10,엥..난 진짜 재밌게봤는데...알바아닌데...누군가한텐 그정도로 재미없을 수도 있구나조정석 연기도 너무좋고 전개도 나름 자연스러웠음몰라 난 재밌었어요~  ,0,1,0
3208,2016.04.22,10,심심풀이 이상으로 재미있었다  ,0,1,0
3209,2016.04.22,2,시그널 전에 나왔어야 하는 영화!!!! 배우들은 고생많이 했을거 같네요  ,0,1,0
3210,2016.04.22,10,한국영호ㅏ 중 최고 퀄리티  ,0,1,0
3211,2016.04.22,8,관람객재밌네요 볼만한데 생각보다 잔인해서 놀랐어요 후후 다들 마음의 준비하고 보세요  ,0,1,0
3212,2016.04.22,10,관람객생각보다 재밋엇어요 ㅎㅎ  ,0,1,0
3213,2016.04.22,7,관람객조정석 연기가...굿 ㅋ  ,0,1,0
3214,2016.04.22,5,나인을 본다면 시간이탈자는 기대만큼 못하네요~~ 배우들의 연기는 최고입니다~  ,0,1,0
3215,2016.04.22,7,"몰입도는 나쁘지 않으나, 몇몇 장면은 어이가 없어서 실소가 나왔다. 곽재용 감독 나처럼 드라마 나인을 재밌게 봤나보다. 나인 스토리에 주제는 ""참교사""  ",0,1,0
3216,2016.04.22,5,"쏘쏘해요...  더 폰, 시그널 , 시간이탈자... 이제는 좀 지겨워 질때가 됐지요 ....  ",0,1,0
3217,2016.04.22,1,70만관객은 속은거다 더이상 속지마시길네이버 평점은 1/2로 판단하면 될듯43년평생 젤 재미없더라는왠만하면 다봐주는데 ㅠㅠㅠ  ,0,1,0
3218,2016.04.22,10,2시간 어떻게 가는지 모르고 봤어요 ㅋ 재밌어요 ㅎ  ,0,1,0
3219,2016.04.22,8,관람객처음엔 너~ 무 긴장되고 재밌는데 끝마무리가 좀.. 그래도 재밌습니다!!!  ,0,1,0
3220,2016.04.22,9,관람객그냥 그저그런 시xx과 비슷한 내용  ,0,1,0
3221,2016.04.22,1,날보러와요나 이거나 내 인생 최악 그냥 욕나옴 돈이 흘러넘치면 봐라 OCN 에 나와도 안보는게 답  ,0,1,0
3222,2016.04.22,10,이진욱 조정석연기 잘하네요 주제에 맞게 연출도 멋지구요 스토리도 예상하던바로 잘짜여있네요 강추입니다  ,0,1,0
3223,2016.04.22,10,관람객너무재밌음 러닝타임 내내 빠져들어서 봤어요. 시그널과 약간비슷하다고 해야하나? 더 긴장감있기도 했구요  ,0,1,0
3224,2016.04.22,8,관람객생각보다 무섭네요..  ,0,1,0
3225,2016.04.22,5,관람객독특한소재의영화그럭저럭보고갑니다  ,0,1,0
3226,2016.04.22,1,뭘얘기하고 싶었던거지도 모르겠고어떤분 말처럼 장르이탈자....  ,0,1,0
3227,2016.04.22,10,관람객개꿀잼임입니다 ㅋㅋㅋ 이야  ,0,1,0
3228,2016.04.22,9,그냥 한마디면 된다. 조정석이 살린영화  ,0,1,0
3229,2016.04.22,9,관람객재미있었어요ㅎㅎ이진욱짱  ,0,1,0
3230,2016.04.22,6,그냥 킬링타임용.. 이런 장르 좋아하는데.. 많이 아쉽다  ,0,1,0
3231,2016.04.22,10,내용 배우 음악 좋다 조정석 사랑한다 거미부럽  ,0,1,0
3232,2016.04.22,4,"올드한 곽재용, 더 이상 통하지 않는다고 생각된다. 영화는 엉성하기 짝이 없다. 이진욱 임수정 연기는 어색할뿐이다.  ",0,1,0
3233,2016.04.22,7,시그널 축소판 ?조정석잘생겼다??  ,0,1,0
3234,2016.04.22,1,관객수준에 비해 영화가 많이 모자란듯. 옛날식 영화.  억지로 짜맞춘 상황. 대사. 현실감 떨어지는 장면. 긴박해야하는 장면에서는장면이 어의없어 폭소.  ,0,1,0
3235,2016.04.23,8,새로운 시도는 좋았음. 다만 범인이 뻔히 보여서  ,0,1,0
3236,2016.04.23,6,관람객극의 전개및 스토리가 식상하고 흥미가 없는 줄거리이다.  ,0,1,0
3237,2016.04.23,4,관람객아무리픽션이지만 더무답답했음 어째서?왜? 이런생각이너무듬 뭐픽션이니까~이런열린마음을가지신분은 충분히 재미는느낄듯  ,0,1,0
3238,2016.04.23,10,관람객조정석연기죽이더만!!!!  ,0,1,0
3239,2016.04.23,10,관람객감동 스릴 재미 모두 만족했습니다  ,0,1,0
3240,2016.04.23,10,와..간만에 요즘 영화 중 정말 재밌게 봤어요..진짜....영화가 여운이 남아야 영화지.. 영화에서 살고싶다  ,0,1,0
3241,2016.04.23,9,"관람객기대안하고볼꺼없어서봤는데,생각보다넘재미지네요ㅎ재밌게잘봤습니다  ",0,1,0
3242,2016.04.23,8,실망한 사람들도 있다고 해서 큰 기대 안하고 봤는데..재밌음! 장르이탈자 말에 완전 동감 : 쓰릴러 + 로맨틱드라마♡  ,0,1,0
3243,2016.04.23,10,관람객나는재밌게봤는데ㅔ왜재미업다고하는지...  ,0,1,0
3244,2016.04.23,1,영화진짜 실망임ㅠㅠ 전개도 이상하고 계속 시그널 생각남..  ,0,1,0
3245,2016.04.23,5,하아.. 나의 시간도 이탈해버렸다  ,0,1,0
3246,2016.04.23,7,막판에 전개가 조금 아쉬움  ,0,1,0
3247,2016.04.23,1,돈 주고 봤는데...돈 안 주고 본 시그널보다 훨~~씬 못함!  ,0,1,0
3248,2016.04.23,10,2016 최고의 타임랩스 무비  ,0,1,0
3249,2016.04.23,3,범인이 예상못한사람인건 ㅇㅈ 그러나 개뜬금없는사람이 범인ㅋ개연성도 없고 특히 살해동기가 너무 허술하다..미안... 내가 영화볼줄 몰라서 다 재밋게보는데 이건  작품성이 떨어진다는걸 통감기억에남는건 박준규  ,0,1,0
3250,2016.04.23,8,관람객생각보단  꽤 볼만합니다~  ,0,1,0
3251,2016.04.23,10,"오랜만에 진짜 재미있게 본 영화, 배우들도 멋지고 이쁘고 연기도 잘함ㅜ 스릴만점에다 감동적인 부분까지....!  대박나길  ",0,1,0
3252,2016.04.23,4,"드라마 시그널 이후에 개봉해서 매력도 덜했고, 배우들 연기력 진짜 거슬리더라.씨지비 골드클래스에서 이런 영화를 보다니ㅡㅡ  ",0,1,0
3253,2016.04.23,10,조정석 개머시떠여 으앙 또보꾸  ,0,1,0
3254,2016.04.23,10,관람객마지막에 반전도잇고재밋네요  ,0,1,0
3255,2016.04.23,8,재미는 있었으나 시그널묘사 느낌 재방송보는 기분  ,0,1,0
3256,2016.04.23,1,이게 장르가무언인가요? 멜로? 뻔한 곳에서 기다리다 공격당하고 소재는 좋았는데 이야기를 풀어나가고 액션이 너무뻔하고 미비함  ,0,1,0
3257,2016.04.23,10,재미있네요나름 긴장감도 있고요  ,0,1,0
3258,2016.04.23,1,망작중에망작 와...  ,0,1,0
3259,2016.04.23,9,관람객만족스러웠다.반전묘미도있고...간만에 재미있게 본영화  ,0,1,0
3260,2016.04.23,5,하...정말 답답해지는 영화인 것 같네요.뜬금없는 장면들도 많은 것 같고 굳이 영화관에서 봐야만한다싶은 영화는 아닙니다.  ,0,1,0
3261,2016.04.23,7,관람객배우님들 연기가 좋았습니다  ,0,1,0
3262,2016.04.23,7,관람객한 번 보기에 재미있는 영화입니다 :)  ,0,1,0
3263,2016.04.23,10,관람객솔찍히 너무 몰입해서 시간이 금방가더라;;  ,0,1,0
3264,2016.04.23,9,"방금 보고 나왔습니다. 극의 진행에 따라 약간 복잡할 수도 있으나 근래에 들어 제대로 된 기승전결의 영화를 보아서 너무 좋습니다.사건의 연관과 그에 대한 이유, 비록 짜임새가 약간씩 비기는 하지만 너무 리얼리티를 추구하지 않으신다면 추천합니다!  ",0,1,0
3265,2016.04.23,10,완전 재밌었는데 평점왜이럼ㅋ  ,0,1,0
3266,2016.04.23,10,조정석이 정말연기를 잘해요ㅜㅜㅜㅜ처음엔 평점이 좀안좋아서 별로기대안했는데 개인적으로 정말 재미있게봤어요 ㅎㅎ 여운도 굉장히남고!개인적으로 정말재미있게본영화!  ,0,1,0
3267,2016.04.23,5,조정석이 연기를 잘해서 감탄하면서 봤어요. 그런데 스토리가 조금 막장인... 시그널도 봐서 신선함이 없었고.. 시그널과 비교해 봤을 때 시그널 1~4화? 가 훨씬 재미있었어요.  ,0,1,0
3268,2016.04.23,10,"호불호가 갈려 썩 기대안했는데 전 재밌게 봤어요~~!타임슬립 드라마는 나인, 시그널 영화는 시간이탈자~  ",0,1,0
3269,2016.04.23,1,알바에 속지맙시다 시그널짝퉁느낌의 졸작영화 도대체 범인이 악행을저지르는 동기도딱히없고 개연성도없고 주인공은 과거의자신이 사라져버리고 갑자기 전혀 다른삶을 살아야하는데 여자하나때문에 좋다고히히덕대는 노답캐릭터인 개망영화  ,0,1,0
3270,2016.04.23,7,관람객배우들의 연기가 뛰어나고 넘나 멋잇엇음 ㅌㅋㅋㅋ내용은 아쉬웟던것이 시그널과 비슷햇다는점 ㅠ  ,0,1,0
3271,2016.04.23,10,관람객재밌어요ㅎㅎ생각버다  ,0,1,0
3272,2016.04.23,9,시간을 오가는 재미가 있네요 볼만합니다  ,0,1,0
3273,2016.04.23,8,관람객세세한  짜임세는  없지만 나름 감동과  반전이  있네요  ,0,1,0
