index,time,score,reple,1st_week,2st_week,3st_week
1943,2015.05.04,10,관람객김고은이 나온 영화는 처음봣는데 연기를 이렇게 잘하는지 몰랐어요 근래 개봉한 영웅들 나오는 영화는 어린이 영화보는 것처럼 오글거렸는데 차이나타운이 훨씬 재밌네요 영화보기전 평점을 확인하는편인데 평점이 낮아서 볼까말까하다가 봤는데 정말 재밌게 봤습니다  ,1,0,0
1944,2015.05.04,10,"태어난 환경에 따라 누구나 그렇게 될 수 있음을 어떻게 극복하고 살 것인가 다시 한 번 고민하게 만든 작품입니다. ""가난은 죄다!!!"" 그 수형을 사는 사람들의 이야기^^ 우리나라에서 이런 작품이 나왔음에 박수를 보냅니다.  ",1,0,0
1945,2015.05.04,8,"관람객김혜수 김고은 연기 굿, 눈물 남.  ",1,0,0
1946,2015.05.04,9,난왜케재밌엇지또보고싶음  ,1,0,0
1947,2015.05.04,10,관람객끝부분에 살짝 지루한거 빼고는 최고였습니다.  ,1,0,0
1948,2015.05.04,10,관람객부모님께예매해드렸는데 재밌게보셨다고하네요^^  ,1,0,0
1949,2015.05.04,5,관람객연기력은좋지만애매한영화  ,1,0,0
1950,2015.05.04,2,정말 재미없다. 무슨 얘기를 하려는지도 모르겠고... 김혜수 라는 배우가 너무 아까울 따름이다.  ,1,0,0
1951,2015.05.04,1,고등학교 졸업이후 25년 만에 혼자서 영화를 보러 갈만큼 기대를 많이 했던 영화입니다.  배우들의 연기력은 돋보였지만 영화 자체는 정말 별점 하나도 아까운 영화  ,1,0,0
1952,2015.05.04,10,관람객재밌었습니다 재밌어요  ,1,0,0
1953,2015.05.04,1,뜬금포 터지는 장면이 많아서 몰입도 방해함..스토리개엉성연기 하나는 대박인듯  ,1,0,0
1954,2015.05.04,10,관람객이 영화 정말 최고. 배우들의 연기가  정말 최고네요  ,1,0,0
1955,2015.05.04,6,기대를 너무 많이 했던 내탓이다. 연기력 연출력 다른거 다 떠나서 재미가 없었다.  ,1,0,0
1956,2015.05.04,8,재밌긴하다만... 한마디로 말해보자면 인신매매업자들에게 동정심을느끼는영화?  ,1,0,0
1957,2015.05.04,3,그냥 어벤져스2 한번 더 보는게 나음  ,1,0,0
1958,2015.05.04,10,대박.. 이라는 말 밖에 안나옴.... 오랜만에 전율!!  ,1,0,0
1959,2015.05.04,10,관람객너무 재미있고 감동~~ 역시 김혜수!! 그리고 김고은 !! 눈물났어요~대박나세요..  ,1,0,0
1960,2015.05.04,1,헐~~ 잠와 죽는줄.. 예산은 거의 안들이고 찍은듯~~ 너무했드만~  ,1,0,0
1961,2015.05.04,6,"여성 중심의 느와르, 새로운 도전에 박수를  ",1,0,0
1962,2015.05.04,5,"긴장감제로, 주인공개연성 제로, 그냥 김혜수빨로 끝까지간다.  ",1,0,0
1963,2015.05.04,1,졸려죽는지알았다의도가뭔지모르겠다  ,1,0,0
1964,2015.05.04,10,진짜 재밌음 액션도 멋있고 심장쪼이는것도good역시 김혜수  ,1,0,0
1965,2015.05.04,8,관람객연기 좋고 스토리도 괜찮은듯했으나너무다죽어버리고 해피엔딩을 좋아하는 사람으로써마음에드는 결말은아니었음  ,1,0,0
1966,2015.05.04,10,김혜수는 진리다 영화 내에서 포스가 후덜덜! 마지막까지 정말 최고라는 말이 계속 나오더라구요  ,1,0,0
1967,2015.05.04,1,좀 실망했던 영화네요.  ,1,0,0
1968,2015.05.04,9,시간가는 줄 모르고 본 영화는 간만이네 ㅋㅋ  ,1,0,0
1969,2015.05.04,8,관람객한편의 느와르를 보는 느낌. 장면장면의 긴장감을 잘 살렸고 각 배역의 캐릭터들이 잘어우러져서 한쪽으로만 치우쳐진 느낌이 아니어서 끝까지 몰입할 수 있었다.다만 갑작스런 죽음의 이유가 모호한것이 개인적으로 흠이라면 흠.  ,1,0,0
1970,2015.05.04,10,묘하게 빠져드네요... 정말 재미있게 잘 봤습니다  ,1,0,0
1971,2015.05.04,10,진짜 다들 연기가 ㄷㄷ 재밌어요 진짜로 김혜수랑 김고은  얀기 소름  ,1,0,0
1972,2015.05.04,4,액션을 원한다면 보지 말아야 할 영화. 110분이 많이 지루했음.엉성한 스토리. 도대체 영화가  뭘 말하려고 하는지 이해할 수 없는 영화  ,1,0,0
1973,2015.05.04,10,기존에 남남케미의 액션 느와르와는 정말 다른 느낌~  ,1,0,0
1974,2015.05.04,10,일영 엄마 최고...오랜만에 재밋는 영화봤다.어벤져스보다 재밋네  ,1,0,0
1975,2015.05.04,10,김고은과 김혜수의 연기가 차이나타운에서 포텐이 터진다  ,1,0,0
1976,2015.05.04,8,달콤한인생의 느낌이 나면서 홍주역. 일영이 역 엄마역 ....등 눈빛 연기가 대단하다고 생각이든다.  ,1,0,0
1977,2015.05.04,10,이렇게 강렬하고 충격적인 영화가 또 있을까?  ,1,0,0
1978,2015.05.04,8,관람객볼만하긴 했지만 참 뭔가 애매한 영화..  ,1,0,0
1979,2015.05.04,10,칸 초청작이라고 하던데 김혜수의 카리스마를 칸에서도 알아본거야  ,1,0,0
1980,2015.05.04,5,관람객김고은 멋있어요^^완전 카리스마짱!  ,1,0,0
1981,2015.05.04,10,관람객자난곡낟그닌드군건드다라학  ,1,0,0
1982,2015.05.04,10,배우들이 연기를 잘해서 소름돋았다 ㅠㅠ  ,1,0,0
1983,2015.05.04,10,연기대박! 이런건 극장에서 봐야 긴장감 유지하면서 재밌게 볼 수 있는 작품이다~  ,1,0,0
1984,2015.05.04,9,신선한 연출력과 배우들의 연기력이 진짜 후덜덜..  ,1,0,0
1985,2015.05.04,10,김혜수의 카리스마에 보는 내내 압도당했다  ,1,0,0
1986,2015.05.04,1,일단 제목이 왜 차이나타운인지 모르겠음.  중식 먹는 장면들 때문에?  그냥 우리나라 하류 세팅으로도 충분했을 연출.  김혜수의 변신이 놀랍다니...매번 똑같은 연기톤인데 뭐가 다르고 대단하단건지.  분위기 어둡기만하면 느와르라니..정말 하품나옵니다.  ,1,0,0
1987,2015.05.04,10,관람객김혜수 카리스마 작렬!!  ,1,0,0
1988,2015.05.04,9,믿고보는 김혜수^^ 진짜 멋있더라구요 여자인 내가봐도!  ,1,0,0
1989,2015.05.04,10,몰입도가 굉장합니다~ 지루함도 없고 김고은도 매력적이구 어쩜그리 매력적이게 생겼지? 중성적인 매력 짱  ,1,0,0
1990,2015.05.04,10,홍주 연기 대박; 진짜 리얼했어요  ,1,0,0
1991,2015.05.04,10,김고은의 웃는 표정연기로 10점이 충분하다고 생각합니다.  ,1,0,0
1992,2015.05.04,10,눈물이 나더라.. 엄마와 딸의 이야기를 잘 그려낸 것 같고 계속 눈물이 낫음 ㅠㅠ  ,1,0,0
1993,2015.05.04,5,노리코의 식탁을 어설프게 오마주함.. 배우들 연기로 5점 줌.  ,1,0,0
1994,2015.05.04,10,와 진짜 배우들 열연 때문에 몰입도 장난 아니엇음 ㅠ  ,1,0,0
1995,2015.05.04,6,"화이와 많이 닮은 영화네요,, 영화 내내 김혜수 압도적인 카리스마에 감탄하는 영화입니다만.. 좀 많이 잔인하고 영화 후엔 그다지 남는 건 없었습니다 ㅠㅠ  ",1,0,0
1996,2015.05.04,10,느와르 좋아하신다면 꼭 보세요! 신선해서 볼만했습니다  ,1,0,0
1997,2015.05.04,10,역시 김혜수 라는 말밖에 나오지 않는다..  ,1,0,0
1998,2015.05.04,1,김혜수씨 김고은씨 너무 좋아해서 두분 보려고 보긴했는데ㅜㅜ 스토리가 너무 오글도글바글이였어요.. 이건 본 사람만 이해 할거에요.  ,1,0,0
1999,2015.05.04,10,여배우 투톱이 나오는 영화인데 이렇게 강렬해? 김혜수만 믿고 봐도 되는 영화.  ,1,0,0
2000,2015.05.04,7,모든 연기력 각본 연출이 완벽했으나 자꾸 달콤한 인생이 떠오르는건 뭘까?  ,1,0,0
2001,2015.05.04,9,별 기대 안하고 봤는데 아주 볼만합니다 돈아깝단 생각은 전혀 안드네요  ,1,0,0
2002,2015.05.04,8,관람객드라마의 내용은 정말 좋았으나 조금은 잔인한면이 있어 19세의 청소년이 보기에는 조금은 걱정이 됨  ,1,0,0
2003,2015.05.04,1,이건 진짜 나만 보기 아까운 영화. 꼭 다른 사람들도 영화관에서 돈내고 보길  ,1,0,0
2004,2015.05.04,4,"관람객사람들이 평점을 팡팡 날리는 지 모르겟습니다. 차이나 타운 이라고 하는데 그냥 난 오늘 ' 담배피고 사람좀 죽였다' 라고 하지요... 차이나 타운과 사회와의 연관성은 뻥이고 그리고 그 차이나 타운의 사람들 사이의 연관성, 보여주고 싶은 인간속성도 없음  ",1,0,0
2005,2015.05.04,10,생각지도 못한 충격적이고 강렬한 영화!  ,1,0,0
2006,2015.05.04,9,신선해요 ! 기존에 못본 영화라서 꿀잼  ,1,0,0
2007,2015.05.04,10,여자가 나오는 영화는 처음인것같아서 그것도 마음에 들구 연기도 좋고!!!  ,1,0,0
2008,2015.05.04,10,김혜수와 김고은의 캐미 대박♥  ,1,0,0
2009,2015.05.04,10,관람객별로 기대안하고 갓는데 생각보다 재밋엇어요  ,1,0,0
2010,2015.05.04,9,솔직하게내가이런류의영화를좋아하는데 우리나라 영화중 괜찮은편에 속한다 특히 배우들의 연기가 가끔씩 소름돋을 때도 있고 영화가 신선하다 김고은은 연기한지얼마안된거같은데 잘한다 개핵꿀잼은아니자만 꿀잼정도임 뭐사람마다차이가 있겠지ㅋㅋ  ,1,0,0
2011,2015.05.04,10,아ㅜㅜ 이런 영화가 앞으로도 더 많이 만들어졌으면  ,1,0,0
2012,2015.05.04,10,차이나 타운 개봉전부터 기다렸는데 기다린 보람이 있어요ㅋㅋ 영화 꿀잼..  ,1,0,0
2013,2015.05.04,8,짧은시간에 다 표현하기에는 다소 아쉽지만. 볼만한 영화. 개인적으로 나쁘지않은영화 김고은 매력있네^^  ,1,0,0
2014,2015.05.04,6,배우 연기는 좋았지만 살인의뢰같은 느낌..  ,1,0,0
2015,2015.05.04,7,박보검이 망친영화. 박보검 나오면 집중 1도 안됨  ,1,0,0
2016,2015.05.04,7,기대만큼은 아니었습니다.  김혜수씨 에게 박수 보냅니다. 김고은은 연기는 잘했으나 뭔가 2%부족...카리스마였네요.  고경표씨 앞으로 기대많이 해도 될듯 합니다.  인상에 많이 남네요.  ,1,0,0
2017,2015.05.04,8,관람객태어나  죽을수없어 산다 쓸모있는 사람 가족 사회 나는어떤삶을살아왔고 살건지 생각하게되는영화였고 배우들연기가 좋았다 사실적이고 미화되거나 과장되지않은 연출도 흐름에있어 매끄러웠다  ,1,0,0
2018,2015.05.04,10,이 영화 보고 김혜수의 진가를 다시 한 번 느낄 수 있었습니다!  ,1,0,0
2019,2015.05.04,9,끝나고도 여운남는 그런 영화 ㅋ배우들의 연기가 장난아님..  ,1,0,0
2020,2015.05.04,7,영화보기전에 볼만하겠다 기대하고보긴했는데  좋은역활들이  중간에 사채빚때문에 잔인하게 살해되고 ㅆㅡㄹ모있는사람보다 잔인함이 돌출된영화  좀지루한면도있ㄱ 김고은배우연기모습에    생존경쟁속에서 살아남기위한처절한삶이 눈물나게하네요 감동깊이   잘감상했읍니  ,1,0,0
2021,2015.05.04,5,관람객전체적으로 영화가 늘어지네요  ,1,0,0
2022,2015.05.04,10,묘하게 빠져드는 매력이 있는 영화~  ,1,0,0
2023,2015.05.04,10,몰입도 있는 영화네요~ 배우들의 연기가 너무 괜찮았어요  ,1,0,0
2024,2015.05.04,10,"몰입 하고 봤던 영화. 잔인 하기는 하지만 탄탄한 내용, 배우들의 연기 또한 일품이였다.  그런 장르의 영화 인지 모르고 봤는데 소재도 그렇고 지루한부분이 하나도 없었던 영화. ^^^ 강추 입니당  ",1,0,0
2025,2015.05.04,10,역시 내공이 다분하게 느껴지는 김혜수.. 칸에 갈만해 ㅎㅎ  ,1,0,0
2026,2015.05.04,9,어우~ 평점 별로인거 같아서 기대 안하고 봤는데... 배우들 연기가 ㅠㅡㅠ 김혜수언니 넘 카리스마있고~ 김고은양도 진짜 눈빛이 살아있네요~ 액션스릴러 인줄알고 봐서 첨엔 실망했다가 마지막에 살짝 눈물도 고이던 여운이 남는 영화네요~  ,1,0,0
2027,2015.05.04,10,잔인하기만한 영화인줄 알앗는데 알고보면 메시지도 들어있더라구요  ,1,0,0
2028,2015.05.04,9,이거 완전잼.. 여성판 느와르는 처음인데 꿀잼이에요ㅠ  ,1,0,0
2029,2015.05.04,10,엄청난 내공이 느껴지는 김혜수 예고편 그 이상의 재미가 있었다  ,1,0,0
2030,2015.05.04,10,모든 배우들의 연기력이 장난 아니다 몰입도 최고였음  ,1,0,0
2031,2015.05.04,6,먼가 부족하느낌 전직형사도 우곤이는 왜이리 쉽게 죽지 전직형사도 엄청난 악동처럼분위기작아놓고...  ,1,0,0
2032,2015.05.04,10,이 영화는 호불호가 갈리지만 진짜 영화를 볼줄아는 사람만 재미를 느낄수 있다고 생각한다  ,1,0,0
2033,2015.05.04,10,이보다 더 강렬하고 충격적인 영화는 없다..  ,1,0,0
2034,2015.05.04,10,기억에 진하게 남을 것 같아요 전반적으로 흥미진진하고 시간가는 줄 모르면서 봤오요  ,1,0,0
2035,2015.05.04,1,정말 이랜선 안되는 영화...  ,1,0,0
2036,2015.05.04,10,관람객어둡고 잔혹한 분위기를 잘 이어갔고 느와르에 흐르는 가늘고 보일듯 말듯한 온기를 군더더기 없이 잘 그려냈다. 캐스팅도 좋았고 배우들 연기도 과하지 않고 절제되어 좋았다. 이야기도 매우 탄탄하다. 이야기에 관한 설명이 다소 부족하지만 느와르니까 굳  ,1,0,0
2037,2015.05.04,10,관람객워더하이즈 내아이입니다  ,1,0,0
2038,2015.05.04,8,"어린일영이랑 다큰일영이가 너무 이뻤고, 모든 연기자들이 진심 멋진 연기를 보여줬어요.  영화도 재미있기는 했는데, 너무 우중충해서 지치더군요  ",1,0,0
2039,2015.05.04,10,김혜수와 김고은의 연기에 박수를 보냅니다.  ,1,0,0
2040,2015.05.04,6,관람객배우들의 연기는 좋았지만 내용에 있어서 넘 잔인해서~~;;  ,1,0,0
2041,2015.05.04,4,첫부분에 김혜수가 중국어로 뭐라고 하는 부분에서 짐작을 해버렸다. 공감 안되는 남자애 연기도 그렇고결말이 눈에 보이고 공감을 못해 보는 내내  뛰쳐나가고 싶었던 영화  ,1,0,0
2042,2015.05.04,10,관람객역시 혜수누님....좀 잔인하지만 짱짱재미짐  ,1,0,0
2043,2015.05.04,9,고민하다 봤는데 후회없어요 일반적인 영화와는 다르니 꼭보세요~  ,1,0,0
2044,2015.05.04,10,한번쯤은 볼만한 영화!! 생각보다 재밌어서^^  ,1,0,0
2045,2015.05.04,9,배우들의 장난 아닌 연기력에 놀랐다!!  ,1,0,0
2046,2015.05.04,10,"배우들의 열연은 당연한 영화! 게다~ 소품에서 배경, 색채~  장면 하나하나 분위기를 끌어가는 힘! 한국 최초 여배우 톱의 느와르!라는 새로운 도전임에도 첫 장편영화라는 한준희 감독은 정말 주목할만한 감독인 듯! 너무 낮은 평점때문에 조금 높게 줘본다  ",1,0,0
2047,2015.05.04,10,김혜수만으로도 이건 꼭 봐야할 영화다라고 생각했어요  ,1,0,0
2048,2015.05.04,10,원래부터 연기잘하는 줄 알았지만 이번 작품에서 포텐 터지네 김혜수 김고은 대박~  ,1,0,0
2049,2015.05.04,10,김혜수와 김고은 대박.. 그냥 영화보는 내내 할말을 잃었다  ,1,0,0
2050,2015.05.04,10,최근 본 영화중에 제일 감탄사 나오는영화! 어벤져스보다 차이나타운!  ,1,0,0
2051,2015.05.04,8,배우들 연기가 다 좋습니다~~연기가 살린 영화  ,1,0,0
2052,2015.05.04,5,그나마 박보검 때문에 영화다봄무슨말을 하고싶은건지 모르겠다뚝뚝끊기는 내용전개에 로맨슼ㅋㅋㅋ웃음이나옴  ,1,0,0
2053,2015.05.04,10,대박이다 역시 눈물도 마음대로 흘릴 수 없는 영화 ㅠㅠ  ,1,0,0
2054,2015.05.04,10,한국영화의 한 획을 새롭게 그었다 이런느낌의 영화가 나올 수 있구나..  ,1,0,0
2055,2015.05.04,10,생각보다 괜찮네요. 좋은점수주고싶습니다.  ,1,0,0
2056,2015.05.04,1,이영화를 보고 생긴 첫번째 의문영화제목이 왜 차이나타운일까?? 진짜 뜬금포. 중국인이나 조선족을 상대로한 그 어떤것도 나오지않음두번째 의문왜 김혜수씨가 이 작품을 선택했을까?파격적 이미지 변신을 위해서 하신 선택같은데진심 개실망.  ,1,0,0
2057,2015.05.04,10,관람객또 보고 싶다. 너무 좋다!!  ,1,0,0
2058,2015.05.04,10,오랜만에 제대로 된 영화를 봤어요 강렬하고 충격적입니다 나도모르게 울컥하는 장면도 잇구ㅜㅜ  ,1,0,0
2059,2015.05.04,9,무서운영화였다...뭔지모를...무서움...섬뜩함  ,1,0,0
2060,2015.05.04,10,연출력도 좋고 영화 괜찮게 만들었네.. 여배우들의 카리스마 짱 ㅎㅎ  ,1,0,0
2061,2015.05.04,10,관람객재밋네요 김혜수 장난아닙니다  ,1,0,0
2062,2015.05.04,10,재밌었어요 여자배우들의 느와르라는 것이 신선했고 배우들이 제 몫을 해낸 것 같음!  ,1,0,0
2063,2015.05.04,9,믿고 봐도 후회없습니다~ 이 영화덕에 숨통이 트임ㅋㅋ 어벤져스 솔까말 노잼  ,1,0,0
2064,2015.05.04,6,다른배우들  연기잘보다가  박보검나오는  장면에서  입술 색깔땜에  느끼해서  못봤다..  애를  그렇게  배려놓냐..  안타깝다  걔  연기라도  잘했음 그래도  볼랬는데ㅜ  ,1,0,0
2065,2015.05.04,10,여자들의 느와르영화. 색다르다 보는 내내 몰입도 굿  ,1,0,0
2066,2015.05.04,10,"스토리,배우들의 연기 어느하나 나무랄 데가 없어...  ",1,0,0
2067,2015.05.04,10,김혜수 언니의 카리스마에 제대로 압도당함 진짜 이 언니 따라갈 사람이 잇을까?  ,1,0,0
2068,2015.05.04,10,난 이거 솔직히 김혜수 때문에 봄 ㅋㅋ  ,1,0,0
2069,2015.05.04,10,캐릭터가 뚜렷하고 극단적이다 잼잼잼  ,1,0,0
2070,2015.05.04,10,칸의 초청작이라던데 ㅎ 칸에가서도 김혜수의 위상을 떨치고오길~  ,1,0,0
2071,2015.05.04,10,관람객영화 잘 봤습니다. 김혜수씨 연기는 언제봐도 대단하십니다.  ,1,0,0
2072,2015.05.04,10,느와르 장르를 좋아한다면 꼭 봐야할 영화!! 강추합니다  ,1,0,0
2073,2015.05.04,9,괜찮은영화다 시간가는줄 모르고 봄 김헤수 카리스마 쩔고 김고은도 중성매력 쩔 ㅠㅠ  ,1,0,0
2074,2015.05.04,10,강렬한 영화를 찾는다면 차이나타운!! 내공이 느껴지는 연기 김혜수 엄지척!!  ,1,0,0
2075,2015.05.04,10,명불허전 김혜수의 연기를 본것만으로도 감사합니다 ㅜㅜ  ,1,0,0
2076,2015.05.04,1,1도 아깝다..쓰레기..  ,1,0,0
2077,2015.05.04,10,ㅋㅋ헐 별 기대 안하고 가서 봤는데 이렇게 재밌다니..?  ,1,0,0
2078,2015.05.04,10,칸에 초청됫다고 하던데 김혜수씨의 명품 연기를 칸에서도 알아보신듯ㅋ  ,1,0,0
2079,2015.05.04,10,보는 내내 긴장감을 놓칠 수 없었다  ,1,0,0
2080,2015.05.04,10,이런 영화는 간만이에요..진짜 보는내내 가슴졸이고 몰입해서 본건..  ,1,0,0
2081,2015.05.04,10,정말 기대이상 이네요 신인배우들과 첫작품의 감독이시지만 대단한 영화입니다 유명감독과 배우들이였다면 정말 더흥행 했겠죠 그냥 보세요 짱  ,1,0,0
2082,2015.05.04,6,내용도 뒤로갈수록 흐지부지... 뭔 말을 하고싶은지도 잘 모르겠다.. 그냥 흉내만 낸거 같은 느와르 영화;; 김고은 김혜수 연기때문에 그나마6점  ,1,0,0
2083,2015.05.04,10,최근에 본 영화중에 제일 재밌다 김고은도 연기 잘하고 김혜수야 말할 필요도 없지 ㅋㅋ  ,1,0,0
2084,2015.05.04,9,폭력적입니다만 몰입도가 높았습니다  ,1,0,0
2085,2015.05.04,10,기대별로안하고봤는데 대박 역시 김혜수  ,1,0,0
2086,2015.05.04,10,관람객조금 잔인해서 무섭긴한데 몰입도 쩜  ,1,0,0
2087,2015.05.04,7,관람객부모님이 보고 오셨는데 잔인한 장명이 많이 나와서 조금 보기 거북했다고 합니다  ,1,0,0
2088,2015.05.04,7,중반까지 지루함..그 담부터 내용이 대충 그려짐..여주 피부가 너무 뽀얘서 몰입이 별로 안되더군요..크게 공감은 안됨  ,1,0,0
2089,2015.05.04,10,김혜수 믿고 보는 영화! 볼만합니다 백번 보고싶을 정도.  ,1,0,0
2090,2015.05.04,6,관람객역시김혜수 짱카리스마 연기도 짱  ,1,0,0
2091,2015.05.04,9,그냥 보면 됩니다 진짜 멋있고 김혜수.. 영화도 재밌어요  ,1,0,0
2092,2015.05.04,8,매력적인 영화 차이나타운 예고편 보고 기대했는데 그 이상의 것들이 들어있다  ,1,0,0
2093,2015.05.04,9,주연 뿐만 아니라 조연들까지 연기 대박임ㅋㅋ  ,1,0,0
2094,2015.05.04,9,뭘 말하고 싶은지 모르겠다는 관람객들에게는 한 인간의 비극에 이유가 있어야 하는지 물어보고 싶다. 괜찮은 영화였다. 희망적인 메세지 하나 없는것이 이 영화의 매력.  ,1,0,0
2095,2015.05.04,10,한국영화중에 이런 수작이 탄생할 줄이야.. 김고은도 대박이고 ㅜㅜ  ,1,0,0
2096,2015.05.04,9,"나 죽이러 올거니 ?    .,.,.,.,.,  ",1,0,0
2097,2015.05.04,10,우리 상섭이 연기잘한다. 항상 응원하겠어요  ,1,0,0
2098,2015.05.04,1,정말 진심 무슨 내용인지.. 내용이없음.. 아. 하나 있다면 장기조심..  보다 암걸릴뻔한 영화  ,1,0,0
2099,2015.05.04,6,관람객스릴감은 있으나 너무 잔인한 영화인것 같습니다^^  ,1,0,0
2100,2015.05.04,8,여자들은 감정 이입이 잘될듯.티슈한장 필요^^;; 악간 부자연스런 전개 빼고는 잘 만들어진 영화  ,1,0,0
2101,2015.05.04,10,한국영화의 새 역사를 보앗다 간만에 눈 정화 제대로 했음  ,1,0,0
2102,2015.05.04,10,배우들의 연기가 좋고 무거운 소재지만 전체적으로 흥미진진했어요!  ,1,0,0
2103,2015.05.04,10,김혜수 카리스마 아직도 살아있다! 이게 명불허전이라는거야 ㅠㅠ  ,1,0,0
2104,2015.05.04,9,김고은 연기 참 잘한단말이야.. 이번영화에서도 굿.. 차이나타운 입소문타고 흥행하는듯..  ,1,0,0
2105,2015.05.04,9,애낳아 버리는 패륜범들에게 경종을 울리는 영화  ,1,0,0
2106,2015.05.04,9,"이런게 정말 있을까?.., 하는 생각도 들고 무언가 많은걸 말하고 이야기해주는 듯한 느낌? 괜찮은 영화였습니다.  ",1,0,0
2107,2015.05.04,10,다시보고싶은영화! 배우들 연기 대박!  ,1,0,0
2108,2015.05.04,10,전 이영화 만점주고싶네요..보는 취향마다 다 다른느낌이겠지만 정말 집중해서 너무잘봤습니다.배우들 연기력은 감히 말할것도 없이 최고였고 스토리또한 좋았습니다.무거우며 현실적으로 무서운 그런영화ㅡ최고  ,1,0,0
2109,2015.05.04,10,스토리 뭐어쩐다 재지 말고 그냥 봐요 김혜수 연기만으로 영화끝날때까지 눈과 귀가 소름  ,1,0,0
2110,2015.05.04,1,"휴... 초반시작부터 나가려다가 참고 봤는데, 그냥 나갈걸,,, 아이고 내돈과 시간 물어내라...  진짜 쒸레기네...  ",1,0,0
2111,2015.05.04,10,재미업다고하는사람들은 내용이해를 못한듯 ㅋ김혜수가 후계자를 일영이로 생각하고잇엇던거고 맘속으론일영이를  딸로생각하고잇엇고 나중에 일영이에게 적을두고싶지안아 주위 다죽이고 죽은거임 ㅋ  ,1,0,0
2112,2015.05.04,8,관람객김혜수가 중심잡고 김고은이 맘껏 날개를 펼칩니다.  ,1,0,0
2113,2015.05.04,1,나중에 18세미만애들이볼까봐겁이납니다어차피보게되게찌만 이영화가말해주는것은 (존속살인 매정 잔악 배신 보복 장기매매 인신매매 마약) 영회제작자님들비싼돈들여서이런영화만들지마시고  제발감동적인것좀만들어주세요 이시대는감동이필요합니다  ,1,0,0
2114,2015.05.04,10,역시 김혜수라는 말밖엔  ,1,0,0
2115,2015.05.04,5,관람객영호ㅏ 중반부터 몰입도가 떨어지더라구요 뒤로갈수록살짝 지루(?) 했어요 ㅠ  ,1,0,0
2116,2015.05.04,10,오랜만에 잘 봤습니다 다음 영화도 기대할꼐요  ,1,0,0
2117,2015.05.04,10,기대안하고보면재밌음  ,1,0,0
2118,2015.05.04,1,관람객잔인하기만하다...  ,1,0,0
2119,2015.05.04,1,진심재미없음 일영이 사랑에빠진남자는 오지랖이 기네스 수준이고 비중도없는데 식구들끼리 담구고 복수하는게다임  ,1,0,0
2120,2015.05.04,10,암튼 말이  필요없네요 강추 ㅋ  ,1,0,0
2121,2015.05.04,8,김혜수씨와 김고은씨의 연기가 정말 돋보이는 영화인거 같습니다.역시 김혜수씨네요 짱!!  ,1,0,0
2122,2015.05.04,10,힘 뺀 김혜수표 진한 연기  ,1,0,0
2123,2015.05.04,7,관람객배우들의 연기는 나무랄데 없으나 후반부로 가며 지루해지는 느낌...  ,1,0,0
2124,2015.05.04,5,관람객안타깝다... 그냥...ㅋㅋㅋ  ,1,0,0
2125,2015.05.04,9,영화 몰입도가 최고였다주조연 모두 완벽한 연기력과 개성들느와르 영화를 좋아하는 나는 개인적으로 잘보고 왔다  ,1,0,0
2126,2015.05.04,3,홍주 연기력  생각만 난다.  ,1,0,0
2127,2015.05.04,7,짜장면과 파스타의 대비도 좋았고 원시적 모계중심 사회를 느와르로 표현한 거 같아서 신선했음. 남성보다는 여성들에게 더욱 어필할 영화임엔 분명해 보임.  ,1,0,0
2128,2015.05.04,10,방금 보고 나왔는데 왜 그거 알죠 너무 멋잇는거 보면 와.. 이러면서 헛웃음 나오는거 ㅋㅋㅋ 진짜 김혜수 미친 연기력에 너무 놀래서 헛웃음이 몇번이 나왔는지 ;; 개인적으로 스토리도 너무 좋고 기억에 오래 남을것 같음  ,1,0,0
2129,2015.05.04,5,재미없다.담배피고 폼잡는게 다다.  ,1,0,0
2130,2015.05.04,10,잘봤습니다! 다들 연기잘함  ,1,0,0
2131,2015.05.04,9,관람객김혜수연기  인상깊게봤습니다  ,1,0,0
