index,time,score,reple,1st_week,2st_week,3st_week
1044,2015.05.01,10,관람객뭔가짠하고슬펏던영화엿어여ㅠㅠ 잔인하다고햇는데별로잔인하지않고 재미잇엇어옄ㅋㅋ  ,1,0,0
1045,2015.05.01,9,이해안가는 부분이 많긴 하지만가볍지않게 재미있는영화김혜수 연기 잘함 인정 완전  ,1,0,0
1046,2015.05.01,5,"솔직히 얘기하자.재미없잖아, 스토리별로잖아.돈아깝다 솔직히.  ",1,0,0
1047,2015.05.01,10,갓혜수 .. 천의얼굴이다 배우들 하나하나 다 연기 훌륭했고 스토리도 좋았다 한번 더 보러가고 싶음. 전반적인 분위기가 흐트러지지 않고 끝까지 유지되서 정말 좋았다!!!  ,1,0,0
1048,2015.05.01,2,"돈과  시간이 이렇게 아깝기는 처음이다,  정말 중간에 나가고 싶은 영화임.  ",1,0,0
1049,2015.05.01,9,으으 넘 잔인하다~ 스릴러 치곤 덜 잔인하긴 하지만.... 김혜수 연기 잘하넹~ 김고은은 안영미인줄  ,1,0,0
1050,2015.05.01,9,8.5점인데 반올림해서  9점 아혜수누나  진짜  연기파배우입니다김고은씨은교안봐서처음봤는데  뭔가매력미터지시네요ㅡ내용은살짝지루하지만 연기로점수드립니다 근데혜수누나는돈에왜그리집착했나요??  ,1,0,0
1051,2015.05.01,10,김혜수랑 김고은이랑 목숨걸고 연기력 승부하는 느낌.. 확실한건 둘다 지림....  ,1,0,0
1052,2015.05.01,1,"처음 부터 결말이 뻔히 그려지는 식상한 내용, 액션도 거의 없다시피 하고 오직 배우의 연기력만 보이는 영화. 배우 섭외하느라 시나리오에 부을 돈을 모두 써버렸나 싶을 정도의 연출과 스토리였음. 15년5월1일 세종시 메가박스 저녁9시 관람.  ",1,0,0
1053,2015.05.01,8,관람객믿고보는 김혜수  카리스마  ,1,0,0
1054,2015.05.01,10,진짜 김고은연기력이...날이가면서 몰입도가..크네요  ,1,0,0
1055,2015.05.01,7,배우들은 연기 잘하는데 내용이 개연성이 없어서 실망...ㅠ 이 배우들 가지고 더 잘 뽑을수 있었을텐데 아쉽네요  ,1,0,0
1056,2015.05.01,1,관람객근래에 본 영화중 시간이 아깝다고 느끼는 것은 이 영화가 첨이다.  ,1,0,0
1057,2015.05.01,3,관람객먼내용인지 ㅡㅡ 이도저도아닌  ,1,0,0
1058,2015.05.01,2,내 앤간함 점수 후한데 이영화는 뭘 보여 주겠다는 거냐 도대체가  복수?  아님 범죄 스릴러 ? 뭔가를 짬봉해놓으며 이도 저도 죽도아닌 작품을 만들었네 안 자고 보느라 힘들었다 절대 돈내고 보지마라  ,1,0,0
1059,2015.05.01,1,댓글단사람들은 정말 일반관객일까?  사람마다 다 다르다지만 도대체 뭘 말하고싶은지..전혀 공감되지않는 영화..아..진짜 내가 이상한가...  ,1,0,0
1060,2015.05.01,9,영화는 영화일뿐~/굳이 꼭 뭘 말하고 감동주고 그럴필요가있나 싶은 영화그냥 영화 한편  신선~~여자배우들  ,1,0,0
1061,2015.05.01,7,관람객전형적이고 쓸쓸하리 만치 직관적인 문법의 장르영화.  ,1,0,0
1062,2015.05.01,10,물론 잔인한걸 싫어하는사람은 평점이 낮겠지만 김혜수 김고은의 명연기가 자칫하면 노답영화가 될뻔한걸 명영화로 바꿔놓네요  ,1,0,0
1063,2015.05.01,10,"내가본 느와르 영화중 최고라고는 할 수 없지만,  차이나타운과 함께한 2시간은 많은 생각속에 몰입할수 있는 시간이었습니다.  ",1,0,0
1064,2015.05.01,9,모든 배우들의 연기는  말할것도 없이 좋았고 끝나는 시간까지 내용이 알찼으나 어디서 본것같은 데자뷰를 느꼈기에 별한개를 뺌  ,1,0,0
1065,2015.05.01,10,김혜수씨 좋아해서 봤는데 생각만큼 재밌게 잘 봤습니다. ^^  김고은도 정말 매력있었어요 ㅎㅎ  ,1,0,0
1066,2015.05.01,9,개인적으로 느와르물은 안좋아하지만 좋아하는 배우가 나와서 보게 되었다. 주인공 두 여배우들의 연기는 뭐 두말하면 입아프고 나머지 조연들의 연기도 너무 잘한다  ,1,0,0
1067,2015.05.01,8,감독이 유명한 작품 배경이 없는 감독이라서...?식구란 사전적 의미를 찾아보고 엄마라는 우리가 자주부르는 단어를 다시 생각해보는거야...느와르란 뜻도 알아보고...평론가 평가 등급이 느와르급이라고 봄.다만 감독님이 옥의티는  별 한쪽  ,1,0,0
1068,2015.05.01,10,친구랑 오늘 보고왔는데 진짜 재밌게 봤어요! 다들 연기를 짱..  ,1,0,0
1069,2015.05.01,7,지하철 보관함에 버려진 아이. 그리고 차이나타운. 그래서??? 흡입력있는 모티브를 뻔한 줄거리로 망친 케이스. 배우들 연기는 좋았으나....  ,1,0,0
1070,2015.05.01,6,관람객좀잔인함... 살기위해 누군갈죽이고 죽어요하는...버려진아이 혼자 살아남기위해 누굴죽여야하늠안스럽지만 보는내내 헐 윽 헉 반복  ,1,0,0
1071,2015.05.02,9,기계적인 유머와 눈물로 점철되던 한국영화에 나타난 단비와 같은 영화 가슴 벅차고 설레인다.  ,1,0,0
1072,2015.05.02,10,연기력이 살린 영화. 쓸모사회.  ,1,0,0
1073,2015.05.02,9,관람객재밌었어요.스토리 중간중간 조금 엉똥한부분 있지만.전체 스토리가 너무 좋았어요.김혜수가 좋아서 선택한 영화는때.잘 선택한거 같아요.  ,1,0,0
1074,2015.05.02,8,"김혜수의 명연기로도 채울수 없었던, 아쉬웠던 영화의 짜임새조금만 더 완성도가 높았다면 역대급 연기로 오래도록 기억될수 있었을 텐데...  ",1,0,0
1075,2015.05.02,10,김혜수 연기 b 스토리는 걍 그런데 배우들 연기가 좋았어요  ,1,0,0
1076,2015.05.02,10,"김혜수는 말 할 것도 없고, 김고은 참 이쁘다.  ",1,0,0
1077,2015.05.02,8,관람객김혜수의 연기력이 돋보이는 영화  ,1,0,0
1078,2015.05.02,7,관람객음 그저 그럭 갠춘햇음ㅋㅋ  ,1,0,0
1079,2015.05.02,7,이런 류의 영화를 좋아하는건 아니지만 스토리도 그렇고 배우들 연기까지 다좋았고 전체적으로소름돋았다ㅎ특히 박보검 오빠님ㅜㅜㅜ사랑합니다♡  ,1,0,0
1080,2015.05.02,8,분위기와 연출 연기력은 수준급이었는데 스토리가 그것을 받쳐주지못하는거같다..무슨느낌의 스토린지 알겠는데 너무 정직하면서 흐지부지해보임  ,1,0,0
1081,2015.05.02,1,시간이 아까운 영화였다. 어벤져스땜에 볼게없어서 본 영화인데 짱구 극장판 로봇 아빠편이 훨씬 더 감동적이었다  ,1,0,0
1082,2015.05.02,6,그냥 그래요 잔인해요 스토리는 별로 미흡  ,1,0,0
1083,2015.05.02,6,치밀하게 분석한 연기임엔 틀림 없으나 직관에 따라 툭툭 내밷는 연기가  아쉬웠다  ,1,0,0
1084,2015.05.02,8,관람객재밌었음 김고은 이뻐요~  ,1,0,0
1085,2015.05.02,6,흡연장면과 잔인한 장면들은 홍수를 이루고 폼은 진지하게 잡는데 이야기는 별개 없어서 기대이하.  ,1,0,0
1086,2015.05.02,10,난 심지어 저 배우의 이름조차 모른다 하지만 저 배우는 영화가 끝나고 나를 앉은채로 평점을 남기게한 강렬한 연기력을 가졌다 난 이 영화의 평점이 7점대인것에 너무도 안타깝다 그대들의 수준이 그 점수이기에.. 봐라 그리고 느껴라  ,1,0,0
1087,2015.05.02,10,그냥 그들의 연기를 보는 것 만으로 몰입의 기쁨으로  들어간다...  ,1,0,0
1088,2015.05.02,9,첨 볼땐 그냥그랬는데 진한 여운이 계속남아서 한번 더 보게됐다.. 두번째보니 좀 알겠더라 감독은 인물들 각각의 '인생'을 담아내고 싶었던게 아닐까. 장면들마다 담겨있는 숨은 뜻을 곰곰히 생각해가며 봐야하는 영화.. 진지하게 봐야 재미있는 영화다.  ,1,0,0
1089,2015.05.02,9,재밌는데요? 이런게 느와르구나  ,1,0,0
1090,2015.05.02,1,관람객진짜로 재미업다... 쏘 왓??!! 이런느낌  ,1,0,0
1091,2015.05.02,5,딱 5점짜리. 김지운 감독이 되고싶었던 느와르 초짜 감독의 어설픈 범죄영화. 대체 누구의 연기가 좋았다는건가? 김혜수부터 단역까지 모든 연기가 어설프기 그지없었다. 연기때문에 몰입조차 안됨. 게다가 감독의 어설프기 짝 없는 수많은 오마주들. 최악  ,1,0,0
1092,2015.05.02,10,진짜 시간가는줄모르고 봤네요~~~연기진짜 쩔구~~~  ,1,0,0
1093,2015.05.02,5,관람객김혜수 연기가 다른연기자들 연기를다 죽게 만드네요~연기 너무 잘하네요^^  ,1,0,0
1094,2015.05.02,10,좋았습니다 연기 정말 최고였어요!  ,1,0,0
1095,2015.05.02,9,관람객중간중간에  비현실적인 요소가 있긴하지만.. 그럭저럭볼만함  ,1,0,0
1096,2015.05.02,10,캐스팅 연기 음악 연출 어느하나 부족함이 없어요  ,1,0,0
1097,2015.05.02,9,스토리만 따져 본다면 개연성이 뛰어난 영화는 아니지만(박보검이 맡은 역이 왜 그렇게 김고은한테 큰 영향을 미치는지 전혀 납득이 가지않았다. ) 인물 하나하나가 매력 있었고 무엇보다도 영화 특유의 음울한 분위기가 마음에 들었다  ,1,0,0
1098,2015.05.02,10,관람객좋아요. 김고운씨짱 김혜수짱  ,1,0,0
1099,2015.05.02,10,내가 휴지챙기니까 왜챙기냐햇지!! 거봐 눈물나지 왠지 그럴 것 같앗어 믿고보는 김혜수인데 김고은 연기 잘함 ㅠㅠㅠㅠ 그 감정선의 연결 너무 좋다ㅜㅜ 보물 하나 발견한 느낌 ㅋㅋㅋㅋ  ,1,0,0
1100,2015.05.02,10,후까시만 잔뜩잡고 알맹이가 없는 영화 그래도 갓혜수누님때매 10점 줍니다  ,1,0,0
1101,2015.05.02,10,아 진짜 잼있었다 몰입도 장난아니네...어벤저스랑 겹치지만 않았음 최고였을텐데..ㅠ  ,1,0,0
1102,2015.05.02,9,호불호가 있을만한 영화이긴한데 저는 재밌게 봤어요! 김혜수 연기가 진짜 대단ㅋㅋㅋ 영화끝나고 짱개먹고싶었음보다보면 결말이 예상되긴하지만 돈은 하나도 안아까워요  ,1,0,0
1103,2015.05.02,10,배우들 연기 너무 잘해요~영화 잘 봤습니다  ,1,0,0
1104,2015.05.02,10,너무 잘봤어요정말 김혜수님의 카리스마가 대단했어요배우분들 모두의 연기력에 감탄했습니다^^  ,1,0,0
1105,2015.05.02,7,관람객아쉽다 정말... 뭔가 심히 부족한데 혜수누님말고 볼게없네  ,1,0,0
1106,2015.05.02,8,안타깝다. 김고은과 김혜수의 매력은 120% 발휘된다. 하지만 뒷받침 되는 스토리가 너무 통속적이다. 기존 잔인느와르에 여성의 정서만 가미된 느낌이랄까.. 개인적으로는 19금으로 간김에 더욱더 자극적이고 잔인하게 표현했으면 좋았으면 한다.  ,1,0,0
1107,2015.05.02,7,관람객너무잔인함이 영상을볼수없게한듯하다  ,1,0,0
1108,2015.05.02,10,"굿  ,, 김혜수와 김고은 연기력이 절정이엿던영화  ",1,0,0
1109,2015.05.02,1,이걸 왜 봤지? ..ㅜㅜ  ,1,0,0
1110,2015.05.02,3,이게영화임?긴장하나도없음 노잼  ,1,0,0
1111,2015.05.02,10,김고운 걸크러쉬쩌네요...! 마지막에 소름~  ,1,0,0
1112,2015.05.02,7,관람객추천! 재밌게 보고 왔어요!  ,1,0,0
1113,2015.05.02,6,여성이 주체가 된 느와르의 신선한 매력.  ,1,0,0
1114,2015.05.02,10,good! 혜수언니연기쩖!!!!  ,1,0,0
1115,2015.05.02,1,이것도 영화라고ㅡㅡ망함  ,1,0,0
1116,2015.05.02,7,관람객다죽이고ㅠㅠ그래도혜수언니는여전히멋있쪙!  ,1,0,0
1117,2015.05.02,1,관람객너무너무 재미없었어요ㅜㅜ 최악이네요  ,1,0,0
1118,2015.05.02,10,느와르 여성버젼..뻔할수있는 스토리지만 각본이 너무잘짜여져있어 몰입도가 최상이었음 김혜수영화는 믿고보지만 정말 연기를위해 태어나신분 김고은도 정말 기대되는 배우 그외 캐스팅 너무잘하신듯 배우빨로 먹는영화가아닌 진짜 연기파 영화 최고예요  ,1,0,0
1119,2015.05.02,10,마지막 처맞고 트렁크에서 일어나 혼자 독백하는 장면에서 몇년전 내 모습을 보았다 ....울컥하더라  ,1,0,0
1120,2015.05.02,7,관람객감정포인트잡기가힘듬  ,1,0,0
1121,2015.05.02,9,관람객혜수언니  짱짱감동도있고  사랑도있고  ~~~  ,1,0,0
1122,2015.05.02,10,혼자본영화몰입도최상 ...김혜수님연기가참좋았던차이나타운...오랜만에 좋은영화봤다했는데평점이참낮네요.ㅠ  ,1,0,0
1123,2015.05.02,1,별점 반개 아까운데... 이런식으로 홍보하면서 쓰레기 팔아먹지 말았으면 좋겠다.  ,1,0,0
1124,2015.05.02,10,완전 재밌어요 연기도 굿굿   김혜수 김고은..  매력있네요^^ 분위기있는영화  ,1,0,0
1125,2015.05.02,9,"김혜수, 김고은이 나온다고 해서 봤는데요 기대했던 것보다 더 재미있었어요 역시예요ㅎ 피튀기는 거 별로 안좋아하는데 억지스러운 흐름이 없어서 좋았고 상영 내내 숨죽여서 봤어요 하지만 영화보고 난 뒤 우울함을 느끼지 않고 싶은 분들께는 비추에요ㅎㅎ  ",1,0,0
1126,2015.05.02,1,김혜수씨가아깝네요…진짜속상  ,1,0,0
1127,2015.05.02,5,관람객김혜수씨 연기가 아깝네요..아쉽습니다  ,1,0,0
1128,2015.05.02,10,"영상,음악,연기,배우..다 마음에 들었던 영화에요. 예술영화 좋아하는 편이라 잘 봤어요. 일영이가 채무자아들의 친절에 마음을 여는 장면중 영화관씬 보면서 많이 울었어요. 사랑받아 본 적 없는 사람의 모습이 짠해서. 쌩뚱은 김혜수캐릭터였지만...  ",1,0,0
1129,2015.05.02,1,연기는 인정이지만 재미없다.뭔가 있겠지 기다리다 후반에 잤다.ㅡㅡ  ,1,0,0
1130,2015.05.02,9,김혜수는 살이 찌고 안찌고를 떠나서 너무 섹시하더라...진심 이 언니는 눈빛이 다 잡아먹었어 김고은도 연기 너무 잘하고 잔인하면서도 현실적인 차이나타운의 이야기. 보고 토할뻔했어요  ,1,0,0
1131,2015.05.02,9,재밌기만하고 배우들 연기 오지게 잘만 하드만 별로라고 하는 분들은 뭐지?  ,1,0,0
1132,2015.05.02,6,배우의 연기력과 연출상의 분위기만으로 영화가 완성되지는 않아요.  ,1,0,0
1133,2015.05.02,2,우울한 영화입니다. 전 당한 느낌...  ,1,0,0
1134,2015.05.02,10,올해 최고의 영화!영화를 보고 나온 후에도  계속 생각나는 씬들  ,1,0,0
1135,2015.05.02,9,전넘잼있게봤네요 연기들도넘잘하시고 역시김혜수의카리스마는 굿!  ,1,0,0
1136,2015.05.02,10,관람객꿀잼 왕잼 다들 연기력...개인적으로 삼촌  ,1,0,0
1137,2015.05.02,9,연기가너무좋아서몰입도가높고시간가는줄모르게잘봤어요.김혜수는역시우리나라독보적인캐릭터의여배우네요김고은도너무기대되는배우입니다  ,1,0,0
1138,2015.05.02,10,김혜수야 원래 믿고보는 배우지만...김고은..일영이가 잊혀지지않음... 은교 이후로 김고은한테 또 한번 반함...  ,1,0,0
1139,2015.05.02,7,"애기일영이는 어떻게 데려왔는지 연기를 너무 잘해서 놀랐고, 디테일이 부족해 중간중간 몰입도가 떨어지기도했지만 배우들이 살린영화라고 생각함. 아쉽다 이 영화.  ",1,0,0
1140,2015.05.02,8,김혜수란 이름값을 톡톡히 한 영화!!  ,1,0,0
1141,2015.05.02,10,오늘 관람하고왔습니다배우들이 다들 연기를너무잘하셔서영화에몰입하다보니 시간가는줄몰랐습니다꼭보세요.후회안하실꺼에요  ,1,0,0
1142,2015.05.02,3,무엇을 보여주려는 건지 의도를 알 수가 없다. 영화의 제목 또한 무엇을 의미하는지 전혀 알 수가 없다. 그저 비와 피와 담배만 기억에 남을 뿐  ,1,0,0
1143,2015.05.02,1,ㅡㅡ뻔한내용 지루함의극치  ,1,0,0
1144,2015.05.02,10,공짜표로 본건데 기대가 너무 없어서였는지 너무 잘봤어요 지루할틈도 없고 다시 돈내고 보러가려구요  ,1,0,0
1145,2015.05.02,10,뭘 말하고 싶은건지...어쨌거나  기워진 시나리오라도  배우들의 탄탄한 연기로 지루하진 않음~~김혜수 연기는~참 볼수록 깊이를 더해가는듯.그래서 10점 다 줬다^^  ,1,0,0
1146,2015.05.02,1,관람객내용이 없고 잔인하기만 함...  ,1,0,0
1147,2015.05.02,10,관람객그냥 봐야함.... 혜수누나의 연기란....크  ,1,0,0
1148,2015.05.02,10,김혜수연기력짱입니다  ,1,0,0
1149,2015.05.02,6,기대를 너무 많이 했나. 그래도 배우 덕에 살았네요  ,1,0,0
1150,2015.05.02,10,감독의 다음 작품이 벌써 기대됩니다가지고있는 시나리오들 궁금합니다  ,1,0,0
1151,2015.05.02,3,"파스타 한 그릇 때문에 범죄가정 파탄나는 거의 코미디 수준의 영화. 깡패들은 김고은 배에 태울 때 주머니에 칼 있는지 없는지 확인도 안하고, 거의 911 테러급. 이런걸 진지빨고 한국형 스릴러의 탄생이니 뭐니 헛소리를 하고 있으니 영화 수준을 알만함.  ",1,0,0
1152,2015.05.02,10,재미있습니다 열자끝.  ,1,0,0
1153,2015.05.02,10,완전 집중해서 봤어요  재밌어요  ,1,0,0
1154,2015.05.02,7,김고은이 아닌 다른 배우였으면 어땠을까 하는 생각이 들었다. 갓혜수는 최고였고 그 밖에 다른 조연들도 멋있었다. 스토리 자체의 개연성은... 많은 걸 담으려고 하다보니 매끄럽지 못한 느낌..  ,1,0,0
1155,2015.05.02,1,이 영화는 마치 남자 같은 늙은 여자가 깃발 들고 깽판치는 수준이며 피로 시작해서 피로 끝나는 영화다. 쉽게 설명하면 이 영화는 쓰레기 이며 여기 알바들 말에 속지 마삼. 내가 이 영화 볼때 어떤 사람은 기분이 상했는지 문을 '쾅' 닫고 가버렸다.  ,1,0,0
1156,2015.05.02,7,관람객내용은..솔직히 여성판 달콤한 인생+공모자들 짬뽕느낌ㅋㅋ혜수누님의 연기는 끝이없네요  ,1,0,0
1157,2015.05.02,1,죽이고 담배피고 죽이고 담배피고  ,1,0,0
1158,2015.05.02,7,잔인한 장면이 많아 끔찍했다 김혜수뿐만아니라 신인 김고은남자배우들의 연기력에 박수 . . .다음 영화는 폭력적이지 않은걸로  ,1,0,0
1159,2015.05.02,10,흘들어놓앗니  엄마눈에서 피눈물이올라오면 * 먹먹해지는 기분은뭐지    영화라지만  ,1,0,0
1160,2015.05.02,10,박수쳐주고 싶습니다. 감사합니다.  ,1,0,0
1161,2015.05.02,5,증명해봐. 네가 영화로서 아직 쓸모있다는 증명  ,1,0,0
1162,2015.05.02,1,"필자는 영화평점 쓰는거 처음인데 위에 평점들보고 낚이지 마세요. 남자 나올때부터 모든게 오글오글, 결국보다가 포기하고 나왔습니다.  ",1,0,0
1163,2015.05.02,4,관람객기대에 비해 실망스러운 영화현실감과 동떨어진 전개  ,1,0,0
1164,2015.05.02,3,헐..진짜 평점 알바라는데 있나봄..완전 재미없던데 사람들 다 찬양하네  하지만 배우들 연기력은 인정해서 별세개 드림 김혜수하나 김고은 하나 홍주 하나 ㅋㅋ  ,1,0,0
1165,2015.05.02,9,호불호가 심한 영화인가보네 도대체 왜이렇게 평점이낮지??난 엄청 재미있게 봤는데?;  ,1,0,0
1166,2015.05.02,10,역시 김혜수는 완벽하고 아름다워요.... 김고은도 완벽~  ,1,0,0
1167,2015.05.02,10,관람객역시 김혜수 말이 필요없어요  ,1,0,0
1168,2015.05.02,1,내가 만들어도 이거보단 낫겠음  ,1,0,0
1169,2015.05.02,7,두배우의 연기력은 최고이나 스토리 연결이 개판  ,1,0,0
1170,2015.05.02,10,한국영화 힘들게 겨우 키워 놨더니 대기업이 낼름 시장 다잡아먹고 이게 뭐냐 진짜  ,1,0,0
1171,2015.05.02,10,관람객역시 김혜수소품하나 하나 감동의 연속김고은 또한 새롭다 신비롭다화이를 보고도 이런 느낌 이엿지만우리가 모르는 진짜 저런 세계가 존재할까  ,1,0,0
1172,2015.05.02,8,관람객재미있지만 잔인하고. 안쓰러운 주인공들..  ,1,0,0
1173,2015.05.02,9,관람객주제의식이 확실한 김혜수를 위한 간만에 빠져든영화  ,1,0,0
1174,2015.05.02,10,재미있게 잘 봤습니다!!!! 김혜수!!!연기 굿!!!  ,1,0,0
1175,2015.05.02,10,재미있고....역시..김혜수..  ,1,0,0
1176,2015.05.02,6,관람객김고은의 연기가 돋보이지만 내용이 별로 없네요..죽이고 죽이고 죽이고 죽이고 영화 끝...  ,1,0,0
1177,2015.05.02,10,관람객짱잼졸잼근데좀징그러웟음  ,1,0,0
1178,2015.05.02,7,관람객영화 잼나게 봤는데 소름끼친 장면이 여러군데 있었지만잘보고 왔네요.  ,1,0,0
1179,2015.05.02,10,오랜만에 영화다운 영화를 본것 같았다.  마치 달콤한 인생의 여자판 같은 느낌이였다.   평점 10점 주는건  전체 평점이 낮아보여서 제 기준은 평점 8~9정도  일영이 귀엽네     대사들이 참 귀속을 맴돈다 .  너 왜태어 났니  ,1,0,0
1180,2015.05.02,10,보고나서 소름돋았어요.  ,1,0,0
1181,2015.05.02,10,관람객역시 혜수누나 보러갔었는데 역시나가 역시더군요 굿!  ,1,0,0
1182,2015.05.02,10,역시 김혜수... 기대를 저버리지 않았음..  ,1,0,0
1183,2015.05.02,10,김혜수 연기 갑 ㅡ 여성 느와르가 이런거구나  ,1,0,0
1184,2015.05.02,10,잘봤습니다 10점 남겨요  ,1,0,0
1185,2015.05.02,5,헛웃음뿐 이걸 돈주고봤다니ㅠ아저씨와 달콤한인생 섞음느낌 암튼 넘 실망스러움ㅠ  ,1,0,0
1186,2015.05.02,5,"프랜시스 포드 코폴라 감독의 대부의 가족의 비극은 반복된다는것을 마틴 스콜세지의 리얼리즘으로 연출해볼려고 했지만, 스타일과 연출력과 각본이 전부 부실하다. 김고은은 캐릭터에 실패했지만, 김혜수와  조연들의 캐릭터가 살아서 5점정도이다.  ",1,0,0
1187,2015.05.02,5,쓸데없이 진지해...  ,1,0,0
1188,2015.05.02,8,스스로 결정해라....  ,1,0,0
1189,2015.05.02,4,돈아까운 영화였다. 그냥 사람피 구경하고 싶으면 보시길. 상당수가 팝콘 콜라를 버리고 나왔으니 비위가 약하면 사가지 마시구요.  ,1,0,0
1190,2015.05.02,10,"영화 전체에서 말 한마디 한마디에 의미가 담겨있었고 디테일한 소품, 색상들이 잘 어울러졌다~ 무엇보다 연기력에 정말 실제로 그렇게 평생 살아온것같은 느낌~! 김고은 짱짱짱  ",1,0,0
1191,2015.05.02,9,ㄱㅊ집중도쩌러여잔인하긴해도 존잼  ,1,0,0
1192,2015.05.02,10,김혜수 최고의배우 증명  ,1,0,0
1193,2015.05.02,1,그냥 이 영화는 쓰레기 자체인데 알바들 평점으로 올라간듯 이건 그냥 내용없고 잔인하기만 한 쓰레기임  ,1,0,0
1194,2015.05.02,10,김혜수연기굿...진짜멋잇음영화너무집중잇게잘봤음강추!!!!  ,1,0,0
1195,2015.05.02,9,"상당히 어두운 전체분위기와 달리, 결국엔 그속에서 보이는 각자의 엇갈리는 잔정과 의리를 느낄수 있는 대목들이 꽤 있습니다. 우리 인생도 칼만 안들었지 잔혹한 차이나타운 같다는 생각이 꽤 들었습니다. 크게 뇌리에 남은 영화입니다.  ",1,0,0
1196,2015.05.02,2,관람객진짜 재미없네 돈아깝다  ,1,0,0
1197,2015.05.02,7,김혜수의 극강 연기력과 박보검의 조금 어정쩡한 연기력  ,1,0,0
1198,2015.05.02,9,배우들 연기 다 좋고...잼있게 봤습니다!!  ,1,0,0
1199,2015.05.02,9,두시간동안 지루하지 않은적은 손에 꼽는데그 중에 한 편  ,1,0,0
1200,2015.05.02,1,올해 최악의 영화다 쓰레기  ,1,0,0
1201,2015.05.02,10,완전 잼있게 집중하면서 봤습니다  ,1,0,0
1202,2015.05.02,3,정말 비추입니다...여주인공 연기부분에서 어색한부분이 많아서 몰입도 깨지고 스토리도 뮤언가 많이 보여주려 했던것 같았지만 와닿지도 않고 재미도 없고...이영화에서 잘표현한건 잔인한게 다네요..  ,1,0,0
1203,2015.05.02,10,재미있게 봤음. 확실한게 맘에드네.  ,1,0,0
1204,2015.05.02,1,연기는 좋은데 (박보검은 최악) 줄거리이 개연성이 하나도 없음  ,1,0,0
1205,2015.05.02,3,"관람객내용이 알차지 못함.액션은 없고 잔인함만있음.미니시리즈 1,2편 정도 본 느낌.  ",1,0,0
1206,2015.05.02,10,여운이 길게가는영화도 진짜 오랜만. 여배우들의 느와르.. 갓혜수 김고은 진짜 보는내내 감탄하며 봤다  ,1,0,0
1207,2015.05.02,10,김혜수가 워낙 연기를 잘하는건 알았지만 이번영화에서는 더 빛나더라구요>_<  ,1,0,0
1208,2015.05.02,1,김혜수는 왜 이영화를 택했나?  ,1,0,0
1209,2015.05.02,5,"잔인하기만하고, 무슨 내용인지 이해 안감! 어벤져스 볼껄!  ",1,0,0
1210,2015.05.02,5,연기는 평정 백개  내용은 평점 0뭘 말하고싶은지모르겠고 잔인하기만함  ,1,0,0
1211,2015.05.02,10,김혜수 포스 작렬..ㅎㅎㅎ  ,1,0,0
1212,2015.05.02,10,카리스마.. 김고은도 장난 아니더라  ,1,0,0
1213,2015.05.02,10,ㅋㅋ진짜 쉽지 않은 선택이었을텐데 김혜수에게 무한 응원을!  ,1,0,0
1214,2015.05.02,1,뭐지 이 영화에 10점 주는 사람들은? 조조 6000원이 진심으로 아까웠던 영화  ,1,0,0
1215,2015.05.02,10,"김혜수의 절대 카리스마!!!우리나라에 김혜수라는 여배우가 있다는 게 자랑스럽다 영화자체는 굉장히 무겁고 잔인했다 이런 류의 영화를 좋아하는데, 신세계보다 잔인한 느낌~~홍주가 진짜 무서웠음....  ",1,0,0
1216,2015.05.02,9,대박나길ㅋㅋ 어벤져스 때문에 이영화 묻힐까봐 괜히 걱정됨..훨씬 재밌어요!!  ,1,0,0
