index,time,score,reple,1st_week,2st_week,3st_week
2826,2015.05.07,10,김고은이란 배우를 뇌리에 각인시킬수 있었던 영화였다.김혜수는 말할것도없이 최고의 여배우-  ,0,1,0
2827,2015.05.07,10,그래.결정은 한번이고 그게 우리 방식이야  ,0,1,0
2828,2015.05.07,2,"아저씨의 장기매매, 화이의 아빠 새로운 것이 하나도 없다  ",0,1,0
2829,2015.05.07,1,거의 두시간 내내 칼로 쑤시고 피만 오질라고 나오는영화... 김혜수가 죽을때 뭔가 있을 줄 알았는데 이건 뭐... 성인요금내고 보기 아깝다  ,0,1,0
2830,2015.05.07,5,관람객무엇을말할려는건지 이해가안갔음.영화끝나고나서도 사람들 조용..무거운소재의영화  ,0,1,0
2831,2015.05.07,7,관람객그냥  볼만해요.  김혜수  고은 연기  잘하고  ,0,1,0
2832,2015.05.07,7,"스토리가 전하고자하는 바는 대충 알겠지만 진부한 스토리구성이 아쉽네요. 배우들의 연기는 좋구요, 주연들 연기도 좋지만 갠적으로 지체장애인을 연기하신분의 연기력이 인상깊어요  ",0,1,0
2833,2015.05.07,5,김혜수의 연기력은 몰입도 최고!!! 스토리는 그닥  ,0,1,0
2834,2015.05.07,9,남자애 오글거리는 바람둥이 연출 빼고는 아주 좋다.  ,0,1,0
2835,2015.05.07,9,"좋았어요. 특히 김혜수 연기. 다만 쏭의 죽음을 더 잘 살릴 수 있었을거 같은데, 너무 허무한 자살  ",0,1,0
2836,2015.05.07,8,특별한것없는 스토리이지만 김혜수 김고은 두 여배우의 조화가 환상적이다. 김혜수야 대한민국 대표 여배우지만 김고은도 개성있고 매력있었다.  ,0,1,0
2837,2015.05.07,6,관람객좀 잔인한 장면이  많아서  많이 놀랬네요.그것 외에는 괜찮아요.  ,0,1,0
2838,2015.05.07,3,그냥 재미없는 영화. 추천할수없는 영화.  ,0,1,0
2839,2015.05.07,9,호불호가 갈리는 영화인 듯 하여  망설이다 보았는데 전 괜찮았어요. 잔인한 면이 있었으나 연기 잘하셨고 짠하면서도  찡했네요.^^  ,0,1,0
2840,2015.05.07,1,진심유치해죽겟다지금보는데욕나와서못보겟다아짱나OO개오그라드네  ,0,1,0
2841,2015.05.07,1,담배만 맛깔나게 피는구만  ,0,1,0
2842,2015.05.07,8,관람객정말정말정말정말정말매우매우재밌었어요  ,0,1,0
2843,2015.05.07,10,관람객별기대안했는데 재밌게봤습니다  ,0,1,0
2844,2015.05.07,5,김고은 너무나 기대되는 배우이지만이 배역을 맡기에는 사랑받고 자랐다는 느낌이 너무 많이 든다.. 삼류도 모자른 느와르영화 이영화에서 건진거라고 고경표? 그 배우 하나  ,0,1,0
2845,2015.05.07,10,전달하고자 하는 메세지와 여운이 깊이 남는 꽉찬 영화다 밑바닥 현실을 잘 꼬집어 주고 있다  ,0,1,0
2846,2015.05.07,9,재밌었다. 김고은과 김혜수의 연기를 보는 것 만으로도...아쉬운 것은 마지막 장면.  ,0,1,0
2847,2015.05.07,7,"관람객뭔가 허전함...,,..  ",0,1,0
2848,2015.05.07,10,관람객이건 완전 꿀잼이야 김혜수 연기 엄청잘함  ,0,1,0
2849,2015.05.07,5,관람객포맷이너무뻔함  예상가능  ,0,1,0
2850,2015.05.07,6,김고은의 연기 말고는 특별한 것이 없었던 것 같다.  ,0,1,0
2851,2015.05.07,6,관람객배우들의 연기는 좋았지만 개연성이 없어서 몰입이 어려웠습니다  ,0,1,0
2852,2015.05.07,3,영화보고 밀려오는 후회감에 1점 주려다 알바라고 할까봐 3점줌. 네이버 평점 7점대 영화는 항상 아쉬웠는데 이 영화는 조만간 4점 찍을듯. 스토리도 없고 그럴듯한 액션신도 없고 연개성없이 사람만 죽어나가고 연기? 식후땡 연기가 제일 인상적이었다.  ,0,1,0
2853,2015.05.07,3,어벤져스 볼려다 이거봤는데 보지마라 레파토리 뻔하고 스토리 예상이 다된다 노답 영화 생돈 날리지말고 그 돈으로  딴거해라  ,0,1,0
2854,2015.05.07,10,김혜수는 말할것도없고 김고은의 연기가 정말 인상깊었어요 매력적인마스크도 좋았구요!  ,0,1,0
2855,2015.05.07,2,평점 등록해본적 없는데아 진짜 ..뭔 말을전하고 싶은건지도 모르겠고뭔내용인지도 모르겠고 굳이 꼭 보고싶으시다면기대하지마시구 그냥...정말그냥..보세요  ,0,1,0
2856,2015.05.07,9,김혜수 김고은의 연기 정말좋음!말도 안되는 액션 영화보는것 보다 훨~~ 좋음. 흥행되길 바람.  ,0,1,0
2857,2015.05.07,8,연기 몰입도 최고였습니다. 주연 뿐만 아니라 조연들도  ,0,1,0
2858,2015.05.07,2,극장을 박차고 나가고 싶게 만들었던 그런 영화.. 언제 끝나나라는 생각밖에 안들었습니다. 최악...;;  ,0,1,0
2859,2015.05.07,5,그냥 그저그렇네요.. 배우들 연기는 좋았습니다..나름 기대하고 봤는데 재밌진 않었네요;;  ,0,1,0
2860,2015.05.07,7,배우들 연기가 모두  좋았던 영화입니다.특히 김고은의 연기는 정말 매력적이네요.재밌습니다.  ,0,1,0
2861,2015.05.07,8,관람객김혜수의 내공연기 굿!  ,0,1,0
2862,2015.05.07,10,대박 꼭 보세요 김혜수 김고은 연기짱  ,0,1,0
2863,2015.05.07,2,김혜수 얼굴때문에 참고 끝까지 봤다.감독은 무슨 말을 하고 싶었던걸까?내가 본 올해 최악의 영화이다.드라마적인반전의 재미나 액션의 재미도 없이 그저그렇게...  ,0,1,0
2864,2015.05.07,8,김혜수를 믿고 봤는데..역시. 김혜수^^거기에 김고은 연기도 좋구...ㅎㅎ 아쉽다면 몬가? 허전했다는...  ,0,1,0
2865,2015.05.07,1,"꽃뱀에게 홀린 사채업자 + 볼펜은 모나미 = ""18""  ",0,1,0
2866,2015.05.07,2,뭘 말하고 싶은걸까... 난 그저 석현이가 불쌍할 뿐..ㅠㅠ 이게뭐냐고  ,0,1,0
2867,2015.05.07,9,암튼 난 재밌었어요 ~ 조조로 봐서 피곤했는데도 집중해서 봤습니다~ 또 볼거예요~  ,0,1,0
2868,2015.05.07,7,중간내용은 너무 편집된것같고 끝부분은 너무 질질끌어간 느낌..잔인한 장면이 많이나와서 자체 심의하면서 봤음... ;.;평점중에 진짜 최악이라는 평 많은데 그정도는 아니고 꽤 볼만해요!  ,0,1,0
2869,2015.05.07,10,오랫만에 여운남는 영화봐서 기분이 참 좋았습니다. 정말 강추합니다 배경이되는 차이나타운의 사진관도 한번 가보고 싶네요  ,0,1,0
2870,2015.05.07,8,관람객믿고 보는 배우들에김고은을 추가합니다.  ,0,1,0
2871,2015.05.07,10,김혜수와 김고은 소름 돋는 연기네요. 조연들도 다 연기 잘 하고~ 여배우에 대한 편견을 깬 영화입니다. 멋졌어요!!!!  ,0,1,0
2872,2015.05.07,10,기대이상이었음.김혜수와 김고은 둘다빛나는 영화였어요시계 한번도 안봄  ,0,1,0
2873,2015.05.07,9,"속이 깊은 영화. 호불호가 갈릴 수 있을 듯 하나, 다소 억제되는 감정과 말 속에 많은 것이 전해지는 듯. 특히 김고은의 연기 굳굳. 다소 비효율적으로 강조되는 이도 있으나, 나는 그에 대한 이유가 있다고 봄^^ 추천하는영화.  ",0,1,0
2874,2015.05.07,10,평점이너무 낮아 8.4정도 연기력이 영화를 바꾼다  ,0,1,0
2875,2015.05.07,5,주근께나 분장이 더 돋보여 연기 잘하는것 처럼 보이지는 않았나~~~  ,0,1,0
2876,2015.05.07,7,관람객재미있네요 추천합니다  ,0,1,0
2877,2015.05.07,7,관람객화이랑 비슷하다구 생각하시면되구 주연조연들 연기좋습니다  ,0,1,0
2878,2015.05.07,10,연기는 두말할것도 없으며  한국 판 느와르의 향기가 가득한 영화이다  ,0,1,0
2879,2015.05.07,10,관람객연기력....역시!! 여자주인공이 두명인거 오랜만에보고 재밌었다 두시간 시간가는줄 모름  ,0,1,0
2880,2015.05.07,8,후덜덜..  생각지않게 심장잡고 봤음  ,0,1,0
2881,2015.05.07,5,관람객생각보다 재미가없네달콤한인생 빼박  ,0,1,0
2882,2015.05.07,7,"관람객김혜수의 기막힌 연기력, 그 하나로도 충분히 볼만한 영화다  ",0,1,0
2883,2015.05.07,10,관람객김고은이랑 김혜수 연기가 대박이다.  ,0,1,0
2884,2015.05.07,10,정말 재미있게 봤습니다. 왜 평점이 낮은지 모르겠네요;;  ,0,1,0
2885,2015.05.07,10,관람객연기대박 스토리대박 영화끝나면 벙찜ㅌㅌㅋㅋ  ,0,1,0
2886,2015.05.07,10,최고 강렬 애틋 절망 간절 절규오뎅맛있었어요...  ,0,1,0
2887,2015.05.07,4,뭘 하고 싶은지는 알겠으나;;;;부족함이 그지없다..;;한국 영화는 사랑 이야기 없으면 영화가 안되나-_-??좀 뺄껀빼자;;  ,0,1,0
2888,2015.05.07,1,내용무...영화도아님 무ㅓ야이거!!!시간돈낭비 증말화났음  배우가아깝다  ,0,1,0
2889,2015.05.07,5,남는건 배우뿐인영화..뭘말하고싶은건지1도모르겠어요..  ,0,1,0
2890,2015.05.07,10,김혜수 김고은 연기 좋고 시나리오 좋네요.안타깝고 슬퍼서 여러번 울었습니다.강추합니다.  ,0,1,0
2891,2015.05.07,1,시나리오 개판 내용 무 개죽음 영화임 김혜수 데리고 이정도 영화밖에 못만드나 18보는내내 시간 아깝다는건 처음이네  ,0,1,0
2892,2015.05.07,5,"엄마와 일영이 어떤 삶을 살아왔는지, 대사, 연기, 외적 디테일은 섬세했다. 하지만 영화를 본 후 남은 것은 두 인물뿐. 이야기가 단순해서 나중엔 인물을 그저 쳐다보게 되어 아쉬웠다. 장르 클리셰를 걷어내고 관계, 행동의 개연성에 공을 들였다면.  ",0,1,0
2893,2015.05.07,1,평점 0점 줄수없는게 슬플정도  ,0,1,0
2894,2015.05.07,1,평점 높은 이유가 여자들이 박보검때문에 올려주는듯 진짜 뭘 나타내고 싶은건지도 모르겠고 뭐 좀 설명이 나올라 하면 죽이고 죽이고 담배만피고 죽이고  ,0,1,0
2895,2015.05.07,9,배우들의 캐릭터에 대한 몰입도가 좋은듯...  ,0,1,0
2896,2015.05.07,10,"여운남는영화..드물고  눈물흘리고  정말 맘에서 우러나오는 영화 드문데요.  이영화 둘을 다 갖 추었네요. 스토리가  좀  떨어지는부분도 상쇄시킬정도로요., 전 집에서 다시볼 생각입니다.  ",0,1,0
2897,2015.05.07,7,관람객뭘말하고자하는건지. 그래도 김고은은 정말 연기잘하더라.  ,0,1,0
2898,2015.05.07,10,흥미롭고 좋았음 김고은 김혜수 캐미 쩔  ,0,1,0
2899,2015.05.07,8,스토리는 다른분들이 말씀하신것처럼 다소 뜬금없다 느낀 부분이 있었습니다만분위기의 흐름은 마치 찐득한 꿀이 흐르듯 점도있는 느낌이었습니다.다소 독특한 포인트의 슬픔이 느껴졌어요.김고은씨 김혜수씨 연기 정말 좋았습니다!  ,0,1,0
2900,2015.05.07,10,정말 끝나는 내내 몰입해서 봤네요오랜만에 좋은영화 봤습니다  ,0,1,0
2901,2015.05.07,10,관람객재미있게 잘 보았습니다  ,0,1,0
2902,2015.05.07,7,사건만있고 스토리는 없는 느낌. 보는 재미는 있었던 것 같았다 돈아까울정도는아닌데 그냥 배우들 연기보는 맛인듯  ,0,1,0
2903,2015.05.08,9,기대이상으로 생각할거리가 많았던 영화. 김혜수와 김고은의 연기도 훌륭했다.  ,0,1,0
2904,2015.05.08,10,연기에서 소름돋았습니다...대박입니다 ㅠ박성현? 하..주차장에서 .'그 장면'은 차마 눈뜨고 못봤습니다 ㅠ ㅠ ㅠ ㅠ짱짱.하 영화 몰입도 장난아닙니다;;;  ,0,1,0
2905,2015.05.08,7,오로지 배우들의 연기력과 캐릭터로 재밌는 영화주연 조연 할것없이 OOO기를 보여준다..스토리는 정말 걸작이 나오려다 졸작이 되버린꼴..이런 배우들에 이런 연기에 이딴 스토리를 붙이니...스토리만 좋았어도 걸작이되었을 비운의 영화..  ,0,1,0
2906,2015.05.08,4,너무 잔인!  하고 싶은 이야기가 있으면 좀 더 순화해서 ...  ,0,1,0
2907,2015.05.08,5,배우들에게 압도당하다가도 터져나오는 웃음은 어쩔수 없었다. 김혜수가 버텨줬다.  ,0,1,0
2908,2015.05.08,10,주 조연 모두 연기를 너무 잘했어요^^  ,0,1,0
2909,2015.05.08,7,영화내내 집중하며 보긴 했는데 뭔가 약하다. 배우들의 연기는 주조연 할 것 없이 감정이입 해서 보았는데 터져나오는 혈극에 비해서 거기에 따르는 강렬한 감정이 안나와 가슴에 와닿는 임팩트가 약함. 김고은 볼라고 왔는데 김고은 좋아ㅋ  ,0,1,0
2910,2015.05.08,6,관람객나름재밌게봤습니다.  ,0,1,0
2911,2015.05.08,9,관람객재밌게 잘봤습니다 ㅋㅋㅋ 김고은씨 연기 잘하네요 김혜수씨는 말할 것도 없구요 ㅎㅎㅎ 평점이 낮은 것 같아 아쉽네요  ,0,1,0
2912,2015.05.08,8,기대를 안하고 봐서 그런가 나름 재미있게 봤네요.. 김혜수는 워낙 연기를 잘하니까  넘어가더라도 김고운의 연기 발전이 눈부시고 고경표 또한 캐릭터와 잘 어울려요.. 조연들이 다들 잘해서 내용에 비해 영화가 좀더 빛을 바랠거 같아요 ^^  ,0,1,0
2913,2015.05.08,10,"자신과 같은 인생을 살고 있는 딸에게 남긴 한마디""워 더 하이즈""  ",0,1,0
2914,2015.05.08,10,배우들연기가 너무 ...역시 영화배우들은 다르구나김혜수..멋지다  ,0,1,0
2915,2015.05.08,10,와 진짜 소름 장난 아니었음 아직도 미련이 남는 영화인것같다 진짜 어벤져스 다음으로 재밌었던 극소름 영화였다  ,0,1,0
2916,2015.05.08,10,진심으로 개존잼 오글거림이 없지않았지만 진짜 몰입해서봤어요 박보검 연기만 조금 거슬렸지 와...진짜 잼께봄 호불호많이갈리넹  ,0,1,0
2917,2015.05.08,1,영화보고 자막에서 감독이름 찾아본건 처음이었다. 죽이고 싶었다. 이런영화만들고서도 투자금 뽑을려고 과장 마케팅하는 상업자들 반성해라. 이건 아니다 진짜.  ,0,1,0
2918,2015.05.08,10,김고은에 연기에 마음이 저리고 아프고 눈물이 났습니다.마음에 큰상처를 갖고 있지만 내색하지 않으려는 그녀...강해보이지만 역시 어쩔 수 없는 여자였네요.잔인하지만 모든 연기자에 연기가 자연스러워서 흥미롭게 잘봤습니다. 오래 기억에 남을거 같네요  ,0,1,0
2919,2015.05.08,10,스토리가이해가안간다는둥 뭘말하고싶은지모르겠다는둥 하는사람들이 이해안감 영화안보고 딴거하고있었나? 집중해서 보면 한장면한장면 모든게 느껴지는데출연배우들모두 소름끼치도록 연기 너무 잘하고 영화보고 잘 우는데 이영화는 너무슬퍼서목만메이고 눈물도안남  ,0,1,0
2920,2015.05.08,6,2015.05.01  ,0,1,0
2921,2015.05.08,10,아주 재미있게 잘보았습니다.김고은 김혜수연기도 아주좋았어요. 영화내용도 좋았습니다.감사합니다.  ,0,1,0
2922,2015.05.08,10,관람객재미있는데 조금잔인 근데괜찮았어요  ,0,1,0
2923,2015.05.08,1,너무 칙칙하고 연출도 엉망이고결정적으로 차이나타운하고 연과도 없고그저  칼질만 하는 영화다제작비중 담배값이 제일 많이 들었던 영화다  ,0,1,0
2924,2015.05.08,1,오랜만에 돈 아까운 영화를 봣네요  ,0,1,0
2925,2015.05.08,9,관람객재미있었다~마지막에 모녀의 관계를 보며...슬푸다  ,0,1,0
2926,2015.05.08,4,"관람객보면서 드는 생각과, 보고 난 뒤 들은 생각. : 그래서 뭐...무슨 영화라고 이게?  ",0,1,0
2927,2015.05.08,10,신랑과 저는 정말 긴장하며 흥미진진하게 봤습니다 김혜수씨 김고은씨 연기도 좋았지만 조현철씨 연기가 정말 뛰어났습니다 저는 강추하는 영화입니다  ,0,1,0
2928,2015.05.08,10,김혜수 연기 진짜 대박임  ,0,1,0
2929,2015.05.08,7,관람객무슨영화인지 잘 모르겟다  ,0,1,0
2930,2015.05.08,9,관람객탄탄한 배우들 연기력에 볼 만한 영화였습니다.  ,0,1,0
2931,2015.05.08,5,감동 재미두 전혀없구 너무잔인하기만하구  기분만 더럽다 남는거하나도없슴도대체 몰 애기하려는건지 진짜돈아까움 ...  ,0,1,0
2932,2015.05.08,7,관람객기대만큼 흥미진진하지는 않았지만 나름  재미있었음  ,0,1,0
2933,2015.05.08,10,김혜수님 연기에 눈물펑펑흘림.  ,0,1,0
2934,2015.05.08,10,관람객굳굳 연기력 소름 재밌네여  ,0,1,0
2935,2015.05.08,6,김혜수 연기 굿! 나머지 연기자들도 연기가 좋음다만 너무 넣거 싶은게 많았던 감독의 욕심 때문에 굵은 스토리 없이 이것저것 짜잘짜잘 늘어놓음보기는 재밌지만 완상도가 떨어짐후속편을 만들려고 그런건지 원...  ,0,1,0
2936,2015.05.08,8,관람객역시 김혜수의 연기는 엄청나다  ,0,1,0
2937,2015.05.08,3,김혜수 연기만 있고 ㅡㅡ;; 정말 스토리라인이 무얼 얘기하는지 알 수 없었던 .  ,0,1,0
2938,2015.05.08,10,역시 김혜수 ! 눈빛만으로도 이미 캐릭터를 다이해시켜줌 .김고은도 정말 다시 본 배우 .이렇게 연기를 잘 할 줄이야 !감정이입 정말 잘되고 시간 가는 줄 모르게 몰입되어 본 영화 .잔인만 할 줄 알았는데 눈물샘 고장나게 만듦 .대박났으면 b  ,0,1,0
2939,2015.05.08,7,김혜수 카리스마는 쩌네요ㅋ 근데 내용이 좀 애매한느낌?  ,0,1,0
2940,2015.05.08,5,"각본 연출 등 스탭과 배우들이 어우러져야 10점이라면, 그렇기에 5점이다. 마우희는 어쩌다 (다른 아이도 아니고) 일영에게 애정을 갖게 되었을까? 영화를 보고도 풀어지지 않는 의문  ",0,1,0
2941,2015.05.08,1,감정 과잉에 과장된 연출 그리고 가짢음.보는 내내 중2병에 다시 걸리는 듯 했다.김고은씨는 영화내내 나 연기 하고 있어!! 라고 외쳤다.조현철 배우를 좋아했던 1인의 안타까움.감독은 반성하라! '잘한다 깜시'  ,0,1,0
2942,2015.05.08,8,관람객연기력 굿 입니다. 배우가 살린 영화?  ,0,1,0
2943,2015.05.08,7,무슨말을 하려는지는 모르겠지만 배우들의 연기력은 좋았습니다.  ,0,1,0
2944,2015.05.08,5,"관람객알바에 속지말자~무게감이 너무없다,그냥 드라마한편 보는거랑 비슷  ",0,1,0
2945,2015.05.08,9,관람객김고은땜에 러닝타임내내 심쿵했어요. 배우들 연기도 좋고 재밌게 봤어요.  ,0,1,0
2946,2015.05.08,2,내 옆에 앉은 아저씨 영화 끝나고 하는말 : 아씨 진짜 머 이런 영화가 다 있노...ㅋㅋㅋㅋ배우들 연기는 너무 실감났었음 ! 굿굿  ,0,1,0
2947,2015.05.08,3,쓸데없이 잔인한 장면만 많다. 우리나라가 언제부터 이렇게 잔인한 나라였던가?  ,0,1,0
2948,2015.05.08,10,스토리개연성은 다소떨어지지만 배우들이 연기를 다 잘함특히 김고은...이 연기한거처음봤는데 어린애가 김혜수한테 밀리지가않음  ,0,1,0
2949,2015.05.08,1,여자판 달콤한인생같은데 개졸작이다 진짜 여성들 느와르라 말만 카리스마스있고 조연들 왜죽는지도 모르겟고 내용은 뒤죽박죽이고 진짜 3류느와르다 김혜수가 왜찍엇는지ㅡㅡ  ,0,1,0
2950,2015.05.08,10,관람객잼있게 봤어요 볼만한영화에요  ,0,1,0
2951,2015.05.08,8,관람객볼만하고 재미있어요.ㅎㅎ  ,0,1,0
2952,2015.05.08,10,내 생애 최고의 느와르 영화가 여성들이 주인공일 줄이야김혜수에 이어 김고은은 나의 애정하는 배우님이 되셨다나오는 길에 남자 고등학생들이 떠들며 지나가는 도중에 튀어나온 (엄마)라는 단어가 뭐이리 섬뜩하던지근데ㅠ차이나타운 정말 저래여?  ,0,1,0
2953,2015.05.08,4,"광명롯시] 뭔가 과거 홍콩느와르 느낌이 물씬 풍기게 만들었지만, 더 자극적이고 애절한 처절함을 주기위해 끼워넣었을 멜로나 비정의 컨셉이 너무 억지부린 느낌이었다. 식상하고 유치했다. 김혜수씨의 연기는 정말 훌륭했지만 영화는 재미도 없고 별로 였다.  ",0,1,0
2954,2015.05.08,7,일단 영화는 재밌었다 주연뿐만아니라 조연배우들 연기도 정말 대단. 근데 일영이 심적변화를위해서 멜로상황을 억지로 집어넣은게 너무 부자연스러웠음 그것만빼면야 괜찮았음  ,0,1,0
2955,2015.05.08,7,관람객무거운 주제로 긴 러닝타임을 보낸거같다  ,0,1,0
2956,2015.05.08,10,관람객살라말라쿵슈루루루루  ,0,1,0
2957,2015.05.08,8,관람객김혜수의 연기..역시잘하시네  ,0,1,0
2958,2015.05.08,10,관람객진심 재밋음 여자도 김고은한테 반하는영화ㅋㅋ  ,0,1,0
2959,2015.05.08,5,포스터만 보고 '달콤한 인생'이나 '친절한 금자씨'를 기대해선 안된다.  ,0,1,0
2960,2015.05.08,7,관람객시나리오가 조금은약한듯ㅜ  ,0,1,0
2961,2015.05.08,1,관람객지금까지 내가 본 영화중에 젤 별로였는데..평점 엄청 높네..  ,0,1,0
2962,2015.05.08,6,몬가... 부족한 느낌??배우들 연기는 참 좋은데 시나리오가 조금 몬가....부족한 느낌이 있네요....  ,0,1,0
2963,2015.05.08,10,그들의 삶 그들의 사랑 그들의 이야기입니다 같은곳에 사는 나완 너무 다른 삶에 슬프고 불쌍하고 감사한 마음도 들었습니다 그리고 연기력에 감탄했어요 나오시는 분들 전부 연기 장난없어요 최근에 본것중에 진짜 여운....  ,0,1,0
2964,2015.05.08,10,김고은 앞으로 이배우 정말기대된다  ,0,1,0
2965,2015.05.08,10,그냥한마디로 표현하면 미쳣어 이영화는클라스가달라  ,0,1,0
2966,2015.05.08,8,관람객연기에 비해 내용이 다소 부족한듯해요.전달하려는 내용이 무엇인지...이해가 잘 안되더라고욤  ,0,1,0
2967,2015.05.08,1,영화를 다보고나서도 눈물이 멈추지 않았다.. 이 영화를 돈을 주고 본게 너무 억울해서....  ,0,1,0
2968,2015.05.08,7,관람객내용을 잘 모르겠어요너무 잔인하고 살벌해요  ,0,1,0
2969,2015.05.08,1,아 알바ㅂㄷㅂㄷ.. 뜬금없는 로맨스에 내용연개성은 하나도없고 뭘얘기하고싶은건지 모르겠고 이리저리 자그만얘기만 조금씩 찔러본 느낌만난다 내용 정말 식상하다 연기는정말좋았는데 내용은정말로  ..알바왜이렇게많아 예고편이끝이다  ,0,1,0
2970,2015.05.08,10,관람객김고은 김혜수 연기도 대박이고 전체적으로 분위기나 긴장감도 대박이였어요 진짜 연기파배우들 모두 짱짱..!!  ,0,1,0
2971,2015.05.08,10,관람객기대안하고봤는데 재밌었음ㅋ  ,0,1,0
2972,2015.05.08,1,별 하나도 아깝다 개 슈레귀 . . 무슨 오글 거리고. . 진짜 수준 . . 하 다들 보세요  나 혼자 억울한게 싫다  ,0,1,0
2973,2015.05.08,10,역시 김혜수 입니다. 잼있게 봤어요  ,0,1,0
2974,2015.05.08,8,이렇다할 스토리는 없지만 보는 내내 집중해서 봤어요.  배우분들 다 연기 잘하셔서 몰입이 잘 됐던 것 같네요.  ,0,1,0
2975,2015.05.08,10,기대안하고 봤는데 심장이 쫄깃 하네요평점 넘 낮게 책정된듯 해요 7점대는 아닌듯  ,0,1,0
2976,2015.05.08,7,소재는 식상하지만 여배우 앙상블이 주는 분위기는 신선하다. 우리 나라 영화계 여배우의 신구 최고의 조화~김혜수는 대부 답고  김고은은 신예답고~  ,0,1,0
2977,2015.05.08,7,관람객잔인한기억뿐..그냥저냥..  ,0,1,0
2978,2015.05.08,7,스토리가 탄탄했으면 하는 아쉬움 뭔가 툭툭 끊긴다역시 김혜수 엄지척 김고은의 재발견 나이스하네 끝  ,0,1,0
2979,2015.05.08,8,관람객배우들 연기가 리얼함.  역시 김혜수!   .김고은도 기대됨.  ,0,1,0
2980,2015.05.08,8,관람객그닥 볼만했음이아웅 더커두아누토주태투유우아투으태추뉴큐구라우두이츠  ,0,1,0
2981,2015.05.08,6,관람객내용이 너무 없는것 같아요.연기력이 커버했던 영화라고나 할까?  ,0,1,0
2982,2015.05.08,10,관람객굿둣굿굿귯귯귯듁듁국굿  ,0,1,0
2983,2015.05.08,4,"10년전에 봤던 ""달콤한 인생""에 비해 누아르라는 장르 자체의 매력을 잘 살리지도 못하고, 스토리 전개의 개연성도 떨어지고, 박찬욱 감독 스타일의 유니크한 미장센을 따라하려 했다는 느낌을 지울수 없다,1년쯤 후에 케이블에서 틀어주는걸 볼걸  ",0,1,0
2984,2015.05.08,5,관람객처음부터 끝까지 죽이고 죽이는 영화 ㅋㅋㅋ  ,0,1,0
2985,2015.05.08,1,"내평점 정말 평점 읽다보니 화가나서 나도 평점 조절중 ... 너무 티남. 내가 돈낸거 아닌데도 아까움. 김혜수 연기 잘하는건 알겠는데.,, 쩝. 뭘 보고 배우라는건지.  ",0,1,0
2986,2015.05.08,8,관람객두 주인공의 연기최고....  ,0,1,0
2987,2015.05.08,7,관람객깔끔하다.근데 스토리부족  ,0,1,0
2988,2015.05.08,7,"김혜수의 연기력이 돋보인 영화. 다소 진부한 내용의 줄거리와 소재였고, 예상가능한 시나리오가 영화의 흥미를 깎아먹은 느낌. 보는내내 우울한 분위기와 스토리 전개방식이 많이 아쉬웠다.  ",0,1,0
2989,2015.05.08,9,김혜수 연기에 뿅감 스토리라인은 ㅠ 집중이좀안되고 주인공 고은자체역할이 뭔가 애매한듯하지만 진짜 뺘져들고봄 영화관에서 봐야함 실감난ㅇㄴ게  ,0,1,0
2990,2015.05.08,3,"영화가 겉멋만 잡고, 잔인하기만 하고, 도대체 감독이 이 영화를 통해서 뭘 말하려고 하는지 모르겠어여??  ",0,1,0
2991,2015.05.08,10,김혜수 김고은의 연기 뿐만아니라 조연들의 탄탄한 연기력이 이 영화의 재미에 한몫 한것같네요'김혜수의 엄마의 내면연기에 박수를 치고싶어요 짱짱  ,0,1,0
