index,time,score,reple,1st_week,2st_week,3st_week
9334,2017.08.20,8,관람객두 남자의 연기가 의외로 자연스러워 의외로 많이 웃었던  ,0,1,0
9335,2017.08.20,10,영화보고 평점주는거 처음인데 타락한 경찰의 모습도 잘보여주고 작은 웃음거리도 있음. 결정적으로 내가 오늘 강하늘과 박서준을 본게 참 감동이었다.  ,0,1,0
9336,2017.08.20,10,관람객정말웃기고재미있는영화에요  ,0,1,0
9337,2017.08.20,10,관람객여자친구랑봤는데보는 내내 계속 낄낄 웃었어요아주 추천할만한 영화입니다두 남자 주연도 케미가 잘맛네요 ㅋㅋㅋ아주 재밌어요!  ,0,1,0
9338,2017.08.20,10,관람객올만에 시원하게 웃고왔습니다..  ,0,1,0
9339,2017.08.20,10,남자친구랑 꿀잼으로 봤네요 생각보다 너무 재밌어서 내내 웃었음  ,0,1,0
9340,2017.08.20,8,관람객재밋어요 가볍게보기좋은거같아요  ,0,1,0
9341,2017.08.20,1,웃긴영화라해서 초6딸이랑 보러갔는데ㅜ완전 미쳤어요?이런 쓰레기영화가 19금이 아니라니 ㅜ한국영화는 조심해서  선택해야해요ㅜ  ,0,1,0
9342,2017.08.20,10,"현실의 이면을 유쾌하고도 진지하게 풀어낸 작품.좋았다.평론가들 평가를 보고 안 보려다가 봤는데 안 봤으면 후회할 뻔.무식하고 유치한 평론가들이라니까, 강하늘 박서준 박하선 연기도 볼 만했다  ",0,1,0
9343,2017.08.20,7,가족이랑 같이 봤는데 7.5점 주고싶다.  ,0,1,0
9344,2017.08.20,10,관람객재밋습니다보세요보ㅔㅅ요  ,0,1,0
9345,2017.08.20,10,관람객진짜 간만에 크게 웃었어요  ,0,1,0
9346,2017.08.20,10,2017년 본 영화중에 제일 재밌었습니다^^  ,0,1,0
9347,2017.08.20,10,강하늘과 박서준의 케미가 돋보이는 영화 잘봤습니다 ㅠㅠ 최고 최고  ,0,1,0
9348,2017.08.20,10,강하늘♡♡♡영화꿀잼  ,0,1,0
9349,2017.08.20,10,아니 얼마나 재밌나 어디한번 보자 했는데 왜케 재밌어 ㅋㅋ 박수 너무 쳐서 손아픔 ㅋㅋ  ,0,1,0
9350,2017.08.20,10,왠만하면 이런거 귀찮아서 안올리는데돈 안아깝다~~~ 박서준 최고  ,0,1,0
9351,2017.08.20,10,지루할틈없이 웃으면서 봣네용! 박서준 강하늘 둘의 케미가 정말 짱!!!  ,0,1,0
9352,2017.08.20,10,영화는 재미있었는데 평점란은 매갈들이 점령했네;;  ,0,1,0
9353,2017.08.20,10,모처럼 웃고 재미있고 신선했습니다  ,0,1,0
9354,2017.08.20,10,관람객별이 아깝지 않을 영화였습니다ㅠㅠ  ,0,1,0
9355,2017.08.20,9,관람객별기대안하고 봤는데 재미있었어요  ,0,1,0
9356,2017.08.20,10,강하늘...송곳니 보이는데까지만 웃어 ㅋㅋ  ,0,1,0
9357,2017.08.20,10,진짜 재밌어요!기대이상 입니다^^강하늘 제대하면 꼭 2편 만들어 주세요ㅜㅜ제발요  ,0,1,0
9358,2017.08.20,1,생애 처음 관람 중간에 나온 영화.. 예전 인터넷소설 같다. 배우들이 아깝꾸롱  ,0,1,0
9359,2017.08.20,10,에나벨.장산범.택시운전사.청년경찰 4개 봤는데 청년경찰이 제일 재밌어요~  ,0,1,0
9360,2017.08.20,8,이 영화를 보고 나서 경찰대에 너무나 들어가고 싶어졌다..!!  ,0,1,0
9361,2017.08.20,10,관람객진짜 가벼운 마음으로 보러 갔다가 구석구석 깨알웃음이며 완벽한 배우들 연기며 즐거운 발걸음으로 나왔어요 재미있게 잘보고 왔습니다. 개인적으로 주연 두분 모두 좋아해서 더 좋은영화였어요ㅎ  ,0,1,0
9362,2017.08.20,10,관람객완전재밌었습니다!ㅎ  ,0,1,0
9363,2017.08.20,7,마지막 장면 괜찬네요.. ㅋㅋ  ,0,1,0
9364,2017.08.20,5,"순진한 청년들의 활약상은 순수하고 신선했으나, 그들의 활약을 보여주기 위해 동원한 소재는 너무 참담한 현실의 일면이어서 더는 웃음이 나오지 않았다.초반에 신선한 웃음코드가 부끄러웠다.  ",0,1,0
9365,2017.08.20,10,관람객오래만에  잼있게 봐네요~~  ,0,1,0
9366,2017.08.20,9,관람객재밌지만 끝이 먼가 조금그런??  ,0,1,0
9367,2017.08.20,10,관람객처음부터 끝까지 정말 재미있게 잘 봣습니다^^  ,0,1,0
9368,2017.08.20,1,최악의 영화. 두 캐릭터를 성장 시키기 위해 꼭 인신매매와 난자적출 이라는 소재를 썼어야 했는지. 이런 소재에 저급한 유우머를 곁들여서 소비해야 했는지. 영화가 끝나고 불쾌함과 역겨움과 토쏠림 현상만 남았다.  ,0,1,0
9369,2017.08.20,9,관람객참  잘  찍었네요   오랜만에  시원한 영화  나왔네요  ,0,1,0
9370,2017.08.20,10,저런 경찰이 많았으면 좋겠다고 생각했습니다  ,0,1,0
9371,2017.08.20,10,관람객너무 재밌고 보는 내내 웃음이 끊기질 않았어요 찡한 장면도 있고 참 잘 만든 영화 같습니다  ,0,1,0
9372,2017.08.20,9,관람객여자친구랑 같이 봤는데 정말 재밌었습니다.ㅋㅋㅋ  ,0,1,0
9373,2017.08.20,9,재밋고 감동도  있는 경찰대학생들의 시민구하기 작전  ,0,1,0
9374,2017.08.20,10,오랜만에 유쾌하고 즐거운영화를 보았습니다.두 청년배우의 연기가 관객을 들어다 놨다 하였습니다.청년경찰덕분에 지금도 즐겁습니다  ,0,1,0
9375,2017.08.20,10,관람객완전 짱~~ 완 전 짱 완 전 짱  ,0,1,0
9376,2017.08.20,10,평점 왜자꾸 떨어지지 진짜 재밌게 봤는데.... 아쉬웠던건 좀 난해한 장면이 많았는데 15세 이용가였다는 것 정도 나머진 다 ㄱㅊ  ,0,1,0
9377,2017.08.20,8,관람객잼있어요^^  넘 기대없이 보니깐 ㅋ유쾌하고 좋아요  ,0,1,0
9378,2017.08.20,9,그냥그럭저럭 볼만한 영화인줄 알고 갔는데  약간 충격 먹음  가출한 여학생들 난자 착취 장기 인신매매  보는내내  좀 그랬음  ,0,1,0
9379,2017.08.20,9,관람객유쾌하고 신나는 반면 눈시울이 붉어지게 하는 감동도 선사한 흐믓한 영화를 오랜만에 만나서 최고였습니다  ,0,1,0
9380,2017.08.20,2,이게 재밌음? 진짜 뻔하고 억지스러움  ,0,1,0
9381,2017.08.20,2,한국영화 특유의 뻔한 스토리 뻔한 피해자 뻔한 결말배우들은 잘생김  ,0,1,0
9382,2017.08.20,10,영화 넘 재밌게 잘봤어요~   무대인사온  배우들도 만나고  오늘 하루 즐거운시간  보냈네요^^   두배우들 케미가 너무 좋아서 눈호강하구  왔네요~~~~  ,0,1,0
9383,2017.08.20,10,"기대안했는데 안봤음 큰일날뻔한 올해 최고 영화인듯.둘 연기 잘하고 캐미 완전 돋고, 이청년들이 경찰된다면, 서장된다면 좋겠다 하고 응원하며 본 영화! 영화 넘 재밌습니다. 뒤에 에피소드 더 있으니 나가지 말고 보세요!  ",0,1,0
9384,2017.08.20,10,ㄹㅇ 재밋음ㅠㅠㅠ박서준♡  ,0,1,0
9385,2017.08.20,8,"관람객재미잇엇습니다..ㅈ,  ",0,1,0
9386,2017.08.20,10,정말 재밌어봣자라는 심정으로 봤는데 2시간동안 이렇게 웃으면서 본 영화는 정말 처음인거같아요 >!<영화끝나고 꼭 기다려서 끝까지.보세요!!! 정말 강추 ! ㅋㅋ  ,0,1,0
9387,2017.08.20,10,관람객짭새야 재미있었어요~~!  ,0,1,0
9388,2017.08.20,1,1점도 아깝다. 돈 시간 감정소모 다 아깝다. 남자배우 제복입히고 상반신까는 씬 보여주고 페이크 쩌는 광고로코믹한 영화인것마냥 현혹하고 댓글알바 고용하고 투자금 회수할때까지 최선을 다해 속여보려 아등바등한 것 같은영화. 보지말자.  ,0,1,0
9389,2017.08.20,10,관람객재미있네요 추천합니다  ,0,1,0
9390,2017.08.20,10,너무 진짜 하 영화관 자주다니면서 이렇게 재밌게 본게 얼마만인지 너무 재밌게봄ㅎㅎ  ,0,1,0
9391,2017.08.20,8,관람객여느 영화들과같이 결말은 뻔했지만 2017년 대학생들의 모습을 잘 표현했다  ,0,1,0
9392,2017.08.20,10,강하늘 박서준 케미 개꿀이에요 완전코믹에 짱입니다  ,0,1,0
9393,2017.08.20,7,관람객순간 순간의 웃음 포인트는 확실히 재밌습니다. 하지만 한국인 저격 영화여서 아쉽네요. 이야기가 주는메세지가 아쉽습니다  ,0,1,0
9394,2017.08.20,9,관람객엄청 웃다가 왔어요꿀잼  ,0,1,0
9395,2017.08.20,10,꿀잼꿀잼꿀잼꿀잼꿀잼꿀잼  ,0,1,0
9396,2017.08.20,10,진짜 시간가는줄 모르고 봤어요  ,0,1,0
9397,2017.08.20,10,이거 진심 재미있습니다 웃다가 나옴  상남자의 향기를 느끼고 싶다묜  보세요 주의사항 운동 욕구 분출되요 아무튼 짱 ^^♡  ,0,1,0
9398,2017.08.20,8,관람객볼만해요 뒷자리 아짐들이 너무시끄럽게해서 짜증나긴해써오  ,0,1,0
9399,2017.08.20,10,관람객진심 재밌다^^  꼭 보세요  ,0,1,0
9400,2017.08.20,10,너무너무 재밌어요~ 꼭 보세요  ,0,1,0
9401,2017.08.20,10,영화가 재미있긴한데 뭐만 하면 웃어대 제발 웃긴 부분만 웃자  ,0,1,0
9402,2017.08.20,9,관람객웃기는 장면이 많아서 재미있었습니다.웃기다고만 생각햇는데 내용이 조금 무섭기도햇어요~~소소하니 재밋게 봤습니다~~  ,0,1,0
9403,2017.08.20,10,관람객긴장감도 있고 웃음도 있고 눈까지 즐거운 영화!  ,0,1,0
9404,2017.08.20,9,관람객재밌었어요!! 한참 웃다가 나왔네요  ,0,1,0
9405,2017.08.20,10,그냥 강하늘 박서준 존잘이고너무너무 재밌는 영화!!!꼭보세요 ㅠㅜ너무 재밌고 잘생기고다해ㅠ♥  ,0,1,0
9406,2017.08.20,8,관람객젊은 혈기가 좋았어요.  ,0,1,0
9407,2017.08.20,3,왜 평점이 높은건지..나도 평점에 낚여서 봤지만 보는내내 덤앤더머 짓에 짜증났음..같이간분은 잤음ㅋㅋ  ,0,1,0
9408,2017.08.20,10,보는 내내 지루하지 않고 다시 보고싶은 영화.  ,0,1,0
9409,2017.08.20,10,관람객너무너무 재밌네요 시간가는줄 몰랐어요 ㅋㅋ또보고 싶네요 ㅋ  ,0,1,0
9410,2017.08.20,8,관람객갠찮았음 중간에 지루한감이 있었는데 쏘쏘  ,0,1,0
9411,2017.08.20,8,관람객웃기네요ㅎㅎ추첞ㅎㅎ  ,0,1,0
9412,2017.08.20,10,관람객좋읍니당 재밋져요 냠냠  ,0,1,0
9413,2017.08.20,10,관람객아주 재밌게 잘 봤어요. 스토리도 배우도 짱  ,0,1,0
9414,2017.08.20,10,간만에 유쾌하고 시원하고 튼튼한 내용구성까지!!  후속작을 기대합니다!! 액션까지! 대박입니다  ,0,1,0
9415,2017.08.20,10,관람객보고 안웃으면 사이코패스 ㅇㅇ  ,0,1,0
9416,2017.08.20,1,걍 볼만할분  별재미없음  ,0,1,0
9417,2017.08.20,9,관람객재미있는 영화 기대이상임  ,0,1,0
9418,2017.08.20,10,청년경찰 박서준강하늘???멋진연기좋아요가족과함께???  ,0,1,0
9419,2017.08.20,8,관람객열혈청년. 서로 다른. 두 사람의 환상콤비.정말 저런 경찰 있었으면 좋겠다  ,0,1,0
9420,2017.08.20,10,관람객두명의 캐미가 좋음 아주 잼나게봄  ,0,1,0
9421,2017.08.20,10,이 영화의 두 주인공처럼 본보기가될 수 있는 대한민국경찰 화이팅!!!  ,0,1,0
9422,2017.08.20,9,관람객구두구두구두구구국국굳  ,0,1,0
9423,2017.08.20,10,관람객너무좋아요 강하늘짱!!!  ,0,1,0
9424,2017.08.20,8,관람객뻔한 스토리이긴 하지만 유쾌한 영화였어요:)  ,0,1,0
9425,2017.08.20,10,굿굿 짱입니당   보십시오  ,0,1,0
9426,2017.08.20,9,관람객가OO리 재밌게 봤어요~ 웃음이 끊이지 않은 영화!!  ,0,1,0
9427,2017.08.20,7,??? 코믹이지만  장기매매 성매매등 경찰 현실을 보여주는 좋은 영화엿던듯 .. 뭐 몇가지 말이안되는건 영화도 영화고 코믹이니깐  ,0,1,0
9428,2017.08.20,10,관람객요즘 재미나게본 영화입니다!!  ,0,1,0
9429,2017.08.20,10,더 길면 좋았을만큼 시간가는줄 모르고 몰입했던 영화근래 본 영화 중 최고!! 진짜 웃기고 재밌어요  ,0,1,0
9430,2017.08.20,10,재밌었어여 진짜 그냥 킬링타임용!  ,0,1,0
9431,2017.08.20,10,진짜 너무너무 재미있어요ㅠㅠ 남친이랑 엄청웃으면사 봤네요  ,0,1,0
9432,2017.08.20,10,관람객스토리 전개가 매우 자연스러움. 무거운 내용을 지나치지  않는 코믹 요소로 풀어냄.  ,0,1,0
9433,2017.08.20,9,관람객즐겁게 볼수있는  영화  ,0,1,0
9434,2017.08.20,1,정말 솔직하게 전문가 평점정도가 딱맞는수준임 재미도없고 감동도없는 그저그런 캐노잼까지는아닌데 그냥5점대 수준의영화  ,0,1,0
9435,2017.08.20,10,"박서준, 강하늘 둘다 연기를 잘해서 그런지 정말 재밌었다.  ",0,1,0
9436,2017.08.20,10,관람객무모한 청년들이지만 그 패기하난 기막히게 멋졌고또 요즘 흉흉한 일들이 많은데 그 속에서 위험에 처한 사람은 그냥 지나치지 말자는 그런 교훈이 담겨있는 것 같았음!한번 더 보고싶을 정도로 유쾌하고 교훈이 있던 영화! 최고! 박서준 강하늘 흥해라  ,0,1,0
9437,2017.08.20,7,"관람객주인공들은 정의롭고, 용감했다. 그들의 열정과 코믹요소가 스크린 밖으로 튀어나와서 과연 기대에 부응할만큼 재미있었다. 그러나 어린 아이들이 볼 때는 사회를 보는 어떤 경각심이나 시각을 깨우치거나 곧게하기 위해 지도가 필요한 영화같다는 생각이 들었다.  ",0,1,0
9438,2017.08.20,10,오랜만에 재밋게 본 영화ㅎ강하늘 너무 귀엽네요ㅎㅎ둘 다 굿 캐스팅이에요 진짜 많이 웃었습니다~~한편 더 제작하세욯ㅎ ㅎ  ,0,1,0
9439,2017.08.20,9,단편적인 스토리에서 이렇게 재미를 뽑아내네요 ㅋㅋㅋ 일단 엄청재밌어여ㅋㅋㅋ  ,0,1,0
9440,2017.08.20,10,관람객지루 할 틈이 없는 아주 유쾌한 영화였음  ,0,1,0
9441,2017.08.20,10,관람객경찰들이  반드시 봐야될 영화입니다~~~~  ,0,1,0
9442,2017.08.20,10,겁나웃김ㅋㅋ 아무생각없이 빵터지기좋은영화 강하늘 재심영화랑 같은사람인가싶다 ㅋㅋ ㄲ  ,0,1,0
9443,2017.08.20,9,관람객재미.감동 모두  다 있어요  ,0,1,0
9444,2017.08.20,10,진짜 109분이 금방 지나갔어요!!박서준이랑 강하늘 케미 짱!! 담에도 같이 또 찍어주세요!!ㅠㅠㅠㅠ  ,0,1,0
9445,2017.08.20,6,마음껏 웃기엔 무거운 주제  ,0,1,0
9446,2017.08.20,10,관람객오랜만에 지루하지 않게 끝까지 본 영화였습니다~  ,0,1,0
9447,2017.08.20,10,관람객이렇게 많이 웃어본 영화 정말 오랜만이네요 시간이 길지도않았던거같고 재밌었습니다  ,0,1,0
9448,2017.08.20,9,관람객특정지역에 대한 자극적인 설정이 아쉬웠지만재미있었어요!  ,0,1,0
9449,2017.08.20,10,관람객캐웃김ㅋㅋㅋㅋ 그런데 끝은 훈훈!  ,0,1,0
9450,2017.08.20,1,코믹영화라서 봤는데 끝이 가면 갈수로 잔인한게 나오네요 코믹영화 아닌거 같에요  ,0,1,0
9451,2017.08.20,10,관람객정말재미있어요!!!!  ,0,1,0
9452,2017.08.20,10,진짜 짱이에요 ㅜㅠㅠㅜ 한번보세요 두번보세요 진짜 완전 재밌고 눈물포인트도 있어요!  ,0,1,0
9453,2017.08.20,1,"별 한개 주기도 아깝네요! 조선족에 대한 편견이 그대로 담겨 있어서 불쾌하네요, 막 말로 한국사람은 다 좋은 사람입니까? 실제사건도 아니면서 왜 소재를 조선족으로만드는거죠? 조선족이 만만함니까? 참 부끄럽네요!  ",0,1,0
9454,2017.08.20,10,한국에 이런 경찰이 많아졌으면 좋겠네요ㅠㅠ 주연둘다 훈훈하고 청량해서 보는 내내 빵빵터지면서봄 거의 베테랑급으로 잼있었음ㅋㅋ 킬링타임용으로 개굿!!!!  ,0,1,0
9455,2017.08.20,6,관람객재밌네요. 두 주연분들 훈훈한 모습 좋았습니다~^^  ,0,1,0
9456,2017.08.20,10,관람객요즘 영화증에제일 재밌게봣다 진짜  ,0,1,0
9457,2017.08.20,9,"관람객머리 식힐려고 본 영화.그야말로 넘웃겨서 많이 많이 웃고 온 영화이다. 짧은 스토리 안에  우정, 감동.분노까지 모두 녹아져 있는 영화인듯 하다.  ",0,1,0
9458,2017.08.20,10,영화보기전에는  별 기대안하고    드라마보느니  기냥  가볍게  보고 온다는  생각으로   봤는데요~~ 기대이상이었습니다ㅎㅎ색다른 느낌도받았구요~^배우  연기력에도  놀라웠고~재밌었어요^^~^^추천합니다^^  ,0,1,0
9459,2017.08.20,10,관람객너무재밋게봣어요 ~ 추천  ,0,1,0
9460,2017.08.20,8,관람객마니 웃으며  본  영화 브로맨스 조타  ,0,1,0
9461,2017.08.20,10,잼있어요~ 정치적이지 않고...  ,0,1,0
9462,2017.08.20,10,잘만든 영화!초반에만 재밌고 진지하고 지루해지는 일반코미디영화와는차별화된 탄탄함!액션 코믹 스토리 모두 만족스럽다  ,0,1,0
9463,2017.08.20,10,오랜만에 깔끔하고 좋은영화 봅니다^^  ,0,1,0
9464,2017.08.20,10,관람객올해본영화중최고!!  ,0,1,0
9465,2017.08.20,10,부모님 모시고 재밌게 보고 왔습니다. 추천합니다~!  ,0,1,0
9466,2017.08.20,10, 재밌으면서 무섭습니다 코믹에서오는 재미와 스릴에서오는 재미 두가지다있습니다 추천해요~! 아그리고 ost 가 너무좋아요!! 박진감넘침  ,0,1,0
9467,2017.08.20,4,"평이 너무 좋아서 웃으려고 영화를 보러간건데, 내용이 이런내용인줄은 몰랐... 소재가 너무 무섭고 잔인했으며 오히려 공포/스릴러물에 가까웠을정도. 재밌는포인트 참 많았으나 마지막에 생각나는건 무서운소재뿐이더라.  ",0,1,0
9468,2017.08.20,9,여자친구랑 꺌꺌거리면서 보았어요ㅎㅎ  ,0,1,0
9469,2017.08.20,5,"관람객두 배우가 열심히 연기해서 배우에 대한 아쉬움은 없지만, 각본이.... 너무 불편하고 어이없는 상황이 많았다. 같은 코미디라도 '공조'나 '럭키맨' 정도는 공감이 갔는데, '청년경찰'은 억지스러운 데가 많아서 배우들이 아까웠다  ",0,1,0
9470,2017.08.20,10,관람객진짜뻥안치고 웃김 꿀잼 계속웃음  ,0,1,0
9471,2017.08.20,10,간만에 웃고갑니다^^  ,0,1,0
9472,2017.08.20,9,연기합이 좋았습니다. 유쾌하고 기분좋아지는 영화였어요. ^^  ,0,1,0
9473,2017.08.20,5,관람객재밌었습니다. 강하늘과 박서준의 케미!!  ,0,1,0
9474,2017.08.20,8,관람객웃기구 잼나요 개인적으로 신선느낌도들고^^  ,0,1,0
9475,2017.08.20,9,관람객박서준 강하늘 콤비 최고!다만 여성인권적  관점에서는 아쉽네요  ,0,1,0
9476,2017.08.20,10,기대 1도 안하고 가서 초반에 좀 유치한줄 알았는데 대사 하나하나에 풍자도 있었고 너무 재밌었다  ,0,1,0
9477,2017.08.20,10,지루한틈이 하나도없고 너무재밌어요 억지전개도 아니고 중간중간 진지하다가 또 웃긴데  그흐름이 자연스러워서 좋았어요  ,0,1,0
9478,2017.08.20,10,웃기기만 한 줄 알았는데 은근 심오한 주제도 많이 다뤄요 그래서 더 재밌었어요 거기다가 액션씬까지! 대박이에요 강추 돈 주고 본게 아깝지 않은 유일한 코미디 영화였어요  ,0,1,0
9479,2017.08.20,9,관람객유쾌한 시간이였어요 감사  ,0,1,0
9480,2017.08.20,5,관람객캐미를 빼면 영화자체에 내용이 없다  ,0,1,0
9481,2017.08.20,9,관람객가족끼리보기좋은영화인거같아요 ㅎㅎ재밌어요!!  ,0,1,0
9482,2017.08.20,10,관람객청년경찰 너무 재밌어요! 박서준짱짱맨♥  ,0,1,0
9483,2017.08.20,10,강추강추강추강추강추강추  ,0,1,0
9484,2017.08.20,10,배우 믿고 본 영화! 역시 기대를 저버리지 않는다. 재미와 감동을 잡은 영화. 박서준 x 강하늘 !  ,0,1,0
9485,2017.08.20,10,가볍게 보기 좋은 영화일부 불편러들은 불편할지도?  ,0,1,0
9486,2017.08.20,10,"와.. 진짜 영화보는 내내 웃었어요. 코믹스러우면서 액션도 되게 멋있었고, 영화 보는 내내 되게 흐뭇했어요.  ",0,1,0
9487,2017.08.20,8,가볍고 즐겁게 볼수 있는 유쾌 유머 액션 영화!  ,0,1,0
9488,2017.08.20,10,스물도 참 재미있게 봤는데 나름 재미 있는 영화 이런 영화가 많이 생기길 바라며 10점 드립니다~  ,0,1,0
9489,2017.08.20,10,그냥웃겨요 ㅋㅋ 너무재밋게잘봣습니다  ,0,1,0
9490,2017.08.20,2,"배우들 때문에, 여름에 시원하게 웃어보자고 가볍게 보러간 영화인데,영화의 중심인 사건이 너무 보고있기 힘들었다. 초반이후에는 웃음이 안나오던데 꿀잼에 통쾌하고 시원하게 웃었다는 반응이 난 공감이 안된다..  ",0,1,0
9491,2017.08.20,10,관람객정말재미있게봤그빈다  ,0,1,0
9492,2017.08.20,10,가볍게 보러 들어갔다가 무겁게 보고 나오는 영화 ! 웃음 + 감동 =완벽 ??  ,0,1,0
9493,2017.08.20,10,우와 진짜진짜 간만에 돈주고 안아까운 영화엿음ㅎ  ,0,1,0
9494,2017.08.20,8,관람객사회 사건들을 다루고 그걸 풀어나가는 모습이 좋았습니다. 멋진 두 청년 파이팅~!  ,0,1,0
9495,2017.08.20,10,개웃김~진짜연기다들잘해서좋았음  ,0,1,0
9496,2017.08.20,3,"코미디영화라고 하길래 가볍게 웃고 즐길 줄 알았는데...난자매매, 장기적출을 코미디 소재로 사용할 줄 몰랐음장르가 다소 의심스러움그리고 배우들이 중딩, 고딩이 쓰는 단어들을 남발하는데 하나도 안 웃기고 보기 불편했음( ex 씨댕, 대박사건 등)  ",0,1,0
9497,2017.08.20,9,관람객참된경찰이 되고자는  청년들이많이나와서비리읍는나라가 되는 희망이있는영화인것같습니다기분좋은영화네요  ,0,1,0
9498,2017.08.20,10,재밌었어요! 웃다나왔음  ,0,1,0
9499,2017.08.20,9,개꿀잼 생각보다 훨잼있다  ,0,1,0
9500,2017.08.20,8,재밌었어요 둘다 연기 넘 잘하네용ㅎㅎㅎ 몸도 좋음!!!!  ,0,1,0
9501,2017.08.20,10, 올해 영화중 가장 재미잇엇고 한국 경찰들의 발전을 기원한다  ,0,1,0
9502,2017.08.20,10,관람객브로맨스케미가굳굳임  ,0,1,0
9503,2017.08.20,10,진짜 첨부터 끝까지 너무재밌음 ㅇㅈ커플들끼리 부모님이랑 다 보기좋은 것 같아요중간에 싸움 장면은 쪼끔 잔인하긴해요  ,0,1,0
9504,2017.08.20,9,관람객짭새야 할때 제일웃김ㅋㅋㅋ  ,0,1,0
9505,2017.08.20,9,관람객웃느라 시간 가는 줄 몰랐던 영화 박서준과 강하늘의 케미  ,0,1,0
9506,2017.08.20,7,양심없는 의료인들이야말로 사회 암덩어리다. 제일 나쁜놈들이 양심없는 의료인들이다. 현재 바글바글하다. 다 갈아죽여야된다  ,0,1,0
9507,2017.08.20,1,C2발 내가 삼OO 살면서 영화평 한번을 안써봤는데  이딴걸 영화라고 만들어놓는 새끼들이나 보지도 않고 알바댓글로 돈벌생각에 눈이 먼 양심팔아먹은 그지새끼들이나 다 고소해버리고싶다 영화보다 토나올뻔해서 불편해서 빨리 나가고 싶었던 내가 이상한가했네!!  ,0,1,0
9508,2017.08.20,10,관람객진짜 군더더기없는 꿀잼영화  ,0,1,0
9509,2017.08.20,10,꿀잼허니잼 꿀잼벌꿀잼  ,0,1,0
9510,2017.08.20,10,코미디굿인거 같음ㅋ ㅇ  ,0,1,0
9511,2017.08.20,9,"개꿀잼, 막판에 뻥 뚫어주는 사이다가 없는게 옥의 티  ",0,1,0
9512,2017.08.20,10,"박서준,강하늘 진짜 웃김ㅋㅋㅋ꼭보세요!  ",0,1,0
9513,2017.08.20,10,관람객진짜 넘나 제밌었다 ㅋㅋㅋ 특히 박서준 강하늘 케미란  ,0,1,0
9514,2017.08.20,10,원래 이런거 안쓰는데 감독님덕분에 남깁니다^^단순히 코믹일꺼란 상상을 뒤집고 감동과 진한 여운을 남기는 연출력에 반전이였고요.물론 박서준.강하늘 두배우님의 최강케미는 여전했습니다.오늘 무인으로 더 팬이 되었네요!!!청년경찰 500만 갑시다!!!!  ,0,1,0
9515,2017.08.20,1,알바들 겁나 많은듯 잼있다고 해서 봤더니 그냥 그런 한국영화 딱 이상도 이하도 아니에요  ,0,1,0
9516,2017.08.20,1,댓글엔 알바들 뿐이냐..내 다시는 개이버 평점 보고 영화 안본다. 평론가 점수가 5.1이라니.. 대가리에 총 맞았나?  ,0,1,0
9517,2017.08.20,10,재밌게 잘봤어요~ 약간 무섭기도 하구요~ 정말 웃기다는^- ^  ,0,1,0
9518,2017.08.20,9,관람객구웃~잼있음~이상열다  ,0,1,0
9519,2017.08.20,10,원래 영화관에서 이렇세 육성으로 빵 터지면서 크게 웃어본 적 없었다. 처음으로 진성으로 육성으로 깔깔깔 웃어본 영화! 박서준과 강하늘의 합은 천하무적이다. 2편이 나오길 감히 기대해본다!!! 굳!  ,0,1,0
9520,2017.08.20,10,넘 재밌고 감동도 있고 보고 유쾌한영화네요^^  ,0,1,0
9521,2017.08.20,10,짱재밌게봄 ㅌㅋㅋ강추  ,0,1,0
9522,2017.08.20,10,영화관에서 이렇게 웃은적은 처음이에요ㅠㅠ너무 재밋고 소름끼치고ㅠㅠ진짜 꼭 보세요 평점남기는 것도 처움이네요  ,0,1,0
9523,2017.08.20,10,관람객진짜 너무너무 오랜만에 웃으면서 끝까지 재밌게본영화오죽하면 내가 평점을 다씁니다꼭보세요 여러분 !재미 플러스 감동  ,0,1,0
9524,2017.08.20,10,가치있는영화 굿굿굿굿  ,0,1,0
9525,2017.08.20,10,박서준 강하늘 캐미 굿 꿀잼  ,0,1,0
9526,2017.08.20,9,관람객재밋고도 좋은 영화였습니다~  ,0,1,0
9527,2017.08.20,9,관람객유쾌하게 보고 왔어요 박서준 강하늘 둘의 케미가 좋네요ㅎㅎ  ,0,1,0
9528,2017.08.20,1,이 영화를 보는 중 단 한순간의 찝찝함도 없었다면 혹시 자신이 시대에 뒤쳐지고 있지는 않은지 의심해봐라. 전혀 가볍지 않은 소재를 왜 억지로 희화화 시키는가?  ,0,1,0
9529,2017.08.20,9,유머코드 10점. 거기에 희생된 여성과 조선족 ㅠ  ,0,1,0
9530,2017.08.20,9,잼나네요 너문히히하하하  ,0,1,0
