index,time,score,reple,1st_week,2st_week,3st_week
5940,2017.08.14,10,진짜 최고! 청년의 입장에서 이 영화를 보니까 공감되는 것도 많고 도데체 내가 뭘 위해 이렇게 열심히 살아야할까.... 열정이나 의미를 잃어가던 중에 내가 잃어버렸던 오랜 전 내 꿈을 다시금 떠올리게 해준 것 같습니다. 청년경찰 너무 좋아요!!  ,1,0,0
5941,2017.08.14,10,진짜 너무 재밌어요 기대이상 !!  ,1,0,0
5942,2017.08.14,10,무조건 재밌다 코미디영화이다 가 아니라 물흐르듯 스무스하게 앞뒤내용이 잘 맞음. 정말 좋은 영화임  ,1,0,0
5943,2017.08.14,10,웃으면서 봤네요 재밌어요  ,1,0,0
5944,2017.08.14,10,진짜 ㄹㅇ 배우들 그냥 사랑이고요 시간이 너무빨리가요 더보고싶은데 무슨 벌써 끝이래ㅠㅠ아쉬웠어요 흑흑 또 볼각입니다 여러분 꿀잼이에요 진짜 꼭 보세요 두번보세요 기대하고 보세요 기대이상 재밌습니다 완전 내스타일 코믹에 스릴까지 진짜 사랑해요 청년경찰?  ,1,0,0
5945,2017.08.14,10,관람객시간순삭지렸다..  ,1,0,0
5946,2017.08.14,10,핵잼존잼꿀잼 강추 드립니다ㅋㅋㅋ  ,1,0,0
5947,2017.08.14,10,시간 가는줄 모르고 봤습니다 박서준 강하늘 두사람 케미가 장난 아니에요 무거운 내용을 가볍게 풀어낸 영화 꼭 보세요 강추합니다  ,1,0,0
5948,2017.08.14,10,별 기대없이 보았는데 너무 재미있네요 두 주인공 콜라보가 환상적임  보는내내 웃다가 나왔네요 500~700만 될듯~~~ 꿀잼!!!  ,1,0,0
5949,2017.08.14,10,간만에  웃기고  말았네여ㅋㅋㅋ 친구우정영화라  남자들끼리 가도 추천합니다  ,1,0,0
5950,2017.08.14,10,진심 개존잼이고 꼭 봐야함. 한번더 보고 싶은 영화임!!  ,1,0,0
5951,2017.08.14,10,올해 영화 역대급 ㅇㅈ한다  ,1,0,0
5952,2017.08.14,8,하늘에서 정의가 .... 피파세레모니인줄 ...ㅋㅋ 아무튼 볼만했고 잼있네요  ,1,0,0
5953,2017.08.14,10,관람객내용도 있고 그러면서 코믹도 있는 진짜 추천영화!!!배우들의 연기내공까지 짱짱  ,1,0,0
5954,2017.08.14,10,완전 재미나고 시원합니다  ,1,0,0
5955,2017.08.14,10,시사점도 많고 스토리구성도 탄탄하구 박서준 강하늘 연기력 체고  ,1,0,0
5956,2017.08.14,10,오랜만에 빵빵 웃었어요  ,1,0,0
5957,2017.08.14,9,씨이배ㅋㅋ졸잼ㅋㅋㅋ군함도 택시운전사보다 잼게봣다 나능ㅋㅋ  ,1,0,0
5958,2017.08.14,10,재밌고감동적! 원래영화에집중잘못하는데 시간이어떻게가는지 몰랐네요~~강추!!  ,1,0,0
5959,2017.08.14,10,관람객올해 가장 재밌게 본 영화^^  ,1,0,0
5960,2017.08.14,10,완전 재미지는 이 느낌!!! 최고  ,1,0,0
5961,2017.08.14,10,너무 잘봤습니다. 택시기사보다 진짜 훨씬 유쾌하게 잘봤어요.  ,1,0,0
5962,2017.08.14,8,관람객재미는있는데 욕이많이나와서 아쉽네요.  ,1,0,0
5963,2017.08.14,9,두 배우 케미 좋고 재미 있어요.~  ,1,0,0
5964,2017.08.14,8,관람객웃기고 스토리도 좋아요~  ,1,0,0
5965,2017.08.14,10,관람객코믹과 액션이 적절히 겸비된 영화입니다.  ,1,0,0
5966,2017.08.14,10,대박 재밌어요후회하지 않아요!!!!  ,1,0,0
5967,2017.08.15,8,가볍게 웃긴 영화~!!  ,1,0,0
5968,2017.08.15,9,강추 잼남ㅋ조선족들 착하신분들도 많은데..그게쫌 아쉽  ,1,0,0
5969,2017.08.15,10,그냥 재미있다~*  청량감 가득! 시리즈로 나와라.  ,1,0,0
5970,2017.08.15,8,가벼운 웃음을 기대하고 갔지만 결코 가벼운 내용이 아니었다. 이것은 관객을 위한 재미요소를 첨가했을 뿐 사회의 무거운 뒷 이야기들이 너무도 많이 표현된다. 더 약자를 보호하는 세상이 와야합니다.  ,1,0,0
5971,2017.08.15,10, 박서준 강하늘 케미 기대하면서 봤는데 기대 이상이었어요. 보는 내내 지루한 적 한번 없고 웃으며 집중해서 잘 봤습니다. 최고!  ,1,0,0
5972,2017.08.15,10,관람객우와진짜재밋네이용화  ,1,0,0
5973,2017.08.15,5,초중반 웃음 터지는 포인트 많다. 하지만 좀 뻔한 전개에 오글거리는 스토리.. 배우들 피지컬 부각시키는 장면에 과하게 심혈을 기울인게 보이는데 한숨이 절로 남ㅋㅋㅋ 영화를 보는건지 배우 화보를 보는건지..  ,1,0,0
5974,2017.08.15,10,한번 더 보고싶어요 ㅋ 기대안하고 봤는데 진짜 재밌었네요 ㅎㅎ  ,1,0,0
5975,2017.08.15,9,관람객재미와 웃음속에 현사회 과제를 적절하게 잘 표현!!!박서준 강하늘 캐미 쵝오!!!꼭 보세요!!!  ,1,0,0
5976,2017.08.15,10,관람객재밌습니당ㅎㅎ오랜만에 영화관람하네요  ,1,0,0
5977,2017.08.15,9,관람객정말 재밌었습니다. 계속 웃으면서 봤던 영화네요. 또 잠깐 나오시는 분이 정말 무서웠습니다.ㅠㅠ  ,1,0,0
5978,2017.08.15,10,ㄹㅇ감동꿀잼보장ㄹㅇ  ,1,0,0
5979,2017.08.15,10,유쾌하게 웃으면서 보고 왔어요. 재밌었어요.  ,1,0,0
5980,2017.08.15,10,"이건 진짜 올 여름에 꼭 봐야하는 영화에요! 박서준이랑 강하늘 케미 짱이고, 스릴넘치고 코믹하고 진짜 유쾌,상쾌,통쾌, 삼쾌!!! 한 영화였어요. 마지막에 일찍 나가시는 분들이 계시던데 꼭 끝까지 보다 나가시길 바랍니다.^^  ",1,0,0
5981,2017.08.15,10,야!  야~아 이 짭새야!  이대사가 재일기역에 남네요ㅋㅋ  ,1,0,0
5982,2017.08.15,10,진짜 처음으로 평점 써보는데 진심 대박 완전 헐 추천합니다 ㅜㅜ 진짜로 웃기면서도 긴장감이 넘쳐서 보는 내내 너무 즐거웠어요♡ 일단 박서준과 강하늘 둘의 호흡은 아주 칭찬합니다 안보신 분들 주춤하지마시고 바로 달려나가세요  ,1,0,0
5983,2017.08.15,10,처음부터 끝까지 너무 재밌었다  ,1,0,0
5984,2017.08.15,7,점프 스트리트랑 너무 똑같은 설정이라 솔직히 싫었는데 재밌어서 용서가된다 아직 좀 점프 스트리트에 비해 어설픈 느낌은 있지만 2편이 기대된다  ,1,0,0
5985,2017.08.15,9,관람객진짜 재밌어요~~ㅎㅎ  ,1,0,0
5986,2017.08.15,10,개잼 졸잼 강추합니다.보는 내내 즐겁습니다짭새야  ,1,0,0
5987,2017.08.15,1,어두운 소재를 가진 영화가 코믹영화가 될 수 있다는 것을 잘 보여준 작품인 것 같습니다. 다시는 이런 작품이 나오지 않았으면 좋겠어요. 한 작품만으로도 벅차니까요.^^  ,1,0,0
5988,2017.08.15,10,너무 재밌어요~올여름 무더위 시원하게 날려버리네요!! 또보고싶은 영화! 특히 짭새야ㅋㅋㅋㅋ진짜 아직까지 생각나네요ㅋㅋ박서준 복근은 진짜 대박  ,1,0,0
5989,2017.08.15,10,예고편도 안 보고 팜플렛도 안 보고 기대도 안 하고 그저 언니가 같이 보자고 해서 봤는데 너무 재밌었어요 연기자 두 분 케미도 정말 좋았고 영화가 지루하지 않고 너무 재밌었어요.  ,1,0,0
5990,2017.08.15,9,관람객답답하긴해도 정말 그시선에서 보면 재밋네용 연기도잘하고  ,1,0,0
5991,2017.08.15,9,유쾌하게 웃을수 잇는 영화  ,1,0,0
5992,2017.08.15,10,개그 코드 완전 내스탈ㅋㅋㅋㅋ 진짜 둘이 케미쩔어요  ,1,0,0
5993,2017.08.15,10,재밌습니다~~추천~~~  ,1,0,0
5994,2017.08.15,10,관람객오랜만에 재미진 영화봄  ,1,0,0
5995,2017.08.15,9,두배우연기 넘 좋네요  멋지심  잼있게봤어요  근데소재가 좀 그러네요  언제나피해자는여성 ㅜㅜ 진짜이런일이있다면소름이네요  ,1,0,0
5996,2017.08.15,10,관람객보는 내내 무서움과 재미를 동시에  ,1,0,0
5997,2017.08.15,7,코믹스릴러라고 하나요? 웃긴장면만 기억하고 싶지만 자극적인 소재와 장면이 머릿속에 남아 괴롭기도 합니다.  ,1,0,0
5998,2017.08.15,10,진짜 너무 재밌어요!!초반부터 끝까지 웃겨요!!두분이 되게 자연스럽게 연기하셔서ㅎㅎ그렇다고 또 너무 가볍지도 않아서 정말 재밌게봤습니다!!  ,1,0,0
5999,2017.08.15,10,관람객짱잼이요ㅠㅠ꼭보세요두번보세요  ,1,0,0
6000,2017.08.15,9,오늘 관람하였습니다. 우선 이런 작품 볼 수있다는것만으로도 감사드립니다^^ 일단 한 아이에 엄마로서 가출이란  얼마나 무섭고 험한지를 보여주고 가르쳐주고 부모란 보호자란 역할이 와 필요와 중요한지를 알게해주는 사충기 청소년한테 교육이된다고봅니다.  ,1,0,0
6001,2017.08.15,10,청년경찰  진심 추천함~~~^^  ,1,0,0
6002,2017.08.15,10,오늘 보고도 내일 또 봐도 재밌을 영화 ?? 소장용으로 두고 싶은 인생영화 ㅠㅠ 서준찡과 하늘찡의 케미 완전 좋고 스토리나 전체적으로 다 맘에 들었습니당 .. 다 보고 여운 남아서 앉아있을 때 쿠키영상보고 웃으면서 나갔어요 ㅋㅋㅋ 청년경찰 화이팅 !  ,1,0,0
6003,2017.08.15,10,너무 재미있었어요^~^두 배우의 캐미 최고에요♡강추~~  ,1,0,0
6004,2017.08.15,10,두주연배우의 연기는 청년경찰이라는 제목에 맞게 열정을 잘표현해내었고 내용도 전혀가볍지 않아 기대이상이였네요 처음부터 끝까지 지루하지않아 시간 가는줄 모르고 보았네요  ,1,0,0
6005,2017.08.15,10,심야로 보고왔는데 핵꿀잼 둘케미 쩌름 강추!!!  ,1,0,0
6006,2017.08.15,10,이거 별5점 안넣으면이영화 안본사람~^^♡한국영화 노잼인데 태어나 처음평점쓴다 완전 꿀♡  ,1,0,0
6007,2017.08.15,1,1. 여자가 뒤돌아본다고 용기내서 뒤따라가도 된다는 뜻 아닙니다.2. 여자가 구해줘서 고마워한다고 둘이 돌아가면서 안아봐도 되는 것 아닙니다. 그  끔찍한 성매매와 난자적출 현장에서 가까스로 살아남은 생존자를 또다시 욕망의 대상으로 삼고 싶었나요정말  ,1,0,0
6008,2017.08.15,1,헬조선영화는 믿고거름  ,1,0,0
6009,2017.08.15,10,관람객기분좋게~ 보고왔습니다^^  ,1,0,0
6010,2017.08.15,10, 거의 3년만에 영화를 봤어요. 영화보는것도 싫어하고 시간 아까워하는 성격인데..정말 정말 잼있었어요^^ 감칠맛 나는 욕과 사건을 풀어나가는게 !! 한번 더 보고싶네요^^  ,1,0,0
6011,2017.08.15,10,방금 보고 나왔는데 재미있네요 ㅎㅎ  ,1,0,0
6012,2017.08.15,8,관람객영화관 온 사람들이 웃었습니다 ㅋㅋㅋ 재미도 배우들 얼굴 보는 재미도 현실풍자도 조금. 돈 아깝지 않은 영화입니다  ,1,0,0
6013,2017.08.15,10,추천으로 기대없이 그냥 봤는데 무섭고 화나는 장면에서 중간에 웃기게 해줘서 강약이 아주 잘 조절 되어있는 영화!!! 부모님께서 매우 냉정하게 평가하는데 인정한 영화  ,1,0,0
6014,2017.08.15,10,관람객졸잼졸잼졸잼졸잼졸잼  ,1,0,0
6015,2017.08.15,8,관람객킬링타임으로 괜찬아요  ,1,0,0
6016,2017.08.15,6,"정말 경찰이라면, 사회적으로 어떤 집단에게 범죄자의 편견을 씌워선 안된다고 생각한다. 경찰의 정신을 다룬 영화라면 더더욱...물론 일부 설정의 아쉬움에도 이 영화는 "" 매우"" 웃기기 때문에 볼 가치는 충분하다.  ",1,0,0
6017,2017.08.15,10,너무너무너무너무너무재밋게잘봣습니다  ,1,0,0
6018,2017.08.15,1,드럽게 재미없다.난자적출이 뭐냐 19세로 하든가 이게 15세냐?적나라하다  ,1,0,0
6019,2017.08.15,10,관람객진짜 너무너무너무 재밌어요  ,1,0,0
6020,2017.08.15,10,내 영화사상 첫 평점주기.  대박이다.  ,1,0,0
6021,2017.08.15,6,초반에는 재밋는데... 난자적출 장기적출 이런 소재들이 뭔가 찝찝함만을 남겻다.... 현실을 보여주려한건지.. 영화가 통쾌할줄 알았는데  완전 찝찝함만 남김... 그냥 경찰은 믿지 말라는 메세지인가...  ,1,0,0
6022,2017.08.15,10,관람객처음부터 끝까지 웃음이 끊기질않아요ㅠㅠ  ,1,0,0
6023,2017.08.15,10,22시30분꺼 cgv에서 봄 존잼 꿀잼  ,1,0,0
6024,2017.08.15,10,짭새야~~~~이부분ㄹㅇ하드캐리  ,1,0,0
6025,2017.08.15,10,기대하고 봤는데도 넘나 재밋는 영화 !엄지척! 처음부터 끝까지 지루할틈도 없이 웃다가 진지하다 또 웃으면서 봤어요 ㅋㅋ강하늘배우님 욕할때마다 너무 웃겨요 ㅋㅋ 전 이거 두세번 또 본다해도 안아깝네용  ,1,0,0
6026,2017.08.15,10,영화보면서 미친듯이 웃었다  ,1,0,0
6027,2017.08.15,10,중학생 아들과 40대부모 모두 평점 10점주고싶은 영화~  ,1,0,0
6028,2017.08.15,10,관람객둘의케미는....뭐랄까 골때리는데 통쾌함  ,1,0,0
6029,2017.08.15,10,웃겨서 배꼽떨어짐 꼭보세요  ,1,0,0
6030,2017.08.15,10,하늘에서 정의가 빗발친다  ,1,0,0
6031,2017.08.15,10,강하늘 박서준 ㅎㅎ 두분의 케미 진짜 너무 귀여웠어요!! 그런 아들 있었음 좋겠단 생각이드네요 ^^ 보고 기분좋은 영화입니다 강추합니다!!  ,1,0,0
6032,2017.08.15,10,진짜 유쾌하고 감동ㅜㅜ두분 너무 좋은영화로 만나서 좋네용ㅋㅋ추천해요. 꼭보세요ㅋ 시간가는줄몰라용지루할틈이없음.  ,1,0,0
6033,2017.08.15,1, 1도 아깝습니다. 코미디라고 해서 봤는데 주제가 난자적출 성매매 장기적출이라니요 보는 내내 끔찍했고 보고 나서도 꺼림직해서 기분 망쳤네요. 영화 초반 클럽에서부터 마지막 장면까지 모든 관점에서 여자를 성상품화 가치절하시켰네요. 최악입니다 정말.  ,1,0,0
6034,2017.08.15,9,좀 유치할줄 알았는데 재밌었어요 ㅎㅎ  ,1,0,0
6035,2017.08.15,9,그저 웃고 즐길 영화를 찾는다면 바로 이영화를 추천!!  하지만 그 속내용은 매우 심각한 사회현상을 품고있고 그런 심각성을 두 청년의 유쾌함으로 무마하려는 흐름이 저에게는 약간 괴리감을 느끼게 만듬.  ,1,0,0
6036,2017.08.15,10,처음부터 끝까지 맘편히 볼수있는영화 맘껏 웃을수 있는영화다 배우두분이 너무잘생기심♡  ,1,0,0
6037,2017.08.15,10,끝까지 울고 웃기네요  재밌어요 ㅋㅋ  ,1,0,0
6038,2017.08.15,10,억지 웃음요소 억지 감동이 없어서 좋았던 영화네요자연스럽게 웃을수 있는 영화를 많이 만들어주세요10점 줘도 아깝지 않는 영화입니다  ,1,0,0
6039,2017.08.15,10,개꿀잼 올해본영화중 최고다진짜!!!!박서준 강하늘 연기케미 장난아니다진짜 유쾌하고 시원하고!  ,1,0,0
6040,2017.08.15,10,그냥재밌음! 강하늘 진짜 연기잘하는거같고 박서준 매력   쩔고.. 지루한지 모르고봤어요  ,1,0,0
6041,2017.08.15,9,웃고 올 수 있는 영화 재미있었다  ,1,0,0
6042,2017.08.15,9,관람객가볍게 보기 좋네요. 꿀잼입니다  ,1,0,0
6043,2017.08.15,10,너무재밌어요 친구들과 함께보는거 추천해요 ^^  ,1,0,0
6044,2017.08.15,9,진짜 재미있었고 맘껏 웃고 배우들 합이 좋아서 좋았는데 제가 쫌 무서운걸 못봐서 그런가...? 무서운 장면두 있었어요ㅠㅠㅠ 이것 빼고는 감동 연기력 연출 외모까지 다 좋았어요!  ,1,0,0
6045,2017.08.15,8,관람객우리들의 청년경찰 화이팅~  ,1,0,0
6046,2017.08.15,9,의외로 식상하지 않고 잼났다.두배우 궁합이 좋았다 모처럼 돈아깝지 않았던영화다  ,1,0,0
6047,2017.08.15,10,정말 너무 재밌고 웃기고 액션도 좋고 박서준.강하늘 케미는 말할 것도 없이 너무 좋고 시간 가는 줄도 모르고 봤네요 진짜 짱이에요ㅠㅜ 조만간 또 보러갈예정!  ,1,0,0
6048,2017.08.15,10,오랜만에 빵터지는 영화 봤네요ㅋㅋㅋ 강하늘 박서준 화이팅!^^  ,1,0,0
6049,2017.08.15,10,너무 웃어서 진짜 와 ㅋㅋ 너무 재미있었어요  ,1,0,0
6050,2017.08.15,1,병맛 그냥 병맛억지웃음코드덤앤더머  ,1,0,0
6051,2017.08.15,10,보통 영화 보면 재밌는 영화였어도 엔딩이 찜찜한 경우가  많은데 이 영화는 엔딩 마저 옳다 웃긴 장면도 많지만 여운을 주는 영화이기도 하다 다들 보러가세요  ,1,0,0
6052,2017.08.15,10,안 보면 후회합니다 그러니깐 꼭 보셔요!!서준하늘 사랑합니더♡♡  ,1,0,0
6053,2017.08.15,1,강간 성매매 장기밀매 난자공장 등 충격적이고 극도로 혐오스러운 주제를 다루는 영화가 15세 관람가라는 사실을 믿을수가 없네요. 여성범죄를 여름밤 한탕웃음으로 가볍게 소비해버리는 영화가 평점이 이렇게 높다니 같은 충격적이네요. 뇌를 씻고 싶습니다.  ,1,0,0
6054,2017.08.15,1,"대사도 역겹고 상황이너너무 끔찍했습니다아직도 대사 하나때문에 속이 안좋네요,,이런 끔찍한 주제로너무가볍게 만든영화같음...  ",1,0,0
6055,2017.08.15,9,젊음이 좋다! 패기란 이런것!  ,1,0,0
6056,2017.08.15,10,관람객강하늘 박서준 캐미는 정말 인정해야한다..ㅋㅋㅋ  ,1,0,0
6057,2017.08.15,10,올해 본 영화 중 제일 재밌다!!!  ,1,0,0
6058,2017.08.15,1,"두 명의 자칭 '정의'를 앞세운 청년 경찰에 의해 기성 경찰, 조선족, 여성 등 그들을 제외한 모두는 그저 웃음거리가 되고 편견의 피해자로 전락합니다. 감독이 생각하는 경찰의 정신이란 정말 이런겁니까? 평론가들의 점수가 백프로 이해되네요  ",1,0,0
6059,2017.08.15,10,강하늘 넘 좋앙♡♡♡♡ 빵빵 터짐ㅋㅋ엄빠랑 또 볼거야ㅋㅋ  ,1,0,0
6060,2017.08.15,5,"관람객너무 자극적인 요소들. 그 요소들을 질러만 놓고 채 수습하지 않은 스토리. 영화 중간중간 웃음 포인트들이 많지만 이야기를 풀어나가는 소재와 장면, 대사가 몹시. 너무 자극적이어서 웃을 수가 없었다.. 흡사 귀향, 도가니를 보고나서의 분통이 그대로 전해  ",1,0,0
6061,2017.08.15,10,관람객친구랑 오랜만에 엄청 웃으면서 봣어요무거운 내용이지만 재밋게 잘 봤습니다  ,1,0,0
6062,2017.08.15,10,꿀잼!! 박서준 짱멋짐. 강하늘 우주최강 귀요미!!★♥★(  ,1,0,0
6063,2017.08.15,9,계속 빵빵터짐   진짜 재밌다 ㅋ  ,1,0,0
6064,2017.08.15,5,두 배우 연기는 정말 좋았고 초반까지는 재밌었는데.. 이런 소재가 아니었다면 끝까지 웃을 수 있었을 것 같네요ㅜ 이런 사건을 다룬 영화인줄 알았으면 밤에 안봤을듯.. 여자입장에서 좀 무서운 영화  ,1,0,0
6065,2017.08.15,10,관람객박서준 강하늘 너무 재밌어요ㅠㅠ케미 폭발..  ,1,0,0
6066,2017.08.15,10,영화관  사람들 다 웃기만 한거같다 둘이 케미 너무 좋았고 영화보면서 그렇게 크게 웃은건 처음인거같다 ㅋㅋ 근데 영화때문에 대림을 못갈듯.. 소름돋았다  ,1,0,0
6067,2017.08.15,8,코믹하지만 뭉클한감동도있고 젊음에 재미와열정 마음속의 청춘같은... 여러모로 재미지네용  ,1,0,0
6068,2017.08.15,10,꼭 보삼!두번보삼! 아니 새번보삼!!!  ,1,0,0
6069,2017.08.15,9,둘 케미가 너무 좋았어요!! 재밌게 봤습니당~~~~  ,1,0,0
6070,2017.08.15,10,영화관 갔다하면 어떤 영화를봐도 중후반을 못넘기고 자는 내가 이걸 끝까지 봤다.. ㅋㅋ  ,1,0,0
6071,2017.08.15,10,"와~~  역시 박서준,강하늘 입니다쩐다 쩔어~~  둘의 케미가 장난아니네요..청년경찰 이라는 제목에 딱이구요 오랜만의 박하선씨 반가웠어요..  목소리 쩌렁쩌렁ㅎ..글구 성동일아저씨~  역쉬 연기 짱이십니다 유쾌통쾌 했습니다 꼭 보세요^^  ",1,0,0
6072,2017.08.15,9,군함도보다 훨 인팩 있슴.  ,1,0,0
6073,2017.08.15,10,억지감동없이 정말유쾌하고  꿀잼 ㅋㅋㅋ  ,1,0,0
6074,2017.08.15,10,처음부터 끝까지 시원하게 봤어요. 답답함 없이 깔끔하네요.유쾌하고 즐거웠습니다!!!!  ,1,0,0
6075,2017.08.15,9,"심야로 보고왔는데 남자라 두 배우를 알기는 아는데 어느작품했는지도 잘 모르고 보긴 봤는데 둘이 캐미가 상당히 좋았고 한국식 마지막 억지감동 없고 적당한 개그도 있고, 현실적인 액션에 꽤 괜찮은 영화였습니다.  ",1,0,0
6076,2017.08.15,10,관람객재미는 물론 정말 조심해야겟다는 생각을 하게되는 영화였습니다.멋져요 청년경찰!!!!  ,1,0,0
6077,2017.08.15,10,쳐음부터 잼있음 계속웃음터짐  ,1,0,0
6078,2017.08.15,10,완전완전 재미있어요!  ,1,0,0
6079,2017.08.15,10,또 페미니스트 아닌 페미니스트들이 평점 테러하네요..  ,1,0,0
6080,2017.08.15,10,미치도록 재미있게 봤어요 !!! 꼭 보세요 추천합니당  ,1,0,0
6081,2017.08.15,10,진짜 잘만들었네...시원시원하네..  ,1,0,0
6082,2017.08.15,3,재밋는데 너무 징그러워요 여자 배들출때ㅠㅠ머그렇게 징그럽게 묘사했는지 토하겟음 아직도  ,1,0,0
6083,2017.08.15,10,관람객진짜 오랜만에 빵빵 터짐 교훈도 있고 웃기기도 웃기고 기대 안했는데 재밌네요 엄마랑 재밌게 봤어요  ,1,0,0
6084,2017.08.15,10,배쨈래레래레래레래렘  ,1,0,0
6085,2017.08.15,10,최근에 본 영화중에 제일 재밌다. 너무 재밌다 그냥 꼭 봤으면 좋겠다  ,1,0,0
6086,2017.08.15,10,진짜.리얼. 헐. 대박. 완전. 재미있음. 걍재미있음.  ,1,0,0
6087,2017.08.15,10,관람객이런 류의 영화는 체포왕 이후로 최고였다.  ,1,0,0
6088,2017.08.15,10,ㅋㅋㅋㅋ정말 재밌게 봤어요 큰소리로 웃으면서~  ,1,0,0
6089,2017.08.15,10,케미굿ㅋㅋ 둘이 넘 귀엽다ㅋ  ,1,0,0
6090,2017.08.15,10,스물 감독이 만든 줄 ㅋㅋㅋ 초반부터 개꿀잼 ㅋㅋㅋㅋ  ,1,0,0
6091,2017.08.15,10,관람객진짜 재밌었음 생각보다 빵빵터지는 영화  ,1,0,0
6092,2017.08.15,10,처음엔 기대안하고 봤는데 몰입해서 잘봤습니다 추쵼~~  ,1,0,0
6093,2017.08.15,1,생가하는 그대로 b급영화다..아휴~ 내 이런걸 돈주고 시간내서 보다니..진짜 분하다!!! 분해~  ,1,0,0
6094,2017.08.15,1,내가진짜 영화보고 평점안쓰는데 이건써야겠다. 보는내내 재미없었다. 그리고 집에와서 얼마나 혹평을받고잇는지 검색해보았더니 8점대다.말이안된다 스토리도병맛이고 이따금 유머가나오긴하지만 그거외엔 정말허술하고 박서준강하늘 찌찌파티하고 끝이다 팬들만좋아할영화  ,1,0,0
6095,2017.08.15,8,관람객그녕저냥 볼만해요 ㅎㅎ  ,1,0,0
6096,2017.08.15,10,오랫만에잼나게본영화임~  ,1,0,0
6097,2017.08.15,10,진짜 핵꿀잼..♡브로맨스쩜♡♡♡♡리얼 군함도 보고 돈 졸 아까비였는데..이건 또 보러갈꺼임♡♡♡보는내내 폭소ㅋㅋㅋ 간만에 재미난 영화♡♡♡  ,1,0,0
6098,2017.08.15,5,지금 롯데 시네마에서 보고옴.. 아무리 영화라지만 현재 경찰력을 이렇게 표현하다니.. 한달 지나서 수사를 한다? 10명 넘는 청소년이 실종 됐는데? 병원의사가 직접 돈을 건네고? 줄줄이 사탕으로 병원으로 들어가고? 댓글 평점 알바들의 승리..  ,1,0,0
6099,2017.08.15,2,최악 그 이상은 없고 그 이하만 있는 영화  ,1,0,0
6100,2017.08.15,1,"킬링타임영화로 재미있긴한데 평점 8점이 넘을 영화는 아니다. 알바들, 얼빠들 죽이고 싶다. 객관적인 점수는 6점정도 하지만 얼빠들,알바들 때문에 1점  ",1,0,0
6101,2017.08.15,10,관람객최고의영화말이필요없닼?ㄱ?ㅋ  ,1,0,0
6102,2017.08.15,10,돈이 아깝지 않은 영화 재미있었습니다  ,1,0,0
6103,2017.08.15,10,정말 너무 재밌네요 별기대안하구봤는데 기대이상임  ,1,0,0
6104,2017.08.15,1,와...여기 진짜 댓글알바들만 있나??진부한 스토리에  억지웃음 억지감동 어지간하면 귀찮아서 로긴하고 평점안남기는데  진짜 시간아깝고 돈내고 영화관가서 본게 화가날정도로 재미없고 유치함  ,1,0,0
6105,2017.08.15,9,"코믹영화는 웃고 즐기면된다.머가 이리 말이많노.소재가 다소자극적이긴했다.어떤생각없는 엄마는 초등학생 애를 데리고왔다,살짝 오글거리기도 했지만,박서준 강하늘이라  다좋다ㅋㅋ  ",1,0,0
6106,2017.08.15,10,관람객영화를 보고 왔는데 아직도 머리속에서 기억이 남았요 이 영화 꼭 추천하고싶어요  ,1,0,0
6107,2017.08.15,10,관람객웃을때 잘생긴 둘ㅋㅋ눈호강함  ,1,0,0
6108,2017.08.15,10,관람객너무 재밌어요 많이 웃음  ,1,0,0
6109,2017.08.15,9,관람객역시 박서준 멋있고 연기도 너무 잘하더라~~^^  ,1,0,0
6110,2017.08.15,8,"관람객꾸르잼 박서준존잘..,,  ",1,0,0
6111,2017.08.15,8,"관람객대학교시절 열정많고 정의에 불탔던 때가 많이 떠오르게하는 영화였다..지금은..현실에 익숙해진 내 모습에 조금은... 암튼 젊음에, 정의에 불타는 열정에 박수칠만한 영화..  ",1,0,0
6112,2017.08.15,10,관람객ㅋㅋㅋㅋ좀잼ㅋㅋ!!!  ,1,0,0
6113,2017.08.15,10,계속 웃었어요ㅋㅋ 배우들의 몰입력도 한 몫해서 대단한 영화가 나온 것 같아요! 화띵  ,1,0,0
6114,2017.08.15,8,관람객오락영화로 시간 잘가고 좋아요  ,1,0,0
6115,2017.08.15,10,관람객중간중간 빵빵 터지네요ㅋㅋㅋ  ,1,0,0
6116,2017.08.15,10,관람객빅재미ㅋ 완전 난 가볍게 잼났음  ,1,0,0
6117,2017.08.15,10,재밌어요 유쾌하게 봤어요  ,1,0,0
6118,2017.08.15,10,정말 재밌어요~~~♡♡  ,1,0,0
6119,2017.08.15,2,정말 너무 하네.   8점 이상 준 사람들은 니들도 엿이나 먹어라 이건가?  ,1,0,0
