index,time,score,reple,1st_week,2st_week,3st_week
2950,2017.08.11,8,영화 재미는 10점 그러나 광고와 영화프로그램에서 보여준게 너무많아서 8점... 아..쒸...  ,1,0,0
2951,2017.08.11,7,두배우의 케미는 인정.. 킬링타임으런 괜찮습니다.^^  ,1,0,0
2952,2017.08.11,10,영화 정말 재밋게봣어요 오랜만에 힐링됐네요  ,1,0,0
2953,2017.08.11,1,"평점 높이 다신 분들에개 묻고싶은데, 영화가 훌륭해서 높게 주신거에요 아님 배우가 좋아서 높게주신거에요?  ",1,0,0
2954,2017.08.11,10,최근 영화개봉한거 다봤는게 이게 제일 재밌었어요!!!! ㅠㅠ  ,1,0,0
2955,2017.08.11,10,관람객정말유쾌하게잘봤습니다.내내웃었네요^^  ,1,0,0
2956,2017.08.11,9,관람객재미있게 잘봤읍니다. 배우는 그리 유명하지 않지만 톡톡 튀는 젊음과 유머도 곁들이고 좋았읍니다  ,1,0,0
2957,2017.08.11,10,대박사건 ~~ 진짜 꿀잼임  ,1,0,0
2958,2017.08.11,10,재밌었닼ㅋㅋㅋㅋ볼까말까 고민한다면 봐서 후회할일없을듯!!!  ,1,0,0
2959,2017.08.11,8,재ㅋ미ㅋ있ㅋ었ㅋ다ㅋ  ,1,0,0
2960,2017.08.11,10,처음부터 끝까지 유쾌하고 재미있는 영화!!!  ,1,0,0
2961,2017.08.11,8,청년경찰 보면서 청년의 때인 지금을 다시 응원하는 계기가 되었습니다!! 진짜 꿈을 꾸게되는 영화 속 두 청년을 닮고 싶네요!!  ,1,0,0
2962,2017.08.11,10,너무 재밌어요 진짜 유쾌하게 재밌어요 기대했는데 기대이상!!!!  ,1,0,0
2963,2017.08.11,10,관람객유쾌하고.재미있었어요.박서준몸짱!!!  ,1,0,0
2964,2017.08.11,10,어제 보고왔는데 오늘 또 봤어요!  ,1,0,0
2965,2017.08.11,10,연기 너무 잘하네요 내용도 정말 재밌어요^^추천해요  ,1,0,0
2966,2017.08.11,10,관람객아이와 가볍게  재미있게 보고왔어요..  ,1,0,0
2967,2017.08.11,10,"최근 몇년간 본 영화중에 가장 재밌다. 꼭 보세요. 그리고 한국영화를 위해서 개인 주관이 아니라 객관적으로 평가했으면 합니다. 이영화는 가히 명작이라 볼수있습니다. 주는 교훈, 재미, 볼거리, 다 제공하네요! 꼭보세요!  ",1,0,0
2968,2017.08.11,9,"관람객박서준 강하늘 연기야 말할 필요없이 그냥 그 캐릭터 자체라ㅋㅋㅋ너무 재밌게 봤어요 박서준 몸 진짜 대박,,  ",1,0,0
2969,2017.08.11,10,관람객아이들과보기에 딱 좋구 재밋어요~~^^  ,1,0,0
2970,2017.08.11,10,시작하자마자 초반에는 억지웃음을 유발하며 망작이라고 생각했지만 중후반가서는 점점 빠져든다.  ,1,0,0
2971,2017.08.11,9,관람객재밌었네요 !!! 특히 액션장면이 멋있었습니다~  ,1,0,0
2972,2017.08.11,10,"영화후기는 처음 써보네요~원래 강하늘씨와 박서준씨 팬이기도 했지만 영화가 참 좋았습니다~ 두 배우의 연기와 케미가 완벽했어요!! 보는내내 시간가는줄 모르고 웃다가 사건해결하면서는 심장이 쫄깃쫄깃했어요ㅎㅎ  두 배우, 그리고 영화 늘 응원합니다♡!!  ",1,0,0
2973,2017.08.11,10,관람객진짜 재미있었습니다! 처음에는 그냥 웃기기만 했는데 가면갈수록 긴장감 넘치고 흥미진진!  ,1,0,0
2974,2017.08.11,10,재밋다 그냥 재밋어 ㅋㅋㅋ 굿  ,1,0,0
2975,2017.08.11,1,긴 말 안 한다 열자채우기  ,1,0,0
2976,2017.08.11,10,내 영화 리스트에는 없었던 영화인데요. 보니 의외로 잼 있고 지루 하지  않는 진도 괜찮네요. 두 배우의  캐미가 찰떡궁합이구요. 욕도 찰지게  현실적으로 잼 있게..적당히  현실  비판도 하고 여하튼  잼 있게  봤어요  ,1,0,0
2977,2017.08.11,10,??쿠키가 있다니 그냥 나왔는데ㅠㅠㅠㅠ아 짱재밌었어요 두번봐요 세번봐요!!@또 보고싶다...아 진짜 보는 2시간 내내 웃고 심각하고 다했네요...연기 짱이고 시간이 엄청 빨리갔어여ㅠㅠ 완전 강추  ,1,0,0
2978,2017.08.11,10,(문을 열고) 짭새야~~~~  ,1,0,0
2979,2017.08.11,7,"광고는 코미디처럼 해놓고 실제론 납치,장기밀매 같은 어두운 영화.. 15살된 중딩 사촌동생이랑 보러 갔다가 충격먹음. 영화는 볼만한데 나와서 기분이 좋지만은 않았다. 난 웃으러 간건데...  ",1,0,0
2980,2017.08.11,8,관람객Djdkdlclcl  ,1,0,0
2981,2017.08.11,10,"어떤 평 중에 '스물의 유쾌함과 베테랑의 통쾌함을 다가졌다'는 평을 본 적이 있는데, 이 평이 딱 맞는 것 같습니다. 이렇게 관객들 다같이 빵터진 영화 너무 오랜만이네요ㅋㅋ올해 본 것 중에 젤 좋았던 영화입니다!  ",1,0,0
2982,2017.08.11,10,이렇게 잘생긴 에이스 두명남자배우 캐스팅해놓고 흥행안될까 걱정하는건 아니죠?^^ 강하늘의 매력은 어디까지인가...두둥  ,1,0,0
2983,2017.08.11,10,대박 웃겨요간만에 실컷 웃다가 나옴  ,1,0,0
2984,2017.08.11,10,안구정화나 하자 반  웃다가 나오자반으로  봤는데  손에 땀을 쥐고 봤네요  정말 시간가는줄 모르고 옆에 남친 붙들어가며 화면도 제대로 못쳐다봐가며 숨죽이고 봤습니다 연기자 두분의 얼굴보단 연기가 더 잘보여서 만족스러웠어요 고생많으셨습니다^^  ,1,0,0
2985,2017.08.11,10,나 진짜 평점 처음 남겨봄.또다시 박서준강하늘 입덕영화ㅠㅠ  ,1,0,0
2986,2017.08.11,10,관람객ㅋㅋ강하늘 졸귀탱 서쥬니는 역시 존멋 ㅠㅠ눈이 즐거웠어요!  ,1,0,0
2987,2017.08.11,10,끊임없이 웃었다 근데 여자들 하나하나 반응하니깐 불---편  ,1,0,0
2988,2017.08.11,10,정말 재미있게 봤습니다~ 다시 한번 박서준씨와 강하늘씨가 나오는 영화가 보고싶습니다. 한번더 이 영화를 보고싶다는 생각이 듭니다^^  ,1,0,0
2989,2017.08.11,10,진짜 개잼 정말재밌어오 ㅠㅠ이런거 귀찮아서 안쓰는데 평론가 평점보고 ?;;;;스러워서 쓰러옴요 나는 또보고싶읗정도로 지밋었음  ,1,0,0
2990,2017.08.11,1,진짜. 재미업서 스토리가. 넘으 의미업서.  ,1,0,0
2991,2017.08.11,10,영화를 보고나서 이렇게 생각나고 꽂힌거 처음임..ㅋ특히 박서준 개 멋있고 매력터져요 꼭 봐요 여자분들 후회안해요 네버ㅋㅋㅋㅋ쨋튼 졸잼  ,1,0,0
2992,2017.08.11,10,진짜 재밌어요 꼭 보세요  ,1,0,0
2993,2017.08.11,10,정말 연기 대단합니다^^시간가는지 모르고 잘봤어요~~^^  ,1,0,0
2994,2017.08.11,8,보는 내내 빠져들어 웃었는데 기억에 남는건 용기탑재된 덤앤더머  ,1,0,0
2995,2017.08.11,9,생각보다 스토리 좋고~투캅스를 보는듯한~  ,1,0,0
2996,2017.08.11,10,"젊음, 패기, 열정, 집념 그리고 우정  ",1,0,0
2997,2017.08.11,10,유쾌하고 재밌어요 그냥 생각없이 시간떼우려고 본영화였는데 기대이상이구요 기대하고봐도 재밌었을듯요 최근 본 영화중 제일 괜찮은영화에요  ,1,0,0
2998,2017.08.11,10,관람객개재밌음 ㄹㅇ 정색한 적이 없따  ,1,0,0
2999,2017.08.11,1,제생각엔 강하늘 박서준씨말고도 연기가너무어색하고스토리전개가 너무뻔했습니다  대사도 너무오글거리고 좀더 재밌게풀어낼수 있었을텐데 아쉽습니다  ,1,0,0
3000,2017.08.11,10,관람객배우들 멋지고 재미있어요  ,1,0,0
3001,2017.08.11,10,간만에 유쾌하게 엔딩크레딧까지 다봐서 문화인이 된 기분입니다  ,1,0,0
3002,2017.08.11,10,관람객재미있어요 돈주고 볼만해요  ,1,0,0
3003,2017.08.11,1,강간 등 여성에게는 너무나 공포스러운걸 단순히 재미로 사용하고 액션 코미디 타이틀 단게 어이없네. 꼭 이런 소재를 썼어야 했을까  ,1,0,0
3004,2017.08.11,9,기승전결확실하고 재미있고 깔끔한 영화~강하늘씨 보러갔는데 박서준씨에게 반했네요~~  ,1,0,0
3005,2017.08.11,9,관람객가볍게보기 좋은영화 중간중간 빵터짐  ,1,0,0
3006,2017.08.11,10,레알 존잼ㅋㅋ 둘다 연기 너무 잘해 ㅜ 케미 난리남  ,1,0,0
3007,2017.08.11,10,두 배우가 너무 웃기고 멋있어서 시간가는줄 모르고봤어요 진짜 박서준 강하늘 너무 멋지고 그 조선족 아저씨도 너무 멋있었어요  ,1,0,0
3008,2017.08.11,10,막 미친듯이 웃긴영화는 아니지만  가볍게 웃긴 영화.소재도 신선하고  스토리도  괜찮고 주인공들 케미도 좋다. 영화를 통해 사회를 더 잘 알게되었고 쿠키영상도 재밌다!  여성남성관객 모두 좋아할만한 여름코미디 영화.가족영화로 추천합니다  ,1,0,0
3009,2017.08.11,9,"관람객두 배우의 케미가 기대 이상입니다.사실 좀 유치하지 않을까 걱정반 기대반이었는데  오랫만에 신나고 즐거웠습니다. 박서준 배우와 강하늘 배우 다시 봤구요, 더위에 지친 요즘  신나고 즐겁게 볼 수 있는 영화였습니다. 개인적으로 박하선씨도 멋졌어요..^^  ",1,0,0
3010,2017.08.11,10,시간가는지 모르고봄 웃기고 재미나요 최고  ,1,0,0
3011,2017.08.11,10,기자(평론가)들은 원래 경찰을 좋아하지 않는다. 열등감  ,1,0,0
3012,2017.08.11,10,끝나지 말아라 끝나지말아라 시간을 붙잡고싶을 정도로 너무 재밌었어요^^  ,1,0,0
3013,2017.08.11,10,조금은 무거운 소재를 유쾌하게 풀어낸 영화  특히 박서준 강하늘 두 배우의 능청스런 연기가 압권입니다.  ,1,0,0
3014,2017.08.11,10,관람객잘봤습니다. 무거운것이랑 가벼운것을 잘 조합한것같습니다.  ,1,0,0
3015,2017.08.11,9,이딴걸 돈주고 영화관에서 뭐하러봐? ㅋㅋㅋ그냥 설날 추석에 하면 보지 ㅋㅋㅋㅋ  ,1,0,0
3016,2017.08.11,10,정말 최고입니다. 둘케미가 너무 잘맞고 처음엔 병맛인 줄 알았는데 멋져요  ,1,0,0
3017,2017.08.11,10,너무 재밌게 잘봤습니다  ,1,0,0
3018,2017.08.11,2,다소 꽤 엄청 많이 실망스러운...  ,1,0,0
3019,2017.08.11,10,관람객경찰대학생을 주인공으로 대규모 범죄조직을 일망타진한다는 내용이 신선했다. 특히나 두 주인공의  몸안사리는 액션은 대단했다. 내용도 흠잡을것없으나 최근 많이보이는 중국동포가 범죄조직과 많이 연관된다는 설정은 좀 아쉬웠다 자칫하면 모든동포가 피해를 볼까.  ,1,0,0
3020,2017.08.11,9,관람객투캅스의 케미를 이 시대에 새롭게 만날 수 있었어요.  ,1,0,0
3021,2017.08.11,5,솔직이 5점 정도네요; 아무래도 10점 주는 사람들 여자들이 많은듯.. 좋은 연기력을 보여줄만한 내용은 아니기 때문에 연기력 평가는 좀 아닌것 같고. 코미디부분도 소량 들어갑니다. 너무 평범한 그저그런 내용이니 참고하세요.  ,1,0,0
3022,2017.08.11,9,관람객입소문 날만한 영화네여~시원한 느낌 오랜만에 느껴봅니다~  ,1,0,0
3023,2017.08.11,8,관람객굳ㅋㅋ생각없이봤는데 기대이상  ,1,0,0
3024,2017.08.11,10,생각없이 봤지만 마냥 가볍지만은 않은 내용. 두배우의 캐미가 환상이라 심각한데도 그냥 웃김ㅋㅋㅋㅋ 재밌다!!!!  ,1,0,0
3025,2017.08.11,10,엄마랑 올만에 영화를 봤는데 너무 재미있다는 리뷰를 보고 예매를 했습니다.저희 엄마도 계속 웃으시면서 봤지만 영화관에 있는 모든 사람들이 다 반응이 좋았던 것 같애요.  ,1,0,0
3026,2017.08.11,10,정말 재밌고 유쾌하고 짠하고 한국사회 풍자까지!결말도 희망적인 영화!~이런 영화가 많아졌음 좋겠어요~좌절이나 회한이 아닌!  ,1,0,0
3027,2017.08.11,9,영화는 재밌다. 하지만 무거운 소재라서 조금 빗겨봐야할 부분이 있어서 아쉽  ,1,0,0
3028,2017.08.11,10,관람객재미있어요 배우들의 액션 연기 내용 다 좋아요  ,1,0,0
3029,2017.08.11,10,재밌게 봤습니다. 중간중간에 빵터지는 부분도 많습니다~  ,1,0,0
3030,2017.08.11,10,"관람객진짜 핵존잼,, 최근 본 영화중에 아주 최고하도 웃겨서 ㄱㅖ속 실실대면서 봤둠 ㅎㅅㅎ 둘의 케미가 현실친구 같았다능  ",1,0,0
3031,2017.08.11,10,짱잼존잼핵잼존웃짱웃핵웃  ,1,0,0
3032,2017.08.11,10,잼나요^^ 두 남자의 코믹연기 ~~  ,1,0,0
3033,2017.08.11,10,완전 꿀잼입니다.~~ 강추합니다.  ,1,0,0
3034,2017.08.11,5,솔직히 재미없다. 평점이 너무 높다. 아무생각없이 웃으려고 봤다가 지루해서 혼났다. 이게 어찌 군함도보다 평점이 높을까;;  ,1,0,0
3035,2017.08.11,10,관람객재밌어요 박서준 강하늘 멋있어요 박서준 몸매 짤어요  ,1,0,0
3036,2017.08.11,8,지루하지않고재미있어요  ,1,0,0
3037,2017.08.11,8,관람객넘 열심히 촬영했어요~~  ,1,0,0
3038,2017.08.11,10,진짜 이번시즌 여름 중에 이영화가 제일 재미있었습니다 배꼽잡고 많이 웃었고 훈훈하네요^^  ,1,0,0
3039,2017.08.11,8,관람객코믹적인 요소가 많으며 지루하지는 않음  ,1,0,0
3040,2017.08.11,10,청년경찰 꿀잼ㅋㅋ 믿고보는 박서준 강하늘  ,1,0,0
3041,2017.08.11,10,시계 볼 틈이 없음... 후딱 지나감  ,1,0,0
3042,2017.08.11,8,"열혈청년들의 열정, 집념, 진심을 유쾌하게 발랄하게 보여주는 영화  ",1,0,0
3043,2017.08.11,10,엄청 짱 재미있습니다!!!!  ,1,0,0
3044,2017.08.11,10,둘의 케미와 개그포인트 겁나 재밋음  ,1,0,0
3045,2017.08.11,8,관람객재미가 있었으나 관심있는 여자를 무작정 따라가는 모습은 별로였어요~  ,1,0,0
3046,2017.08.11,9,방금 봤어요.  재미있네요~^^  ,1,0,0
3047,2017.08.11,9,재밌어요~지루하지 않고 유쾌한 영화에요!  ,1,0,0
3048,2017.08.11,10,올해 본 영화중 제일 재미있었습니다! 계속해서 시리즈로 볼 수 있었으면 좋겠어요! 제발요ㅜㅜ  ,1,0,0
3049,2017.08.11,10,시원시원한연기!!!꿀잼이네요ㅋ !!맘아픈소토리는있지만ㅜ생각없이보기조아요  ,1,0,0
3050,2017.08.11,9,"관람객유쾌, 통쾌, 상쾌한 짬세 영화였음  ",1,0,0
3051,2017.08.11,10,재밌고지루하지않고굿  ,1,0,0
3052,2017.08.11,10,완전 둘이 쿵짝으로 너무 재밌음.!!!!  ,1,0,0
3053,2017.08.11,10,관람객내배꼽어디갔어요????ㅠㅜ  ,1,0,0
3054,2017.08.11,10,너무 재밌어요...와  ,1,0,0
3055,2017.08.11,10,와 개웃기네ㅋㅋ 가래침졸라웃김  ,1,0,0
3056,2017.08.11,9,"박서준,강하늘 두 배우 케미 짱!성동일,박하선 연기도 좋구 악역맡으신 배우님도 포스 쩔음  ",1,0,0
3057,2017.08.11,10,코미디영화라 계속 웃으면서 본 영화에요웃음이 필요하신 분 꼭 보세요!이 와중에 박서준.강하늘 잘생긴콤보♡  ,1,0,0
3058,2017.08.11,6,양산형영화다. ...  ,1,0,0
3059,2017.08.11,10,한국영화 잘 안 보는데 이건 진짜 보고 나오는데 또 봐도 재밌을 것 같다는 생각이 뽝!!ㅜㅜㅜ 한번 더 볼게욥ㅜㅜ또 보고싶어요ㅜㅜㅡㅜ  ,1,0,0
3060,2017.08.11,10,관람객중간중간 재미있는 요소들도 많고 재밋어욤  ,1,0,0
3061,2017.08.11,9,"관람객너무 멋진 서준,하늘~^^  ",1,0,0
3062,2017.08.11,9,관람객 경찰이 되기까지 얼마나힘든 과정있는지알게되었습니다  경찰이란 직업도정말멋진거같아요    재미도 있고 감동동 있었습니다  ,1,0,0
3063,2017.08.11,10,관람객유치한데 개그코드가 제 스타일 진짜 껄껄 웃으면서 봤어요ㅎㅎㅎ 몇일동안 계속생각나네요~~ 편하게 볼 수 있는 영화인것 같아요!!!  ,1,0,0
3064,2017.08.11,10,시간가는줄 모르고 정말 재밌게봤어요~~ 배우들 캐미 최고!!  ,1,0,0
3065,2017.08.11,8,간만에 웃으면서 봤다. 무서운 상황에서도 침착한 초인들이다  ,1,0,0
3066,2017.08.11,5,가벼운 오락영화지만 범죄는 가볍지 않게  ,1,0,0
3067,2017.08.11,10,"1시50분 cgv에서 봤음.단순 코믹이 아니라 더  좋았음.부조리한 현실을 다룬 코믹영화!내용도 알차고 ost도 좋았고, 연기도  잘하고.. 다 좋았던 영화!  ",1,0,0
3068,2017.08.11,9,유쾌한 웃음으로 발산되는 영화로서 시간가는줄모르고 봤는데도 재미있는영화라서 추천하고 싶습니다  ,1,0,0
3069,2017.08.11,10,관람객청년경찰 정말 재밌어요!  ,1,0,0
3070,2017.08.11,10,진심 박서준과 강하늘케미 존잼 ㅋㅋㅋㅋ첨부터 끝까지 다웃기다ㅋㅋ그리고 이거보고 난후 혈기가 솟아오른다하늘에서 정의가 빚발친다!!  ,1,0,0
3071,2017.08.11,10,재밌어요 ~ 계속 웃으면서 봤어요  ,1,0,0
3072,2017.08.11,10,관람객난 진짜 평론가들이 개싫다 그냥 사회적문제를 적용해  무조건 영화를 까려고만하네 그냥 평점 낮게 조지면 다평론가인줄아나? 난 정말 재미지고 즐겁게봤다  ,1,0,0
3073,2017.08.11,10,"정말 제가 지금까지 본 작품 중 제일 재밌게 봄.진짜...여운이 길게 갔고 재미,감동,교훈,스릴 뭐하나 빠지는거 없어 극찬하고 싶은 작품임.내가 지금까지 영화보면서 울었던 적이 없었는데 울었음.뭐,그건 우리 사회에 대한 답답함에 운거였지만.. 꼭 보셈  ",1,0,0
3074,2017.08.11,10,ㅋㅋㅋ진짜 재밌어요ㅋㅋ 박서준 강하늘 케미가 진짜 친구같아요 ㅋㅋㅋㅋ  ,1,0,0
3075,2017.08.11,10,유쾌하고 즐거운영화말이안되는 부분이있긴하지만 영화라고 생각하고 이해해서봤습니다  ,1,0,0
3076,2017.08.11,10,안땡겨서 보기싫었는데 억지로 갔는데 ....안봤으면 울뻔할정도로 핵꿀잼.코미디드라마중 신선한 재미였음.아오랜만에 재밌는 한국코미디 본듯  ,1,0,0
3077,2017.08.11,1,빠순이들을 위한 영화 ㅋㅋ  ,1,0,0
3078,2017.08.11,9,관람객둘의 케미 좋음ㅋㅋ 개연성은 좀 떨어지는 부분이 있으나 코믹요소로 메꿔짐  ,1,0,0
3079,2017.08.11,10,관람객시간 가는줄 모르고 봤어요 ㅋㅋㅋ진짜 웃기고 진짜 재미있었습니다박서준 강하늘 둘 다 진짜ㅠㅠㅠ ?? 너무 사랑해요  ,1,0,0
3080,2017.08.11,10,기대안하고봣는데 기대이상으로 너무 재밋었고한번보고 두번볼만한 영화인것같다  ,1,0,0
3081,2017.08.11,1,최악. 최악의 영화. 굳이난자적출이라는 걸 소재로 해야했나  ,1,0,0
3082,2017.08.11,10,와 진짜 개웃김ㅋㅋㅋ 한참 웃다가 나옴  ,1,0,0
3083,2017.08.11,10,관람객코믹영화라고 해서 가볍게 생각하고 갔는데 무거운 소재로 다뤄서진지하기도 하고 무섭?기도 하고 생각해볼수 있더라구요~무튼 재밌었어요!!!!박서준 강하늘 케미 굿  ,1,0,0
3084,2017.08.11,10,재밌게 잘봤습니다 불필요한 절차는 생략하여 생명을 더 빨리 더 많이 구했으면 좋겠습니다  ,1,0,0
3085,2017.08.11,9,한바탕 웃음읃 준 영화. 지금 나에게 절실히 필요했던 영화다  ,1,0,0
3086,2017.08.11,10,시간 가는줄 모르고 봤어요 !긴장 될때는 긴장되고 웃음기 있을땐 웃음기 있고오랜만에 본 영화값제대로 하는 영화봤습니다 !  ,1,0,0
3087,2017.08.11,10,진짜 꿀잼 강추!!!!  ,1,0,0
3088,2017.08.11,10,진짜 이번에 본 영화중 젤 재밌어요! 한번더 볼 예정이에요!  ,1,0,0
3089,2017.08.11,10,재밌으면서 한편으론 무섭네요..  ,1,0,0
3090,2017.08.11,3,간혹 웃기기는 하나 스토리가 너무 억지스러움...경찰대 학생이라고 사건 해결 했으나 1년 유급이라던가...이런 큰사건을 경찰 자체가 도와주지 않는다던가...너무 말이 안되는 상황이 꽤 많음..두 주연 배우의 연기는 괜찮음.시나리오가 엉망이라서 그렇지  ,1,0,0
3091,2017.08.11,9,관람객기억에 남을 영화같아요재미있게 봤습니다  ,1,0,0
3092,2017.08.11,10,관람객ㄹㅇ 개꿀잼 안믿었는데 진심 꿀잼  ,1,0,0
3093,2017.08.11,10,코믹과 감동 모두 잡은 영화.. 시간가는줄 모르며 봤고 박서준과 강하늘 케미는 진짜 쩔었음 ㅋㅋㅋ  ,1,0,0
3094,2017.08.11,8,둘 케미도 좋았고 재밌었지만 조선족들에 대한 차별적 시각이 느껴져서 아쉬웠다 선악을 규정내려버리네  ,1,0,0
3095,2017.08.11,10,관람객진짜  두 주인공 케미가 짱임 너무잼씀 돈이안아깝고 다시돈주고봐도 꿀잼!!앞이고 뒤고 옆이고 관객들 다웃음  남자지만 박서준넘나멋잇고  강하늘잼씀!  ,1,0,0
3096,2017.08.11,8,관람객유쾌하지만 현실이 안타까운 영화!  ,1,0,0
3097,2017.08.11,10,계속 웃었음~!! ㅎㅎ  ,1,0,0
3098,2017.08.11,10,마무리까지 좋다 재밌다!  ,1,0,0
3099,2017.08.11,10,관람객박서준 강하늘 케미최고ㅎㅎ엄마랑같이봤는데 너무재밋었어요나이제한없이 전연령대가재밋게볼수있는영화같아요  ,1,0,0
3100,2017.08.11,10,강하늘♡박서준 둘의 케미가 아주환상적이였다~~ 넘 재밌고 시간가는줄 몰랐음^^둘 완죤멋져~~~♡  ,1,0,0
3101,2017.08.11,10,관람객눈이 즐겁고 너무너무 유쾌했어요ㅠ 아끼는 배우들로 내용이 이상하면 어쩌지 하고 너어어무 걱정했는데 진짜 최고였어요^^ 가볍게 보기에 아주 좋습니다  ,1,0,0
3102,2017.08.11,9,관람객보는내내 지루하지 않고 웃겼어요 ㅎㅎ 강하늘 박서준 케미가 너무 좋음~  ,1,0,0
3103,2017.08.11,10,진짜 재미있고 웃음이 안멈췄어요 !  ,1,0,0
3104,2017.08.11,10,재미있습니다ㅎㅎ  10ㅈㅏ  ,1,0,0
3105,2017.08.11,9,박서준 강하늘 케미 굿!!!  ,1,0,0
3106,2017.08.11,10,가벼운 마음으로 봤는데 올해 영화중 제일 재미있었던것같아요.주인공들 케미와 코믹연기 최고예요!한번더 보고싶네요  ,1,0,0
3107,2017.08.11,8,관람객생각보다 재미있었어요  ,1,0,0
3108,2017.08.11,10,관람객지루하지도않고아주재미있게봤습니다  ,1,0,0
3109,2017.08.11,10,친구들과 함께 봤는데 다들 시간가는줄 모르고 너무너무 재밌게 봤어요 더운날 기분전환으로 딱 좋은영화! 그리고 박서준씨 강하늘씨 케미가 장난이 아닙니더  ,1,0,0
3110,2017.08.11,10,"관람객은 재미있다는데,,,기자,평론가들은 머리가 쓰레기인가??평점이 항상 딱 지들 뇌수준이네,,,  ",1,0,0
3111,2017.08.11,8,관람객기대안하고 봤는데 재밌게 봤습니다 강하늘 박서준 케미 볼만합니다 :)  ,1,0,0
3112,2017.08.11,8,처음부터 끝까지 박서준을 위한 영화. 강하늘 팬이라 봤는데 액션씬부터 분장까지 심지어 마지막 쿠키영상까지 박서준만을 더 잘나게 표현했네요. 웃기는 장면은 거의다 강하늘씨가 주가되었고요. 하지만 두 배우 케미는 정말 좋습니다. 단순 재미만을 위한 영화.  ,1,0,0
3113,2017.08.11,10,올해 최고 웃겼던 영화! 지루하지도 않고 빵빵 터졌습니다.강추드립니다.  ,1,0,0
3114,2017.08.11,10,깔끔하게  웃기고  훈훈하기도 하고  두배우케미도  넘좋은영화..최근들어  보기드문   맘껏웃을 수있었던 영화!!  후기 안쓰는데 이런영화 많아졌으면해서 적어봐요~~  ,1,0,0
3115,2017.08.11,10,여름에 유쾌 상쾌 통쾌를 느낄수 있는 재미있는 영화두배의 케미와 말이 필요없는 배우 성동일배우의 호연이 돋보이는 작품감독님 다음작품도 기대가 됩니다^^  ,1,0,0
3116,2017.08.11,9,아무런 기대없이 에어컨 바람 쐬러 가서 봤는데 너무 재미있어서 빵빵 터졌음 ㅋㅋ 두 주인공의 연기도 너무 좋고 박하선도 진짜 경찰인줄 ~  ,1,0,0
3117,2017.08.11,9,관람객재미있었어요 중간중간 웃기고 유쾌하고 결말은 약간 뻔했어요 시간이 꽤잘가는 영화였던것같아요  ,1,0,0
3118,2017.08.11,10,관람객여자친구랑 재밋게 웃으면서 즐겼습니다 좋은영화에요 ~  ,1,0,0
3119,2017.08.11,10,요즘  더운  여름에  무거운  주제만  가득해서  아이들과  신나게  웃을  만한  좋은  영화네요.중고등학교  아들녀석이  친구들과  같이  보믄  완전  신나할  것  같은  영화.40대  주부인  저도  박수치며  웃었어요!  ,1,0,0
3120,2017.08.11,10,관람객너무너무 재미있게 봣습니당  ,1,0,0
3121,2017.08.11,10,아 진짜너무재밌어요 1번보세요 10번보세요  ,1,0,0
3122,2017.08.11,10,지금까지 영화중에 젤 재밌을 정도다... 웃고 울고 다했다  ,1,0,0
3123,2017.08.11,9,엄청 재밌는 장면도 많았지만 친구랑 정말 가볍게 보러갔던 나는 엄청난 정신적 충격을 받았다.. 마냥 가볍지만은 않은영화  ,1,0,0
3124,2017.08.11,9,하늘에서 정의가 빛발친다~  ,1,0,0
3125,2017.08.11,10,관람객와 진짜ㅠ 감독님 사랑해요  ,1,0,0
3126,2017.08.11,8,두 주인공의 캐미가 좋았음.근데 뭔지 모를 씁쓸함이 있음..  ,1,0,0
3127,2017.08.11,10,엄마가 오랜만에 많이 웃으셨어요ㅋㅋ 저도 대만족ㅋㅋㅋ코믹하기도 하지만 전해주는 메세지도 굿굿입니다!!  ,1,0,0
3128,2017.08.11,9,진짜 영화관에서 웃긴거참느라죽는줄알았어요 택시운전사보시고 운다음 이거보고 웃으면될듯  ,1,0,0
3129,2017.08.11,10,옵치유저라면 봅시다 !!  ,1,0,0
3130,2017.08.11,10,진짜 최고!!!!강하늘 잘생겼다??????????  ,1,0,0
3131,2017.08.11,1,관람 후기 보고 갔다가 영화 보다가 나온 적은 처음임. 평이 필요 없음  ,1,0,0
