index,time,score,reple,1st_week,2st_week,3st_week
1,2017.08.09,10,진짜 정말 재밌습니다 꼭보세요  ,1,0,0
2,2017.08.09,10,2017년 최고의 앙상블  ,1,0,0
3,2017.08.09,10,의외의 꿀잼!! 부모님과 물개박수 치면서 웃었네요!  ,1,0,0
4,2017.08.09,10,서둔이 진짜 연기 개 잘함!!  ,1,0,0
5,2017.08.09,10,이제 좀 웃으며 삽시다 ㅋㅋㅋ  ,1,0,0
6,2017.08.09,10,강하늘 박서준 캐미 짱짱입니다. 진짜..ㅠㅠ 꼭 보세요 무조건 강추입니다!  ,1,0,0
7,2017.08.09,10,별기대 안하고 가격 싼 무비핫딜로 봤는데 대박 웃김!  ,1,0,0
8,2017.08.09,10,ㅋㅋ 여름엔 이런 영화지  ,1,0,0
9,2017.08.09,10,정말... 나도 따라 젊어지는 시~원한 영화는 이거다!!  ,1,0,0
10,2017.08.09,10,올해 본 영화중에 가장 웃기다  ,1,0,0
11,2017.08.09,10,너무너무 재밌어요~!! 요즘 너무 덥고 웃을일이 없는데 넘 재밌게 봤어요~  ,1,0,0
12,2017.08.09,10,심각하다가도 웃고!또 웃고를 반복했음!  ,1,0,0
13,2017.08.09,10,우리 똥만이  격투기에서 유도까지..  대단하구나!!  ,1,0,0
14,2017.08.09,10,기대 이상으로 깔깔 웃으며 즐겁게 관람했어요 :)  ,1,0,0
15,2017.08.09,10,하얏!!!!ㅋㅋㅋ 천천히 ㅋㅋ  ,1,0,0
16,2017.08.09,10,ㅋㅋ ** 끝나고 쿠키영상있어요!! 오늘 못 보시고 나가신 분들이 있어서.. ㅎ  ,1,0,0
17,2017.08.09,10,핵잼ㅋㅋㅋ 박서준 강하늘 너무 좋다 흥해라 청년경찰  ,1,0,0
18,2017.08.09,10,21세기 최고의 영화가 될뻔했던 영화  ,1,0,0
19,2017.08.09,1,긴말 필요없음. 평론가 평점을 보면 답이 나와요  ,1,0,0
20,2017.08.09,10,뻔할거라는 생각하고 보러갔다가 박수치면서 웃고나온 정말 시원한 영화~! 정말 빵빵 터졌네요.ㅋㅋ  ,1,0,0
21,2017.08.09,10,올해 본 영화 중 최고 많이 웃은듯ㅋㅋㅋㅋ 마지막엔 짠하기까지 진짜 좋았습니다  ,1,0,0
22,2017.08.09,10,이거랑 택시운전사는 꼭보세요! 후회안합니다 ㅎㅎ  ,1,0,0
23,2017.08.09,10,"기대 많이하고 갔는데 기대 이상으로 너무 재밌어요 끝나고 쿠키영상있어요! 오늘 못 보시고 나가신 분들이 있어서.. 맴찢..ㅠ 그리고 영화 자막 다 나가고 맨 마지막에 ""청년경찰은 ---_----다."" 라는 문구가 있어요!! 나름 스포 방지용 - ㅋㅋㅋ  ",1,0,0
24,2017.08.09,10,박서준 강하늘 콤비플레이 재밌어요!!  ,1,0,0
25,2017.08.09,1,그냥 택시운전사나 봐야겠다노잼  ,1,0,0
26,2017.08.09,10,마지막은 허무하긴하지만 중간에 긴장도 되게 만들었고 즐겁게 봤습니다  ,1,0,0
27,2017.08.09,10,꾸르잼!!! 더운여름엔 역시 유쾌한 영화가 최고!!!!  ,1,0,0
28,2017.08.09,10,"생각보다 훨씬 재미있었고, 영화관 사람들도 다 웃느라 바빴어요.  ",1,0,0
29,2017.08.09,10,둘의 케미가 좋네여! 웃긴 요소가 많아서 가볍게 보기 좋습니당  ,1,0,0
30,2017.08.09,1,실망이자 별로였다...  ,1,0,0
31,2017.08.09,10,"월타 무대인사로 7/29일날 보았습니다. 정말  재밌습니다. 완전 강추입니다... 너무 웃었고, 즐겁게 보았습니다.  ",1,0,0
32,2017.08.09,10,배우분들 스텝분들 모두 정말 고생하며 재미있게 촬영했다는 점이! 관객한테도 잘 전달된 것 같습니다 정말 더운 올 여름 시원하게 유쾌통쾌상쾌 삼쾌하게 시원하게 볼 수있는 영화입니다 안보면 후회함.. 모든 준비는 끝났어 땅야!! 흥행각  ,1,0,0
33,2017.08.09,10,초반에 군대생각도 나고 대학교 생각도 나면서 엄청 웃었어요.  ,1,0,0
34,2017.08.09,10,기대 많이하고 갔는데 기대 이상으로 너무 재밌어요!!!ㅋㅋㅋ  ,1,0,0
35,2017.08.09,10,너무 웃기고 재밌었어요 시사끝나고 계속 낄낄  ,1,0,0
36,2017.08.09,1,언플 너무 심해서 1점 드릴게요. 영화관까지 가서 볼 정도는 아닌듯. 롯데 배급사라 그런가..유독 롯데시네마만 예매율 조작 심하고..  ,1,0,0
37,2017.08.09,1,경찰대 생이 수사를 한다고?공사 생도가 전투기 끄는 소리하네.  ,1,0,0
38,2017.08.09,10,진짜 후회하지않으실거에요!!!시원하게 빵빵 터지는 영화! 꼭보세요  ,1,0,0
39,2017.08.09,10,완전 재밌습니다!여친이 강스카이 본다고 끌고가서 엄청 투덜댔는데 여친보다 내가 더 웃어버린 완전 민망한 상황^^;;그래도 올 영화 중 최고였습니다!  ,1,0,0
40,2017.08.09,10,개꿀잼ㅋㅋㅋ무비핫딜로 보고왔는데 너무  잘보고  왔어요!  ,1,0,0
41,2017.08.09,9,신입 경찰이나 경찰을 준비중인 사람들이 부딪 칠수 있는 현실적인  문제들을 사건을 통해 웃기면서도 진지하게 풀어 놓은 영화 그러나 영화인지라 완전 현일적이지는 못함 현실에서는 저런 청년들이 문제해결 못함 그래서 저런 청년경찰이 있었으면 좋겠다는 생각  ,1,0,0
42,2017.08.09,10,좀있다보고오겠습니다  ,1,0,0
43,2017.08.09,8,"정의와 사명감이 넘치는게 조금 유치했지만..솔직히 재밌다.. 시사회로 본 1인, 강하늘과 박서준의 코믹연기가 제대로 살렸다. 신파와 국뽕이 싫으신분들은 이영화도 괜찮을듯...  ",1,0,0
44,2017.08.09,5,안봐도 눈에 보이는 영화.. 신입경찰이 범인잡을려고 우왕좌왕 하면서 코미디요소 몇개 들어가고.. 억지감동 몇개 들어가고..결국 범인 잡아서 표창장 받으면서 마지막에 둘이 점프하면서 하이파이브 하면서  끝나겠지.. 그냥  코미디 프로 보는게 낫지않나?  ,1,0,0
45,2017.08.09,10,대박이다그냥보세용ㅡ아프니깐 청춘이당ㅡ도전ㅡ배려 ㅡ참을성ㅡ20대필히꼭보세요ㅡ젊음이 기를한껏머콩왔다  ,1,0,0
46,2017.08.09,10,"내가 본 영화중 제일 유쾌하고 재밌는영화 꼭보세요!! 더위 싹 없애주는 영화!! 감동 , 재미 두개 다 잡은 영화!  보는 내내 웃다왔습니다~ 두 청년의 케미가 장난아니더라구요!  ",1,0,0
47,2017.08.09,10,무거운 소재이지만 유쾌 상쾌 통쾌하게 풀어가는 재미도 연기잘하는 박서준 & 강하늘 배우의 케미도 너무 좋은 영화였습니다. 생각해보자니 20살의 나는 저들만큼의 열정이 없었던거 같네요- 20살의 나를 돌아보는 시간도 되었어요~  ,1,0,0
48,2017.08.09,10,관람객두 주인공 케미가 좋다해서 봤는데 연기합이 잘 맞아 웃겨서 시간 가는 줄 모르고 봤음..재미있는 영화 기다린 사람에게 추천!  ,1,0,0
49,2017.08.09,10,스타톡인가 먼저 상영하길래 봤는데 꿀잼입니다 코믹영화봐도  잘 안웃는데 이 영화는 진짜 웃으면서 봄 ㅋㅋ  ,1,0,0
50,2017.08.09,10,아니.. 평점 테러분들 양심이 없는건지..;;; 평점만 내려가고... 재밌는 영화에... 진짜 보면 평점 10점 자동으로 주게 되있는디..ㅜ  ,1,0,0
51,2017.08.09,10,"시사회로 영화를 봤는데 정말 재밌었습니다. 영화 볼 때 관객분들이 그렇게 크게 웃는 거 처음 보고 배우들의 연기력, 감독님의 연출력 뭐 하나 빠지는 거 없이 너무 좋습니다. 두 배우간의 케미가 정말 좋아서 보시는 내내 흐뭇해할 수 있습니다! 추천합니다  ",1,0,0
52,2017.08.09,10,영화 쉴새없이 웃깁니다 강하늘 화이팅  ,1,0,0
53,2017.08.09,10,진짜 정말 재밌습니다 꼭보세요  ,1,0,0
54,2017.08.09,9,빵빵터짐^^(10자)  ,1,0,0
55,2017.08.09,10,진짜 돈하나도안아깝고 재밋어요 강추  ,1,0,0
56,2017.08.09,1,그럭저럭볼만하네요~돈안네고드라마로본다치면~나돈다주고봤어ㅜㅜ내돈너무아까워~ㅜㅜ  ,1,0,0
57,2017.08.09,10,군함도보다 훨씬 재밌음.  ,1,0,0
58,2017.08.09,10,진짜 알바가 아니라 존나 재밌습니다 꼭 보세요 진짜 강력추천임  ,1,0,0
59,2017.08.09,10,그냥 다 좋아ㅜㅜㅠㅠ 제발 꼭 보세요  ,1,0,0
60,2017.08.09,10,더운여름 시원하게 볼수있는 영화  ,1,0,0
61,2017.08.09,10,오랜만에 웃습니다  ,1,0,0
62,2017.08.09,10,진짜 오랜만에 나오는 한국의 버디무비! 진행빠르고 웃음 감동 둘다 느낄수잇는 영화인거같다.아주 무겁지도않고 가볍지도않은 영화! 한번 더 보고싶은 영화  ,1,0,0
63,2017.08.09,10,모처럼 볼만한 영화가 나왔다.  ,1,0,0
64,2017.08.09,10,이런 꿀잼이 따로 없다 땅야  ,1,0,0
65,2017.08.09,10,연기력 진짜 흠잡을때가 없네  ,1,0,0
66,2017.08.09,8,핫딜로 봤습니다.처음부터 끝까지 끊김없이 재밌게 봤습니다.코믹 속에 메시지도 잘 묻혀놔서 오히려 그 메세지가한번 더 생각나는 영화.  ,1,0,0
67,2017.08.09,10,"너무 무겁고 진지하기만 한 영화들이 많은데, 가볍게 볼 수 있는 재미난 영화가 나와서 좋습니다! 두 배우 찰떡같은 호흡과 연기력이 몰입도를 높여주네요. 관객들 모두 빵 터져서 웃고 기분좋게 나왔습니다  ",1,0,0
68,2017.08.09,8,서준이 마이큿네 세끼~ㅎ  ,1,0,0
69,2017.08.09,10,관람객시사회로 보고왔어요~ 진짜 꿀잼 박서준 강하늘 케미 대박잼!!! 빈틈없이 재밌어요!  ,1,0,0
70,2017.08.09,1,지금보고잇는데 나갈까말까 고민중이다  유치하다 영화  ,1,0,0
71,2017.08.09,1,재미없어라.  영화관에서 볼 영화가 아님.  내 돈 돌리도~  ,1,0,0
72,2017.08.09,10,너무재미있게봤어요 유쾌상쾌통쾌   3쾌에 맞게 여름에 시원하게볼수있어서 좋았어요 신랑이랑 또 한번 보러갈려구요  ,1,0,0
73,2017.08.09,10,이영화는 런닝맨같은 영화 함께 달려보세욥  ,1,0,0
74,2017.08.09,10,여름엔 이런 영화지 세상이 너무 무겁다  ,1,0,0
75,2017.08.09,10,오랜만에 코믹영화봐서 좋았네요. 택시운전사랑 이거 꼭보세요.  ,1,0,0
76,2017.08.09,10,재밌게봤음 ㅎㅎ한참 웃다나왔네  ,1,0,0
77,2017.08.09,1,균형 좀 맞추자...10점은 좀 너무했잖아  ,1,0,0
78,2017.08.09,10,가족끼리 봤는데 무난하고 정말 재밌었어요!@@  ,1,0,0
79,2017.08.09,10,시작하고 훅 지나갔습니다. 재밌네요.  ,1,0,0
80,2017.08.09,10,박서준강하늘 진짜 멋있으세요ㅠ또 봐도 재미있을듯!청년경찰 응원합니다♡♡  ,1,0,0
81,2017.08.09,10,유쾌 통쾌 상쾌 삼쾌한 영화에 전달하려는 메세지도 있는 영화  ,1,0,0
82,2017.08.09,10,관람객방금 조조로 봤는뎈ㅋㅋ진짜 개웃김ㅋㅋㅋㅋ 아침부터 잠이 확깨네 쿠키영상도있음  ,1,0,0
83,2017.08.09,10,"우와 완전 시간 가는지 모르고 봤네요~~~강하늘,박서준 캐미 장난아님^^ 감동,즐거움 두배♡두번 보고싶은 그런 영화 :)  ",1,0,0
84,2017.08.09,10, 시사회평 후기 다 좋아서 예매해서 봄. . 코믹속에 사회문제를 녹여서 그렇지 가볍지만은 않은 소재네요 여성범죄에 대해 다시한번 생각하게됨 추천합니다  ,1,0,0
85,2017.08.09,10,"진짜 오랜만에 박장대소 했습니다. (젊은웃음^^) 관객들 반응도 재미있고, 강하늘씨, 박서준씨 케미도 너무 귀엽고 재미있고 멋졌습니다. 영화관에서 나올때 기분을 좀 중요시하는편인데, 마음가볍게 웃고 즐기고 나올수 있는 영화입니다 ^^ 추천드려욤!  ",1,0,0
86,2017.08.09,1,그냥 단순히 웃기다 역시나 부실했다  ,1,0,0
87,2017.08.09,1,이런거 좀 만들지 마라 휴...  ,1,0,0
88,2017.08.09,10,"강하늘,박서준의 케미가 돋보입니다. 두 분 다 연기파배우여서 그런지 영화에 더욱 몰입할 수 있었던 것 같아요!  ",1,0,0
89,2017.08.09,10,진짜 정말재밌어요!!극장에서 다같이 웃으면서 본 영화일정도로 정말 재밌어요!청년경찰 화이팅!  ,1,0,0
90,2017.08.09,1,어이 없는 영화. 지금 현재 2위라는 게 믿기지 않는 다.  ,1,0,0
91,2017.08.09,10,관람객유치하고 어설플거라는 편견을 깨준 의외의 영화. 알차고 군더더기 없이 깔끔하다. 웃기는 지점에 충실하고 액션의 이유와 쾌감도 충분.  ,1,0,0
92,2017.08.09,1,비추 폭탄보고 알바라는거 깨달음. 돈굳었다 거마웡~  ,1,0,0
93,2017.08.09,10,관람객더운 여름에 시원하고 재밌게 볼 수 있는 영화 같아요. 강하늘 박서준 두 배우의 연기호흡이 좋았습니다!  ,1,0,0
94,2017.08.09,10,관람객진짜 여름용 영화로 딱임. 보고 나서 기분 좋아짐  ,1,0,0
95,2017.08.09,10,너무 진지한 극장가에서 유쾌하게 볼 수 있는 영화!  ,1,0,0
96,2017.08.09,1,음.. 그냥 뻔한 영화..  ,1,0,0
97,2017.08.09,10,기대이상으로 재밌게 본 영화. 두 배우의 매력에 자꾸 보고싶은 영화  ,1,0,0
98,2017.08.09,10,의외로 꿀잼 시원한 여름영화  ,1,0,0
99,2017.08.09,10,관람객시간 가는 줄 모름ㅋㅋㅋㅋ 관객들 중간중간에 다 빵 터지고 액션도 스토리도 기대 이상이었음! 진짜 배우 말대로 삼쾌한 영화ㅋㅋ  ,1,0,0
100,2017.08.09,10,큰 기대 안하고 봤는데 보는 내내 박수치고 웃고 긴장하며 봤습니다.박서준씨와 강하늘씨의 연기력 또한 너무 좋았고 큰 배우로 성장할것 같습니다. 오랜만에 너무 재미있는 영화를 보니 여름더위가 모두 씻기는 기분이네요.강추입니다~  ,1,0,0
101,2017.08.09,10, 기준이와 희열이의 조합 유쾌통쾌상쾌 삼쾌  ,1,0,0
102,2017.08.09,10,진짜 처음부터 너무 웃겨요ㅋㅋ  ,1,0,0
103,2017.08.09,10,강하늘 박서준 케미도 좋고 영화도 굿  ,1,0,0
104,2017.08.09,7,덥고 짜증날 때 아무 생각 없이 웃으면서 볼 수 있는 영화.  ,1,0,0
105,2017.08.09,10,"두 배우의 케미가 좋고, 아무생각없이 가서 시원하게 웃고 올 수 있는 영화입니다 :)  ",1,0,0
106,2017.08.09,10,강남건물주 나오네요 ㅋㅋㅋㅋ  ,1,0,0
107,2017.08.09,10,간만에 크게 웃으면서 봤네요ㅎ패기 넘치는 영화입니다.  ,1,0,0
108,2017.08.09,1,너무 흔한소재라 안땡김  ,1,0,0
109,2017.08.09,10,몇 년 만에 박수치며 박장대소했다. 하지만 메시지는 마냥 가볍지만은 않았다.  ,1,0,0
110,2017.08.09,10,간만에 웃을수있는 시원한영화~~우리나라의 경찰들이 꼭 봤으면하는 영화~~짱 재밌어요~~~  ,1,0,0
111,2017.08.09,10,관람객오래 기다렸던 영화라 개봉하자마자 보러 갔는데 대만족이었어요 ㅋㅋㅋㅋ 존잼꿀잼 !!  ,1,0,0
112,2017.08.09,10,두 배우의 케미가 참 좋았어요~ 생각보다 재밌었어요^^  ,1,0,0
113,2017.08.09,10,강하늘X박서준. 콤비가 보여준 영화 관객들도 모두 웃었다..  ,1,0,0
114,2017.08.09,10,재밌는 버디무비 탄생!!! 시리즈 기대합니다  ,1,0,0
115,2017.08.09,10,기대안하고 보았는데~!! 정말 망가질꺼면 제대로 망가져서 더 큰 그림을 완성할 줄 아는 배우가 스크린 속에서 빛나는 것 같아요:)  ,1,0,0
116,2017.08.09,10,누가 뭐래도 내 인생영화  ,1,0,0
117,2017.08.09,10,재밌어요. 아무 생각없이 즐길 수 있는 웰메이드 팝콘무비. 더운 여름에 딱이네요..  ,1,0,0
118,2017.08.09,10,대박ㅋㅋ 훈훈한 두 배우를 스크린에서 볼수 있어서 좋았고 영화도 완전 재밌음 ㅋㅋ 강하늘 하드캐리 ㅋㅋ 꼭 대박 나길 땅야! 땅야!  ,1,0,0
119,2017.08.09,1,0점은 못 주나? 이런 주제를 어떻게 이렇게 풀어가는지 이해를 못하겠다  ,1,0,0
120,2017.08.09,10,정말 원없이 웃다 나왔어요. 박서준 강하늘 콤비의 생활코믹연기 짱짱!  ,1,0,0
121,2017.08.09,10,혈기왕성하고 정의로운 두 청년 경찰(활약이 유쾌하고 통쾌하네요.  ,1,0,0
122,2017.08.09,10,"ㅋㅋ 꼭 보세요 진짜 개웃겨요,, 점점 잼나짐  ",1,0,0
123,2017.08.09,10,서준x하늘 연기 캐미가 살린 영화!  ,1,0,0
124,2017.08.09,10,와 진짜 보는 내내 웃었어요ㅋㅋㅋㅋ 웃음 속의 약간의 진지함ㅋㅋㅋ  ,1,0,0
125,2017.08.09,1,"난자소재가 실화임?? 리얼, 군함도를 잇는 대단한 명작이 탄생했네요. 영화 자체도 핵노잼이지만 난자매매라는 소재가 아주 신선하네요. 그 수많은 범죄소재 놔두고 난.자.매매?? 제목도 걍 난자경찰이라 짓지.. 이딴걸 영화라고..  ",1,0,0
126,2017.08.09,10,두 배우의 뜀박질이 그대로 느껴지는 영화 강하늘과 박서준의 케미가 이리도 좋단 말인가!!  ,1,0,0
127,2017.08.09,10,킬링타임이 필요하다면 꼭 추천할 만한 청춘영화!!  ,1,0,0
128,2017.08.09,10,재밌었다. 엔딩에 조연들 큼직큼직하게 보여주는 것도 색다르고 배려인것 같아 굿굿  ,1,0,0
129,2017.08.09,10,잡생각없이 웃고볼수있는영화  ,1,0,0
130,2017.08.09,10,웃음 감동 긴장감 모두 있는 최고의 영화!! 두 배우 캐미 대박!!  ,1,0,0
131,2017.08.09,10,관람객조조로 보고왔는데 꿀잼 핵잼 ㅋㅋ 스트레스 다 풀고 왔음 강추!!  ,1,0,0
132,2017.08.09,10,정말 재밌었어요!  박서준 정말 멋있습니다!!! 피지컬도 액션연기도 짱짱!!!????  ,1,0,0
133,2017.08.09,10,개병맛. 존웃. 눈호강. 재밌음  ,1,0,0
134,2017.08.09,10,경찰준비생으로서 동기부여 제대로 왔네요.재밌었어요  ,1,0,0
135,2017.08.09,10,조조로 봤는데 너무 재미있었음!!  ,1,0,0
136,2017.08.09,10,조조로 바로 봤는데 진짜 재밌어요!!! 역시 강하늘 박서준 믿고보는 배우들이에요!!!!  ,1,0,0
137,2017.08.09,10,청년들의 열정을 재미있게 그려낸 영화 곧 돌아오길 기대할께요~ㅋㅋㅋ  ,1,0,0
138,2017.08.09,10,무더운 여름에 시원하게 볼 수 있는 코믹액션영화였어요 ㅋㅋ 강하늘 박서준 호흡이 좋네요 ㅋㅋ  ,1,0,0
139,2017.08.09,9,8월에 가볍게 보기좋은 영화 웃음과 감동이 함께  ,1,0,0
140,2017.08.09,10,영화를 이렇게 웃으면서 본 게 얼마만 인지... 마지막 쿠키영상 까지 시원하게 웃겼다!!!  ,1,0,0
141,2017.08.09,9,말 그대로 유쾌상쾌통쾌한 영화!  ,1,0,0
142,2017.08.09,10,박서준??강하늘 잘생겼어요ㅠㅠㅠ  ,1,0,0
143,2017.08.09,9,진짜 쉴새없이 웃었다! 오랜만에 본 재밌는 영화다!!  ,1,0,0
144,2017.08.09,10,진짜 믿고봐요 대박이에요 이영화  ,1,0,0
145,2017.08.09,9, 개봉첫날 짐조조보고 바로남겨요 요새 무거운영화들사이에서 어떤영화일지 궁금해서 보게되었는데 기대 이상입니다! 대사가 참 찰지구요 무겁다가도 재밌게도하고 스토리나 편집매우 깔끔합니다!!리뷰 잘안남기는데 기대이상이라 많은분들 즐겨보심좋겠다 싶어 남깁니다  ,1,0,0
146,2017.08.09,7,관람객생가없이 보기에는 무리없는영화네요 근데 예고편은 보고 가지마세요  ,1,0,0
147,2017.08.09,9,진짜 재밌어요!!! 두 배우의 케미가 장난아니에요 둘이 티격태격하는 게 현실 남자애들같아요 ㅋㅋㅋ몰입도도 높은 영화입니당><  ,1,0,0
148,2017.08.09,10,관람객올 여름 영화 중 제일 시원함!  ,1,0,0
149,2017.08.09,8,관람객무난하게 재밌었다. 유쾌했고  ,1,0,0
150,2017.08.09,10,둘다 연기를 너무 잘해서 ..진짜 완전 재밌게 보고왔어오!!  ,1,0,0
151,2017.08.09,10,"관람객조조로 보고 왔는데 극장에서 웃으면서 봐서 하루가 기분 좋습니다!! 재밌네요~ 박서준, 강하늘 볼 수록 매력있습니다!!  ",1,0,0
152,2017.08.09,10,강하늘 배우님 팬인데 정말 잘보고왔습니다박서준 배우님은 그녀는 예뻤다 랑 뷰티 인사이드에서 인상깇게봤는데 정말 연기를 잘하시는것 같습니다 영화가 좀 짧은감이있지만 몇번이고또보고싶네요!  ,1,0,0
153,2017.08.09,10,관람객영화 진짜 재밌었어요! 박서준 강하늘 둘의 연기케미가 정말 굳굳! 코믹한 부분도 많아서 빵빵 터지면서 봤어요!  ,1,0,0
154,2017.08.09,10,관람객박서준 강하늘 케미 대박ㅋㅋㅋ 짱잼  ,1,0,0
155,2017.08.09,9,관람객현실에 대해 다시한번 생각하는 영화네요... 재밌게 잘봤어요  ,1,0,0
156,2017.08.09,10,택시운전사 보다 훨씬 낫다.  우리나라 평론가 들은 왜 이렇게 '주'자를 좋아하지? 광주... 민주...  ,1,0,0
157,2017.08.09,10,관람객오늘 롯데시네마에서 조조로 봤는데 진심으로 웃기고 잼있다!  ,1,0,0
158,2017.08.09,10,간만에 좋은 영화본듯 하네요  ,1,0,0
159,2017.08.09,10,관람객박서준 강하늘 둘의 케미가 굿굿. 올해 영화제 베스트 커플상은 이들에게 줘야 함ㅋㅋㅋㅋ 보는 내내 넘나 훈훈하고 신나는 영화였음  ,1,0,0
160,2017.08.09,10,시사회랑 무대인사로 개봉전에 두번이나 보고왔는데 두번봐도 너무 재밌어요 진짜ㅠㅠ 추천합니다  ,1,0,0
161,2017.08.09,10,관람객박서준 강하늘 두배우의 케미가 환상적이예요보는내내 귀여움과 훈훈함에 즐거웠습니다.간만에 유쾌하고 시원한 영화였습니다ㅎㅎ박수치며 웃었네요.ㄴ  ,1,0,0
162,2017.08.09,10,올 여름 제일 유쾌하고 시원한듯  ,1,0,0
163,2017.08.09,10,개봉하자 마자 조조로 보고 왔습니다. 두명의 경찰대 학생의 열정에 가슴 뜨거워지는 영화입니다. 강력 추천합니다.  ,1,0,0
164,2017.08.09,10,관람객올해 본 영화중에 젤 재밌었던 영화ㅋㅋㅋ 너무 재밌었어요 또보고싶을정도!!  ,1,0,0
165,2017.08.09,10,존잼 짱잼 꿀잼 청! 년! 경! 찰!  ,1,0,0
166,2017.08.09,1,치외법권이 생각난 영화  ,1,0,0
167,2017.08.09,10,진심으로 재미있었고 감동적인 영화였습니다. 그리고 끝까지 포기하지않고 소녀들을 구해주는데 엄청 감동했어요!!정말 재밌고 배우들 연기도 참좋았었고 박서준씨와강하늘씨의 캐미가 좋아서 더욱 재미있게 볼수 있었습니다. 많이들 봐주세요><  ,1,0,0
168,2017.08.09,10,관람객박서준 강하늘 케미가 너무 좋았음ㅋㅋㅋㅋ계속 웃으면서 영화 봄  ,1,0,0
169,2017.08.09,10,관람객웃긴 영화 좋았어요 추천합니다  ,1,0,0
170,2017.08.09,10,관람객진짜 여름이랑 넘 잘어울림ㅜㅜ꿀잼 무인할때 또봐야지ㅋㅋㅋ  ,1,0,0
171,2017.08.09,10,"관람객개봉날 바로 조조로 보고 왔는데, 정말 2시간동안 계속 웃다왔어요. 남자인데도 두 배우에게 흠뻑 빠져드는! 올 여름 한국영화 중 최고bb  ",1,0,0
172,2017.08.09,10,"무거운 내용을 진지하지만 재미있게 풀어나간듯 해요배우들이 왜 자신만만 했는지,  평점이 왜 좋은지 알겠어요한번 더 볼래요  ",1,0,0
173,2017.08.09,10,명예란 무엇인가?에 대한 답절차 vs 당위경찰의 인력 부족그리고 그냥 재밌음. 핵꿀잼  ,1,0,0
174,2017.08.09,1,7점짜리... 평점 맞추기  ,1,0,0
175,2017.08.09,10,관람객더위를 한방에 날려주는 완전 시원한!! 영화! 오래간만에 극장에 발 동동 구르면 봤던 것 같아욬ㅋㅋㅋ 완전 강추!  ,1,0,0
176,2017.08.09,10,관람객존좋... 박서준 강하늘 케미 너무 좋고 이 영화 덕에 강하늘에 입덕하게 되었습니다 ..ㅋㅋㅋㅋ  아침부터 씬나씬나 ㅋㅋ  ,1,0,0
177,2017.08.09,10,관람객강하늘ㅋㅋㅋㅋ아진짜 케미대박임  ,1,0,0
178,2017.08.09,10,관람객강하늘 박서준 케미 ㅠㅠㅠㅠ 진짜 재밌었음 ㅋㅋㅋ  ,1,0,0
179,2017.08.09,10,지루하지 않고 괜..찮...다  ,1,0,0
180,2017.08.09,10,"이 더운날 시원하게 볼 수 있는 영화예요^^ 꿀잼, 존잼 입니다! 꼭 보세요~!! 토마스감독님 화이팅!  ",1,0,0
181,2017.08.09,10,짱잼!! 영화관에서 오랜만에 소리내서 웃었어요ㅋㅋ  ,1,0,0
182,2017.08.09,10,관람객진짜 꿀잼 ㅋㅋㅋㅋ 박서준 강하늘 너무 잘생겼고 얼굴만 봐도 즐겁다~~~~  ,1,0,0
183,2017.08.09,9,너무 재밌어요 유쾌하고 감동적이구 박서준이랑 강하늘 케미가 좋네요 간만에 엄마랑 힐링했어요♡  ,1,0,0
184,2017.08.09,10,"이 영화는 대한민국경찰의 현실을 보여주고있는것같아서 마음이 짠하네요..그래도 박서준,강하늘 두배우분들이 실감나고 캐미넘치는모습들을 보여주어서 재미있게본것같습니다!!  ",1,0,0
185,2017.08.09,9,딱 전형적인 한국영화..! 유쾌하고 긴장감 잇고 감동도 잇는~ 그래도 즐겁게 웃으면서 잘 보고왓습니다 ㅋ 중간중간 개그요소들이 잇어요 ㅋㅋ  ,1,0,0
186,2017.08.09,1,억지설정 개연성 없는 과한 스토리 오그라드는 대사 진짜...  ,1,0,0
187,2017.08.09,10,관람객2시간동안 깔깔깔한 영화는 오랫만!  ,1,0,0
188,2017.08.09,9,박서준 강하늘 케미 좋으네요 ~ 굿 !!  ,1,0,0
189,2017.08.09,10,"음악도 경쾌하고 딱 이십대의 남자애들 모습이다가 무모하고 어리숙하지만 열정,집념,진심은 통한다. 박서준과 강하늘 호흡이 척척~  ",1,0,0
190,2017.08.09,10,관람객완전 웃겨요. . 올 최고인듯.  . .  ,1,0,0
191,2017.08.09,10,6개월동안 본 영화중에 제일 재밌음  ,1,0,0
192,2017.08.09,6,관람객그냥 그래요배우들 연기 약간 어색  ,1,0,0
193,2017.08.09,9,소소한 재미 원하신다면 추천. 배우들 케미 좋음. ㅎ  ,1,0,0
194,2017.08.09,10,관람객박서준 강하늘 두 배우의 유쾌한 청춘 드라마!  ,1,0,0
195,2017.08.09,10,박서준왜이렇게 멋있음? 상남자여...  ,1,0,0
196,2017.08.09,8,"ㅋㅋ ▶ 기자, 평론가 : 이런 ‘덤 앤 더머’에게 미래의 안전을 맡기고 싶지 않다 / 인간과 시대에 대한 무례와 무지 / 여성 관객의 욕망을 너무 쉽게 본다.... ▶ 35명 시사회, 조조 관객(알바포함) 평 : 너무 웃기고 재미있어요  ",1,0,0
