index,time,score,reple,1st_week,2st_week,3st_week
9372,2016.01.01,10,관람객어마어마한 대작이다 그 누가보더라도 후회하지안으리  ,0,0,1
9373,2016.01.01,10,관람객너무감동적이에요  조아요조아요 조아요조아요 조아요조아요 조아요조아요 조아요조아요 조아요조아요 조아요조아요 조아요조아요 조아요조아요 조아요조아요 조아요조아요 조아요조아요 조아요조아요 조아요조아요 조아요조아요 조아요조아요 조아요조아요 조아요조아요  ,0,0,1
9374,2016.01.01,8,관람객마음이웅클해서 눈물좀 흘렸네요 완전  재미있습니다  ,0,0,1
9375,2016.01.01,8,관람객실화라서 더 몰입해서 본거같아요  ,0,0,1
9376,2016.01.01,1,더이상 한국영화가 망해가는걸 볼 수가 없다  ,0,0,1
9377,2016.01.01,10,관람객한해를 마무리하면서 선택한 영화였는데요~~무엇보다 신의에 대해서 또 도전에 대해서 생각해보게됩니다.팍팍하게 사느라고 놓친 내면을 들여다보게 합니다.단순 눈물의 의미를 넘어 깊은 내면을 깨우는 좋은 영화..강추입니다~~  ,0,0,1
9378,2016.01.01,9,관람객영화 재밌게 잘 봤습니다  ,0,0,1
9379,2016.01.01,10,관람객 안좋은 평들이 많았는데 생각보다 재미있게 봤습니다. 엔딩크레딧이 딱 12시에 올라왔네요  ,0,0,1
9380,2016.01.01,7,관람객그냥Soso 내눈물샘을 자극하진 못했음  ,0,0,1
9381,2016.01.01,9,관람객일반인들은 몰랐던 히말라야 등반이 결코 쉬운게 아니였다는 것을 고스란히 관객에게 전달 된 영화인거 같습니다.  ,0,0,1
9382,2016.01.01,8,관람객가슴 따뜻한 영화였습니다~~^^  ,0,0,1
9383,2016.01.01,1,OO년 첫영화가 이딴 영화라니... 초반부부터 후반부까지 발암의 연속 초반은 그나마 산에 대한 열정을 불태우기에 볼만했는에 후반부 감동팔이 눈물세례에 완전히 질렸다. 히말라야가 아니라 무택마야나 눈물마야로 제목을 바꿔야할듯하다  ,0,0,1
9384,2016.01.01,10,관람객추천드릴수있는영화입니다.  ,0,0,1
9385,2016.01.01,6,스토리는괜찮았으나국제시장에서장사하던황정민이산악대장으로나오고전설의주먹에서국수집사장이산악대장으로나오는거전혀엄홍길같지않음...너무다작이라그런지..윤제균감독은제작했는데감정에호소할수있는안정빵의영화를만들었네요아무튼그냥가서시간때우면서볼만은합니다  ,0,0,1
9386,2016.01.01,1,그놈의 신파극 그만 보고 싶다  ,0,0,1
9387,2016.01.01,10,관람객연기력을떠나실화라는게감동그자체!  ,0,0,1
9388,2016.01.01,9,관람객너무너무 감동적인영화~초반엔 미소지으며 보기시작해서 중반부턴 딱 집중하게되고 후반부터 눈물샘을 자극해 눈물닦으면서 극장을 나서게하는영화~황정민 정우의 의외의 조합이 영화를 살린듯~이런 역할에 이런연기~이둘이 아니면 누가할수있을까~  ,0,0,1
9389,2016.01.01,9,관람객너무너무 감동적인영화~초반엔 미소지으며 보기시작해서 중반부턴 딱 집중하게되고 후반부터 눈물샘을 자극해 눈물닦으면서 극장을 나서게하는영화~황정민 정우의 의외의 조합이 영화를 살린듯~이런 역할에 이런연기~이둘이 아니면 누가할수있을까~  ,0,0,1
9390,2016.01.01,9,"가족끼리 봣는데 좋았어요, 10살부터 70세 연령대를 두루 아우르고, 실존인물들의  인간애가 참 애잔하게 다가왓어요  ",0,0,1
9391,2016.01.01,10,관람객완전감동적인영화에요지루할줄알앗는데그런거전혀없고엄청감동받앗습니다ㅠㅠ  ,0,0,1
9392,2016.01.01,10,관람객감동 감동... 눈물 펑펑 쏟았네요 안타까운마음 안도하는마음 ㅠㅡㅠ  ,0,0,1
9393,2016.01.01,10,"관람객 <국제시장>이 우리 부모님들이 시련의 역사를 어떻게 살아왔는지를 다루었다면, <히말라야>는 우리가 어떻게 살아야하는가를 보여주는 열정의 영화, 자녀와 함께 꼭 보아야할 휴머니즘 영화....  ",0,0,1
9394,2016.01.01,8,관람객한번쯤 보면 마음이 따뜻해지는영화랄까  ,0,0,1
9395,2016.01.01,6,관람객약간부족 내용면에서 뭔가 빠진듯 아쉬움  ,0,0,1
9396,2016.01.01,10,관람객봐도봐도 최고입니다 두번은 봐야될듯  ,0,0,1
9397,2016.01.01,7,관람객휴먼드라마입니다~~^^  ,0,0,1
9398,2016.01.01,10,산사나이의 의리와 배려에 감동이었다  ,0,0,1
9399,2016.01.01,8,실화 라서 더 감동적인 영화 등장인물들이 다 실존인물이였군요 ...모르면 재미없음...실화라는거...실존인물이라는거  ,0,0,1
9400,2016.01.01,9,관람객재밌고 감동적이긴 한데 실제 인물 사진도 넣어주고 설명 조금 더 해줬으면? 하네요.  ,0,0,1
9401,2016.01.01,3,뻔하디 뻔한 스토리와 쓸데없이 눈물 짜내는 장면만 많은 7번방의 선물과 다를 바가 없는 영화네요 돈아깝고 시간아깝습니다 솔직히  ,0,0,1
9402,2016.01.01,4,제일 극혐인 연출장면은 엄대장이 원정대장이랑 소주 한 잔 하고 있을 때 엄대장님 우리도 있잖아요 하면서 셋이 쪼르르 들어와 앉는장면이랑 텐트에서 무전기 돌려쓰면서 대장님 우리가 있잖아요 힘내세요 하는 장면  ,0,0,1
9403,2016.01.01,10,관람객정말 재미있어요ㅎ 최고에요  ,0,0,1
9404,2016.01.01,8,관람객괜찮았던거같아요 나름  ,0,0,1
9405,2016.01.01,8,관람객재미와 감동이 있어요 ㅎㅎ  ,0,0,1
9406,2016.01.01,10,관람객정말 최고입니다. 필히 수건 챙겨가세요 손수건으로 안됩니다  ,0,0,1
9407,2016.01.01,10,관람객감동...슬픈영화네요..ㅠ  ,0,0,1
9408,2016.01.01,1,원래 4점 주려던거 알바들보니 너무 화가나서 1점드려요 ㅠ 이렇게 억지로 눈물짜내는 신파적요소만 가득한 7번방같은 영화가 스크린독점과 언론플레이로 관객몰이하고 있는 걸 보면 한국영화의 미래가 걱정되네요 ㅠ 정말 돈 아까운 영화에요!!!  ,0,0,1
9409,2016.01.01,10,관람객와~~몰입최고!!안보면 후회할걸요???슬프다ㅜㅜㅜ  ,0,0,1
9410,2016.01.01,9,관람객반지원정대보다 더 멋진 휴먼원정대  ,0,0,1
9411,2016.01.01,6,관람객실화 그대로가 감동을 주기에 충분하지만 영화적으로 풀어내는 역량은 아쉬운.  ,0,0,1
9412,2016.01.01,6,재미 자채는 별로지만 아무생각없아 그냥 아무생각없이 드라마한편 본다고 생각하면 편히 관람할수있을듯 싶습니다  ,0,0,1
9413,2016.01.01,8,관람객너무 울었네요..새삼 산악인들이 존경스러우면서도 왜 그렇게까지 생명을 던져가면서까지 오를까 하는 생각이 드네여..  ,0,0,1
9414,2016.01.01,1,부실한 연출력에 허접한 전개과정을 감추려고 감동과 눈물의 신파라는 msg를 첨가한다.그맛에 길들여진 관객들은 마치 미슐랭 맛집이라도 찾은것마냥 별표 5개를 손쉽게 던진다. 관객들 눈물을 사수하기위해 행군하는 눈물원정대  ,0,0,1
9415,2016.01.01,9,관람객굿! 너무 잼나게 잘봤습니다!  ,0,0,1
9416,2016.01.01,10,관람객너무재밌게봤어요.. 보는내내 춥더라구요ㅠ  ,0,0,1
9417,2016.01.01,7,관람객배우들의 연기가 실감나고 좋았습니다.  ,0,0,1
9418,2016.01.01,7,관람객산사람들에 대해서 다시한번 생각하게하는 영화였읍니다  ,0,0,1
9419,2016.01.01,7,관람객흥미 감동 스토리 약하네요 ?  ,0,0,1
9420,2016.01.01,7,관람객배우들 연기가 좋았습니다  ,0,0,1
9421,2016.01.01,7,관람객감동적이네요  실화라서 그런지 더  ,0,0,1
9422,2016.01.01,9,관람객흐름대로 내용을 보면 감성이 우러 나오는 것을 억지로 더많은 감성을 짜내려고 하는것만 제외하면 충분이 새로운 세계에대한 감성과 정이 느껴지는 산악인의 영화로 충분히 좋은 작품이라고 생각한다.  ,0,0,1
9423,2016.01.01,10,정말최고요~~~^^  ,0,0,1
9424,2016.01.01,10,관람객집에서 쿡티비로 볼껄....  극장이린 꺼이꺼이 못울었음..  ,0,0,1
9425,2016.01.01,8,"평점보고 볼까말까 망설엿던.근데,오늘보니 잘봣다는 생각^^추운날씨 마음은 따스하게 해줄영화♥곁에잇는 사람들의 소중함을 알게되는?^^근데 밑에 장비란분,감독 나무라하기전에 니뇌부터 검사받아봐.문어발새리.  ",0,0,1
9426,2016.01.01,2,너무 억지로 눈물을 쥐어짜려는듯한 영화였네요 보면서 정말 영화관 뛰쳐나오고 싶었어요 이런 이야기가 실화였다는건 감동적이지만 영화만 두고보면 돈주고 보기엔 진짜 아까웠습니다  ,0,0,1
9427,2016.01.01,10,좋았어요~~<~~<  ,0,0,1
9428,2016.01.01,9,관람객리얼리티하고 재밌게봤습니다  ,0,0,1
9429,2016.01.01,10,관람객박무택보다 김인권이 더 기억에 남는 ㅇ가슴시린 영화입니다~~  ,0,0,1
9430,2016.01.01,7,실화 자체가 가진 힘을 살리지 못한느낌. 담담하게 그려냈으면 어땠을까 하는 아쉬움이 생긴다.  ,0,0,1
9431,2016.01.01,8,걍 재밌었음 약간 투박한 연결이 없지않아있지만 그마저도 잘커버될만큼 재밌었습니다~  ,0,0,1
9432,2016.01.01,3,몇 번을 두드려도 울림을 주지 못한다.  ,0,0,1
9433,2016.01.01,8,관람객나름 재밌었습니다. 실제 이야기에 적절한 연출 이었습니다.  ,0,0,1
9434,2016.01.01,10,잘봣으니 10점드립니아  ,0,0,1
9435,2016.01.01,9,관람객감동적이였어요황정민씨연기짱!  ,0,0,1
9436,2016.01.01,8,관람객정우연기가 인상깊었슴돠  ,0,0,1
9437,2016.01.01,6,관람객다소 억지스러운 신파입니다.너무 눈물을 쥐어짜게하는느낌이 크네요  ,0,0,1
9438,2016.01.01,9,관람객아들이랑 같이봤는데 많은 생각을 하게하네요좋은영화 감사합니다  ,0,0,1
9439,2016.01.01,10,관람객완전재밌네요ㅋㅋㅋㅋ  ,0,0,1
9440,2016.01.01,2,억지감동과 스크린독점. 그리고 거짓말안하고 뻔한내용. 여자친구가 보자고해서봤는데 여자친구도울고 뒤를 보니 여자분들은 다 울더라.. 내부자들 더오리지날이나볼껄...  ,0,0,1
9441,2016.01.01,10,관람객넘 감동적이고 재미있어요  ,0,0,1
9442,2016.01.01,10,평점이 나쁜게 많아서 불안하게 봤는데 완전 재밌고 감동적이더만..더 어떻게 잘 만들지?  ,0,0,1
9443,2016.01.01,8,관람객생각외로 많이 울었습니다.  ,0,0,1
9444,2016.01.01,8,관람객중간중간 웃음을 줄수 있는 영화그러나 마지막에는 감동적인 영화로 재미있게 보았습니다  ,0,0,1
9445,2016.01.01,8,관람객울다울다왔네요 마지막에 실제 대원들 사진이나 성함이라도 올려줬으면 하는 아쉬움  ,0,0,1
9446,2016.01.01,10,평점 왜이럼;; 괜히 기대안하고 봤다고 눈물쏟고나옴.. 국가대표 이런 흥행 영화랑 견주어도 흠이없는데.. 다 실화인데 뭐가 억지감동이라는지 ㅋㅋㅋ 평점보고 고민하지마시고 그냥 보세요 ㅠㅠ 여운 남음..  ,0,0,1
9447,2016.01.01,10,관람객굳굳굳...굳굳굳굳ㅋㅋ  ,0,0,1
9448,2016.01.01,2,뭐지? . . .뭐지?. . . .  ,0,0,1
9449,2016.01.01,6,쓰레기 성님의 부활..  ,0,0,1
9450,2016.01.01,8,관람객질질 끄는듯하지만 전체적으로 무난  ,0,0,1
9451,2016.01.01,1,억지감 가득한 감동.CJ의 스크린장악.실존인물들 크레딧에 비춰주지도않는 노센스  ,0,0,1
9452,2016.01.01,3,진짜 최악. 2015년 본영화중 제일 허졉한영화  ,0,0,1
9453,2016.01.01,9,2015년 마지막날 영화를 봤다. 실화 그 자체가 감동적인데 어떻게 억지감동이라 할 수 있는가? 실화를 바탕으로 해서 뻔한 내용인건 맞지만 산악인들의 도전정신과 의리는 경외감이 들 정도로 놀라웠다.  ,0,0,1
9454,2016.01.01,1,평점 너무높다 언제 감동적인건데  ,0,0,1
9455,2016.01.01,6,원작 다큐멘터리가 더 감동적이고 슬프다...선택하라고 하면 원작 다큐를 보겠다. 엄홍길 대장님과 대원들 새해 복 많이 받으세요.  ,0,0,1
9456,2016.01.01,10,관람객여러가지 생각이드는영화 . 만드신분들의 노력...  ,0,0,1
9457,2016.01.01,9,관람객산악산행영화라고생각하고가족과함께봤습니다.막상영화는휴먼드라마였고내용은예전텔레비젼에서다큐멘트리로진행한것이었습니다.하지만영화로감상하니훨씬감동적이었습니다.추천드립니다.  ,0,0,1
9458,2016.01.01,6,관람객박무택 구조하려고 팀 다시 꾸리는데  그 설정은 너무 오글 거렷음  전형적인 한국영화  ,0,0,1
9459,2016.01.01,7,관람객산악인의 애환을 느끼게해준 영화였다  ,0,0,1
9460,2016.01.01,8,관람객히말라야등반이라는 독특한소재를 자연스러운스토리에담아 잔잔한 인간애를 다룬 멋진영화...하지만낌히말라야등반이라는 큰배경에 비하연 좀더 스릴있는 부분이 부족하다는 느낌  ,0,0,1
9461,2016.01.01,7,관람객그럭저럭 볼만하나 뻔한 스토리 유치뽕임ㅡㅡ  ,0,0,1
9462,2016.01.01,10,관람객감동적인 히말라야~♡♡♡  ,0,0,1
9463,2016.01.01,10,감동적이었다....  ,0,0,1
9464,2016.01.01,8,관람객황정민에 의한 황정민을 위한 영화...모처럼 잔인한 장면이나 19금 장면이없는 힐링받는 느낌의 휴먼스토리 한편  ,0,0,1
9465,2016.01.01,9,"관람객실화라 약간의 다큐느낌이  없지않지만 황정민님  연기멋지십니다, 많은 눈물을 흘리고 ..여운이 가시지않아~  그시절 이야기를 다시한번  찾아보기도 했어요  ",0,0,1
9466,2016.01.01,10,관람객잘봤어요 십자압박 ㅋㅋㅋ  ,0,0,1
9467,2016.01.01,10,정말감동적인영화인것같습니다ㅠㅠ  ,0,0,1
9468,2016.01.01,8,관람객깐깐한 편인데 나름 재밌게 봤습니다. 신파가 막 심하지도 않았구요 ..  8점드립니다ㅋㅋㅋ  ,0,0,1
9469,2016.01.01,9,관람객배우들 연기가 너무 실감나고 산악인들에 대해 좀더 알거되는 계기가 된 것 같아요. 잘 만든 영화네요^^  ,0,0,1
9470,2016.01.01,10,기대하지않고 봤는데 정말잼있네요  ,0,0,1
9471,2016.01.01,8,관람객울컥하는순간이 많았구 재미있었어요  ,0,0,1
9472,2016.01.01,1,아 정말 재미없었다그냥 대놓고 억지신파이자 영화 그 자체로 보면 최악이다이게 왜 이렇게 평점이 높은지 대체 알 수가 없군  ,0,0,1
9473,2016.01.01,9,관람객재밋는데 뭔가 조금 아쉬움  ,0,0,1
9474,2016.01.01,5,"관람객한국영화이고 익숙한 배우들이라서 몰입감과 공감은 할리우드 영화에 비해 높았지만, 비운을 통해 감동을 만들려고 하는 인위적인  정서적 조작보다는  해피엔딩의 결말이 연말연시의 즐거움을 더해주는데 더 좋았지 않았겠나 싶음.  ",0,0,1
9475,2016.01.01,10,관람객재미감동 믿고보는 배우들 쵝오  ,0,0,1
9476,2016.01.01,6,좋은친구지만 나쁜아빠. 아재감성  ,0,0,1
9477,2016.01.01,7,관람객7점이 적당합니다 그이상은 무리데스요  ,0,0,1
9478,2016.01.01,10,오랜만에 많이 울었음ㅠㅠ  ,0,0,1
9479,2016.01.01,8,관람객잼있었어요 슬프기도하구요  ,0,0,1
9480,2016.01.01,8,관람객믿고보는 배우들...b  ,0,0,1
9481,2016.01.01,9,감동적이었습니다ㅠㅠ 보는내내 짠하고 눈물이 났네요  ,0,0,1
9482,2016.01.01,8,관람객재미있어요.울딸 8살인덕 감동받고 우네요  ,0,0,1
9483,2016.01.01,7,관람객재밌었다 근게조금 길었다  ,0,0,1
9484,2016.01.01,7,관람객감동에 더한 감동이지만 자기만족  ,0,0,1
9485,2016.01.01,2,재미도 없고 이런 대놓고 억지신파는 처음본다  ,0,0,1
9486,2016.01.01,10,관람객정말 감동적정말 감동적정말 감동적정말 감동적  ,0,0,1
9487,2016.01.01,9,관람객슬퍼요 그래도 재밋습니다  ,0,0,1
9488,2016.01.01,9,관람객휴먼원정대에 먼저 박수를 보냅니다. 가슴따뜻한 영화였습니다.  ,0,0,1
9489,2016.01.01,9,관람객감동적이네요 ㅠㅠ 재미있게봤습니다  ,0,0,1
9490,2016.01.01,10,"새해 첫 영화가 울음바다가 되었네요잘 봤습니다, 감사합니다.  ",0,0,1
9491,2016.01.01,9,관람객아무 기대 안하고 봤는데 너무 쟀밌고 감동적이네요~황정민과 정우 케미가 너무 좋네요~^^  ,0,0,1
9492,2016.01.01,8,관람객연기력 최고에 몰입감도 좋은데  ,0,0,1
9493,2016.01.01,9,관람객말이필쇼없다  황정민 짱짱~!!!  ,0,0,1
9494,2016.01.01,10,관람객웃음감동어느하나 빼놓을거없고실제 엄홍길대장님 존경합니다  ,0,0,1
9495,2016.01.01,10,관람객너무재미있고감동스터리  ,0,0,1
9496,2016.01.01,10,막판 가면서 전개가 이상해지고 뒤죽박죽한 느낌이었지만 황정민 연기 소름돋을 정도로 몰입감 좋았습니다. 마지막에 실제 인물들 사진과 다같이 찍은 실제 사진컷 하나씩 보여줬으면 굉장히 좋았을듯 하네요  ,0,0,1
9497,2016.01.01,4,별루 잼없었음. 걍 그냥 저냥 . 그냥 그런 영화였다. CGV 독점이 이룬 500만 관객.  ,0,0,1
9498,2016.01.01,1,나레이션과 대사가 왜이렇게 단조롭죠. 초등학생이 쓴 일기 같습니다. 더 재미와 감동이 있을 수 있는 영화인데. '센스'가 부족해서 그런지 지루했습니다. 억지감동이야 바라지도 않았지만....요즘 나오는 위트있는 영화들에 비해서는 뒤쳐지는 느낌  ,0,0,1
9499,2016.01.01,10,관람객강력추천완전추천짱짱  ,0,0,1
9500,2016.01.01,3,관람객나도 울었다... 이렇게 짜내는데 어떻게 안울어...  하지만 이렇게 좋은 소재를 완전 내수용으로 만든 신파가 아쉽다..  ,0,0,1
9501,2016.01.01,8,관람객너무 슬펐어요 ㅠㅠ 감동입니다  ,0,0,1
9502,2016.01.01,8,관람객고인의 명복을 빕니다?  ,0,0,1
9503,2016.01.01,7,관람객스토리 전개가 좀 빨라서 디테일한 부분이 아쉽기는 하지만연기력이 좋은 배우들 덕분에 갠찬은 영화였음.  ,0,0,1
9504,2016.01.01,9,관람객눈물이 주룩 주룩! 재미 있네요^^  ,0,0,1
9505,2016.01.01,9,관람객너무너무 슬펐고 감동 ㅜㅜ  ,0,0,1
9506,2016.01.01,7,감동있고 공감도되고 이해되긴했지만 빠른전개 너무 감성을짜내려고하는느낌 그런거가 아쉬운 영화였네요  ,0,0,1
9507,2016.01.01,10,"평점때문에 볼까말까하시지마시고 가족,친구,연인이랑같이보세요 박무택대원과엄홍길대장의 이야기가 따스하게 전해지는영화였습니다 다른관점말고 그냥순수한마음으로보면 빠져드는영화이고 실화라는부분에서 더감동적인 영화입니다.평점신경쓰지마시고 보시길....  ",0,0,1
9508,2016.01.01,10,관람객재미나게 감동적으로 잘 봤습니다  ,0,0,1
9509,2016.01.01,9,관람객감동적이였습니다.~~~  ,0,0,1
9510,2016.01.01,10,관람객감동적으로 감상하였습니다.  ,0,0,1
9511,2016.01.01,9,관람객 배우들 연기는 이루말할것없습니다. 이미 알고있는 사실이기 때문에 결말을 알고 있었음에도 머리가 띵할정도로 울고 나왔습니다 ㅜㅜ  ,0,0,1
9512,2016.01.01,1,까놓고 명량 히말라야 둘다 독점빨 없으면 3류 그 이상 취급 못받는 영화 이걸 보느니  무릎팍도사 엄홍길대장님편을 보는게 낫습니다.  2007.06.27 일날 방송했네요.  ,0,0,1
9513,2016.01.01,7,관람객실화를 바탕으로 한 스토리라 특별하지는 않았지만 배우들의 연기가 덜하지도 너무 과하지도 않게 감동을 잘살린것 같다. 배우 정우의 발견과 기존에 없던 산악영화의 스타트를 잘 끊은것같다  ,0,0,1
9514,2016.01.01,10,관람객감동적이엇어요!! 꼭보세요  ,0,0,1
9515,2016.01.01,7,관람객잘보고 나왔어요 눈물도나고 감동적이긴 한데 계속 감동을 주려 노력하는것 같았어요.ㅠㅠ  ,0,0,1
9516,2016.01.01,9,주변 사람들 얘기만 듣고 보는 걸 망설였는데 눈물을 흘리면서 봤습니다. 신파라고 본다면 그럴수도 있고 사실과도 다르지만 영화라고 본다면 어느정도 이해할수 있는 수준입니다. 재미있게 봤습니다.  ,0,0,1
9517,2016.01.01,8,관람객 감동적이었네요.  마지막부분이 더욱  ,0,0,1
9518,2016.01.01,1,기대와는 다르게 재미없음 그냥 산타고 내려오는 영화;;  ,0,0,1
9519,2016.01.01,9,"내 숨이 가빠지는 영화, 그리고 내 숨을 나누고픈 영화.누군가의 권유나 선택이 아닌, 오로지 자신의 결정만이 삶과 죽음을 만드는 곳, 히말라야를 보는 내내 추운 느낌이 들었던건 저 뿐만이 아니었을 겁니다.  ",0,0,1
9520,2016.01.01,10,관람객야박한 우리 아들내미 딸내미두 눈물나게 하는 감동 스토리  ,0,0,1
9521,2016.01.01,9,관람객배우들의 연기가 좋았어요 볼만한 영화네여  ,0,0,1
9522,2016.01.01,5,히말라야보다 더 먼저 나온 에베레스트와 히말라야를 비교해보면 히말라야에서 보여주는 산의 웅장함은 에베레스트에 미치지 못한다. 너무 감동을 주는 것에만 집중한 것인지 산악영화의 본질을 살리지 못했다. 에베레스트는 영화의 마지막에 대원들 사진까지 보여줬다  ,0,0,1
9523,2016.01.01,7,관람객초반부분엔 개그적 요소도 많고 재밌었는데.후반부로 걸수록 이해가.안되었습니다..뭔가 살짝 억지 감동유도하는  것 같구 ㅋㅋ뭐 전반적으로는 재밌었습니다.ㅎㅎ  ,0,0,1
9524,2016.01.01,7,관람객실화라는점은 흥미있지만 에베레스트와는 비교되네요  ,0,0,1
9525,2016.01.01,10,관람객재미있는  시간되었습니다  ,0,0,1
9526,2016.01.01,8,관람객그냥저냥 한번쯤은 볼수있는 그런영화. 두번은 보고싶진않음  ,0,0,1
9527,2016.01.01,8,관람객암질아찔스릴잇게잘본고같아요~~재밋네요~  ,0,0,1
9528,2016.01.01,8,감동....새해첫날 좋은영화로 시작하네요^^*  ,0,0,1
9529,2016.01.01,9,관람객감동감동감동 정말 볼만한 꼭봐야하는영화였어요  ,0,0,1
9530,2016.01.01,5,관람객생각보다는 그렇게 감동적이지 않았네요  ,0,0,1
9531,2016.01.01,5,관람객기대에는 못 미쳤지만 나쁘지 않은 영화  ,0,0,1
9532,2016.01.01,10,관람객와우 정말 재밌게봤어용ㅎㅎ  ,0,0,1
9533,2016.01.01,9,관람객너무  슬퍼요 감동적이구  ,0,0,1
9534,2016.01.01,10,관람객너무 너무 너무 재밌어염  ,0,0,1
9535,2016.01.01,4,관람객배우들은 좋은데 너무 지루하고 그렇게 감동까지도....  ,0,0,1
9536,2016.01.01,9,관람객감동적^~ 가족과 함께  ,0,0,1
9537,2016.01.01,10,관람객보는내내 뭉클했습니다~영화 잘 만들었네요~~강추입니다~~  ,0,0,1
9538,2016.01.01,9,관람객눈물콧물흘리며  잘보았습니다.한국영화 화이팅입니다수고들 하셨습니다~~^^새해복많이받으세요  ,0,0,1
9539,2016.01.01,8,관람객실제 있었던 일을 영화로 만들었다는게.감동이다  ,0,0,1
9540,2016.01.01,7,조난이라는 소재를 우리 영화에서는 흔치 않아 흥미로웠지만 구성을 무너트리는 신파극으로 나아가 아쉬울 따름  ,0,0,1
9541,2016.01.01,8,관람객영화관람하는동안 많이 울었네요. 잔잔하면서 감동적이었어요  ,0,0,1
9542,2016.01.01,10,관람객히말라야 영화는 휴머나즘이 살아있는 영화다. 산 사나이들의 등방과 관련한 정산과 감덩과 우정등을 한눈에 볼수 있었다. 박무택 대원의 죽음이 슬펐지만 엄 대장을 비롯한 대원들의 우정은 역시 빛났다.  ,0,0,1
9543,2016.01.01,10,얼마나울었는지모른다 정말감동적이다!!배우들짱!황정민 짱  ,0,0,1
9544,2016.01.01,9,관람객눈물쌤 자극최고영화.감동...  ,0,0,1
9545,2016.01.01,10,관람객넘 감동적인 히말라야....감동 감동입니다ㅠㅠ  ,0,0,1
9546,2016.01.01,10,관람객한국 영화의 힘이 느껴집니다.끈끈한 동료애가 가슴을 울립니다.새해 첫날을 감동으로 시작 할수 있어서 아주 좋았습니다  ,0,0,1
9547,2016.01.01,8,관람객감동이 있고 눈이 시원시원한 영화!!  ,0,0,1
9548,2016.01.01,10,관람객감동적인 실화 이야기에 보는내내 가슴을 울렸습니다..배우부들의 연기도 너무 인간적이였는데 특히 정우씨와 김인권씨의 연기가 저에게는 좀더 감동적이였습니다..사소한일들로 많은 무서운 일들이 일어나는 요즘..사람들이 한번쯤은 꼭 봐야할 영화인것 같습니다^^  ,0,0,1
9549,2016.01.01,8,관람객실제있었던일이라고해서슬펐어요 한번쯤볼만한영화라생각합니당  ,0,0,1
9550,2016.01.01,10,관람객산은 잘 못타지만 잔잔한 울림 있네요  ,0,0,1
9551,2016.01.01,10,관람객황정민 정말 고생한게 보이더군요  ,0,0,1
9552,2016.01.01,8,관람객죽음을 두려워하지안는  동료애에  감동적이다  ,0,0,1
9553,2016.01.01,9,관람객감동적이에요 ㅠㅠㅍ퓨ㅠㅠㅠㅠ  ,0,0,1
9554,2016.01.01,8,관람객그럭저럭 볼만했어요 ^^  ,0,0,1
9555,2016.01.01,10,관람객아들이랑함께 보았는데 감동적이었습니다 제가 그 산을 다녀온것 같은 느낌입니다  ,0,0,1
9556,2016.01.01,7,관람객좀 뻔한 스토리지만 그냥저냥 볼 만 합니다  ,0,0,1
9557,2016.01.01,9,관람객가슴이 아려오는  영화네요  ,0,0,1
9558,2016.01.01,10,관람객휴먼 스토리 감동 삶의 의미 생각  ,0,0,1
