index,time,score,reple,1st_week,2st_week,3st_week
6123,2015.12.26,10,감동입니다...실화를 바탕으로한 영화여서 그런지 더 감동이 많았던것 같습니다.한국영화최고....^^  ,0,1,0
6124,2015.12.26,4,산에 오르는 이유.. 산이 거기에 있으니까.산쟁이 아니면  공감이 안갈수도 있다는느낌.  ,0,1,0
6125,2015.12.26,10,관람객자신의 꿈을 위해 열심히 사는 모습은 언제봐도 멋져보인다. 다른 이를 위해 자신을 희생하는 모습은 더 멋져보인다. 하지만  세상에서 가장 값어치 있는 일을 위해 자신이 드려질 때 인생의 참된 가치가 빛나지 않을까...  ,0,1,0
6126,2015.12.26,5,뭐라설명할수없는지루함..하지만 슬펐다  ,0,1,0
6127,2015.12.26,5,뭐 그닥... 돈주고 보기 좀 아까운 정도  ,0,1,0
6128,2015.12.26,8,관람객감동은 있었지만 약간알차지않은느낌  ,0,1,0
6129,2015.12.26,6,관람객그냥 감동적인 눈물 안남 딴사람은 울더라  ,0,1,0
6130,2015.12.26,9,관람객명품 연기에 감동을 한아름 안고 돌아왔습니다...  ,0,1,0
6131,2015.12.26,10,124분 동안 모든걸 담는다는건 힘들겠지만 나름 여운이 많이 남는 영화인것 같아요.성탄절 집사람과 따뜻하게 감사히 잘보고 왔어요~^  ,0,1,0
6132,2015.12.26,9,관람객그럭저럭재밍있는영화  ,0,1,0
6133,2015.12.26,5,기대를 너무 많이 하고 봐서 그런가 딱히 ..  ,0,1,0
6134,2015.12.26,9,"관람객정우,황정민의 연기는 역시 믿고봅니다.  ",0,1,0
6135,2015.12.26,9,관람객감동적이고 가슴따뜻한영화^^  ,0,1,0
6136,2015.12.26,3,다큐로 받은 감동을 아쉬운 연출(욕심과다)로 고생한 배우들의 노력이 헛되보여 많이 실망스러웠다....내기대가 큰걸까  ,0,1,0
6137,2015.12.26,9,관람객멋짐!!사랑과 우정!!그리고 열정!!  ,0,1,0
6138,2015.12.26,6,원래 영화보고 잘 우는데 이 영화는 대놓고 울어라울어 하는 것 같아서 눈물 참음.. 황정민님의 대사 하나하나도 오글거려 죽는줄..  ,0,1,0
6139,2015.12.26,9,관람객전체적으로 깔끔한영화내용의 특수성은 없으나 감동이있는 영화  ,0,1,0
6140,2015.12.26,8,관람객감동입니다 실화를 알고서 영화를보니 감동이 두배더군요배우들 연기좋았습니다  ,0,1,0
6141,2015.12.26,8,관람객좀 지루합니다만 배우 분들이 얼마나 고생하고 찍었을까 라는 생각이 절로 들었어요  ,0,1,0
6142,2015.12.26,10,감동적이었고 황정민과 정우씨의 연기를 잘한다는것을 알고있었지만 진짜 믿고 보는 배우들 입니다.  ,0,1,0
6143,2015.12.26,9,관람객잔잔한  감동을  가족과  느낄수있어서  좋았습니다.  ,0,1,0
6144,2015.12.26,6,한국관객들은 참... 뻔한 스토리여도 슬픈거 쪼오금만 넣어주면 바로 대박이다~ 감동이다하며 평점 10 박는다. 반성해라  ,0,1,0
6145,2015.12.26,10,관람객잘보았습 니다.재미도 있었습니다.  ,0,1,0
6146,2015.12.26,8,관람객감동적이였어요. 휴먼영화  ,0,1,0
6147,2015.12.26,8,관람객국가대표 같은 그런 영화?  ,0,1,0
6148,2015.12.26,8,관람객큰감동은 못받았지만 무난하게 볼수있는 영화였던것같습니다  ,0,1,0
6149,2015.12.26,10,관람객이영화 정말강추합니다..  ,0,1,0
6150,2015.12.26,9,관람객재밋어요재밋어~~~  ,0,1,0
6151,2015.12.26,9,관람객다큐멘터리 같으면 어떻하나 걱정했는데 재미도 감동도! 꼭 보세요^^  ,0,1,0
6152,2015.12.26,10,관람객무난하게 볼수 있었던 영화입니다.  ,0,1,0
6153,2015.12.26,10,관람객감동이었습니다~배우님들 모든 출연진들 고생 정말 많으셨어요^^  ,0,1,0
6154,2015.12.26,7,관람객실화를 바탕으로 해서 나름 볼만했습니다.  ,0,1,0
6155,2015.12.26,8,관람객사람사이에 표현할수있는 최고의 감동을 보여준 영화!  ,0,1,0
6156,2015.12.26,10,관람객역시황정민이고 정우의 연기력폭발  ,0,1,0
6157,2015.12.26,10,관람객굿해드굿쟙 머찐해드굿쨥  ,0,1,0
6158,2015.12.26,8,관람객기냥저냥 볼만했어요ㅋ  ,0,1,0
6159,2015.12.26,9,관람객괜춘이에요한번보아요  ,0,1,0
6160,2015.12.26,10,관람객우리가족에게 2015년 클스마스심야에 공유할수 있는 좋은 추억의 시간이어서 너무 좋았고 배우들에 열연에 박수를 보냅니다~초6중3 우리부부 모두다 목숨건 산악인들의 의리에 감동과 뜨거운 눈물을 흘렸습니다 영화 히말라야 강추합니다  ,0,1,0
6161,2015.12.26,10,아~~~산악인 정말 멋있네...눈물이 앞을 가려서 닦고 닦고 . . .감동입니다^^ 영화 잘 봤습니다....멋진분들  ,0,1,0
6162,2015.12.26,10,위대한 산악인의 이야기 감동적이었습니다  ,0,1,0
6163,2015.12.26,10,관람객너무 감동적이었어요^^  ,0,1,0
6164,2015.12.26,5,관람객노잼노잼 다른영화나볼ㅋ걸 내부자글이나 호랑이나오는거  ,0,1,0
6165,2015.12.26,8,관람객재미있게 잘 보았습니다. 실화에 바탕을 두고 있어서 눈물이 났어요...다들 지금은 잘 살고 있을거라고 생각합니다.  ,0,1,0
6166,2015.12.26,9,관람객황정민 연기에 다시한번 반했습니다.  ,0,1,0
6167,2015.12.26,1,"오늘 아침 300만 돌파했단 보도자료 표 젤 마지막줄은 왜 안보여줍니까? 히말라야 상영횟수는 5천몇회, 스타워즈 3천회, 대호 1,600회, 심지어어제 개봉한  몬스터호텔도 천몇회인데 스크린 독과점 너무 심하네요 불공정기록~~  ",0,1,0
6168,2015.12.26,9,관람객너무 슬퍼요 ㅠㅠ 아주 잘 밨어요  ,0,1,0
6169,2015.12.26,3,ㅋㅋㅋ평점댓글알바가 넘치네요 겁나 별로..그정도 등정했으면 됐지.가정 내팽겨치고 동료시신 수습하러 가겠다니...억지억지  ,0,1,0
6170,2015.12.26,10,관람객진심으로 극장에서 소리내면서 울뻔한거 참았습니다.  ,0,1,0
6171,2015.12.26,9,관람객산악인의 실제 삶을 느낄수 있는 영화였다  ,0,1,0
6172,2015.12.26,7,"관람객황정민 연기b . 두번, 세번은 보고싶지않음  ",0,1,0
6173,2015.12.26,10,관람객너무 감동적이고 재밌어요!!  ,0,1,0
6174,2015.12.26,8,관람객재미낫어요 스릴도있고요  ,0,1,0
6175,2015.12.26,10,최고입니다 보셔도 후회없을 영화!  ,0,1,0
6176,2015.12.26,10,관람객도전하는 정신과 다른 사람들이 하지 못할 걸 도전해서 감동을 주는 영화입니다.  ,0,1,0
6177,2015.12.26,9,관람객아쉬울게 없을 만큼 감동 적입니다 시간 가는 줄 몰랐어요.  ,0,1,0
6178,2015.12.26,8,눈물펑펑ㅜ감동그자체!  ,0,1,0
6179,2015.12.26,10,관람객굿 굿 굿 베리베리 굿감동적입니다  ,0,1,0
6180,2015.12.26,9,관람객정말 말로만 듣다갔가 봤는데 짱입니다 그리고 감동도 적절하구 정말 괜찮은 영화입니다  ,0,1,0
6181,2015.12.26,10,감동적이다ㅜㅜ 재밌게 봤습니다  ,0,1,0
6182,2015.12.26,9,관람객중간중간 재미도있고 나중엔 슬픔ㅠㅠ  ,0,1,0
6183,2015.12.26,10,와....대단합니다  ,0,1,0
6184,2015.12.26,10,관람객우리가 잊고  살곤 하는데 기억  해야  할 일들 중하나  인것 같아요 ?우리나라 대한민국의 긍지를 보여준 분들 ?이름 없는 산악인들을 위해서 영화를 많이 보았으면해요 ?  ,0,1,0
6185,2015.12.26,1,타영화 테러좀 작작해래 알바색기들아  ,0,1,0
6186,2015.12.26,10,관람객좋은 내용에 좋은 연기 입니다.  ,0,1,0
6187,2015.12.26,8,"관람객내용전개는 우리가 예상할만한 스토리였지만, 믿고 보는 배우들의 연기력과 연출력에 감동  ",0,1,0
6188,2015.12.26,1,"초반,중반까지는 좋았는데 후반부에 너무 지루하게 끌더군요. 이래서 감독이 중요한거같아요. 같은 주제로 얼마나 잘 영화로 만드는지요. 후반부는 억지감동같은 느낌이 들었어요. 적당히 끊어줬어야죠. 배우들 연기력이랑 실화가 아니었으면 망했을 영화인듯  ",0,1,0
6189,2015.12.26,10,그냥 최고..꼭 보세요  ,0,1,0
6190,2015.12.26,10,관람객남자까지울리는영화~~~간만에 영화다운영화봤어요^^역쉬 황정민이네요  ,0,1,0
6191,2015.12.26,1,진짜 여러모로 못만든 영화인데 특히 각본이 90년대 ebs 드라마 수준임. 한국 영화들이 알바 진짜 이정도로 심하게 풀어놓는줄 몰랐는데  이번에 좀 충격먹었음.  10점이 55% 나올 영화가 절대 아닌데  ,0,1,0
6192,2015.12.26,8,관람객연휴라 사람들 진짜 많아요.. 개봉시기가 절묘한듯.그래도 휴머니즘이라..나쁘진 않았어요..촬영하느라 힘드셨을듯요..  ,0,1,0
6193,2015.12.26,7,관람객황정민 정우 연기 짱~!!  ,0,1,0
6194,2015.12.26,6,관람객이전엔 몰랐지만 그 뜻깊었던 사건을 영화로나마 함께한 느낌이라 감동이었다. 하지만 영화의 연출부분에 있어선 약간..전형적인 감동영화를 보는 것 같은 느낌이 없지않아 있어서 그 부분이 아쉬웠다. 배우분들의 연기는 대단했다. 특히 정우.  ,0,1,0
6195,2015.12.26,10,재밌어요~ 하도 재미없고 억지스럽다고 그래서 망설엿는데...아님! 보길 정말잘한듯!  ,0,1,0
6196,2015.12.26,9,관람객훌륭한영화엿다하도 재미없다 지루하다 억지로만든 신파극이다 말들많앗지만 난영화를보면서 정말산을좋아하는사람중애 악한사람없다는말이 기억낫고 진짜 악역없는가슴따틋한 영화라서 더욱좋앗다  강추  ,0,1,0
6197,2015.12.26,1,0점이 없네. .  아쉬운데로 1점  ,0,1,0
6198,2015.12.26,1,별점 0개 없냐? 스크린쿼터제 폐지해라 이감독 기억했다 다신 한국영화 안 본다 황정민을 망친영화.... 별점 테두리도 아깝다 할리우드의 반의 반의 반의 반의 반만 따라가봐 진짜 기가차서... 내 크리스마스 물어내라 라미란? 인지 뭔지 연기못하네  ,0,1,0
6199,2015.12.26,10,관람객재미있고 감동적입니다  ,0,1,0
6200,2015.12.26,10,감동입니다 매우님들연기력갑 ㅜㅜ  ,0,1,0
6201,2015.12.26,5,기자 평론가 말이 정확했다  ,0,1,0
6202,2015.12.26,9,관람객부모님크리스마스날보여드렸는데잘보셨다네요^^  ,0,1,0
6203,2015.12.26,10,엄홍길대장의 실화를 바탕으로 제작 됐다고 하는 히말라야 황정민이 이 영화를 선택하게 왜 선택했는지 영화를 보는 동안 알게되었습니다. 가족애 부터 시작해서 인생 살아가는 모습이 레파토리 처럼 흘러가고 가슴 찡하고 웃기고 대단한영화니다.  ,0,1,0
6204,2015.12.26,10,오랜만에 정말 감동적인 영화를 봤다... 배우들 연기도 정말 대박!  ,0,1,0
6205,2015.12.26,10,관람객감동적이에요ㅠㅠ 잘봤습니다  ,0,1,0
6206,2015.12.26,9,관람객몰입도 좋았네요 아침첫영화로봤는데 눈물범벅 ㅜㅜ  ,0,1,0
6207,2015.12.26,9,관람객너무 감동적입니다~~근데 약간 지루할수있어요  ,0,1,0
6208,2015.12.26,10,관람객재밌어요 역시 배우진이 믿고볼  영화에요  ,0,1,0
6209,2015.12.26,7,관람객실화라서 그런지 더 짠해지는 느낌이 들었습니다.  ,0,1,0
6210,2015.12.26,10,관람객가족들과   함께볼만한 영화  추천합니다  ,0,1,0
6211,2015.12.26,10,관람객재미있었습니다. 또 보고싶네요  ,0,1,0
6212,2015.12.26,10,관람객진짜너무너무 재밌어요  ,0,1,0
6213,2015.12.26,1,"그냥 남들은 어떻게 봤나 궁금해서 들어왔는데, 보지도 않고 테러라뇨. 보고 테러합니다.  ",0,1,0
6214,2015.12.26,3,중후반에 나오는 억지눈물 짜내기 감성팔이만 없었다면 괜찮았음.초중반에는 배우 정우분 캐릭터가 재밌어서 영화를 이끌어 나갔다고 생각될 정도로 재밌었는데..  ,0,1,0
6215,2015.12.26,9,관람객실화를 바탕으로 해서 만든거라 더 감동이 전해졌고 배우들 의 연기력도 뛰어나서 몰입도가 높았던 거 같아요.  ,0,1,0
6216,2015.12.26,8,산악영화 특성상 스펙타클한 화려함은 없지만 실화를 배경으로 해서 그런지 엄홍길대장과 박무택대원에 대해서 다시 한번 관심을 가질수 있는 감동의 영화였습니다  ,0,1,0
6217,2015.12.26,10,관람객크리스마스에 엄마아빠랑 영화본적이 처음인데 정말 몰입도 최고고 계속 펑펑 울었네요...  ,0,1,0
6218,2015.12.26,5,첫장면 황정민을 보고는 국제시장이 떠오르고 정우를 보고는 응사가 떠오르는.. 사실을 배경으로 하는 영화라지만 중간중간 얘기를 풀어나가는 방법이 식상했습니다. 개인적으로 감동이 물밀듯이 일어나지는 않았어요 소문에 비해 좀 실망스럽고 아쉬운영화네요  ,0,1,0
6219,2015.12.26,10,가슴에 뜨거운 여운을 준 영화. 다만 아쉬웠던건 엄대장의 일대기가 좀더 부각됬으면 어땟을까 하는 바램입니다  ,0,1,0
6220,2015.12.26,10,관람객감동 휴먼영화 입니다 눈물쪽 뺏네요...  ,0,1,0
6221,2015.12.26,10,관람객돈 안아까움!강추!~~~  ,0,1,0
6222,2015.12.26,10,관람객감동만땅..펑펑울엇네요 꿀잼  ,0,1,0
6223,2015.12.26,7,관람객사실감은 높은 점수를 주고 싶음  ,0,1,0
6224,2015.12.26,9,관람객감동적인 영화. 요즘 대세여서 봤는데 역시네요. 황정민 외 모든 배우들 잘봤습니다.  ,0,1,0
6225,2015.12.26,9,관람객뭔가 아쉬움이 심하게 남는영화...끝나고 나오면서도 자꾸 울컥하고..재미있게봤어요~  ,0,1,0
6226,2015.12.26,9,관람객오랜만에 눈물나는 감동  ,0,1,0
6227,2015.12.26,9,관람객버티칼 리미트를 보신분들이라면 좋아하실 겁니다  ,0,1,0
6228,2015.12.26,7,관람객사람은 자기가 좋아하는 사람을 위해서 움직인다는 걸 다시 한 번 철저히 느낀 영화  ,0,1,0
6229,2015.12.26,10,관람객정말 굿~~~ 이었습니다  ,0,1,0
6230,2015.12.26,9,관람객정말 감동적이고 멋있고 동료를 위해 자신을 던지는사나이 다운 영화입니다 산악인들에게 경의를 표하고픈 영화이기도 합니다.눈물 많이 흘렸습니다.  ,0,1,0
6231,2015.12.26,9,관람객연출이 좋네요 왜 그들이 산이라는 곳에 빠져드는지 잠시나마 느낄수 있게 해준 영화였습니다:)  ,0,1,0
6232,2015.12.26,10,관람객너무재밌고 감동적인영화  ,0,1,0
6233,2015.12.26,10,죽기전에 봐야하는 영화다  ,0,1,0
6234,2015.12.26,5,"산악신파극...,,  ",0,1,0
6235,2015.12.26,9,관람객실화를 바탕으로해서 그런지 감동있게 봤습니다 ㅎ  ,0,1,0
6236,2015.12.26,10,관람객웃고 울고 너무 재밋엇어요!  ,0,1,0
6237,2015.12.26,8,관람객황정민 역시ㅋㅋ 스토리도 좋고 감동도 있 영화  ,0,1,0
6238,2015.12.26,4,관람객그냥 그랬음...좋아하는 배우들이지만 여성에 대한 묘사가 매우 불쾌했습니다  ,0,1,0
6239,2015.12.26,6,관람객초반 코메디 중반이후 산파극  ,0,1,0
6240,2015.12.26,8,관람객보는내내 감동적이고...감동적이다 히말라야 가고싶다하하하ㅏ하ㅠㅠㅠㅠ눈물이주르륵  ,0,1,0
6241,2015.12.26,6,관람객정말 죽은 동료를 데리러 갔다는 것에 대해 감동적이었으나 중간중간 오그라드는 부분과 지루한 부분들이 있었어요. 억지 감동은 아니어서 볼만한 영화입니다.  ,0,1,0
6242,2015.12.26,8,관람객첨부터끝까지감동적이네요  ,0,1,0
6243,2015.12.26,10,관람객배우들의 연기가 인상적인 감동적인영화!!!  너무 잘봤네요.  ,0,1,0
6244,2015.12.26,10,관람객너무 감동적이네요 ㅠㅠㅠㅠ  ,0,1,0
6245,2015.12.26,9,관람객재밌어요 감동있습니다  ,0,1,0
6246,2015.12.26,1,별점 너무 높다 진심 7점후반대가 적당한거같아여솔직히 황정민 때문에 봤는데 대사도 유치하고 좀 오그라들던데요... 술집에서 동료하나씩 모이는거 대박유치... 감동적인 부분이 없는건 아니지만 감정이입이 잘 안되는 부분이 더 많음 평점 알바인듯 진심  ,0,1,0
6247,2015.12.26,9,관람객오랜만에  보는  감동있는 영화였습니다.  실제  이야기도  알고 있었지만  나도  모르게  울컥해서  울고  있더군요. 가족과 좋은 사람들과  보면  더  좋을  영화  같습니다. 소중한  내  사람들을  다시  돌아보게  만든  영화네요.  ,0,1,0
6248,2015.12.26,8,관람객가족과함께 보기 좋은영화~  ,0,1,0
6249,2015.12.26,10,관람객아이들이 쉰난네요  좋은영화계속나오면 좋겠넹?  ,0,1,0
6250,2015.12.26,1,평점 테러 작작해라 알바생들아  ,0,1,0
6251,2015.12.26,10,관람객너무 재밋게  잘봣어요  마지막부분에서   계속 울엇네  ,0,1,0
6252,2015.12.26,10,관람객슬퍼요 ㅠㅠ재미잇게봣어요ㅛ  ,0,1,0
6253,2015.12.26,10,관람객너무 감동적이고 잘 만든 영화였어요  ,0,1,0
6254,2015.12.26,8,관람객마음이 따뜻해지는영화  ,0,1,0
6255,2015.12.26,10,관람객 2시간 내내 긴장과 감동을 준 좋은 영화다.한국의 히말라야 등반 역사를 알수 있고 산악인의삶과 애환...투지가 잘 느껴진다  ,0,1,0
6256,2015.12.26,8,관람객슬픔을 유도하는 영화인 것 같다  ,0,1,0
6257,2015.12.26,10,뭐 하나 버릴게 없는 영화!! 완전 강추입니다! 손수건 필수!!  ,0,1,0
6258,2015.12.26,10,관람객감동 입니다. 믿고 볼 수 배우 황정민  ,0,1,0
6259,2015.12.26,10,관람객감동적인 내용이었습니다. 등산 좋아 하시는 분들께 강추합니다.  ,0,1,0
6260,2015.12.26,10,관람객너무재밌음 웃고울고 황정민 연기 굿??  ,0,1,0
6261,2015.12.26,10,관람객에베레스트보다도 더 감동적이었다.  ,0,1,0
6262,2015.12.26,7,관람객가족과 함께 보기에 좋은 영화입니다~  ,0,1,0
6263,2015.12.26,6,관람객기대보단 재밋지않았어요  ,0,1,0
6264,2015.12.26,9,관람객완전 감동입니다  연기도 완전 잘하구요 짱입니다~^^  ,0,1,0
6265,2015.12.26,8,관람객그냥저냥 볼만했던영화....  ,0,1,0
6266,2015.12.26,10,관람객저에게는 2015년 최고의 영화였습니다!  ,0,1,0
6267,2015.12.26,1,그냥 무난함 멍때리고 볼만함  ,0,1,0
6268,2015.12.26,10,인간으로서  가치를 다시 한 번 느낄 수 있었던 최고의 순간이었습니다.  ,0,1,0
6269,2015.12.26,10,"관람객첨부터 끝까지 산 얘기 뿐이데, 감동이 폭풍처럼 몰려옵니다. 절대 후회하지 않으실거예요^^ 크리스마스 영화 1순위답네요!  ",0,1,0
6270,2015.12.26,10,관람객쟈미쪄여어응?응?으어의  ,0,1,0
6271,2015.12.26,10,가슴 따뜻한 영화진짜 보는내내 눈물참느라 혼났네요  ,0,1,0
6272,2015.12.26,10,관람객감동이에요 재밌게 잘 봤습니다  ,0,1,0
6273,2015.12.26,1,동네 영화관갔더니 상영관이 죄다 히말라야  ,0,1,0
6274,2015.12.26,9,관람객최고의 실화와 최고의 연기자들의 만남 가슴뭉클한 감동을 만날수 있었어요  ,0,1,0
6275,2015.12.26,1,딱 김치영화 표본.유치 개그.감성팔이.억지 감동. 딱 그거뿐.  ,0,1,0
6276,2015.12.26,7,관람객그럭저럭 한번은 볼만하네요  ,0,1,0
6277,2015.12.26,10,울컥... 영화관에서 훌쩍훌쩍 소리만 들렸네요  ,0,1,0
6278,2015.12.26,9,관람객인간미 넘치는 휴먼등반대 굳! 다만 한사람에 대한 편애는 조직을 깨는 암  ,0,1,0
6279,2015.12.26,8,관람객기대없이봤눈데 굿굿ㅋㅋㅋ  ,0,1,0
6280,2015.12.26,6,주연급에서는 황정민 조연급에서는 이경영 비슷한 역할에 최근 다작으로 인한 이미지 소비와 식상함이 한계치에 다다르고 있다  ,0,1,0
6281,2015.12.26,10,관람객감동적이며   삶이 무엇인가 되세겨보는 영화입니다  ,0,1,0
6282,2015.12.26,10,눈물이 뺨을 떠날 수 없는 명화!  ,0,1,0
6283,2015.12.26,10,관람객엄마랑 동생이랑 보고왔는데 너무너무재밋었어요!!!  ,0,1,0
6284,2015.12.26,10,관람객재밌어요 나름....  ,0,1,0
6285,2015.12.26,9,관람객영화 생각보다 재미이썽요  ,0,1,0
6286,2015.12.26,10,배우들 연기좋고. 감동감동~ 보는 내내 울었음..진정한 산악인들에게 박수를 보내고 싶다..최고~!  ,0,1,0
6287,2015.12.26,10,관람객한시도 눈을 뗄 수 없었습니다.  산악인들의 휴먼 드라마라할까..  ,0,1,0
6288,2015.12.26,6,관람객웃다가 울다가 본 영화! 재밌었어요:)  ,0,1,0
6289,2015.12.26,10,관람객감명깊게 잘 봤습니다 ~  ,0,1,0
6290,2015.12.26,10,관람객무지무지 재미있음  역시 한국영화가 재미있음  ,0,1,0
6291,2015.12.26,9,관람객감동실화입니다.뭉클하네요  ,0,1,0
6292,2015.12.26,10,관람객다아는이야기지만감동적임  ,0,1,0
6293,2015.12.26,7,중간부터 지루한 감이 있지만 참 고생하셨습니다 엄대장님  ,0,1,0
6294,2015.12.26,10,"관람객역시 실화를 바탕으로한 영화다 보니 감동이 열배,아니 그이상 전달해오는거 같습니다!정말, 엄홍길대장님 및 대원님들 대단하시고 존경스럽네요!  ",0,1,0
6295,2015.12.26,9,관람객인간의한계를넘어선 인간승리.의리.감동임  ,0,1,0
6296,2015.12.26,7,영화보면서 슬펐네요.. 근데 좀 아쉬운 결말....  ,0,1,0
6297,2015.12.26,10,관람객최고의코미디.2시간내내 눈물흘리며 배꼽빠질정도로웃었음  최고  ,0,1,0
6298,2015.12.26,8,관람객산사람들의 악전고투산은 정복하는게 아니데이~  ,0,1,0
6299,2015.12.26,10,관람객믿고보는 황정민라미란씨 여기저기서 좋은연기많이보여주시네요  ,0,1,0
6300,2015.12.26,6,관람객실화가 주는 감동이 있지만 전체 줄거리가 다소 신파적이며 스펙터클함이 덜하다. 진부한 면도 있고 억지스런 감동과 눈물을 강요하는 면이 없지않다. 중간부터는 내용이 지루하며 히말라야 산악영화다운 설산. 빙벽. 등반의 장면 연출이 많이 아쉽다.  ,0,1,0
6301,2015.12.26,1,감성팔이 한국영화뿌린만큼 거두는게 세상 이치다내용없고 볼거없으면서 배우나 감성으로 흥행하려는 도둑놈심보좀 고쳐라 그리고 스크린쿼터 폐지좀해라극장가니 참 가관이더라  ,0,1,0
6302,2015.12.26,1,전 현역군인이고 외박을 나가서 가족들과 함께 히말라야를 봤습니다. 황정민씨가 출연하고 평점도 높고 해서 정말 기대했죠.... 보면서 정말 '언제 끝나 좀 빨리끝나라'라고 생각한 건 영화 디워 이후로 오랜만이었습니다.  ,0,1,0
6303,2015.12.26,9,관람객재미있으며 감동적이었습니다^^  ,0,1,0
6304,2015.12.26,10,whsskwoalTdma  ,0,1,0
6305,2015.12.26,1,감동스토리일것을.너무 기대하고 가서인가ㅠㅠ도대체어느장면에서울어야는지찡한장면하나없었다는게 아쉽  ,0,1,0
6306,2015.12.26,10,처음에는 지루하지 않을까 걱정했는데걱정과 달리 지루할 틈이 없었고오히려 보는 내내 긴장되고 뒷이야기가 점점 궁금해졌던영화이고 배우들의 케미도 연기도 모두 좋았다.내 생각으로는 올해 최고의 영화라고 생각한다  ,0,1,0
6307,2015.12.26,10,무한감동이에요. 감사합니다.  ,0,1,0
6308,2015.12.26,9,관람객크리스마스라 가족들과 봤는데 감동적이었네요  ,0,1,0
6309,2015.12.26,10,관람객가슴 찡한 명장면들이 많아 몇번이나 울음을 참지 못했다.  '산은 정복하는 것이 아니다'라는 말처럼 '우리 인생은?'이라는 말로 바꿔 생각해볼 수 있는 시간이었다.  감동 그 자체의 영화!!!  ,0,1,0
6310,2015.12.26,8,관람객적당히 볼만한 영화라고 생각합니다  ,0,1,0
6311,2015.12.26,10,관람객ㅠㅠㅠㅠ너무 감동이었습니다  ,0,1,0
6312,2015.12.26,10,관람객완전감동감동ㅠ3ㅠ또봐도재밌어요^.^  ,0,1,0
6313,2015.12.26,9,관람객감동이 있는 영화! 한번은 볼만한것같어요  ,0,1,0
6314,2015.12.26,9,관람객재밋고 슬프고 감동적인 영화에요!  ,0,1,0
6315,2015.12.26,6,기대가 넘  컸나   영화가  넘  진부하고  뻔한  스토리에  긴장감도  별로없고  그냥  평범한  수준인거같다  ,0,1,0
6316,2015.12.26,7,관람객출연진과 촬영팀 모두 무척 고생을 하셨군요.단순한 스토리라서 극적효과가 부족하고 실제 엄홍길대장과 황정민배우의 이미지가 잘 어울리질 않는 것이 아쉽군요.  ,0,1,0
6317,2015.12.26,10,웃기고 슬픈영화 히말라야 재밌네요 오랜만에 눈물 좀 흘렸습니다  ,0,1,0
6318,2015.12.26,8,관람객재미도있고 정도 느껴지지만 2프로 부족한 느낌  ,0,1,0
6319,2015.12.26,8,관람객산사람은 산뿐인가산으로 향하는 발걸음이 무거워 질때면욕심을 내려놓고 가족이 기다리는 집으로 돌아가야 할거같다.  ,0,1,0
6320,2015.12.26,10,"도전은 아름답지만, 그 도전의 과정들이 너무나도 슬펐다.  ",0,1,0
6321,2015.12.26,10,슬프고 감동적이었이요  ,0,1,0
6322,2015.12.26,9,관람객산악인의 삶을 간접경험 한것처럼 좋았읍니다. 그리고 헹제애보다 뜨거운 동료애가 가슴을 따뜻하게 해주는 영화이네요. 남자들이 좋아할만한 영화로 강력히 추천합니다.  ,0,1,0
6323,2015.12.26,10,관람객굿굿굿 너무 재밌어요 감동...  ,0,1,0
6324,2015.12.26,9,관람객감동적이고 너무 재미있었습니다. 슬픈 장면이 많아 많이 아쉽기는 했습니다..  ,0,1,0
6325,2015.12.26,10,관람객살아가기 힘들만큼 각박한 요즘인데 너무도 끈끈한 인간애에  감동받았네요.  ,0,1,0
