index,time,score,reple,1st_week,2st_week,3st_week
2973,2015.12.20,8,포스터가 반감을 만든듯 막상 보면 나름 편안하게 볼수 있었음  ,1,0,0
2974,2015.12.20,10,기대가 컸던 영화인데 기대 그 이상으로 만족해요  ,1,0,0
2975,2015.12.20,9,관람객재미있어요 꼭 보세요 추천 드립니다  ,1,0,0
2976,2015.12.20,10,관람객너무 재미있어서 시간가는줄 몰랐어요  ,1,0,0
2977,2015.12.20,1,"ㅠㅠ재미없음,....          하지만 볼 가치는 있음  ",1,0,0
2978,2015.12.20,10,사람의 중요성에 대해 일깨워주는 아주 좋은 영화  ,1,0,0
2979,2015.12.20,8,요즘 같이 험악한 세상에 보기 좋은 훌륭한 영화 히말라야  ,1,0,0
2980,2015.12.20,9,믿고보는 황배우 짱조연들 연기도 굿최고다  ,1,0,0
2981,2015.12.20,10,이 영화 무조건 천만 넘는다 안보면 후회하는 국내 최고 영화!!  ,1,0,0
2982,2015.12.20,10,관람객재미있었어요 한참 웃었네요~^^  ,1,0,0
2983,2015.12.20,10,흐규흐규 너무너뮤 슬퍼용  ,1,0,0
2984,2015.12.20,10,관람객역시...황정민씨 멋집니다...초반에는 웃음도 빵빵 후반에는 또  맘이많이아프더라구요ㅠㅠㅠ웃고 울고 잘봤습니다!!정우씨도 연기 참 잘하더라구요  ,1,0,0
2985,2015.12.20,10,그냥 굿굿!! 진짜짱이다ㅜㅠㅠ 그냥 말이필요없다!!!  ,1,0,0
2986,2015.12.20,5,초반엔 좀 재밌었는데 뒤로가면갈수록 지루하고 내용도 너무 진부함 글고 작품성도 별로임 대호보는걸 추천함  ,1,0,0
2987,2015.12.20,10,관람객두리번 두리번 아저씨 아줌마 징징~ 후후후? ㅠㅠ  ,1,0,0
2988,2015.12.20,10,"관람객히말라야에서의 동료애,사랑,인간애를 제대로 담아냈네요.감동 그 자체입니다. 연기또한 너무 좋았구요, 흥행할것 같네요  ",1,0,0
2989,2015.12.20,9,관람객재미있 고재미있고재미있고아주아주아주아주아주재미있습니다.  ,1,0,0
2990,2015.12.20,10,관람객히말라야 너무 재밌고감동적  최고!!  ,1,0,0
2991,2015.12.20,10,관람객감동적이었어요ㅠㅠ황정민이랑 정우 연기짱bb  ,1,0,0
2992,2015.12.20,8,방금 극장에서 보고 왔는데 볼만합니다  ,1,0,0
2993,2015.12.20,10,관람객감명깊게봣어요 엄홍길대장님대단하십니다  ,1,0,0
2994,2015.12.20,10,감동 또 감동 ... 최고다  ,1,0,0
2995,2015.12.20,9,관람객재밌긴한데 약간 뻔한 스토리ㅎㅎㅎ  ,1,0,0
2996,2015.12.20,10,인간이 살아가는 의미를 돠새기게 하는.용화.  ,1,0,0
2997,2015.12.20,10,관람객감동의 감동이었어요 ㅠㅠ  ,1,0,0
2998,2015.12.20,7,관람객가족과 함께  볼만한 영화입니다  ,1,0,0
2999,2015.12.20,10,옥에 티..첫장면.. 1992년 장면에서 '밀레'옷은.. 웃으라한거죠? ^^ .. 산을 좋아하는 한 사람으로서 존경해마지 않으며.. 자연 앞에선 작을 수밖에 없는 인간의 한계.. 슬프고도 가슴 한 켠이 아려오는 영화..  ,1,0,0
3000,2015.12.20,9,관람객몰입도짱 최고에요!!  ,1,0,0
3001,2015.12.20,9,"동료의 의리가 뭔지, 같이 한다는 것의 의미가 뭔지에 대해서 모르는 친구들이여. 보아라 . 작게나마 그 의미를 알게 될것이다.  ",1,0,0
3002,2015.12.20,7,이 영화는 소주 세 잔 전후로 나뉩니다..  ,1,0,0
3003,2015.12.20,10,난 내인생의최고의 영화인듯 밑에 억지로짜낸것같다그러는데 전혀 .. 따듯하게느껴지는 감동실화엿어요 감사합니다  ,1,0,0
3004,2015.12.20,9,관람객지렸음 눈물ㅠ 등산 한번 가야것다.  ,1,0,0
3005,2015.12.20,9,관람객지렸음 눈물ㅠ 등산 한번 가야것다.  ,1,0,0
3006,2015.12.20,8,관람객그냥 그냥 볼만한 영화입니다  ,1,0,0
3007,2015.12.20,10,와...진짜 울며서 봤음....배우들 연기도 대박이고 2015년 잘 마무리하게 되었다. ^^  ,1,0,0
3008,2015.12.20,10,"혹자는 너무 뻔한 배우가 나와 뻔한 연기, 스토리 일 것 이라고 하는데막상 보면 그렇게 감동적일 수가 없었습니다. 정말 중간에 대사들이 너무도 감동을 배가시키더라고요. 연말에 가족끼리 같이 볼만한 영화로 추천합니다!  ",1,0,0
3009,2015.12.20,10,흑흑흑 질질짯어요ㅋ큐ㅠㅠㅠ  ,1,0,0
3010,2015.12.20,1,전문가 평점 보고 거르고 봐야 했는데..하 ㅋ  ,1,0,0
3011,2015.12.20,8,감동이 있는 실화를 바탕으로 한 영화다!연기도 멋있다.  ,1,0,0
3012,2015.12.20,9,"10점 주면 거짓말이라 생각할거같아서 9점 드리는데, 재미도 있었고 감동도 있어서 좋았음. 다큐인줄 알고 기대 안했는데 기대 이상이었음. 추천드림  ",1,0,0
3013,2015.12.20,6,관람객실화감동 어머니가 많이 우시네요...  ,1,0,0
3014,2015.12.20,10,지루하지 않게 봤어요! 재미도 있고 감동도 있고 러닝타임이 어떻게 흘러간거야~  ,1,0,0
3015,2015.12.20,9,"관람객황정민,정우의 콜라보 굿  ",1,0,0
3016,2015.12.20,7,관람객연기파 배우들이라 재밋었어요  ,1,0,0
3017,2015.12.20,10,저는정말재밌게봤습니다! 꼭보세요!!  ,1,0,0
3018,2015.12.20,1,이런 영화가 망해야 만들어지지도 않을텐데 억지단순눈물짜내기 영화에 길들여진 수준 낮은 관객수준 때문에 이런 영화들은 계속 매년 나올테고 한국영화에 먹칠 하겠지..  ,1,0,0
3019,2015.12.20,7,관람객역시 황정민 믿보황!!!!감동적이었습니다  ,1,0,0
3020,2015.12.20,8,관람객엄홍길 개인의 삶에  대한 생각을 많게하는 영화ㅡ  ,1,0,0
3021,2015.12.20,10,관람객황정민 연기 진짜 최고입니다  ,1,0,0
3022,2015.12.20,10,관람객감동감동 코믹과 감동이 대박  ,1,0,0
3023,2015.12.20,10,눈물 안 흘려야지 안 흘려야지 했는데 계속 울면서 본 영화ㅜㅜ  ,1,0,0
3024,2015.12.20,1,인터스텔라를뒤잇는 거품낀영화  ,1,0,0
3025,2015.12.20,10,이 영화 보면서 7번방의 선물과 같은 억지눈물이 아닌 진짜 슬퍼서 눈물 흘렸습니다ㅠㅠ...(참고로 저 진짜 댓글알바 아닙니다. 혹시나 해서 추가로 적는거에요)  ,1,0,0
3026,2015.12.20,6,관람객보통입니다 ~조금 감동이 있어요  ,1,0,0
3027,2015.12.20,10,관람객산싸나이들 영화 눈물 쫙 감동 쫙  ,1,0,0
3028,2015.12.20,7,관람객좀 지루한 감이 있어요너무 기대하고 본거  같아요  ,1,0,0
3029,2015.12.20,9,초반에는 단막단막 끊어져서 차라리 영화시간을 늘려주지.. 하는 생각도 했는데 뒤로 갈수록 감동이 되게 좋았다. 힘들게 찍었다 그랬는데 그래서그런지 영상도 예쁘고 배우들 연기도 좋고!! 아내분한테 감정이입이 엄청 되더라ㅠㅠ 진짜 많이 운 것같다  ,1,0,0
3030,2015.12.20,10,관람객너무슬프면서 감동이 있는 영화다울음을 참느라 너무힘들었다누구든 한번보길 원한다  ,1,0,0
3031,2015.12.20,5,관람객좀 억지눙물 억지 감동손발오글리는 유치 웃음코드로영실망스럽네요그래도 의도한곳에서 눈물은 흘럿다는울면서도 가슴은 싸늘 ㅋ  ,1,0,0
3032,2015.12.20,8,관람객생각보다 재미있었다유명인 이름을 써서 몰입하는데 시간이 좀 걸린듯 ㅋㅋ  ,1,0,0
3033,2015.12.20,10,관람객개잼 ㅜㅜ 울컥울컥 개졓아  ,1,0,0
3034,2015.12.20,9,관람객감동적이었어요 황정민 연기굿  ,1,0,0
3035,2015.12.20,8,관람객고생이 많으 셨겠구 황정민 연기가 역시 최고 입니다  ,1,0,0
3036,2015.12.20,5,관람객그냥 슬픈데 눈물 안나오는 슬픔이랄까... 허무  ,1,0,0
3037,2015.12.20,9,관람객처음에는 재미있고 가면갈수록 감동적인 내용이여서 눈물 참으면서 봣어요 ~역시 황배우 정우 연기력 좋아서 더 집중할수 있었어요 !  ,1,0,0
3038,2015.12.20,7,감동이긴한데 산이라는 생소한소재에 다소 지루합니다.  ,1,0,0
3039,2015.12.20,10,관람객기대안하고 봤는데 생각보다 훨신 재미있내요 ㅋㅋ  ,1,0,0
3040,2015.12.20,3,배우들 고생많이 한것같아 차마 1점은 못주겠고 3점줍니다 회사 연말행사로 다같이 보러갔는데 돈아깝습니다ㅠㅠ 억지눈물. . 그리고 도대체 어느부분에서 웃음포인트가있나요?  웃음도  있다는 글은 이해불가. . 정우 너무 오버연기. . 어색해요  ,1,0,0
3041,2015.12.20,8,관람객평타는 친거 같네요 ㅎㅎ  ,1,0,0
3042,2015.12.20,9,관람객감동 휴먼원정대!!!!  ,1,0,0
3043,2015.12.20,10,관람객재미있다이야재미있다  ,1,0,0
3044,2015.12.20,10,역시!! 황정민!!!모든배우들 연기에 나도 히말라야 간것같고내가 정상에오른듯 심장이 뛰었다!!  ,1,0,0
3045,2015.12.20,9,눈물 펑펑 재미있어요  ,1,0,0
3046,2015.12.20,8,관람객감동과 재미를 느끼면서 가슴뭉클한 영화였네요 실화를 재구성한 히말라야의 제작진 출연진에게 고생했다는 말을 전하고싶네요  ,1,0,0
3047,2015.12.20,10,관람객중반부터 훌쩍거리기만...  ,1,0,0
3048,2015.12.20,10,관람객배우들의 명연기가 감동이였음  ,1,0,0
3049,2015.12.20,8,관람객가슴찡해지는 영화였다 극적인 요소를 포함시킨부분이 너무 눈에 보이는게 좀 흠이었다  ,1,0,0
3050,2015.12.20,7,전체적으로 영화는 좋다...하지만...오래전부터 휴먼 원정대 관련 다큐를 여러 챙겨 봐서 그런지..여러 부분이 각색이 된것이 어색했다.(실화는 잘알기에..)황정민..오열&신음 연기 너무 비슷했다.정우..응답1994 컬러가 너무 많이 보인게..단점이다.  ,1,0,0
3051,2015.12.20,10,감동 백배!!! 믿고 보는 배우들의 연기력 또한 최고였다.  ,1,0,0
3052,2015.12.20,7,관람객걍 쏘쏘.. 열자열자열자  ,1,0,0
3053,2015.12.20,10,진짜 울기도많이울고 너무감동적인이야기입니다. 정말 멋진영화네요  ,1,0,0
3054,2015.12.20,9,관람객재밌게 잘 봤음~~~굿  ,1,0,0
3055,2015.12.20,10,히말라야에서 자연과 사람의 이야기 참 잘만드셨습니다.박무택대원이 아리게남아요;  ,1,0,0
3056,2015.12.20,10,관람객기대 이상이네요후회안합니다 꼭 봐야함!!!  ,1,0,0
3057,2015.12.20,10,관람객실화내용에 감동까지 더해져서 정말 재미있었어요아직까지 영화가 기억에 남네요 다시 또 보고싶은 영화이네요  ,1,0,0
3058,2015.12.20,10,최고다. 너무 감동적.  ,1,0,0
3059,2015.12.20,7,관람객신파 오브 신파로 그닥 추천하고 싶지는 않지만 왜 눈물이 이리 나는지;;;;  ,1,0,0
3060,2015.12.20,9,관람객감동적입니다보시기를 강추!!!  ,1,0,0
3061,2015.12.20,10,관람객감동적인 영화..재밌게 잘 봤습니다..  ,1,0,0
3062,2015.12.20,9,관람객실화를 바탕으로 한 영화라 감동두배...  나도모르게 울컥 눈물이 나네요...   배우들 연기 굿.  보는내내 시간가는줄 몰랐네요  ,1,0,0
3063,2015.12.20,10,관람객고생많으셨어요 감동감동  ,1,0,0
3064,2015.12.20,10,믿고보는황정민!ㅠㅠㅠ  ,1,0,0
3065,2015.12.20,9,관람객감동적인 인간애를 느낀 영화  ,1,0,0
3066,2015.12.20,10,진짜감동이었어요..계속여운이가시질않아요...배우분들정말 고생하셨고..돌아가신분들의명복을빕니다.  ,1,0,0
3067,2015.12.20,9,관람객보는 내내  눈물이 났습니다대한 민국의 민족성  최고입니다황정민은 원래 최고의 배우였지만 정우의 연기 정말 좋았습니다한국 영화 최고~~^^  ,1,0,0
3068,2015.12.20,1,관객 기만하는 상술의 영화  ,1,0,0
3069,2015.12.20,7,관람객긴장감이 떨어지고 디테일이 부족하다  감독이 치열하게 공부하고 만들지는 않은듯하다  ,1,0,0
3070,2015.12.20,10,관람객늠후늠후 재밋어용 히히  ,1,0,0
3071,2015.12.20,10,관람객완전 멋진 영화황정민 정말 최고  ,1,0,0
3072,2015.12.20,7,"연기 좋고 실화였고 공이 많이 든 영화네요. 눈물, 당연히 났습니다. 하지만 정말 이상하게 .. 우선 황정민님의 캐릭터가 전작들과 비슷한 느낌이었고.. 클라이맥스가 살짝 아쉬우며 뭔가 관객을 울리기 위한 요소들이 자연스럽지 않아서 전 아쉬웠네요.  ",1,0,0
3073,2015.12.20,9,스토리를 잘 사렸다고봄  ,1,0,0
3074,2015.12.20,10,관람객잊고지낸 옛기억이 나네요~그때 생각도나고많이 울었네요~!가슴찡한  우정~ㅠ  ,1,0,0
3075,2015.12.20,6,관람객배우들꽤나고생하셨겠어요ㅎㅎ잘봤습니다  ,1,0,0
3076,2015.12.20,1,참..제발 스크린쿼터제 좀 들멕이게 하는 이런 영화는 그만 찍자.솔까 이게 진짜 재미있니?? 시카리오 조기 종영이 진짜 아쉽다..울 나라에서 시카리오 같은 영화 나오면 내돈주고 열번도 가겠다! 평점 높네! 많이들 가셔..ㅡㅡ  ,1,0,0
3077,2015.12.20,10,정말 감동적이네요..역시 국민배우 황정민  ,1,0,0
3078,2015.12.20,10,황정민.정우.라미란...등등 배우님들 최고네요  ,1,0,0
3079,2015.12.20,10,재미있고 순간순간 감동적이였어요  ,1,0,0
3080,2015.12.20,10,시간이 아깝지 않았고 표현 할 수 가 없네요 너무 잘봤습니다.  ,1,0,0
3081,2015.12.20,7,중반까지는 잔잔한 감동과 웃음으로 괜찮았는데 후반부로 갈수록 너무 극적인 슬픔을 강요? 하는 것 같음...이래두 안울래? 하고 마치 관객에게 윽박지르는 느낌이랄까....아쉬운 영화...  ,1,0,0
3082,2015.12.20,9,자녀들과 함께 봤는데 넘~좋았어요!!  ,1,0,0
3083,2015.12.20,1,황정민 걍 싫은듯...  ,1,0,0
3084,2015.12.20,10,관람객진짜 감동적이고 재밌음  ,1,0,0
3085,2015.12.20,10,관람객최고입니다. 정말 영화 감동적입니다. 눈물 콧물 ㅜㅜ다 쏟았어요ㅜㅜ 최고의 영화 입니다. 히말라야 나오신 모든 배우님들 수고하셨습니다. 사랑합니다.  ,1,0,0
3086,2015.12.20,10,관람객눈에. 남겨진  여러한국인의. 발자국. 가슴뿌듯.  ,1,0,0
3087,2015.12.20,8,관람객아주 재미있게 보았습니다. '사람이 있어야 산이다'  ,1,0,0
3088,2015.12.20,10,관람객간만에가족들과.감동적인영화본것같네요.출연한모든배우.연기짱입니다.꼭.보세요  ,1,0,0
3089,2015.12.20,10,재미있는 영화눈물이 하염없이...  ,1,0,0
3090,2015.12.20,9,관람객저라면할수없던일들이 영화를통해서 느껴지면서제 주위에 소중한사람들에게 또한번 감사한마음이들더군요....명품배우들에게 명품연기에도 또한번 감동받았습니다.  ,1,0,0
3091,2015.12.20,10,황정민... 믿고보는... 정말 최고였다~ 경상도남자~  ,1,0,0
3092,2015.12.20,10,관람객감동적이었습니다. 눈물콧물 쏙 뺏지요. 다들 꼭 보시길~~  ,1,0,0
3093,2015.12.20,8,관람객오랜만에 휴먼스토리 본것 같아 행복했습니다  ,1,0,0
3094,2015.12.20,10,보다가 울어버렸어요 ㅠㅠ  ,1,0,0
3095,2015.12.20,10,방금보고 나왔습니다. 영화많이슬프네요 휴지지참하시고 영화관람하세요~T^T 역시 믿고보는 정민이형이네요! 대박나세요 ^^  ,1,0,0
3096,2015.12.20,10,관람객영화감명있게잘봤습니다  ,1,0,0
3097,2015.12.20,10,관람객 굿굿굿!!!! 재미있어용  황정민 정우 쵝오  ,1,0,0
3098,2015.12.20,1,잼 없어  보고 후회하면 늦어  알았냐 !  ,1,0,0
3099,2015.12.20,9,"관람객역시 믿고보는 황정민배우. 감동, 의리, 리더의 존재감.  ",1,0,0
3100,2015.12.20,10,개인적으로 엄홍길대장님을 존경하는 사람으로써 히말라야라는 영화는 정말 기대 이상의 감동과 여운이 남아서 좋았습니다.보는 내내 감동스런 눈물이 흘렀습니다..  ,1,0,0
3101,2015.12.20,10,관람객재미있습니다눈물이앞을가리네  ,1,0,0
3102,2015.12.20,8,관람객진짜히말라야에서촬영한건가요??  ,1,0,0
3103,2015.12.20,10,"영화 평론가들... 영화에 대한 지식이 많다는 것은 알겠다. 하지만 진정 영화에 빠져서 영화속에서 영화를 본것인지는 의문이다. 영화를 저렇게 분석하면서 냉철하게 본다면, 과연 그 주인공들의 입장에서 그 감정을 느낄수나 있을까..?  ",1,0,0
3104,2015.12.20,9,관람객대장님  잘보구갑니다...!!엉엉 울다가네ㅠㅠ  ,1,0,0
3105,2015.12.20,10,여운남는 영화에요ㅠㅠㅠ 슬퍼요ㅠㅠㅠ  ,1,0,0
3106,2015.12.20,8,감동적이예요~울컥울컥하다 결국 울엇네ㅠㅠ  ,1,0,0
3107,2015.12.20,10,관람객너무너무 감동적인 영화입니다올해 최고의영화인듯요!!  ,1,0,0
3108,2015.12.20,9,관람객감동 그 자체입니다 또 보고싶은 영화예요  ,1,0,0
3109,2015.12.20,4,감동이 있으나 1시간40분동안 설명 20분 본편 이 느낌이었음  ,1,0,0
3110,2015.12.20,10,관람객감동적이고 잼났습니다  ,1,0,0
3111,2015.12.20,10,관람객실화 바탕이라 더 몰입해서 보게 되었어요.. 인간의 한계를 넘는 도전과 사람과 사람 사이의 끈끈한 정이 느껴지는 영화였습니다. 곁에 있는 소중한 사람을 볼 수 있다는 것 만으로도 감사해야겠다는 생각이 들었구요. 눈물 콧물 범벅이었지만 강력 추천합니다!  ,1,0,0
3112,2015.12.20,1,관람객 평점에 낚였다..  ,1,0,0
3113,2015.12.20,8,관람객솔직히 황정민이 팔할=히말라야  ,1,0,0
3114,2015.12.20,10,정말 최고의영화다 평점1점의 되도않는소리를 적어논 저 작자들은 영화를보지않은게분명하고 개개인의차이라지만 정말 빠짐없는 감동실화영화이고 역시 황배우의 명품연기도 빛낫다  ,1,0,0
3115,2015.12.20,6,배우들은 고생했을듯 하지만 억지눈물짜네는건 국제시장으로 충분했음 국제시장이 10배는 나은듯..  ,1,0,0
3116,2015.12.20,10,관람객대형 화면에 그려진 눈덮인 산은 산악인들 만큼 묘한매력을 느껴습니다. '사람이 없으면 산이 무슨 소용 있느냐' 에 가슴에 와 닿네요.대체로 감동적어여습니다.  ,1,0,0
3117,2015.12.20,5,관람객사실 이 점수는 배우들 연기 점수... 스토리 라인은 실화라 어쩔 수 없지만  대사나 극 구성은 아쉬웠습니다. 연기는 너무 대박이에요ㅠㅠ연기는 정말 짱  ,1,0,0
3118,2015.12.20,10,보기 전의 편견과 보고 난 후의 반전감동  ,1,0,0
3119,2015.12.20,9,관람객뻔한 휴면스토리이지만 황정민때문에 봐따  ,1,0,0
3120,2015.12.20,8,관람객기대했던것보다 더 감동이있습니다.. 추천해요  ,1,0,0
3121,2015.12.20,7,관람객재미있게 봣는데 그냥 그냥7점?  ,1,0,0
3122,2015.12.20,6,"관람객실화를바탕으로 하여 스토리는 좋았으니 예전에 ""산""이란프로로 기억되는 프로를 본바라 리얼감이 너무 떨어졌지만 재미는 있었읍니다  ",1,0,0
3123,2015.12.20,5,오랜만에 하품 엄청한영화  말로  관객들을 이해시키려한다  지겹다 편집도 뜬금없다  ,1,0,0
3124,2015.12.20,10,이런게 바로 감동이다!  믿고 보는 황정민!  ,1,0,0
3125,2015.12.20,9,관람객포스터는 영화보시기전에 챙겨놓으시고 손수건도 가지고 들어가세요감동적이고 스토리구성도 좋아요 억지스럽지 않아서 재밌게 잘봤습니다 굿굿  ,1,0,0
3126,2015.12.20,7,재미있는데  왜 눈보라치고 기상이 나쁠때만 등반하는 지 .. 역시 영화는 영화다.  ,1,0,0
3127,2015.12.20,10,관람객재미와감동 그리고 황정민 정우  ,1,0,0
3128,2015.12.20,10,명품연기...정말 잘 봤습니다.ㅠ  ,1,0,0
3129,2015.12.20,10,관람객감동 감동이였습니다~  ,1,0,0
3130,2015.12.20,5,지루한감도 살짝...개인적인 이기심으로 공감하기 조금 힘든 눈물  ,1,0,0
3131,2015.12.20,10,진심으로 감동적이었고 배우들의 연기에도 감동을 받았습니다!!!진짜 ㅠㅠㅠ좋은영화  ,1,0,0
3132,2015.12.20,9,잘 봤습니다. 배우들 고생 많았겠어요. 무택..아 슬프도다.  ,1,0,0
3133,2015.12.20,10,실화라는게 가장 마음이 아프다..  ,1,0,0
3134,2015.12.20,10,정말 웃기도하고 슬픔에빠지기도하고.... 실화를 바탕으로 하였기에 더욱 감동이 있었던 것 같다.  ,1,0,0
3135,2015.12.20,10,2015 최고의 한국 영화였다  ,1,0,0
3136,2015.12.20,8,관람객역시 황정민?재밌고 슬프고 멋지고~~영화 대박나세요~~  ,1,0,0
3137,2015.12.20,1,오~개굿!! 꼭봐라   나만 당할순없다 다같이죽자!!  ,1,0,0
3138,2015.12.20,7,관람객산 사람들의 생활과 의리 도전정신이감동적입니다.  ,1,0,0
3139,2015.12.20,7,관람객산 사람들의 생활과 의리 도전정신이감동적입니다.  ,1,0,0
3140,2015.12.20,9,감동적이었고 마지막에서 눈물 콧물 다나옴ㅜㅜ 역시 믿보황^^♡♡♡  ,1,0,0
3141,2015.12.20,8,관람객스토리가 갑자기 전개되는것 빼고는 나름 괜찬음...  ,1,0,0
3142,2015.12.20,10,관람객마지막에 남는 여운은 정말 감동이다  ,1,0,0
3143,2015.12.20,6,못해도 중간은 가는 전형적인 휴먼드라마  ,1,0,0
3144,2015.12.20,8,관람객역시 믿고보는배우 황정민 재밌었어용  ,1,0,0
3145,2015.12.20,10,관람객감동의 쓰나미가..산타러 갑니다..  ,1,0,0
3146,2015.12.20,8,관람객너무 기대해서 그런가 그렇게는 아니였지만 역시 황정민  ,1,0,0
3147,2015.12.20,10,방금보고왔는데요 어렴풋이 뉴스로알고는있었던 내용이었지만 이런가슴아프고 감동적인지 몰랐습니다  정말산악인여러분...존경스럽단말밖에나오질않습니다.  추위와싸우며 연기하신 배우분들께도 수고많으셨다고 전하고싶습니다  ,1,0,0
3148,2015.12.20,10,관람객꼭봐야해요꼭봐야해요  ,1,0,0
3149,2015.12.20,10,재미 감동 있네요 추천 강추  ,1,0,0
3150,2015.12.20,10,관람객진짜최고입니다.  황정민짱 정우짱ㅠㅠ 나도 모르는 사이에 눈물이 주르르 ㅠㅠ  ,1,0,0
3151,2015.12.20,10,정말 감명깊게 봤습니다!  ,1,0,0
3152,2015.12.20,9,관람객역시 ㅋㅋㅋ황정민너무 멋지네요 조금아쉬운점이 있다면 마지막에 실제 사진좀이라도 있었으면 더 감동적이었을듯하네요  ,1,0,0
3153,2015.12.20,10,코믹에 웃다가 울은 영화네요. 정우가 연기를 되게 잘하네요~ 제가 본 올해 영화 중 가장 완성도 높은 영화였던것 같네요!!  ,1,0,0
3154,2015.12.20,10,그냥 진짜 있던 이야기잖아...감동적일 수 밖에 없자나...찡 할 수 밖에 없잖아....연출이 어떻고 필요 없는 거잖아~  ,1,0,0
3155,2015.12.20,10,관람객재밌고 슬프고 그래요 추천!!  ,1,0,0
3156,2015.12.20,10,관람객남자는의리다라는걸 보여주는영화 굿입니다!!  ,1,0,0
3157,2015.12.20,8,관람객오랜만에 감동적으로 영화 보았어요~^^ 추천해요  ,1,0,0
3158,2015.12.20,10,관람객정말슬픔니다 눈물ㅜㅜ 장난아니에요  ,1,0,0
3159,2015.12.20,1,국제시장보고난 느낌가 똑같..억지로눈물짜낼려고하고. 오히려 엄홍길대장님 다큐를 찾아볼생각. 이런영화는 보고나면짜증남. 억지신파영화. 차라리 담담히 풀어냈음 더슬프고 감동적이었을듯... 이런영화가 먹히는게 싱기함.  ,1,0,0
3160,2015.12.20,1,1점 주기도 아까움 배우는 좋으나 억지감정 뻔한스토리 여기완전 알바천국 ㅡㅡ 돈주고보기 아깝다  ,1,0,0
3161,2015.12.20,9,관람객실화를 바탕으로 한 영화라 감동이 2배로 다가왔어요 험한 산을 배경으로 찍느라 다들 넘 고생하셨겠어요~~~  ,1,0,0
3162,2015.12.20,10,관람객정말감동적이엿어요.한눈도안팔고 집중해서 감동깊이봣습니다!!!히말라야 흥행하세용  ,1,0,0
3163,2015.12.20,1,평점 보고낚이지 마삼핵노잼임  ,1,0,0
3164,2015.12.20,10,이거 보고 안우는 사람없고 거이다 울듯..ㅠㅠ슬프고 감동적이였따ㅠㅠ  ,1,0,0
3165,2015.12.20,6,"연기는 다들 참 좋았는데... 너무 뻔한 신파에 실망했다. 대사톤도, 연출도 억지스러움이 묻어났다. 차라리 좀 더 담담한 시선을 보여줬더라면 하는 생각이 들었다.  ",1,0,0
3166,2015.12.20,10,관람객재밌어요...아들과 같이봤는데 감동 백배  ,1,0,0
3167,2015.12.20,10,보면서 엄청 울었음ㅜㅜ진짜감동입니다  ,1,0,0
3168,2015.12.20,4,관람객볼만합니다 막 잼있는정도는아니고  ,1,0,0
3169,2015.12.20,10,제가 아직 어려서인지 산악인으로든 동료애든 공감할부분이 뚜렷하지 않았는데도 눈물콧물 다뺀 영화였네요  ,1,0,0
3170,2015.12.20,7,"저는 좀 지루했어요 중간중간 감동은 있긴한데,,,엄청 재미지진 않았어요 연기야 뭐 다들 잘하시구요 그냥 그래요 킬링타임용입니다  ",1,0,0
3171,2015.12.20,10,진짜 웃고 울고 정말 한국영화에 남을 엄청난 영화입니다!!실화라고 하니 더욱더 재미있엇는ㄱ ㅓ같습니다!!  ,1,0,0
3172,2015.12.20,10,관람객감동적이고 가족에대해 소중함을 느끼는 올해 최고영화입니다  ,1,0,0
3173,2015.12.20,10,관람객Very good very good  ,1,0,0
3174,2015.12.20,7,관람객나름재밋게잘봤습니다  ,1,0,0
3175,2015.12.20,8,관람객호오 상당히 괜찮았습니다. 울다가 웃다가 ㅋㅋㅋ  ,1,0,0
3176,2015.12.20,8,관람객오랜만에 감동적인 영화  가족끼리 보기 너무 좋았어요~  ,1,0,0
3177,2015.12.20,10,관람객아.. 정말 기대한만큼 감동적이었고 대단했습니다.오랜만에 펑펑 울었네요 ㅠㅠ영화관 사람들도 모두 흐느꼈구요.다시 한 번 감사드립니다. 배우들 모두 고생하셨습니다.  ,1,0,0
